"";"document";"attention";"reform";"unmatched";"kommune";"date";"total_words";"attention_perc";"reform_perc";"year";"month";"dato";"performance_sd";"reform_sd";"indbyggertal";"udg_pr_6_16";"school_size";"faktisk_perf";"forventet_perf";"borgmester_for";"borgmester_efter";"skift_borgm";"parti_for";"parti_efter";"skift_parti";"skift_blok";"island";"reference";"school_size_sd"
"1";"Aeroe.02-05-2018.pdf";5;6;2481;"Ærø Kommune";"02-05-2018";2492;0,00200642054574639;0,00240770465489567;2018;"05";2018-05-02;0,535708905912033;0,77091585634631;6178;63500;440;7,1;7;"Jørgen Jørgensen";"Ole Petersen";1;"S";"S";0;0;1;0,0999999999999996;1,43791406435124
"2";"Aeroe.02-10-2018.pdf";6;9;4392;"Ærø Kommune";"02-10-2018";4407;0,00136147038801906;0,00204220558202859;2018;"10";2018-10-02;0,363508943099465;0,653887785573521;6178;63500;440;7,1;7;"Jørgen Jørgensen";"Ole Petersen";1;"S";"S";0;0;1;0,0999999999999996;1,43791406435124
"3";"Aeroe.03-04-2018.pdf";8;5;4181;"Ærø Kommune";"03-04-2018";4194;0,00190748688602766;0,00119217930376729;2018;"04";2018-04-03;0,509293884037305;0,381720377129035;6178;63500;440;7,1;7;"Jørgen Jørgensen";"Ole Petersen";1;"S";"S";0;0;1;0,0999999999999996;1,43791406435124
"4";"Aeroe.04-09-2018.pdf";1;2;3497;"Ærø Kommune";"04-09-2018";3500;0,000285714285714286;0,000571428571428571;2018;"09";2018-09-04;0,0762849482018735;0,182964029906191;6178;63500;440;7,1;7;"Jørgen Jørgensen";"Ole Petersen";1;"S";"S";0;0;1;0,0999999999999996;1,43791406435124
"5";"Aeroe.04-12-2018.pdf";3;6;3027;"Ærø Kommune";"04-12-2018";3036;0,000988142292490119;0,00197628458498024;2018;"12";2018-12-04;0,263831342595412;0,632780735841569;6178;63500;440;7,1;7;"Jørgen Jørgensen";"Ole Petersen";1;"S";"S";0;0;1;0,0999999999999996;1,43791406435124
"6";"Aeroe.05-12-2017.pdf";1;2;842;"Ærø Kommune";"05-12-2017";845;0,00118343195266272;0,00236686390532544;2017;"12";2017-12-05;0,315973158232612;0,757839177126235;6177;60492;444;7,1;7;"Jørgen Jørgensen";"Ole Petersen";1;"S";"S";0;0;1;0,0999999999999996;1,4509860103908
"7";"Aeroe.06-02-2018.pdf";15;3;4465;"Ærø Kommune";"06-02-2018";4483;0,0033459736783404;0,000669194735668079;2018;"02";2018-02-06;0,893366000579602;0,21426748985222;6178;63500;440;7,1;7;"Jørgen Jørgensen";"Ole Petersen";1;"S";"S";0;0;1;0,0999999999999996;1,43791406435124
"8";"Aeroe.06-03-2018.pdf";16;8;4531;"Ærø Kommune";"06-03-2018";4555;0,00351262349066959;0,0017563117453348;2018;"03";2018-03-06;0,937861053634449;0,562348280721553;6178;63500;440;7,1;7;"Jørgen Jørgensen";"Ole Petersen";1;"S";"S";0;0;1;0,0999999999999996;1,43791406435124
"9";"Aeroe.06-06-2018.pdf";13;19;6707;"Ærø Kommune";"06-06-2018";6739;0,00192906959489539;0,00281940940792402;2018;"06";2018-06-06;0,515056409435412;0,902738387651113;6178;63500;440;7,1;7;"Jørgen Jørgensen";"Ole Petersen";1;"S";"S";0;0;1;0,0999999999999996;1,43791406435124
"10";"Aeroe.06-11-2018.pdf";8;12;4172;"Ærø Kommune";"06-11-2018";4192;0,00190839694656489;0,00286259541984733;2018;"11";2018-11-06;0,509536867760605;0,916565989510976;6178;63500;440;7,1;7;"Jørgen Jørgensen";"Ole Petersen";1;"S";"S";0;0;1;0,0999999999999996;1,43791406435124
"11";"Aeroe.06-12-2017.pdf";0;0;60;"Ærø Kommune";"06-12-2017";60;0;0;2017;"12";2017-12-06;0;0;6177;60492;444;7,1;7;"Jørgen Jørgensen";"Ole Petersen";1;"S";"S";0;0;1;0,0999999999999996;1,4509860103908
"12";"Aeroe.09-02-2016.pdf";3;4;2982;"Ærø Kommune";"09-02-2016";2989;0,00100368016058883;0,00133824021411843;2016;"02";2016-02-09;0,267979911716183;0,428487189475857;6290;61465;460;7;6,6;"Jørgen Jørgensen";"Ole Petersen";1;"S";"S";0;0;1;0,4;1,50327379454902
"13";"Aeroe.10-10-2017.pdf";1;8;2790;"Ærø Kommune";"10-10-2017";2799;0,000357270453733476;0,00285816362986781;2017;"10";2017-10-10;0,0953902531999132;0,915146987740862;6177;60492;444;7,1;7;"Jørgen Jørgensen";"Ole Petersen";1;"S";"S";0;0;1;0,0999999999999996;1,4509860103908
"14";"Aeroe.11-10-2016.pdf";5;1;3738;"Ærø Kommune";"11-10-2016";3744;0,00133547008547009;0,000267094017094017;2016;"10";2016-10-11;0,35656693203333;0,0855200460298702;6290;61465;460;7;6,6;"Jørgen Jørgensen";"Ole Petersen";1;"S";"S";0;0;1;0,4;1,50327379454902
"15";"Aeroe.12-03-2019.pdf";0;2;377;"Ærø Kommune";"12-03-2019";379;0;0,00527704485488127;2019;"03";2019-03-12;0;1,68964143712841;6058;63595;436;7,5;7,1;"Jørgen Jørgensen";"Ole Petersen";1;"S";"S";0;0;1;0,4;1,42484211831168
"16";"Aeroe.12-12-2017.pdf";2;11;3280;"Ærø Kommune";"12-12-2017";3293;0,000607348921955664;0,00334041907075615;2017;"12";2017-12-12;0,16216053368148;1,06955893583182;6177;60492;444;7,1;7;"Jørgen Jørgensen";"Ole Petersen";1;"S";"S";0;0;1;0,0999999999999996;1,4509860103908
"17";"Aeroe.13-12-2016.pdf";6;10;3718;"Ærø Kommune";"13-12-2016";3734;0,00160685591858597;0,00267809319764328;2016;"12";2016-12-13;0,429026221810215;0,85749076683405;6290;61465;460;7;6,6;"Jørgen Jørgensen";"Ole Petersen";1;"S";"S";0;0;1;0,4;1,50327379454902
"18";"Aeroe.14-06-2016.pdf";16;18;6791;"Ærø Kommune";"14-06-2016";6825;0,00234432234432234;0,00263736263736264;2016;"06";2016-06-14;0,625927780117936;0,844449368797804;6290;61465;460;7;6,6;"Jørgen Jørgensen";"Ole Petersen";1;"S";"S";0;0;1;0,4;1,50327379454902
"19";"Aeroe.14-08-2018.pdf";2;6;4762;"Ærø Kommune";"14-08-2018";4770;0,000419287211740042;0,00125786163522013;2018;"08";2018-08-14;0,11194856130254;0,402751009227464;6178;63500;440;7,1;7;"Jørgen Jørgensen";"Ole Petersen";1;"S";"S";0;0;1;0,0999999999999996;1,43791406435124
"20";"Aeroe.14-11-2017.pdf";5;10;5764;"Ærø Kommune";"14-11-2017";5779;0,000865201591970929;0,00173040318394186;2017;"11";2017-11-14;0,231006505196883;0,554052694818886;6177;60492;444;7,1;7;"Jørgen Jørgensen";"Ole Petersen";1;"S";"S";0;0;1;0,0999999999999996;1,4509860103908
"21";"Aeroe.15-01-2019.pdf";7;6;3909;"Ærø Kommune";"15-01-2019";3922;0,00178480367159612;0,00152983171851096;2019;"01";2019-01-15;0,476537794733784;0,489832308519889;6058;63595;436;7,5;7,1;"Jørgen Jørgensen";"Ole Petersen";1;"S";"S";0;0;1;0,4;1,42484211831168
"22";"Aeroe.15-03-2016.pdf";3;5;1637;"Ærø Kommune";"15-03-2016";1645;0,00182370820668693;0,00303951367781155;2016;"03";2016-03-15;0,486925201288554;0,973212925032931;6290;61465;460;7;6,6;"Jørgen Jørgensen";"Ole Petersen";1;"S";"S";0;0;1;0,4;1,50327379454902
"23";"Aeroe.15-08-2017.pdf";0;4;2713;"Ærø Kommune";"15-08-2017";2717;0;0,00147221199852779;2017;"08";2017-08-15;0;0,47138322022206;6177;60492;444;7,1;7;"Jørgen Jørgensen";"Ole Petersen";1;"S";"S";0;0;1;0,0999999999999996;1,4509860103908
"24";"Aeroe.15-11-2016.pdf";6;9;3554;"Ærø Kommune";"15-11-2016";3569;0,00168114317736061;0,00252171476604091;2016;"11";2016-11-15;0,448860720717104;0,807420417770386;6290;61465;460;7;6,6;"Jørgen Jørgensen";"Ole Petersen";1;"S";"S";0;0;1;0,4;1,50327379454902
"25";"Aeroe.16-05-2017.pdf";11;4;5753;"Ærø Kommune";"16-05-2017";5768;0,00190707350901526;0,000693481276005548;2017;"05";2017-05-16;0,509183513483379;0,222043725614309;6177;60492;444;7,1;7;"Jørgen Jørgensen";"Ole Petersen";1;"S";"S";0;0;1;0,0999999999999996;1,4509860103908
"26";"Aeroe.16-08-2016.pdf";2;13;4411;"Ærø Kommune";"16-08-2016";4426;0,000451875282422052;0,00293718933574333;2016;"08";2016-08-16;0,120649488796456;0,940449995563905;6290;61465;460;7;6,6;"Jørgen Jørgensen";"Ole Petersen";1;"S";"S";0;0;1;0,4;1,50327379454902
"27";"Aeroe.17-01-2017.pdf";12;6;2909;"Ærø Kommune";"17-01-2017";2927;0,00409976084728391;0,00204988042364195;2017;"01";2017-01-17;1,09462515356293;0,656345170486848;6177;60492;444;7,1;7;"Jørgen Jørgensen";"Ole Petersen";1;"S";"S";0;0;1;0,0999999999999996;1,4509860103908
"28";"Aeroe.17-01-2018.pdf";1;2;904;"Ærø Kommune";"17-01-2018";907;0,00110253583241455;0,00220507166482911;2018;"01";2018-01-17;0,294374111032588;0,706035396550902;6178;63500;440;7,1;7;"Jørgen Jørgensen";"Ole Petersen";1;"S";"S";0;0;1;0,0999999999999996;1,43791406435124
"29";"Aeroe.17-05-2016.pdf";2;9;4309;"Ærø Kommune";"17-05-2016";4320;0,000462962962962963;0,00208333333333333;2016;"05";2016-05-17;0,123609869771554;0,667056359032988;6290;61465;460;7;6,6;"Jørgen Jørgensen";"Ole Petersen";1;"S";"S";0;0;1;0,4;1,50327379454902
"30";"Aeroe.18-04-2017.pdf";7;22;3933;"Ærø Kommune";"18-04-2017";3962;0,00176678445229682;0,00555275113579;2017;"04";2017-04-18;0,471726711495684;1,77791901852306;6177;60492;444;7,1;7;"Jørgen Jørgensen";"Ole Petersen";1;"S";"S";0;0;1;0,0999999999999996;1,4509860103908
"31";"Aeroe.18-09-2018.pdf";2;4;669;"Ærø Kommune";"18-09-2018";675;0,00296296296296296;0,00592592592592593;2018;"09";2018-09-18;0,791103166537947;1,89740475458272;6178;63500;440;7,1;7;"Jørgen Jørgensen";"Ole Petersen";1;"S";"S";0;0;1;0,0999999999999996;1,43791406435124
"32";"Aeroe.19-01-2016.pdf";10;19;5623;"Ærø Kommune";"19-01-2016";5652;0,00176928520877565;0,00336164189667374;2016;"01";2016-01-19;0,472394406770271;1,07635420990461;6290;61465;460;7;6,6;"Jørgen Jørgensen";"Ole Petersen";1;"S";"S";0;0;1;0,4;1,50327379454902
"33";"Aeroe.19-02-2019.pdf";2;11;4177;"Ærø Kommune";"19-02-2019";4190;0,000477326968973747;0,00262529832935561;2019;"02";2019-02-19;0,127445020862318;0,840586533578562;6058;63595;436;7,5;7,1;"Jørgen Jørgensen";"Ole Petersen";1;"S";"S";0;0;1;0,4;1,42484211831168
"34";"Aeroe.19-04-2016.pdf";3;5;3773;"Ærø Kommune";"19-04-2016";3781;0,000793440888653795;0,00132240148108966;2016;"04";2016-04-19;0,211846589822711;0,423415832234639;6290;61465;460;7;6,6;"Jørgen Jørgensen";"Ole Petersen";1;"S";"S";0;0;1;0,4;1,50327379454902
"35";"Aeroe.19-09-2017.pdf";2;5;3854;"Ærø Kommune";"19-09-2017";3861;0,000518000518000518;0,00129500129500129;2017;"09";2017-09-19;0,138304749394746;0,414642647417553;6177;60492;444;7,1;7;"Jørgen Jørgensen";"Ole Petersen";1;"S";"S";0;0;1;0,0999999999999996;1,4509860103908
"36";"Aeroe.19-11-2018.pdf";1;0;516;"Ærø Kommune";"19-11-2018";517;0,00193423597678917;0;2018;"11";2018-11-19;0,516435819548467;0;6178;63500;440;7,1;7;"Jørgen Jørgensen";"Ole Petersen";1;"S";"S";0;0;1;0,0999999999999996;1,43791406435124
"37";"Aeroe.20-06-2017.pdf";4;2;3664;"Ærø Kommune";"20-06-2017";3670;0,00108991825613079;0,000544959128065395;2017;"06";2017-06-20;0,291005251996248;0,174488856858765;6177;60492;444;7,1;7;"Jørgen Jørgensen";"Ole Petersen";1;"S";"S";0;0;1;0,0999999999999996;1,4509860103908
"38";"Aeroe.20-08-2018.pdf";0;3;2641;"Ærø Kommune";"20-08-2018";2644;0;0,00113464447806354;2018;"08";2018-08-20;0;0,363298470880296;6178;63500;440;7,1;7;"Jørgen Jørgensen";"Ole Petersen";1;"S";"S";0;0;1;0,0999999999999996;1,43791406435124
"39";"Aeroe.20-09-2016.pdf";0;7;2150;"Ærø Kommune";"20-09-2016";2157;0;0,00324524802967084;2016;"09";2016-09-20;0;1,03908640071898;6290;61465;460;7;6,6;"Jørgen Jørgensen";"Ole Petersen";1;"S";"S";0;0;1;0,4;1,50327379454902
"40";"Aeroe.21-02-2017.pdf";6;14;2564;"Ærø Kommune";"21-02-2017";2584;0,00232198142414861;0,00541795665634675;2017;"02";2017-02-21;0,619962814334111;1,73475957147898;6177;60492;444;7,1;7;"Jørgen Jørgensen";"Ole Petersen";1;"S";"S";0;0;1;0,0999999999999996;1,4509860103908
"41";"Aeroe.21-03-2017.pdf";8;17;5394;"Ærø Kommune";"21-03-2017";5419;0,00147628713784831;0,00313711016792766;2017;"03";2017-03-21;0,394164707446477;1,00446205752153;6177;60492;444;7,1;7;"Jørgen Jørgensen";"Ole Petersen";1;"S";"S";0;0;1;0,0999999999999996;1,4509860103908
"42";"Aeroe.23-04-2019.pdf";1;2;3737;"Ærø Kommune";"23-04-2019";3740;0,000267379679144385;0,00053475935828877;2019;"04";2019-04-23;0,0713896574081704;0,171223022639483;6058;63595;436;7,5;7,1;"Jørgen Jørgensen";"Ole Petersen";1;"S";"S";0;0;1;0,4;1,42484211831168
"43";"Aeroe.26-03-2019.pdf";3;7;5367;"Ærø Kommune";"26-03-2019";5377;0,000557931932304259;0,0013018411753766;2019;"03";2019-03-26;0,148966329946005;0,416832688553253;6058;63595;436;7,5;7,1;"Jørgen Jørgensen";"Ole Petersen";1;"S";"S";0;0;1;0,4;1,42484211831168
"44";"Aeroe.27-04-2016.pdf";0;0;383;"Ærø Kommune";"27-04-2016";383;0;0;2016;"04";2016-04-27;0;0;6290;61465;460;7;6,6;"Jørgen Jørgensen";"Ole Petersen";1;"S";"S";0;0;1;0,4;1,50327379454902
"45";"Aeroe.28-01-2019.pdf";0;0;59;"Ærø Kommune";"28-01-2019";59;0;0;2019;"01";2019-01-28;0;0;6058;63595;436;7,5;7,1;"Jørgen Jørgensen";"Ole Petersen";1;"S";"S";0;0;1;0,4;1,42484211831168
"46";"Aeroe.30-03-2016.pdf";3;26;2174;"Ærø Kommune";"30-03-2016";2203;0,00136177939173854;0,011802088061734;2016;"03";2016-03-30;0,363591446264036;3,77887578789455;6290;61465;460;7;6,6;"Jørgen Jørgensen";"Ole Petersen";1;"S";"S";0;0;1;0,4;1,50327379454902
"47";"Albertslund.04-01-2017.pdf";0;5;484;"Albertslund Kommune";"04-01-2017";489;0;0,0102249488752556;2017;"01";2017-01-04;0;3,2738962406527;27896;83456;661;6,3;6,6;"Steen Christiansen";"Steen Christiansen";0;"S";"S";0;0;0;-0,3;2,16013908303675
"48";"Albertslund.04-03-2019.pdf";0;0;272;"Albertslund Kommune";"04-03-2019";272;0;0;2019;"03";2019-03-04;0;0;27877;87933;598;6,4;6,5;"Steen Christiansen";"Steen Christiansen";0;"S";"S";0;0;0;-0,0999999999999996;1,95425593291373
"49";"Albertslund.04-06-2018.pdf";0;0;734;"Albertslund Kommune";"04-06-2018";734;0;0;2018;"06";2018-06-04;0;0;27743;83716;603;6,1;6,4;"Steen Christiansen";"Steen Christiansen";0;"S";"S";0;0;0;-0,300000000000001;1,97059586546318
"50";"Albertslund.05-03-2018.pdf";0;1;295;"Albertslund Kommune";"05-03-2018";296;0;0,00337837837837838;2018;"03";2018-03-05;0;1,08171301464809;27743;83716;603;6,1;6,4;"Steen Christiansen";"Steen Christiansen";0;"S";"S";0;0;0;-0,300000000000001;1,97059586546318
"51";"Albertslund.06-02-2019.pdf";2;5;1395;"Albertslund Kommune";"06-02-2019";1402;0,0014265335235378;0,00356633380884451;2019;"02";2019-02-06;0,380880625829611;1,14189390989955;27877;87933;598;6,4;6,5;"Steen Christiansen";"Steen Christiansen";0;"S";"S";0;0;0;-0,0999999999999996;1,95425593291373
"52";"Albertslund.06-12-2016.pdf";0;1;517;"Albertslund Kommune";"06-12-2016";518;0;0,00193050193050193;2016;"12";2016-12-06;0;0,61812172265605;27880;79855;744;6,2;6,5;"Steen Christiansen";"Steen Christiansen";0;"S";"S";0;0;0;-0,3;2,43138196335755
"53";"Albertslund.07-03-2017.pdf";0;0;121;"Albertslund Kommune";"07-03-2017";121;0;0;2017;"03";2017-03-07;0;0;27896;83456;661;6,3;6,6;"Steen Christiansen";"Steen Christiansen";0;"S";"S";0;0;0;-0,3;2,16013908303675
"54";"Albertslund.07-06-2017.pdf";1;0;1069;"Albertslund Kommune";"07-06-2017";1070;0,000934579439252336;0;2017;"06";2017-06-07;0,249530204398652;0;27896;83456;661;6,3;6,6;"Steen Christiansen";"Steen Christiansen";0;"S";"S";0;0;0;-0,3;2,16013908303675
"55";"Albertslund.08-06-2016.pdf";0;0;1338;"Albertslund Kommune";"08-06-2016";1338;0;0;2016;"06";2016-06-08;0;0;27880;79855;744;6,2;6,5;"Steen Christiansen";"Steen Christiansen";0;"S";"S";0;0;0;-0,3;2,43138196335755
"56";"Albertslund.08-11-2016.pdf";2;0;493;"Albertslund Kommune";"08-11-2016";495;0,00404040404040404;0;2016;"11";2016-11-08;1,07877704527902;0;27880;79855;744;6,2;6,5;"Steen Christiansen";"Steen Christiansen";0;"S";"S";0;0;0;-0,3;2,43138196335755
"57";"Albertslund.13-12-2017.pdf";16;2;1159;"Albertslund Kommune";"13-12-2017";1177;0,0135938827527613;0,00169923534409516;2017;"12";2017-12-13;3,62953024579857;0,544073156050695;27896;83456;661;6,3;6,6;"Steen Christiansen";"Steen Christiansen";0;"S";"S";0;0;0;-0,3;2,16013908303675
"58";"Albertslund.14-02-2018.pdf";26;1;1187;"Albertslund Kommune";"14-02-2018";1214;0,0214168039538715;0,000823723228995058;2018;"02";2018-02-14;5,71822923094768;0,263745512632483;27743;83716;603;6,1;6,4;"Steen Christiansen";"Steen Christiansen";0;"S";"S";0;0;0;-0,300000000000001;1,97059586546318
"59";"Albertslund.14-12-2016.pdf";0;0;1485;"Albertslund Kommune";"14-12-2016";1485;0;0;2016;"12";2016-12-14;0;0;27880;79855;744;6,2;6,5;"Steen Christiansen";"Steen Christiansen";0;"S";"S";0;0;0;-0,3;2,43138196335755
"60";"Albertslund.15-02-2017.pdf";0;12;1268;"Albertslund Kommune";"15-02-2017";1280;0;0,009375;2017;"02";2017-02-15;0;3,00175361564845;27896;83456;661;6,3;6,6;"Steen Christiansen";"Steen Christiansen";0;"S";"S";0;0;0;-0,3;2,16013908303675
"61";"Albertslund.16-01-2019.pdf";3;6;2855;"Albertslund Kommune";"16-01-2019";2864;0,00104748603351955;0,00209497206703911;2019;"01";2019-01-16;0,279675962332288;0,670782930871161;27877;87933;598;6,4;6,5;"Steen Christiansen";"Steen Christiansen";0;"S";"S";0;0;0;-0,0999999999999996;1,95425593291373
"62";"Albertslund.16-03-2016.pdf";3;2;1740;"Albertslund Kommune";"16-03-2016";1745;0,00171919770773639;0,00114613180515759;2016;"03";2016-03-16;0,459021178292075;0,366976564281758;27880;79855;744;6,2;6,5;"Steen Christiansen";"Steen Christiansen";0;"S";"S";0;0;0;-0,3;2,43138196335755
"63";"Albertslund.16-04-2018.pdf";0;0;210;"Albertslund Kommune";"16-04-2018";210;0;0;2018;"04";2018-04-16;0;0;27743;83716;603;6,1;6,4;"Steen Christiansen";"Steen Christiansen";0;"S";"S";0;0;0;-0,300000000000001;1,97059586546318
"64";"Albertslund.16-05-2018.pdf";0;5;1627;"Albertslund Kommune";"16-05-2018";1632;0;0,00306372549019608;2018;"05";2018-05-16;0;0,980965233872041;27743;83716;603;6,1;6,4;"Steen Christiansen";"Steen Christiansen";0;"S";"S";0;0;0;-0,300000000000001;1,97059586546318
"65";"Albertslund.17-01-2018.pdf";0;3;1252;"Albertslund Kommune";"17-01-2018";1255;0;0,00239043824701195;2018;"01";2018-01-17;0;0,765387376101596;27743;83716;603;6,1;6,4;"Steen Christiansen";"Steen Christiansen";0;"S";"S";0;0;0;-0,300000000000001;1,97059586546318
"66";"Albertslund.17-02-2016.pdf";0;4;210;"Albertslund Kommune";"17-02-2016";214;0;0,0186915887850467;2016;"02";2016-02-17;0;5,98480471655765;27880;79855;744;6,2;6,5;"Steen Christiansen";"Steen Christiansen";0;"S";"S";0;0;0;-0,3;2,43138196335755
"67";"Albertslund.17-05-2017.pdf";2;13;2160;"Albertslund Kommune";"17-05-2017";2175;0,000919540229885057;0,00597701149425287;2017;"05";2017-05-17;0,245514775822122;1,91376169212223;27896;83456;661;6,3;6,6;"Steen Christiansen";"Steen Christiansen";0;"S";"S";0;0;0;-0,3;2,16013908303675
"68";"Albertslund.17-12-2018.pdf";3;0;568;"Albertslund Kommune";"17-12-2018";571;0,00525394045534151;0;2018;"12";2018-12-17;1,40278801422009;0;27743;83716;603;6,1;6,4;"Steen Christiansen";"Steen Christiansen";0;"S";"S";0;0;0;-0,300000000000001;1,97059586546318
"69";"Albertslund.18-01-2017.pdf";8;7;2804;"Albertslund Kommune";"18-01-2017";2819;0,00283788577509755;0,00248315005321036;2017;"01";2017-01-18;0,757707892746526;0,795072496044994;27896;83456;661;6,3;6,6;"Steen Christiansen";"Steen Christiansen";0;"S";"S";0;0;0;-0,3;2,16013908303675
"70";"Albertslund.18-04-2018.pdf";2;8;1788;"Albertslund Kommune";"18-04-2018";1798;0,00111234705228031;0,00444938820912125;2018;"04";2018-04-18;0,296993680429986;1,42463649537635;27743;83716;603;6,1;6,4;"Steen Christiansen";"Steen Christiansen";0;"S";"S";0;0;0;-0,300000000000001;1,97059586546318
"71";"Albertslund.18-05-2016.pdf";0;10;1641;"Albertslund Kommune";"18-05-2016";1651;0;0,00605693519079346;2016;"05";2016-05-18;0;1,93935222492934;27880;79855;744;6,2;6,5;"Steen Christiansen";"Steen Christiansen";0;"S";"S";0;0;0;-0,3;2,43138196335755
"72";"Albertslund.18-09-2017.pdf";2;2;1325;"Albertslund Kommune";"18-09-2017";1329;0,00150489089541008;0,00150489089541008;2017;"09";2017-09-18;0,401801834020402;0,481846579888388;27896;83456;661;6,3;6,6;"Steen Christiansen";"Steen Christiansen";0;"S";"S";0;0;0;-0,3;2,16013908303675
"73";"Albertslund.19-04-2017.pdf";1;13;1655;"Albertslund Kommune";"19-04-2017";1669;0,000599161174355902;0,00778909526662672;2017;"04";2017-04-19;0,159974427026098;2,49396745378421;27896;83456;661;6,3;6,6;"Steen Christiansen";"Steen Christiansen";0;"S";"S";0;0;0;-0,3;2,16013908303675
"74";"Albertslund.19-09-2018.pdf";6;4;2216;"Albertslund Kommune";"19-09-2018";2226;0,00269541778975741;0,00179694519317161;2018;"09";2018-09-19;0,719669322659184;0,575358584610663;27743;83716;603;6,1;6,4;"Steen Christiansen";"Steen Christiansen";0;"S";"S";0;0;0;-0,300000000000001;1,97059586546318
"75";"Albertslund.19-11-2018.pdf";0;1;205;"Albertslund Kommune";"19-11-2018";206;0;0,00485436893203883;2018;"11";2018-11-19;0;1,55430607930017;27743;83716;603;6,1;6,4;"Steen Christiansen";"Steen Christiansen";0;"S";"S";0;0;0;-0,300000000000001;1,97059586546318
"76";"Albertslund.20-03-2019.pdf";1;0;1165;"Albertslund Kommune";"20-03-2019";1166;0,000857632933104631;0;2019;"03";2019-03-20;0,228985693573377;0;27877;87933;598;6,4;6,5;"Steen Christiansen";"Steen Christiansen";0;"S";"S";0;0;0;-0,0999999999999996;1,95425593291373
"77";"Albertslund.20-04-2016.pdf";8;3;3654;"Albertslund Kommune";"20-04-2016";3665;0,00218281036834925;0,000818553888130969;2016;"04";2016-04-20;0,582804515594122;0,262090356618691;27880;79855;744;6,2;6,5;"Steen Christiansen";"Steen Christiansen";0;"S";"S";0;0;0;-0,3;2,43138196335755
"78";"Albertslund.21-03-2018.pdf";3;0;1512;"Albertslund Kommune";"21-03-2018";1515;0,00198019801980198;0;2018;"03";2018-03-21;0,528707561795163;0;27743;83716;603;6,1;6,4;"Steen Christiansen";"Steen Christiansen";0;"S";"S";0;0;0;-0,300000000000001;1,97059586546318
"79";"Albertslund.21-09-2016.pdf";3;3;1074;"Albertslund Kommune";"21-09-2016";1080;0,00277777777777778;0,00277777777777778;2016;"09";2016-09-21;0,741659218629325;0,88940847871065;27880;79855;744;6,2;6,5;"Steen Christiansen";"Steen Christiansen";0;"S";"S";0;0;0;-0,3;2,43138196335755
"80";"Albertslund.21-11-2018.pdf";8;13;2833;"Albertslund Kommune";"21-11-2018";2854;0,0028030833917309;0,00455501051156272;2018;"11";2018-11-21;0,748415749703033;1,45845538905601;27743;83716;603;6,1;6,4;"Steen Christiansen";"Steen Christiansen";0;"S";"S";0;0;0;-0,300000000000001;1,97059586546318
"81";"Albertslund.22-08-2018.pdf";7;13;2645;"Albertslund Kommune";"22-08-2018";2665;0,00262664165103189;0,0048780487804878;2018;"08";2018-08-22;0,70130627802848;1,5618880601748;27743;83716;603;6,1;6,4;"Steen Christiansen";"Steen Christiansen";0;"S";"S";0;0;0;-0,300000000000001;1,97059586546318
"82";"Albertslund.23-08-2017.pdf";2;4;957;"Albertslund Kommune";"23-08-2017";963;0,00207684319833853;0,00415368639667705;2017;"08";2017-08-23;0,554511565330337;1,32995660367948;27896;83456;661;6,3;6,6;"Steen Christiansen";"Steen Christiansen";0;"S";"S";0;0;0;-0,3;2,16013908303675
"83";"Albertslund.23-11-2016.pdf";2;6;1659;"Albertslund Kommune";"23-11-2016";1667;0,0011997600479904;0,00359928014397121;2016;"11";2016-11-23;0,320332715904688;1,15244289982904;27880;79855;744;6,2;6,5;"Steen Christiansen";"Steen Christiansen";0;"S";"S";0;0;0;-0,3;2,43138196335755
"84";"Albertslund.24-08-2016.pdf";7;5;2210;"Albertslund Kommune";"24-08-2016";2222;0,00315031503150315;0,00225022502250225;2016;"08";2016-08-24;0,841125666492304;0,720492917047332;27880;79855;744;6,2;6,5;"Steen Christiansen";"Steen Christiansen";0;"S";"S";0;0;0;-0,3;2,43138196335755
"85";"Albertslund.25-10-2017.pdf";24;1;721;"Albertslund Kommune";"25-10-2017";746;0,032171581769437;0,00134048257372654;2017;"10";2017-10-25;8,58972607098843;0,429205163989054;27896;83456;661;6,3;6,6;"Steen Christiansen";"Steen Christiansen";0;"S";"S";0;0;0;-0,3;2,16013908303675
"86";"Albertslund.26-10-2016.pdf";2;2;1498;"Albertslund Kommune";"26-10-2016";1502;0,00133155792276964;0,00133155792276964;2016;"10";2016-10-26;0,355522395081967;0,426347606306038;27880;79855;744;6,2;6,5;"Steen Christiansen";"Steen Christiansen";0;"S";"S";0;0;0;-0,3;2,43138196335755
"87";"Albertslund.28-03-2017.pdf";11;2;1566;"Albertslund Kommune";"28-03-2017";1579;0,00696643445218493;0,0012666244458518;2017;"03";2017-03-28;1,86001931967836;0,405556747733799;27896;83456;661;6,3;6,6;"Steen Christiansen";"Steen Christiansen";0;"S";"S";0;0;0;-0,3;2,16013908303675
"88";"Albertslund.29-10-2018.pdf";0;10;1228;"Albertslund Kommune";"29-10-2018";1238;0;0,00807754442649435;2018;"10";2018-10-29;0;2,58632514003097;27743;83716;603;6,1;6,4;"Steen Christiansen";"Steen Christiansen";0;"S";"S";0;0;0;-0,300000000000001;1,97059586546318
"89";"Alleroed.01-03-2016.pdf";12;33;15363;"Allerød Kommune";"01-03-2016";15408;0,000778816199376947;0,0021417445482866;2016;"03";2016-03-01;0,207941836998876;0,68575887377223;24732;61112;669;8,1;8;"Jørgen Johansen";"Karsten Längerich";1;"C";"V";1;0;0;0,0999999999999996;2,18628297511586
"90";"Alleroed.02-05-2018.pdf";2;6;4068;"Allerød Kommune";"02-05-2018";4076;0,000490677134445535;0,0014720314033366;2018;"05";2018-05-02;0,131009479247575;0,471325395980129;25235;66901;783;8,2;8;"Jørgen Johansen";"Karsten Längerich";1;"C";"V";1;0;0;0,199999999999999;2,55883343724323
"91";"Alleroed.03-04-2019.pdf";2;4;1798;"Allerød Kommune";"03-04-2019";1804;0,00110864745011086;0,00221729490022173;2019;"04";2019-04-03;0,296005896570463;0,709949118261273;25646;70915;771;8,1;8;"Jørgen Johansen";"Karsten Längerich";1;"C";"V";1;0;0;0,0999999999999996;2,51961759912456
"92";"Alleroed.03-05-2016.pdf";29;57;31694;"Allerød Kommune";"03-05-2016";31780;0,000912523599748269;0,00179358086847074;2016;"05";2016-05-03;0,243641354389243;0,574281371401591;24732;61112;669;8,1;8;"Jørgen Johansen";"Karsten Längerich";1;"C";"V";1;0;0;0,0999999999999996;2,18628297511586
"93";"Alleroed.04-04-2018.pdf";6;3;3047;"Allerød Kommune";"04-04-2018";3056;0,00196335078534031;0,000981675392670157;2018;"04";2018-04-04;0,524209395366277;0,31431975032968;25235;66901;783;8,2;8;"Jørgen Johansen";"Karsten Längerich";1;"C";"V";1;0;0;0,199999999999999;2,55883343724323
"94";"Alleroed.05-04-2016.pdf";23;74;31680;"Allerød Kommune";"05-04-2016";31777;0,000723793939012493;0,00232872832551846;2016;"04";2016-04-05;0,193251041012393;0,745628658238718;24732;61112;669;8,1;8;"Jørgen Johansen";"Karsten Längerich";1;"C";"V";1;0;0;0,0999999999999996;2,18628297511586
"95";"Alleroed.06-03-2019.pdf";12;4;3418;"Allerød Kommune";"06-03-2019";3434;0,0034944670937682;0,0011648223645894;2019;"03";2019-03-06;0,933013344344405;0,372961039412736;25646;70915;771;8,1;8;"Jørgen Johansen";"Karsten Längerich";1;"C";"V";1;0;0;0,0999999999999996;2,51961759912456
"96";"Alleroed.09-01-2019.pdf";2;14;4510;"Allerød Kommune";"09-01-2019";4526;0,000441891294741494;0,00309323906319046;2019;"01";2019-01-09;0,117983790855748;0,990415097813009;25646;70915;771;8,1;8;"Jørgen Johansen";"Karsten Längerich";1;"C";"V";1;0;0;0,0999999999999996;2,51961759912456
"97";"Alleroed.10-01-2018.pdf";0;1;1137;"Allerød Kommune";"10-01-2018";1138;0;0,000878734622144112;2018;"01";2018-01-10;0;0,281359448449766;25235;66901;783;8,2;8;"Jørgen Johansen";"Karsten Längerich";1;"C";"V";1;0;0;0,199999999999999;2,55883343724323
"98";"Alleroed.12-05-2016.pdf";1;1;3341;"Allerød Kommune";"12-05-2016";3343;0,000299132515704457;0,000299132515704457;2016;"05";2016-05-12;0,0798675796310371;0,0957783584612127;24732;61112;669;8,1;8;"Jørgen Johansen";"Karsten Längerich";1;"C";"V";1;0;0;0,0999999999999996;2,18628297511586
"99";"Alleroed.18-01-2016.pdf";1;15;1064;"Allerød Kommune";"18-01-2016";1080;0,000925925925925926;0,0138888888888889;2016;"01";2016-01-18;0,247219739543108;4,44704239355325;24732;61112;669;8,1;8;"Jørgen Johansen";"Karsten Längerich";1;"C";"V";1;0;0;0,0999999999999996;2,18628297511586
"100";"Alleroed.20-09-2016.pdf";4;2;3221;"Allerød Kommune";"20-09-2016";3227;0,00123954136969321;0,000619770684846607;2016;"09";2016-09-20;0,330954222133941;0,198442548705196;24732;61112;669;8,1;8;"Jørgen Johansen";"Karsten Längerich";1;"C";"V";1;0;0;0,0999999999999996;2,18628297511586
"101";"Alleroed.20-12-2016.pdf";16;32;14272;"Allerød Kommune";"20-12-2016";14320;0,00111731843575419;0,00223463687150838;2016;"12";2016-12-20;0,298321026487773;0,715501792929238;24732;61112;669;8,1;8;"Jørgen Johansen";"Karsten Längerich";1;"C";"V";1;0;0;0,0999999999999996;2,18628297511586
"102";"Alleroed.21-06-2016.pdf";56;36;16875;"Allerød Kommune";"21-06-2016";16967;0,00330052454765132;0,00212176578063299;2016;"06";2016-06-21;0,881231204548076;0,679361931047918;24732;61112;669;8,1;8;"Jørgen Johansen";"Karsten Längerich";1;"C";"V";1;0;0;0,0999999999999996;2,18628297511586
"103";"Alleroed.21-11-2018.pdf";9;35;4941;"Allerød Kommune";"21-11-2018";4985;0,00180541624874624;0,00702106318956871;2018;"11";2018-11-21;0,482041297564496;2,24805352693163;25235;66901;783;8,2;8;"Jørgen Johansen";"Karsten Längerich";1;"C";"V";1;0;0;0,199999999999999;2,55883343724323
"104";"Alleroed.22-11-2016.pdf";157;12;5751;"Allerød Kommune";"22-11-2016";5920;0,0265202702702703;0,00202702702702703;2016;"11";2016-11-22;7,08084105353538;0,649027808788853;24732;61112;669;8,1;8;"Jørgen Johansen";"Karsten Längerich";1;"C";"V";1;0;0;0,0999999999999996;2,18628297511586
"105";"Alleroed.24-01-2017.pdf";2;7;4230;"Allerød Kommune";"24-01-2017";4239;0,000471809389006841;0,00165133286152394;2017;"01";2017-01-24;0,125971841805406;0,52873540135665;24942;68030;810;8;8,1;"Jørgen Johansen";"Karsten Längerich";1;"C";"V";1;0;0;-0,0999999999999996;2,64706907301024
"106";"Alleroed.24-01-2018.pdf";1;5;3167;"Allerød Kommune";"24-01-2018";3173;0,000315159155373464;0,00157579577686732;2018;"01";2018-01-24;0,084146649450538;0,504549404878402;25235;66901;783;8,2;8;"Jørgen Johansen";"Karsten Längerich";1;"C";"V";1;0;0;0,199999999999999;2,55883343724323
"107";"Alleroed.24-11-2016.pdf";1;13;1711;"Allerød Kommune";"24-11-2016";1725;0,000579710144927536;0,00753623188405797;2016;"11";2016-11-24;0,154781054322642;2,41300387267585;24732;61112;669;8,1;8;"Jørgen Johansen";"Karsten Längerich";1;"C";"V";1;0;0;0,0999999999999996;2,18628297511586
"108";"Alleroed.25-02-2016.pdf";0;7;411;"Allerød Kommune";"25-02-2016";418;0;0,0167464114832536;2016;"02";2016-02-25;0;5,36198413002593;24732;61112;669;8,1;8;"Jørgen Johansen";"Karsten Längerich";1;"C";"V";1;0;0;0,0999999999999996;2,18628297511586
"109";"Alleroed.26-01-2016.pdf";511;117;61527;"Allerød Kommune";"26-01-2016";62155;0,00822138202879897;0,00188239079720055;2016;"01";2016-01-26;2,1950869577516;0,602717160699744;24732;61112;669;8,1;8;"Jørgen Johansen";"Karsten Längerich";1;"C";"V";1;0;0;0,0999999999999996;2,18628297511586
"110";"Alleroed.26-04-2018.pdf";0;0;243;"Allerød Kommune";"26-04-2018";243;0;0;2018;"04";2018-04-26;0;0;25235;66901;783;8,2;8;"Jørgen Johansen";"Karsten Längerich";1;"C";"V";1;0;0;0,199999999999999;2,55883343724323
"111";"Alleroed.26-09-2018.pdf";1;13;3390;"Allerød Kommune";"26-09-2018";3404;0,000293772032902468;0,00381903642773208;2018;"09";2018-09-26;0,0784363450959334;1,22280601655871;25235;66901;783;8,2;8;"Jørgen Johansen";"Karsten Längerich";1;"C";"V";1;0;0;0,199999999999999;2,55883343724323
"112";"Alleroed.27-06-2018.pdf";11;23;7168;"Allerød Kommune";"27-06-2018";7202;0,00152735351291308;0,00319355734518189;2018;"06";2018-06-27;0,407799292664833;1,02253571281924;25235;66901;783;8,2;8;"Jørgen Johansen";"Karsten Längerich";1;"C";"V";1;0;0;0,199999999999999;2,55883343724323
"113";"Alleroed.28-02-2018.pdf";32;18;6574;"Allerød Kommune";"28-02-2018";6624;0,00483091787439614;0,00271739130434783;2018;"02";2018-02-28;1,28984211935535;0,870073511782158;25235;66901;783;8,2;8;"Jørgen Johansen";"Karsten Längerich";1;"C";"V";1;0;0;0,199999999999999;2,55883343724323
"114";"Alleroed.28-03-2017.pdf";33;45;24518;"Allerød Kommune";"28-03-2017";24596;0,00134168157423971;0,00182956578305416;2017;"03";2017-03-28;0,358225382879996;0,585803275130612;24942;68030;810;8;8,1;"Jørgen Johansen";"Karsten Längerich";1;"C";"V";1;0;0;-0,0999999999999996;2,64706907301024
"115";"Alleroed.28-04-2016.pdf";0;4;3498;"Allerød Kommune";"28-04-2016";3502;0;0,00114220445459737;2016;"04";2016-04-28;0;0,365719077482392;24732;61112;669;8,1;8;"Jørgen Johansen";"Karsten Längerich";1;"C";"V";1;0;0;0,0999999999999996;2,18628297511586
"116";"Alleroed.29-08-2018.pdf";5;5;2994;"Allerød Kommune";"29-08-2018";3004;0,00166444740346205;0,00166444740346205;2018;"08";2018-08-29;0,444402993852459;0,532934507882547;25235;66901;783;8,2;8;"Jørgen Johansen";"Karsten Längerich";1;"C";"V";1;0;0;0,199999999999999;2,55883343724323
"117";"Alleroed.30-01-2019.pdf";2;6;3759;"Allerød Kommune";"30-01-2019";3767;0,000530926466684364;0,00159277940005309;2019;"01";2019-01-30;0,141755943035071;0,509987341124238;25646;70915;771;8,1;8;"Jørgen Johansen";"Karsten Längerich";1;"C";"V";1;0;0;0,0999999999999996;2,51961759912456
"118";"Alleroed.30-05-2018.pdf";8;9;5443;"Allerød Kommune";"30-05-2018";5460;0,00146520146520147;0,00164835164835165;2018;"05";2018-05-30;0,39120486257371;0,527780855498628;25235;66901;783;8,2;8;"Jørgen Johansen";"Karsten Längerich";1;"C";"V";1;0;0;0,199999999999999;2,55883343724323
"119";"Alleroed.30-08-2016.pdf";29;15;24317;"Allerød Kommune";"30-08-2016";24361;0,00119042732235951;0,000615738270185953;2016;"08";2016-08-30;0,317840903185015;0,197151421741206;24732;61112;669;8,1;8;"Jørgen Johansen";"Karsten Längerich";1;"C";"V";1;0;0;0,0999999999999996;2,18628297511586
"120";"Alleroed.31-05-2016.pdf";3;6;4131;"Allerød Kommune";"31-05-2016";4140;0,00072463768115942;0,00144927536231884;2016;"05";2016-05-31;0,193476317903302;0,464039206283818;24732;61112;669;8,1;8;"Jørgen Johansen";"Karsten Längerich";1;"C";"V";1;0;0;0,0999999999999996;2,18628297511586
"121";"Alleroed.31-10-2018.pdf";2;10;2909;"Allerød Kommune";"31-10-2018";2921;0,000684697021567956;0,00342348510783978;2018;"10";2018-10-31;0,18281226888501;1,09615560539484;25235;66901;783;8,2;8;"Jørgen Johansen";"Karsten Längerich";1;"C";"V";1;0;0;0,199999999999999;2,55883343724323
"122";"Assens.01-02-2016.pdf";8;0;2001;"Assens Kommune";"01-02-2016";2009;0,0039820806371329;0;2016;"02";2016-02-01;1,06320485298778;0;41224;63227;299;7;6,8;"Søren Andersen";"Søren Andersen";0;"V";"V";0;0;0;0,2;0,977127966456865
"123";"Assens.02-01-2017.pdf";1;0;1251;"Assens Kommune";"02-01-2017";1252;0,000798722044728434;0;2017;"01";2017-01-02;0,213256644334311;0;41390;63637;318;7,2;6,9;"Søren Andersen";"Søren Andersen";0;"V";"V";0;0;0;0,3;1,03921971014476
"124";"Assens.02-10-2017.pdf";10;15;2594;"Assens Kommune";"02-10-2017";2619;0,00381825124093165;0,00572737686139748;2017;"10";2017-10-02;1,01946284347674;1,83383191486732;41390;63637;318;7,2;6,9;"Søren Andersen";"Søren Andersen";0;"V";"V";0;0;0;0,3;1,03921971014476
"125";"Assens.03-02-2017.pdf";0;21;2185;"Assens Kommune";"03-02-2017";2206;0;0,00951949229374433;2017;"02";2017-02-03;0;3,04801817726769;41390;63637;318;7,2;6,9;"Søren Andersen";"Søren Andersen";0;"V";"V";0;0;0;0,3;1,03921971014476
"126";"Assens.03-04-2017.pdf";9;6;2870;"Assens Kommune";"03-04-2017";2885;0,00311958405545927;0,00207972270363951;2017;"04";2017-04-03;0,832920578287353;0,665900282154248;41390;63637;318;7,2;6,9;"Søren Andersen";"Søren Andersen";0;"V";"V";0;0;0;0,3;1,03921971014476
"127";"Assens.03-05-2017.pdf";5;18;4870;"Assens Kommune";"03-05-2017";4893;0,00102186797465767;0,00367872470876763;2017;"05";2017-05-03;0,272836009305699;1,17788002085531;41390;63637;318;7,2;6,9;"Søren Andersen";"Søren Andersen";0;"V";"V";0;0;0;0,3;1,03921971014476
"128";"Assens.03-09-2018.pdf";1;5;2235;"Assens Kommune";"03-09-2018";2241;0,000446229361892012;0,00223114680946006;2018;"09";2018-09-03;0,119142043153305;0,714384320249518;41328;64838;336;7;6,7;"Søren Andersen";"Søren Andersen";0;"V";"V";0;0;0;0,3;1,09804346732276
"129";"Assens.03-10-2016.pdf";7;4;2248;"Assens Kommune";"03-10-2016";2259;0,0030987162461266;0,00177069499778663;2016;"10";2016-10-03;0,827348929148252;0,566953611927108;41224;63227;299;7;6,8;"Søren Andersen";"Søren Andersen";0;"V";"V";0;0;0;0,2;0,977127966456865
"130";"Assens.03-12-2018.pdf";5;15;2876;"Assens Kommune";"03-12-2018";2896;0,00172651933701657;0,00517955801104972;2018;"12";2018-12-03;0,460976033678448;1,65842741196047;41328;64838;336;7;6,7;"Søren Andersen";"Søren Andersen";0;"V";"V";0;0;0;0,3;1,09804346732276
"131";"Assens.04-01-2016.pdf";0;3;604;"Assens Kommune";"04-01-2016";607;0;0,00494233937397035;2016;"01";2016-01-04;0;1,5824730757949;41224;63227;299;7;6,8;"Søren Andersen";"Søren Andersen";0;"V";"V";0;0;0;0,2;0,977127966456865
"132";"Assens.04-02-2019.pdf";1;12;4040;"Assens Kommune";"04-02-2019";4053;0,000246730816679003;0,00296076980014804;2019;"02";2019-02-04;0,065876466495573;0,948000154954357;41212;65062;328;6,8;6,7;"Søren Andersen";"Søren Andersen";0;"V";"V";0;0;0;0,0999999999999996;1,07189957524365
"133";"Assens.04-03-2019.pdf";3;15;3691;"Assens Kommune";"04-03-2019";3709;0,000808843354003775;0,00404421677001887;2019;"03";2019-03-04;0,215959006772626;1,29490584659949;41212;65062;328;6,8;6,7;"Søren Andersen";"Søren Andersen";0;"V";"V";0;0;0;0,0999999999999996;1,07189957524365
"134";"Assens.04-04-2016.pdf";17;11;4293;"Assens Kommune";"04-04-2016";4321;0,0039342744735015;0,00254570701226568;2016;"04";2016-04-04;1,05044073548055;0,815102424368011;41224;63227;299;7;6,8;"Søren Andersen";"Søren Andersen";0;"V";"V";0;0;0;0,2;0,977127966456865
"135";"Assens.04-06-2018.pdf";4;18;4609;"Assens Kommune";"04-06-2018";4631;0,000863744331677823;0,0038868494925502;2018;"06";2018-06-04;0,230617420605966;1,24451888189268;41328;64838;336;7;6,7;"Søren Andersen";"Søren Andersen";0;"V";"V";0;0;0;0,3;1,09804346732276
"136";"Assens.04-09-2017.pdf";12;4;4399;"Assens Kommune";"04-09-2017";4415;0,00271800679501699;0,000906002265005663;2017;"09";2017-09-04;0,725700526495739;0,290090194641752;41390;63637;318;7,2;6,9;"Søren Andersen";"Søren Andersen";0;"V";"V";0;0;0;0,3;1,03921971014476
"137";"Assens.04-12-2017.pdf";4;4;1899;"Assens Kommune";"04-12-2017";1907;0,00209753539590981;0,00209753539590981;2017;"12";2017-12-04;0,560036326600015;0,671603675586438;41390;63637;318;7,2;6,9;"Søren Andersen";"Søren Andersen";0;"V";"V";0;0;0;0,3;1,03921971014476
"138";"Assens.05-02-2018.pdf";1;7;3268;"Assens Kommune";"05-02-2018";3276;0,000305250305250305;0,00213675213675214;2018;"02";2018-02-05;0,0815010130361896;0,684160368238962;41328;64838;336;7;6,7;"Søren Andersen";"Søren Andersen";0;"V";"V";0;0;0;0,3;1,09804346732276
"139";"Assens.05-03-2018.pdf";8;0;2119;"Assens Kommune";"05-03-2018";2127;0,00376116596144805;0;2018;"03";2018-03-05;1,004221226917;0;41328;64838;336;7;6,7;"Søren Andersen";"Søren Andersen";0;"V";"V";0;0;0;0,3;1,09804346732276
"140";"Assens.05-09-2016.pdf";5;1;2029;"Assens Kommune";"05-09-2016";2035;0,00245700245700246;0,000491400491400491;2016;"09";2016-09-05;0,656013068075079;0,157340074857904;41224;63227;299;7;6,8;"Søren Andersen";"Søren Andersen";0;"V";"V";0;0;0;0,2;0,977127966456865
"141";"Assens.05-11-2018.pdf";3;3;2608;"Assens Kommune";"05-11-2018";2614;0,00114766641162969;0,00114766641162969;2018;"11";2018-11-05;0,306423854674702;0,367467925404553;41328;64838;336;7;6,7;"Søren Andersen";"Søren Andersen";0;"V";"V";0;0;0;0,3;1,09804346732276
"142";"Assens.06-03-2017.pdf";4;3;2040;"Assens Kommune";"06-03-2017";2047;0,00195407914020518;0,00146555935515388;2017;"03";2017-03-06;0,521733890975197;0,469253129949928;41390;63637;318;7,2;6,9;"Søren Andersen";"Søren Andersen";0;"V";"V";0;0;0;0,3;1,03921971014476
"143";"Assens.06-06-2016.pdf";0;20;2025;"Assens Kommune";"06-06-2016";2045;0;0,0097799511002445;2016;"06";2016-06-06;0;3,13141371477588;41224;63227;299;7;6,8;"Søren Andersen";"Søren Andersen";0;"V";"V";0;0;0;0,2;0,977127966456865
"144";"Assens.06-11-2017.pdf";6;4;2595;"Assens Kommune";"06-11-2017";2605;0,00230326295585413;0,00153550863723608;2017;"11";2017-11-06;0,614965033489191;0,491649984392836;41390;63637;318;7,2;6,9;"Søren Andersen";"Søren Andersen";0;"V";"V";0;0;0;0,3;1,03921971014476
"145";"Assens.07-01-2019.pdf";2;11;2544;"Assens Kommune";"07-01-2019";2557;0,000782166601486116;0,00430191630817364;2019;"01";2019-01-07;0,208836385378613;1,37741790210957;41212;65062;328;6,8;6,7;"Søren Andersen";"Søren Andersen";0;"V";"V";0;0;0;0,0999999999999996;1,07189957524365
"146";"Assens.08-01-2018.pdf";6;2;1462;"Assens Kommune";"08-01-2018";1470;0,00408163265306122;0,00136054421768707;2018;"01";2018-01-08;1,08978497431248;0,435628642633788;41328;64838;336;7;6,7;"Søren Andersen";"Søren Andersen";0;"V";"V";0;0;0;0,3;1,09804346732276
"147";"Assens.08-10-2018.pdf";6;2;2707;"Assens Kommune";"08-10-2018";2715;0,00220994475138122;0,000736648250460405;2018;"10";2018-10-08;0,590049323108414;0,235865231923266;41328;64838;336;7;6,7;"Søren Andersen";"Søren Andersen";0;"V";"V";0;0;0;0,3;1,09804346732276
"148";"Assens.08-11-2016.pdf";7;8;2429;"Assens Kommune";"08-11-2016";2444;0,00286415711947627;0,00327332242225859;2016;"11";2016-11-08;0,76472227125446;1,04807545772777;41224;63227;299;7;6,8;"Søren Andersen";"Søren Andersen";0;"V";"V";0;0;0;0,2;0,977127966456865
"149";"Assens.09-04-2018.pdf";2;5;3821;"Assens Kommune";"09-04-2018";3828;0,000522466039707419;0,00130616509926855;2018;"04";2018-04-09;0,139497031717115;0,418217152998738;41328;64838;336;7;6,7;"Søren Andersen";"Søren Andersen";0;"V";"V";0;0;0;0,3;1,09804346732276
"150";"Assens.09-05-2016.pdf";0;0;1928;"Assens Kommune";"09-05-2016";1928;0;0;2016;"05";2016-05-09;0;0;41224;63227;299;7;6,8;"Søren Andersen";"Søren Andersen";0;"V";"V";0;0;0;0,2;0,977127966456865
"151";"Assens.12-06-2017.pdf";0;24;6353;"Assens Kommune";"12-06-2017";6377;0;0,00376352516857456;2017;"06";2017-06-12;0;1,20503203011761;41390;63637;318;7,2;6,9;"Søren Andersen";"Søren Andersen";0;"V";"V";0;0;0;0,3;1,03921971014476
"152";"Assens.13-08-2018.pdf";5;29;4406;"Assens Kommune";"13-08-2018";4440;0,00112612612612613;0,00653153153153153;2018;"08";2018-08-13;0,300672656201078;2,09131182831964;41328;64838;336;7;6,7;"Søren Andersen";"Søren Andersen";0;"V";"V";0;0;0;0,3;1,09804346732276
"153";"Assens.14-08-2017.pdf";4;2;2522;"Assens Kommune";"14-08-2017";2528;0,00158227848101266;0,000791139240506329;2017;"08";2017-08-14;0,422464111877464;0,253312541404932;41390;63637;318;7,2;6,9;"Søren Andersen";"Søren Andersen";0;"V";"V";0;0;0;0,3;1,03921971014476
"154";"Assens.14-11-2016.pdf";0;12;1168;"Assens Kommune";"14-11-2016";1180;0;0,0101694915254237;2016;"11";2016-11-14;0;3,25613951527967;41224;63227;299;7;6,8;"Søren Andersen";"Søren Andersen";0;"V";"V";0;0;0;0,2;0,977127966456865
"155";"Assens.15-01-2016.pdf";0;0;114;"Assens Kommune";"15-01-2016";114;0;0;2016;"01";2016-01-15;0;0;41224;63227;299;7;6,8;"Søren Andersen";"Søren Andersen";0;"V";"V";0;0;0;0,2;0,977127966456865
"156";"Assens.15-08-2016.pdf";0;7;1862;"Assens Kommune";"15-08-2016";1869;0;0,00374531835205993;2016;"08";2016-08-15;0;1,19920244320537;41224;63227;299;7;6,8;"Søren Andersen";"Søren Andersen";0;"V";"V";0;0;0;0,2;0,977127966456865
"157";"Assens.16-06-2017.pdf";0;0;845;"Assens Kommune";"16-06-2017";845;0;0;2017;"06";2017-06-16;0;0;41390;63637;318;7,2;6,9;"Søren Andersen";"Søren Andersen";0;"V";"V";0;0;0;0,3;1,03921971014476
"158";"Assens.17-08-2017.pdf";1;3;1004;"Assens Kommune";"17-08-2017";1008;0,000992063492063492;0,00297619047619048;2017;"08";2017-08-17;0,264878292367616;0,952937655761411;41390;63637;318;7,2;6,9;"Søren Andersen";"Søren Andersen";0;"V";"V";0;0;0;0,3;1,03921971014476
"159";"Assens.18-06-2018.pdf";0;0;94;"Assens Kommune";"18-06-2018";94;0;0;2018;"06";2018-06-18;0;0;41328;64838;336;7;6,7;"Søren Andersen";"Søren Andersen";0;"V";"V";0;0;0;0,3;1,09804346732276
"160";"Assens.28-11-2016.pdf";17;2;2083;"Assens Kommune";"28-11-2016";2102;0,00808753568030447;0,000951474785918173;2016;"11";2016-11-28;2,15935034158491;0,304649907075009;41224;63227;299;7;6,8;"Søren Andersen";"Søren Andersen";0;"V";"V";0;0;0;0,2;0,977127966456865
"161";"Assens.29-02-2016.pdf";2;10;1764;"Assens Kommune";"29-02-2016";1776;0,00112612612612613;0,00563063063063063;2016;"02";2016-02-29;0,300672656201078;1,80285502441348;41224;63227;299;7;6,8;"Søren Andersen";"Søren Andersen";0;"V";"V";0;0;0;0,2;0,977127966456865
"162";"Assens.29-03-2016.pdf";0;0;296;"Assens Kommune";"29-03-2016";296;0;0;2016;"03";2016-03-29;0;0;41224;63227;299;7;6,8;"Søren Andersen";"Søren Andersen";0;"V";"V";0;0;0;0,2;0,977127966456865
"163";"Assens.30-01-2017.pdf";2;14;3403;"Assens Kommune";"30-01-2017";3419;0,000584966364434045;0,00409476455103832;2017;"01";2017-01-30;0,156184450837413;1,31109059160622;41390;63637;318;7,2;6,9;"Søren Andersen";"Søren Andersen";0;"V";"V";0;0;0;0,3;1,03921971014476
"164";"Assens.30-04-2018.pdf";4;2;1944;"Assens Kommune";"30-04-2018";1950;0,00205128205128205;0,00102564102564103;2018;"04";2018-04-30;0,547686807603194;0,328396976754702;41328;64838;336;7;6,7;"Søren Andersen";"Søren Andersen";0;"V";"V";0;0;0;0,3;1,09804346732276
"165";"Assens.31-10-2016.pdf";1;7;1769;"Assens Kommune";"31-10-2016";1777;0,00056274620146314;0,00393922341024198;2016;"10";2016-10-31;0,150251726902958;1,26128833221769;41224;63227;299;7;6,8;"Søren Andersen";"Søren Andersen";0;"V";"V";0;0;0;0,2;0,977127966456865
"166";"Ballerup.01-03-2016.pdf";19;6;2641;"Ballerup Kommune";"01-03-2016";2666;0,00712678169542386;0,00225056264066016;2016;"03";2016-03-01;1,90283160368514;0,720601018010129;48224;72013;1045;6,8;6,8;"Jesper Würtzen";"Jesper Würtzen";0;"S";"S";0;0;0;0;3,41504590283419
"167";"Ballerup.01-11-2016.pdf";3;8;2013;"Ballerup Kommune";"01-11-2016";2024;0,00148221343873518;0,00395256916996047;2016;"11";2016-11-01;0,395747013893118;1,26556147168314;48224;72013;1045;6,8;6,8;"Jesper Würtzen";"Jesper Würtzen";0;"S";"S";0;0;0;0;3,41504590283419
"168";"Ballerup.02-02-2016.pdf";23;6;3439;"Ballerup Kommune";"02-02-2016";3468;0,0066320645905421;0,00173010380622837;2016;"02";2016-02-02;1,77074346316344;0,55395683795127;48224;72013;1045;6,8;6,8;"Jesper Würtzen";"Jesper Würtzen";0;"S";"S";0;0;0;0;3,41504590283419
"169";"Ballerup.02-05-2017.pdf";23;7;3913;"Ballerup Kommune";"02-05-2017";3943;0,00583312198833376;0,0017752979964494;2017;"05";2017-05-02;1,55742793057337;0,568427432500847;48231;75335;1022;7;7,1;"Jesper Würtzen";"Jesper Würtzen";0;"S";"S";0;0;0;-0,0999999999999996;3,33988221310674
"170";"Ballerup.03-05-2016.pdf";3;11;5068;"Ballerup Kommune";"03-05-2016";5082;0,000590318772136954;0,00216450216450216;2016;"05";2016-05-03;0,157613529342714;0,693045567826481;48224;72013;1045;6,8;6,8;"Jesper Würtzen";"Jesper Würtzen";0;"S";"S";0;0;0;0;3,41504590283419
"171";"Ballerup.03-10-2017.pdf";1;13;3294;"Ballerup Kommune";"03-10-2017";3308;0,00030229746070133;0,00392986698911729;2017;"10";2017-10-03;0,080712611459056;1,25829252731737;48231;75335;1022;7;7,1;"Jesper Würtzen";"Jesper Würtzen";0;"S";"S";0;0;0;-0,0999999999999996;3,33988221310674
"172";"Ballerup.04-10-2016.pdf";4;0;1341;"Ballerup Kommune";"04-10-2016";1345;0,00297397769516729;0;2016;"10";2016-10-04;0,794044070502772;0;48224;72013;1045;6,8;6,8;"Jesper Würtzen";"Jesper Würtzen";0;"S";"S";0;0;0;0;3,41504590283419
"173";"Ballerup.04-12-2018.pdf";5;3;1442;"Ballerup Kommune";"04-12-2018";1450;0,00344827586206897;0,00206896551724138;2018;"12";2018-12-04;0,920680409332956;0,662455970350002;48295;79247;995;7,3;7,2;"Jesper Würtzen";"Jesper Würtzen";0;"S";"S";0;0;0;0,0999999999999996;3,25164657733973
"174";"Ballerup.05-01-2016.pdf";3;16;2342;"Ballerup Kommune";"05-01-2016";2361;0,00127064803049555;0,00677678949597628;2016;"01";2016-01-05;0,33925961716208;2,16984025301709;48224;72013;1045;6,8;6,8;"Jesper Würtzen";"Jesper Würtzen";0;"S";"S";0;0;0;0;3,41504590283419
"175";"Ballerup.05-02-2019.pdf";8;25;3499;"Ballerup Kommune";"05-02-2019";3532;0,00226500566251416;0,00707814269535674;2019;"02";2019-02-05;0,604750438746449;2,26632964563869;48458;81103;990;7;7;"Jesper Würtzen";"Jesper Würtzen";0;"S";"S";0;0;0;0;3,23530664479029
"176";"Ballerup.05-04-2016.pdf";17;17;4251;"Ballerup Kommune";"05-04-2016";4285;0,00396732788798133;0,00396732788798133;2016;"04";2016-04-05;1,05926590852076;1,27028702210249;48224;72013;1045;6,8;6,8;"Jesper Würtzen";"Jesper Würtzen";0;"S";"S";0;0;0;0;3,41504590283419
"177";"Ballerup.05-09-2017.pdf";22;23;6343;"Ballerup Kommune";"05-09-2017";6388;0,00344395742016281;0,00360050093926111;2017;"09";2017-09-05;0,919527396923021;1,15283378267442;48231;75335;1022;7;7,1;"Jesper Würtzen";"Jesper Würtzen";0;"S";"S";0;0;0;-0,0999999999999996;3,33988221310674
"178";"Ballerup.06-02-2018.pdf";1;6;2736;"Ballerup Kommune";"06-02-2018";2743;0,000364564345607;0,002187386073642;2018;"02";2018-02-06;0,0973377027730795;0,700372699239885;48295;79247;995;7,3;7,2;"Jesper Würtzen";"Jesper Würtzen";0;"S";"S";0;0;0;0,0999999999999996;3,25164657733973
"179";"Ballerup.06-03-2018.pdf";14;3;3618;"Ballerup Kommune";"06-03-2018";3635;0,00385144429160935;0,000825309491059147;2018;"03";2018-03-06;1,02832529900737;0,264253413207016;48295;79247;995;7,3;7,2;"Jesper Würtzen";"Jesper Würtzen";0;"S";"S";0;0;0;0,0999999999999996;3,25164657733973
"180";"Ballerup.06-09-2016.pdf";1;15;4582;"Ballerup Kommune";"06-09-2016";4598;0,000217485863418878;0,00326228795128317;2016;"09";2016-09-06;0,0580681423894209;1,04454236299206;48224;72013;1045;6,8;6,8;"Jesper Würtzen";"Jesper Würtzen";0;"S";"S";0;0;0;0;3,41504590283419
"181";"Ballerup.07-03-2017.pdf";4;6;2741;"Ballerup Kommune";"07-03-2017";2751;0,00145401672119229;0,00218102508178844;2017;"03";2017-03-07;0,388218565912842;0,698335992008362;48231;75335;1022;7;7,1;"Jesper Würtzen";"Jesper Würtzen";0;"S";"S";0;0;0;-0,0999999999999996;3,33988221310674
"182";"Ballerup.07-11-2017.pdf";1;8;1771;"Ballerup Kommune";"07-11-2017";1780;0,000561797752808989;0,00449438202247191;2017;"11";2017-11-07;0,149998493655369;1,43904293184645;48231;75335;1022;7;7,1;"Jesper Würtzen";"Jesper Würtzen";0;"S";"S";0;0;0;-0,0999999999999996;3,33988221310674
"183";"Ballerup.07-12-2016.pdf";1;0;291;"Ballerup Kommune";"07-12-2016";292;0,00342465753424658;0;2016;"12";2016-12-07;0,914374379132045;0;48224;72013;1045;6,8;6,8;"Jesper Würtzen";"Jesper Würtzen";0;"S";"S";0;0;0;0;3,41504590283419
"184";"Ballerup.09-10-2018.pdf";4;11;3063;"Ballerup Kommune";"09-10-2018";3078;0,00129954515919428;0,00357374918778428;2018;"10";2018-10-09;0,346975073042959;1,14426821822423;48295;79247;995;7,3;7,2;"Jesper Würtzen";"Jesper Würtzen";0;"S";"S";0;0;0;0,0999999999999996;3,25164657733973
"185";"Ballerup.10-01-2017.pdf";0;2;1999;"Ballerup Kommune";"10-01-2017";2001;0;0,000999500249875062;2017;"01";2017-01-10;0;0,320027038816426;48231;75335;1022;7;7,1;"Jesper Würtzen";"Jesper Würtzen";0;"S";"S";0;0;0;-0,0999999999999996;3,33988221310674
"186";"Ballerup.11-09-2018.pdf";13;21;2586;"Ballerup Kommune";"11-09-2018";2620;0,0049618320610687;0,00801526717557252;2018;"09";2018-09-11;1,32479585617757;2,56638477063073;48295;79247;995;7,3;7,2;"Jesper Würtzen";"Jesper Würtzen";0;"S";"S";0;0;0;0,0999999999999996;3,25164657733973
"187";"Ballerup.11-11-2016.pdf";0;4;255;"Ballerup Kommune";"11-11-2016";259;0;0,0154440154440154;2016;"11";2016-11-11;0;4,9449737812484;48224;72013;1045;6,8;6,8;"Jesper Würtzen";"Jesper Würtzen";0;"S";"S";0;0;0;0;3,41504590283419
"188";"Ballerup.12-03-2019.pdf";17;2;5065;"Ballerup Kommune";"12-03-2019";5084;0,00334382376081825;0,0003933910306845;2019;"03";2019-03-12;0,89279197836575;0,125958714530226;48458;81103;990;7;7;"Jesper Würtzen";"Jesper Würtzen";0;"S";"S";0;0;0;0;3,23530664479029
"189";"Ballerup.12-06-2018.pdf";7;10;5476;"Ballerup Kommune";"12-06-2018";5493;0,00127434917167304;0,00182049881667577;2018;"06";2018-06-12;0,340247811932623;0,582900149892289;48295;79247;995;7,3;7,2;"Jesper Würtzen";"Jesper Würtzen";0;"S";"S";0;0;0;0,0999999999999996;3,25164657733973
"190";"Ballerup.12-10-2016.pdf";0;11;538;"Ballerup Kommune";"12-10-2016";549;0;0,0200364298724954;2016;"10";2016-10-12;0;6,41540542020797;48224;72013;1045;6,8;6,8;"Jesper Würtzen";"Jesper Würtzen";0;"S";"S";0;0;0;0;3,41504590283419
"191";"Ballerup.13-11-2018.pdf";3;19;4293;"Ballerup Kommune";"13-11-2018";4315;0,000695249130938586;0,00440324449594438;2018;"11";2018-11-13;0,185629653793667;1,40986187587042;48295;79247;995;7,3;7,2;"Jesper Würtzen";"Jesper Würtzen";0;"S";"S";0;0;0;0,0999999999999996;3,25164657733973
"192";"Ballerup.14-09-2016.pdf";0;0;456;"Ballerup Kommune";"14-09-2016";456;0;0;2016;"09";2016-09-14;0;0;48224;72013;1045;6,8;6,8;"Jesper Würtzen";"Jesper Würtzen";0;"S";"S";0;0;0;0;3,41504590283419
"193";"Ballerup.15-01-2019.pdf";5;1;2301;"Ballerup Kommune";"15-01-2019";2307;0,00216731686172518;0,000433463372345037;2019;"01";2019-01-15;0,578667790868134;0,138789359486707;48458;81103;990;7;7;"Jesper Würtzen";"Jesper Würtzen";0;"S";"S";0;0;0;0;3,23530664479029
"194";"Ballerup.15-05-2018.pdf";5;13;4569;"Ballerup Kommune";"15-05-2018";4587;0,00109003706126008;0,00283409635927622;2018;"05";2018-05-15;0,291036972647217;0,907440959312371;48295;79247;995;7,3;7,2;"Jesper Würtzen";"Jesper Würtzen";0;"S";"S";0;0;0;0,0999999999999996;3,25164657733973
"195";"Ballerup.15-08-2017.pdf";31;27;6324;"Ballerup Kommune";"15-08-2017";6382;0,0048574114697587;0,00423064869946725;2017;"08";2017-08-15;1,29691583828005;1,35459893655085;48231;75335;1022;7;7,1;"Jesper Würtzen";"Jesper Würtzen";0;"S";"S";0;0;0;-0,0999999999999996;3,33988221310674
"196";"Ballerup.16-01-2018.pdf";3;0;1374;"Ballerup Kommune";"16-01-2018";1377;0,00217864923747277;0;2018;"01";2018-01-16;0,581693504807314;0;48295;79247;995;7,3;7,2;"Jesper Würtzen";"Jesper Würtzen";0;"S";"S";0;0;0;0,0999999999999996;3,25164657733973
"197";"Ballerup.16-08-2016.pdf";6;25;6017;"Ballerup Kommune";"16-08-2016";6048;0,000992063492063492;0,00413359788359788;2016;"08";2016-08-16;0,264878292367616;1,32352452189085;48224;72013;1045;6,8;6,8;"Jesper Würtzen";"Jesper Würtzen";0;"S";"S";0;0;0;0;3,41504590283419
"198";"Ballerup.17-04-2018.pdf";8;20;3369;"Ballerup Kommune";"17-04-2018";3397;0,00235501913453047;0,00588754783632617;2018;"04";2018-04-17;0,628783794422272;1,88511658719949;48295;79247;995;7,3;7,2;"Jesper Würtzen";"Jesper Würtzen";0;"S";"S";0;0;0;0,0999999999999996;3,25164657733973
"199";"Ballerup.21-06-2016.pdf";0;6;600;"Ballerup Kommune";"21-06-2016";606;0;0,0099009900990099;2016;"06";2016-06-21;0;3,17016883500826;48224;72013;1045;6,8;6,8;"Jesper Würtzen";"Jesper Würtzen";0;"S";"S";0;0;0;0;3,41504590283419
"200";"Ballerup.23-02-2017.pdf";1;3;1396;"Ballerup Kommune";"23-02-2017";1400;0,000714285714285714;0,00214285714285714;2017;"02";2017-02-23;0,190712370504684;0,686115112148216;48231;75335;1022;7;7,1;"Jesper Würtzen";"Jesper Würtzen";0;"S";"S";0;0;0;-0,0999999999999996;3,33988221310674
"201";"Ballerup.27-11-2018.pdf";12;20;2261;"Ballerup Kommune";"27-11-2018";2293;0,00523331879633668;0,00872219799389446;2018;"11";2018-11-27;1,39728208655852;2,79273486555459;48295;79247;995;7,3;7,2;"Jesper Würtzen";"Jesper Würtzen";0;"S";"S";0;0;0;0,0999999999999996;3,25164657733973
"202";"Ballerup.28-03-2017.pdf";10;5;2118;"Ballerup Kommune";"28-03-2017";2133;0,0046882325363338;0,0023441162681669;2017;"03";2017-03-28;1,25174551667397;0,750555678236836;48231;75335;1022;7;7,1;"Jesper Würtzen";"Jesper Würtzen";0;"S";"S";0;0;0;-0,0999999999999996;3,33988221310674
"203";"Ballerup.28-11-2017.pdf";7;8;2163;"Ballerup Kommune";"28-11-2017";2178;0,0032139577594123;0,00367309458218549;2017;"11";2017-11-28;0,85811810419922;1,17607732722069;48231;75335;1022;7;7,1;"Jesper Würtzen";"Jesper Würtzen";0;"S";"S";0;0;0;-0,0999999999999996;3,33988221310674
"204";"Ballerup.29-11-2016.pdf";0;1;1377;"Ballerup Kommune";"29-11-2016";1378;0;0,000725689404934688;2016;"11";2016-11-29;0;0,232356351477383;48224;72013;1045;6,8;6,8;"Jesper Würtzen";"Jesper Würtzen";0;"S";"S";0;0;0;0;3,41504590283419
"205";"Ballerup.30-03-2016.pdf";0;0;310;"Ballerup Kommune";"30-03-2016";310;0;0;2016;"03";2016-03-30;0;0;48224;72013;1045;6,8;6,8;"Jesper Würtzen";"Jesper Würtzen";0;"S";"S";0;0;0;0;3,41504590283419
"206";"Ballerup.30-05-2017.pdf";8;4;4862;"Ballerup Kommune";"30-05-2017";4874;0,00164136233073451;0,000820681165367255;2017;"05";2017-05-30;0,438239341332059;0,262771483246479;48231;75335;1022;7;7,1;"Jesper Würtzen";"Jesper Würtzen";0;"S";"S";0;0;0;-0,0999999999999996;3,33988221310674
"207";"Ballerup.31-01-2017.pdf";8;12;4299;"Ballerup Kommune";"31-01-2017";4319;0,00185228062051401;0,00277842093077101;2017;"01";2017-01-31;0,494553959169358;0,889614407971755;48231;75335;1022;7;7,1;"Jesper Würtzen";"Jesper Würtzen";0;"S";"S";0;0;0;-0,0999999999999996;3,33988221310674
"208";"Ballerup.31-05-2016.pdf";6;17;5511;"Ballerup Kommune";"31-05-2016";5534;0,00108420672208168;0,00307191904589808;2016;"05";2016-05-31;0,289480287719433;0,983588704320416;48224;72013;1045;6,8;6,8;"Jesper Würtzen";"Jesper Würtzen";0;"S";"S";0;0;0;0;3,41504590283419
"209";"Billund.01-03-2016.pdf";38;4;4100;"Billund Kommune";"01-03-2016";4142;0,00917431192660551;0,000965717044905843;2016;"03";2016-03-01;2,44951668538126;0,309210093998874;26434;64818;405;7;6,7;"Ib Kristensen";"Ib Kristensen";0;"V";"V";0;0;0;0,3;1,32353453650512
"210";"Billund.02-02-2016.pdf";4;2;2185;"Billund Kommune";"02-02-2016";2191;0,00182565038795071;0,000912825193975354;2016;"02";2016-02-02;0,487443758478425;0,292274808156855;26434;64818;405;7;6,7;"Ib Kristensen";"Ib Kristensen";0;"V";"V";0;0;0;0,3;1,32353453650512
"211";"Billund.02-05-2017.pdf";8;21;4140;"Billund Kommune";"02-05-2017";4169;0,00191892540177501;0,00503717917965939;2017;"05";2017-05-02;0,51234793707183;1,61283955362258;26481;67587;393;7,2;6,9;"Ib Kristensen";"Ib Kristensen";0;"V";"V";0;0;0;0,3;1,28431869838645
"212";"Billund.03-05-2016.pdf";26;2;4444;"Billund Kommune";"03-05-2016";4472;0,00581395348837209;0,000447227191413238;2016;"05";2016-05-03;1,55230999247998;0,143196356143039;26434;64818;405;7;6,7;"Ib Kristensen";"Ib Kristensen";0;"V";"V";0;0;0;0,3;1,32353453650512
"213";"Billund.03-05-2017.pdf";5;0;540;"Billund Kommune";"03-05-2017";545;0,00917431192660551;0;2017;"05";2017-05-03;2,44951668538126;0;26481;67587;393;7,2;6,9;"Ib Kristensen";"Ib Kristensen";0;"V";"V";0;0;0;0,3;1,28431869838645
"214";"Billund.04-04-2017.pdf";7;11;4156;"Billund Kommune";"04-04-2017";4174;0,00167704839482511;0,0026353617632966;2017;"04";2017-04-04;0,447767424759439;0,843808714828504;26481;67587;393;7,2;6,9;"Ib Kristensen";"Ib Kristensen";0;"V";"V";0;0;0;0,3;1,28431869838645
"215";"Billund.04-10-2016.pdf";6;9;3416;"Billund Kommune";"04-10-2016";3431;0,00174876129408336;0,00262314194112504;2016;"10";2016-10-04;0,466914576578066;0,839896085987324;26434;64818;405;7;6,7;"Ib Kristensen";"Ib Kristensen";0;"V";"V";0;0;0;0,3;1,32353453650512
"216";"Billund.04-12-2017.pdf";0;3;271;"Billund Kommune";"04-12-2017";274;0;0,0109489051094891;2017;"12";2017-12-04;0;3,50569765331205;26481;67587;393;7,2;6,9;"Ib Kristensen";"Ib Kristensen";0;"V";"V";0;0;0;0,3;1,28431869838645
"217";"Billund.05-04-2017.pdf";6;1;1521;"Billund Kommune";"05-04-2017";1528;0,00392670157068063;0,000654450261780105;2017;"04";2017-04-05;1,04841879073255;0,209546500219787;26481;67587;393;7,2;6,9;"Ib Kristensen";"Ib Kristensen";0;"V";"V";0;0;0;0,3;1,28431869838645
"218";"Billund.05-09-2017.pdf";0;13;969;"Billund Kommune";"05-09-2017";982;0;0,0132382892057026;2017;"09";2017-09-05;0;4,23872879874322;26481;67587;393;7,2;6,9;"Ib Kristensen";"Ib Kristensen";0;"V";"V";0;0;0;0,3;1,28431869838645
"219";"Billund.05-09-2018.pdf";17;8;3996;"Billund Kommune";"05-09-2018";4021;0,00422780402884855;0,0019895548371052;2018;"09";2018-09-05;1,12881233971934;0,637029698753214;26482;69247;383;7,1;6,7;"Ib Kristensen";"Ib Kristensen";0;"V";"V";0;0;0;0,399999999999999;1,25163883328756
"220";"Billund.05-12-2017.pdf";17;22;7355;"Billund Kommune";"05-12-2017";7394;0,00229916148228293;0,00297538544766027;2017;"12";2017-12-05;0,613869951042936;0,952679896049277;26481;67587;393;7,2;6,9;"Ib Kristensen";"Ib Kristensen";0;"V";"V";0;0;0;0,3;1,28431869838645
"221";"Billund.05-12-2018.pdf";1;6;1984;"Billund Kommune";"05-12-2018";1991;0,000502260170768458;0,00301356102461075;2018;"12";2018-12-05;0,134102118888276;0,964903221504272;26482;69247;383;7,1;6,7;"Ib Kristensen";"Ib Kristensen";0;"V";"V";0;0;0;0,399999999999999;1,25163883328756
"222";"Billund.06-06-2017.pdf";11;10;4767;"Billund Kommune";"06-06-2017";4788;0,00229741019214703;0,00208855472013367;2017;"06";2017-06-06;0,613402361272374;0,668728179481692;26481;67587;393;7,2;6,9;"Ib Kristensen";"Ib Kristensen";0;"V";"V";0;0;0;0,3;1,28431869838645
"223";"Billund.06-06-2018.pdf";14;10;3781;"Billund Kommune";"06-06-2018";3805;0,00367936925098555;0,0026281208935611;2018;"06";2018-06-06;0,982381724544494;0,841490282091548;26482;69247;383;7,1;6,7;"Ib Kristensen";"Ib Kristensen";0;"V";"V";0;0;0;0,399999999999999;1,25163883328756
"224";"Billund.06-09-2016.pdf";49;11;8059;"Billund Kommune";"06-09-2016";8119;0,0060352260130558;0,00135484665599212;2016;"09";2016-09-06;1,61138916327396;0,433804357149178;26434;64818;405;7;6,7;"Ib Kristensen";"Ib Kristensen";0;"V";"V";0;0;0;0,3;1,32353453650512
"225";"Billund.06-12-2018.pdf";0;5;2981;"Billund Kommune";"06-12-2018";2986;0;0,00167448091091762;2018;"12";2018-12-06;0;0,536147107059334;26482;69247;383;7,1;6,7;"Ib Kristensen";"Ib Kristensen";0;"V";"V";0;0;0;0,399999999999999;1,25163883328756
"226";"Billund.07-03-2017.pdf";12;17;3447;"Billund Kommune";"07-03-2017";3476;0,00345224395857307;0,00489067894131185;2017;"03";2017-03-07;0,921739880459921;1,56593207413958;26481;67587;393;7,2;6,9;"Ib Kristensen";"Ib Kristensen";0;"V";"V";0;0;0;0,3;1,28431869838645
"227";"Billund.07-06-2016.pdf";62;9;5386;"Billund Kommune";"07-06-2016";5457;0,0113615539673813;0,00164925783397471;2016;"06";2016-06-07;3,03350444563067;0,528071004402145;26434;64818;405;7;6,7;"Ib Kristensen";"Ib Kristensen";0;"V";"V";0;0;0;0,3;1,32353453650512
"228";"Billund.07-06-2017.pdf";9;1;852;"Billund Kommune";"07-06-2017";862;0,0104408352668213;0,00116009280742459;2017;"06";2017-06-07;2,78767502129816;0,371446696445283;26481;67587;393;7,2;6,9;"Ib Kristensen";"Ib Kristensen";0;"V";"V";0;0;0;0,3;1,28431869838645
"229";"Billund.08-08-2017.pdf";11;22;4703;"Billund Kommune";"08-08-2017";4736;0,00232263513513514;0,00464527027027027;2017;"08";2017-08-08;0,620137353414723;1,48735539514112;26481;67587;393;7,2;6,9;"Ib Kristensen";"Ib Kristensen";0;"V";"V";0;0;0;0,3;1,28431869838645
"230";"Billund.08-11-2016.pdf";8;8;2947;"Billund Kommune";"08-11-2016";2963;0,00269996625042187;0,00269996625042187;2016;"11";2016-11-08;0,720883749460836;0,864494235128813;26434;64818;405;7;6,7;"Ib Kristensen";"Ib Kristensen";0;"V";"V";0;0;0;0,3;1,32353453650512
"231";"Billund.09-05-2018.pdf";35;1;3149;"Billund Kommune";"09-05-2018";3185;0,010989010989011;0,000313971742543171;2018;"05";2018-05-09;2,93403646930283;0,100529686761643;26482;69247;383;7,1;6,7;"Ib Kristensen";"Ib Kristensen";0;"V";"V";0;0;0;0,399999999999999;1,25163883328756
"232";"Billund.09-08-2016.pdf";16;6;7322;"Billund Kommune";"09-08-2016";7344;0,00217864923747277;0,000816993464052288;2016;"08";2016-08-09;0,581693504807314;0,261590729032544;26434;64818;405;7;6,7;"Ib Kristensen";"Ib Kristensen";0;"V";"V";0;0;0;0,3;1,32353453650512
"233";"Billund.10-01-2017.pdf";5;0;2444;"Billund Kommune";"10-01-2017";2449;0,00204164965291956;0;2017;"01";2017-01-10;0,545114983067695;0;26481;67587;393;7,2;6,9;"Ib Kristensen";"Ib Kristensen";0;"V";"V";0;0;0;0,3;1,28431869838645
"234";"Billund.12-01-2016.pdf";17;11;5346;"Billund Kommune";"12-01-2016";5374;0,00316337923334574;0,00204689244510607;2016;"01";2016-01-12;0,844613773355317;0,655388458447;26434;64818;405;7;6,7;"Ib Kristensen";"Ib Kristensen";0;"V";"V";0;0;0;0,3;1,32353453650512
"235";"Billund.12-04-2016.pdf";12;4;3402;"Billund Kommune";"12-04-2016";3418;0,00351082504388531;0,00117027501462844;2016;"04";2016-04-12;0,937380873165209;0,374706907356155;26434;64818;405;7;6,7;"Ib Kristensen";"Ib Kristensen";0;"V";"V";0;0;0;0,3;1,32353453650512
"236";"Billund.14-03-2018.pdf";0;7;841;"Billund Kommune";"14-03-2018";848;0;0,00825471698113208;2018;"03";2018-03-14;0;2,64305349805523;26482;69247;383;7,1;6,7;"Ib Kristensen";"Ib Kristensen";0;"V";"V";0;0;0;0,399999999999999;1,25163883328756
"237";"Billund.14-11-2018.pdf";3;4;2257;"Billund Kommune";"14-11-2018";2264;0,00132508833922261;0,00176678445229682;2018;"11";2018-11-14;0,353795033621763;0,5657015058937;26482;69247;383;7,1;6,7;"Ib Kristensen";"Ib Kristensen";0;"V";"V";0;0;0;0,399999999999999;1,25163883328756
"238";"Billund.15-08-2018.pdf";27;16;5727;"Billund Kommune";"15-08-2018";5770;0,00467937608318891;0,00277296360485269;2018;"08";2018-08-15;1,24938086743103;0,88786704287233;26482;69247;383;7,1;6,7;"Ib Kristensen";"Ib Kristensen";0;"V";"V";0;0;0;0,399999999999999;1,25163883328756
"239";"Billund.18-04-2018.pdf";9;3;3353;"Billund Kommune";"18-04-2018";3365;0,00267459138187221;0,000891530460624071;2018;"04";2018-04-18;0,714108727595547;0,28545651025483;26482;69247;383;7,1;6,7;"Ib Kristensen";"Ib Kristensen";0;"V";"V";0;0;0;0,399999999999999;1,25163883328756
"240";"Billund.20-03-2019.pdf";5;4;2691;"Billund Kommune";"20-03-2019";2700;0,00185185185185185;0,00148148148148148;2019;"03";2019-03-20;0,494439479086217;0,47435118864568;26629;67751;380;7;6,8;"Ib Kristensen";"Ib Kristensen";0;"V";"V";0;0;0;0,2;1,24183487375789
"241";"Billund.20-06-2017.pdf";1;0;642;"Billund Kommune";"20-06-2017";643;0,0015552099533437;0;2017;"06";2017-06-20;0,415236887568518;0;26481;67587;393;7,2;6,9;"Ib Kristensen";"Ib Kristensen";0;"V";"V";0;0;0;0,3;1,28431869838645
"242";"Billund.21-02-2018.pdf";2;0;1847;"Billund Kommune";"21-02-2018";1849;0,00108166576527853;0;2018;"02";2018-02-21;0,288801859066043;0;26482;69247;383;7,1;6,7;"Ib Kristensen";"Ib Kristensen";0;"V";"V";0;0;0;0,399999999999999;1,25163883328756
"243";"Billund.22-01-2018.pdf";5;16;3147;"Billund Kommune";"22-01-2018";3168;0,00157828282828283;0,00505050505050505;2018;"01";2018-01-22;0,421397283312117;1,61710632492846;26482;69247;383;7,1;6,7;"Ib Kristensen";"Ib Kristensen";0;"V";"V";0;0;0;0,399999999999999;1,25163883328756
"244";"Billund.23-01-2019.pdf";8;25;3554;"Billund Kommune";"23-01-2019";3587;0,00223027599665459;0,00696961248954558;2019;"01";2019-01-23;0,595477711082369;2,23157967895061;26629;67751;380;7;6,8;"Ib Kristensen";"Ib Kristensen";0;"V";"V";0;0;0;0,2;1,24183487375789
"245";"Billund.24-10-2018.pdf";12;7;5464;"Billund Kommune";"24-10-2018";5483;0,00218858289257706;0,00127667335400328;2018;"10";2018-10-24;0,584345764085115;0,408774278014014;26482;69247;383;7,1;6,7;"Ib Kristensen";"Ib Kristensen";0;"V";"V";0;0;0;0,399999999999999;1,25163883328756
"246";"Billund.26-02-2019.pdf";4;0;784;"Billund Kommune";"26-02-2019";788;0,0050761421319797;0;2019;"02";2019-02-26;1,35531633861197;0;26629;67751;380;7;6,8;"Ib Kristensen";"Ib Kristensen";0;"V";"V";0;0;0;0,2;1,24183487375789
"247";"Billund.26-06-2017.pdf";0;0;485;"Billund Kommune";"26-06-2017";485;0;0;2017;"06";2017-06-26;0;0;26481;67587;393;7,2;6,9;"Ib Kristensen";"Ib Kristensen";0;"V";"V";0;0;0;0,3;1,28431869838645
"248";"Billund.26-09-2017.pdf";3;0;1445;"Billund Kommune";"26-09-2017";1448;0,00207182320441989;0;2017;"09";2017-09-26;0,553171240414138;0;26481;67587;393;7,2;6,9;"Ib Kristensen";"Ib Kristensen";0;"V";"V";0;0;0;0,3;1,28431869838645
"249";"Billund.26-09-2018.pdf";7;1;2862;"Billund Kommune";"26-09-2018";2870;0,0024390243902439;0,000348432055749129;2018;"09";2018-09-26;0,651212972455017;0,111563432869629;26482;69247;383;7,1;6,7;"Ib Kristensen";"Ib Kristensen";0;"V";"V";0;0;0;0,399999999999999;1,25163883328756
"250";"Billund.27-02-2019.pdf";2;4;2394;"Billund Kommune";"27-02-2019";2400;0,000833333333333333;0,00166666666666667;2019;"02";2019-02-27;0,222497765588798;0,53364508722639;26629;67751;380;7;6,8;"Ib Kristensen";"Ib Kristensen";0;"V";"V";0;0;0;0,2;1,24183487375789
"251";"Billund.29-08-2017.pdf";6;24;4281;"Billund Kommune";"29-08-2017";4311;0,00139178844815588;0,00556715379262352;2017;"08";2017-08-29;0,37160378386438;1,78253056276039;26481;67587;393;7,2;6,9;"Ib Kristensen";"Ib Kristensen";0;"V";"V";0;0;0;0,3;1,28431869838645
"252";"Billund.31-01-2017.pdf";5;7;1476;"Billund Kommune";"31-01-2017";1488;0,00336021505376344;0,00470430107526882;2017;"01";2017-01-31;0,897168409632249;1,50625629459062;26481;67587;393;7,2;6,9;"Ib Kristensen";"Ib Kristensen";0;"V";"V";0;0;0;0,3;1,28431869838645
"253";"Billund.31-10-2017.pdf";48;28;5363;"Billund Kommune";"31-10-2017";5439;0,00882515168229454;0,00514800514800515;2017;"10";2017-10-31;2,3562918363513;1,64832459374947;26481;67587;393;7,2;6,9;"Ib Kristensen";"Ib Kristensen";0;"V";"V";0;0;0;0,3;1,28431869838645
"254";"Bornholm.01-03-2016.pdf";3;12;2650;"Bornholms Kommune";"01-03-2016";2665;0,00112570356472795;0,00450281425891182;2016;"03";2016-03-01;0,300559833440777;1,44174282477674;39756;64477;460;6,4;6,4;"Winni Grosbøll";"Winni Grosbøll";0;"S";"S";0;0;1;0;1,50327379454902
"255";"Bornholm.01-11-2016.pdf";18;12;6561;"Bornholms Kommune";"01-11-2016";6591;0,00273099681383705;0,00182066454255803;2016;"11";2016-11-01;0,729168826690643;0,582953213174027;39756;64477;460;6,4;6,4;"Winni Grosbøll";"Winni Grosbøll";0;"S";"S";0;0;1;0;1,50327379454902
"256";"Bornholm.02-02-2016.pdf";41;28;5438;"Bornholms Kommune";"02-02-2016";5507;0,00744506991102234;0,00508443798801525;2016;"02";2016-02-02;1,98781370382583;1,62797121216694;39756;64477;460;6,4;6,4;"Winni Grosbøll";"Winni Grosbøll";0;"S";"S";0;0;1;0;1,50327379454902
"257";"Bornholm.02-05-2017.pdf";3;19;4372;"Bornholms Kommune";"02-05-2017";4394;0,000682749203459263;0,00432407828857533;2017;"05";2017-05-02;0,182292206672661;1,38451388128831;39695;65332;404;6,9;6,8;"Winni Grosbøll";"Winni Grosbøll";0;"S";"S";0;0;1;0,100000000000001;1,32026654999523
"258";"Bornholm.03-05-2016.pdf";39;29;8837;"Bornholms Kommune";"03-05-2016";8905;0,00437956204379562;0,00325659741718136;2016;"05";2016-05-03;1,16933132280244;1,04272032765179;39756;64477;460;6,4;6,4;"Winni Grosbøll";"Winni Grosbøll";0;"S";"S";0;0;1;0;1,50327379454902
"259";"Bornholm.04-04-2017.pdf";3;29;3835;"Bornholms Kommune";"04-04-2017";3867;0,000775795190069822;0,00749935350400828;2017;"04";2017-04-04;0,207135235614086;2,40119589287282;39695;65332;404;6,9;6,8;"Winni Grosbøll";"Winni Grosbøll";0;"S";"S";0;0;1;0,100000000000001;1,32026654999523
"260";"Bornholm.04-06-2018.pdf";15;5;5408;"Bornholms Kommune";"04-06-2018";5428;0,00276344878408253;0,000921149594694178;2018;"06";2018-06-04;0,737833415732932;0,294940173485477;39632;66890;359;6,7;6,7;"Winni Grosbøll";"Winni Grosbøll";0;"S";"S";0;0;1;0;1,17320715705022
"261";"Bornholm.04-09-2018.pdf";19;42;5798;"Bornholms Kommune";"04-09-2018";5859;0,00324287421061615;0,00716845878136201;2018;"09";2018-09-04;0,865838719137154;2,29524768699523;39632;66890;359;6,7;6,7;"Winni Grosbøll";"Winni Grosbøll";0;"S";"S";0;0;1;0;1,17320715705022
"262";"Bornholm.04-12-2018.pdf";7;16;4601;"Bornholms Kommune";"04-12-2018";4624;0,00151384083044983;0,00346020761245675;2018;"12";2018-12-04;0,404191442678612;1,10791367590254;39632;66890;359;6,7;6,7;"Winni Grosbøll";"Winni Grosbøll";0;"S";"S";0;0;1;0;1,17320715705022
"263";"Bornholm.05-01-2016.pdf";3;22;4845;"Bornholms Kommune";"05-01-2016";4870;0,000616016427104723;0,00451745379876797;2016;"01";2016-01-05;0,164474734316154;1,44643021589083;39756;64477;460;6,4;6,4;"Winni Grosbøll";"Winni Grosbøll";0;"S";"S";0;0;1;0;1,50327379454902
"264";"Bornholm.05-02-2019.pdf";10;3;1696;"Bornholms Kommune";"05-02-2019";1709;0,00585137507314219;0,00175541252194266;2019;"02";2019-02-05;1,56230145527535;0,562060361034232;39572;66327;349;6,4;6,4;"Winni Grosbøll";"Winni Grosbøll";0;"S";"S";0;0;1;0;1,14052729195132
"265";"Bornholm.05-04-2016.pdf";1;4;2529;"Bornholms Kommune";"05-04-2016";2534;0,000394632991318074;0,0015785319652723;2016;"04";2016-04-05;0,105365950555074;0,505425496978428;39756;64477;460;6,4;6,4;"Winni Grosbøll";"Winni Grosbøll";0;"S";"S";0;0;1;0;1,50327379454902
"266";"Bornholm.05-12-2017.pdf";8;2;4546;"Bornholms Kommune";"05-12-2017";4556;0,00175592625109745;0,000438981562774363;2017;"12";2017-12-05;0,468827600889477;0,140556212614501;39695;65332;404;6,9;6,8;"Winni Grosbøll";"Winni Grosbøll";0;"S";"S";0;0;1;0,100000000000001;1,32026654999523
"267";"Bornholm.06-03-2018.pdf";2;1;1868;"Bornholms Kommune";"06-03-2018";1871;0,00106894708711919;0,000534473543559594;2018;"03";2018-03-06;0,285406006100008;0,171131508463834;39632;66890;359;6,7;6,7;"Winni Grosbøll";"Winni Grosbøll";0;"S";"S";0;0;1;0;1,17320715705022
"268";"Bornholm.06-06-2017.pdf";9;14;6599;"Bornholms Kommune";"06-06-2017";6622;0,0013591060102688;0,00211416490486258;2017;"06";2017-06-06;0,362877660579736;0,676928229039819;39695;65332;404;6,9;6,8;"Winni Grosbøll";"Winni Grosbøll";0;"S";"S";0;0;1;0,100000000000001;1,32026654999523
"269";"Bornholm.06-11-2018.pdf";1;13;1841;"Bornholms Kommune";"06-11-2018";1855;0,000539083557951483;0,00700808625336927;2018;"11";2018-11-06;0,143933864531837;2,24389847998159;39632;66890;359;6,7;6,7;"Winni Grosbøll";"Winni Grosbøll";0;"S";"S";0;0;1;0;1,17320715705022
"270";"Bornholm.06-12-2016.pdf";16;8;3604;"Bornholms Kommune";"06-12-2016";3628;0,00441014332965821;0,00220507166482911;2016;"12";2016-12-06;1,17749644413035;0,706035396550902;39756;64477;460;6,4;6,4;"Winni Grosbøll";"Winni Grosbøll";0;"S";"S";0;0;1;0;1,50327379454902
"271";"Bornholm.07-03-2017.pdf";0;9;2179;"Bornholms Kommune";"07-03-2017";2188;0;0,00411334552102377;2017;"03";2017-03-07;0;1,31703997761541;39695;65332;404;6,9;6,8;"Winni Grosbøll";"Winni Grosbøll";0;"S";"S";0;0;1;0,100000000000001;1,32026654999523
"272";"Bornholm.07-06-2016.pdf";36;8;6059;"Bornholms Kommune";"07-06-2016";6103;0,00589873832541373;0,00131083073898083;2016;"06";2016-06-07;1,57494731663707;0,419711030425475;39756;64477;460;6,4;6,4;"Winni Grosbøll";"Winni Grosbøll";0;"S";"S";0;0;1;0;1,50327379454902
"273";"Bornholm.07-11-2017.pdf";4;14;5307;"Bornholms Kommune";"07-11-2017";5325;0,000751173708920188;0,00262910798122066;2017;"11";2017-11-07;0,20056136616455;0,841806334779658;39695;65332;404;6,9;6,8;"Winni Grosbøll";"Winni Grosbøll";0;"S";"S";0;0;1;0,100000000000001;1,32026654999523
"274";"Bornholm.08-01-2019.pdf";5;2;2080;"Bornholms Kommune";"08-01-2019";2087;0,00239578342117873;0,00095831336847149;2019;"01";2019-01-08;0,639667749656342;0,306839532664911;39572;66327;349;6,4;6,4;"Winni Grosbøll";"Winni Grosbøll";0;"S";"S";0;0;1;0;1,14052729195132
"275";"Bornholm.08-05-2018.pdf";23;40;6631;"Bornholms Kommune";"08-05-2018";6694;0,00343591275769346;0,00597550044816253;2018;"05";2018-05-08;0,917379493613806;1,91327787472862;39632;66890;359;6,7;6,7;"Winni Grosbøll";"Winni Grosbøll";0;"S";"S";0;0;1;0;1,17320715705022
"276";"Bornholm.09-01-2018.pdf";0;1;1839;"Bornholms Kommune";"09-01-2018";1840;0;0,000543478260869565;2018;"01";2018-01-09;0;0,174014702356432;39632;66890;359;6,7;6,7;"Winni Grosbøll";"Winni Grosbøll";0;"S";"S";0;0;1;0;1,17320715705022
"277";"Bornholm.09-06-2016.pdf";2;1;1410;"Bornholms Kommune";"09-06-2016";1413;0,00141542816702052;0,000707714083510262;2016;"06";2016-06-09;0,377915525416217;0,226600886295707;39756;64477;460;6,4;6,4;"Winni Grosbøll";"Winni Grosbøll";0;"S";"S";0;0;1;0;1,50327379454902
"278";"Bornholm.10-01-2017.pdf";1;26;2023;"Bornholms Kommune";"10-01-2017";2050;0,00048780487804878;0,0126829268292683;2017;"01";2017-01-10;0,130242594491004;4,06090895645448;39695;65332;404;6,9;6,8;"Winni Grosbøll";"Winni Grosbøll";0;"S";"S";0;0;1;0,100000000000001;1,32026654999523
"279";"Bornholm.10-04-2018.pdf";8;7;4433;"Bornholms Kommune";"10-04-2018";4448;0,00179856115107914;0,00157374100719424;2018;"04";2018-04-10;0,480211004867909;0,503891494233552;39632;66890;359;6,7;6,7;"Winni Grosbøll";"Winni Grosbøll";0;"S";"S";0;0;1;0;1,17320715705022
"280";"Bornholm.12-03-2019.pdf";4;20;5897;"Bornholms Kommune";"12-03-2019";5921;0,000675561560547205;0,00337780780273602;2019;"03";2019-03-12;0,180373125287321;1,08153032371503;39572;66327;349;6,4;6,4;"Winni Grosbøll";"Winni Grosbøll";0;"S";"S";0;0;1;0;1,14052729195132
"281";"Bornholm.18-03-2019.pdf";0;0;490;"Bornholms Kommune";"18-03-2019";490;0;0;2019;"03";2019-03-18;0;0;39572;66327;349;6,4;6,4;"Winni Grosbøll";"Winni Grosbøll";0;"S";"S";0;0;1;0;1,14052729195132
"282";"Bornholm.23-02-2017.pdf";0;7;1305;"Bornholms Kommune";"23-02-2017";1312;0;0,00533536585365854;2017;"02";2017-02-23;0;1,70831506581619;39695;65332;404;6,9;6,8;"Winni Grosbøll";"Winni Grosbøll";0;"S";"S";0;0;1;0,100000000000001;1,32026654999523
"283";"Bornholm.25-09-2018.pdf";4;1;971;"Bornholms Kommune";"25-09-2018";976;0,00409836065573771;0,00102459016393443;2018;"09";2018-09-25;1,09425130617441;0,328060504442453;39632;66890;359;6,7;6,7;"Winni Grosbøll";"Winni Grosbøll";0;"S";"S";0;0;1;0;1,17320715705022
"284";"Bornholm.26-09-2017.pdf";1;1;874;"Bornholms Kommune";"26-09-2017";876;0,00114155251141553;0,00114155251141553;2017;"09";2017-09-26;0,304791459710682;0,365510333716706;39695;65332;404;6,9;6,8;"Winni Grosbøll";"Winni Grosbøll";0;"S";"S";0;0;1;0,100000000000001;1,32026654999523
"285";"Bornholm.29-08-2017.pdf";12;10;6689;"Bornholms Kommune";"29-08-2017";6711;0,00178810907465355;0,00149009089554463;2017;"08";2017-08-29;0,477420328487362;0,477107811556898;39695;65332;404;6,9;6,8;"Winni Grosbøll";"Winni Grosbøll";0;"S";"S";0;0;1;0,100000000000001;1,32026654999523
"286";"Bornholm.30-01-2018.pdf";17;0;1806;"Bornholms Kommune";"30-01-2018";1823;0,00932528798683489;0;2018;"01";2018-01-30;2,48982688865138;0;39632;66890;359;6,7;6,7;"Winni Grosbøll";"Winni Grosbøll";0;"S";"S";0;0;1;0;1,17320715705022
"287";"Bornholm.30-08-2016.pdf";8;14;5514;"Bornholms Kommune";"30-08-2016";5536;0,00144508670520231;0,00252890173410405;2016;"08";2016-08-30;0,38583427558751;0,809721591889754;39756;64477;460;6,4;6,4;"Winni Grosbøll";"Winni Grosbøll";0;"S";"S";0;0;1;0;1,50327379454902
"288";"Bornholm.31-01-2017.pdf";3;2;1927;"Bornholms Kommune";"31-01-2017";1932;0,0015527950310559;0,0010351966873706;2017;"01";2017-01-31;0,414592109792791;0,331456575917013;39695;65332;404;6,9;6,8;"Winni Grosbøll";"Winni Grosbøll";0;"S";"S";0;0;1;0,100000000000001;1,32026654999523
"289";"Broendby.14-06-2017.pdf";0;0;72;"Brøndby Kommune";"14-06-2017";72;0;0;2017;"06";2017-06-14;0;0;35594;78387;788;6,1;6,3;"Kent Max Magelund";"Kent Max Magelund";0;"S";"S";0;0;0;-0,2;2,57517336979267
"290";"Broendby.15-02-2017.pdf";7;7;1060;"Brøndby Kommune";"15-02-2017";1074;0,00651769087523277;0,00651769087523277;2017;"02";2017-02-15;1,74020598784534;2,08688022937695;35594;78387;788;6,1;6,3;"Kent Max Magelund";"Kent Max Magelund";0;"S";"S";0;0;0;-0,2;2,57517336979267
"291";"Broendby.16-03-2016.pdf";0;1;625;"Brøndby Kommune";"16-03-2016";626;0;0,00159744408945687;2016;"03";2016-03-16;0;0,511480914274495;35322;75700;770;6,2;6,2;"Kent Max Magelund";"Kent Max Magelund";0;"S";"S";0;0;0;0;2,51634961261467
"292";"Broendby.17-02-2016.pdf";0;0;573;"Brøndby Kommune";"17-02-2016";573;0;0;2016;"02";2016-02-17;0;0;35322;75700;770;6,2;6,2;"Kent Max Magelund";"Kent Max Magelund";0;"S";"S";0;0;0;0;2,51634961261467
"293";"Broendby.18-01-2017.pdf";0;0;24;"Brøndby Kommune";"18-01-2017";24;0;0;2017;"01";2017-01-18;0;0;35594;78387;788;6,1;6,3;"Kent Max Magelund";"Kent Max Magelund";0;"S";"S";0;0;0;-0,2;2,57517336979267
"294";"Broendby.18-04-2018.pdf";2;0;436;"Brøndby Kommune";"18-04-2018";438;0,0045662100456621;0;2018;"04";2018-04-18;1,21916583884273;0;35538;79678;793;6,7;6,4;"Kent Max Magelund";"Kent Max Magelund";0;"S";"S";0;0;0;0,3;2,59151330234212
"295";"Broendby.18-10-2017.pdf";0;0;39;"Brøndby Kommune";"18-10-2017";39;0;0;2017;"10";2017-10-18;0;0;35594;78387;788;6,1;6,3;"Kent Max Magelund";"Kent Max Magelund";0;"S";"S";0;0;0;-0,2;2,57517336979267
"296";"Broendby.19-04-2017.pdf";2;0;488;"Brøndby Kommune";"19-04-2017";490;0,00408163265306122;0;2017;"04";2017-04-19;1,08978497431248;0;35594;78387;788;6,1;6,3;"Kent Max Magelund";"Kent Max Magelund";0;"S";"S";0;0;0;-0,2;2,57517336979267
"297";"Broendby.19-09-2018.pdf";4;1;370;"Brøndby Kommune";"19-09-2018";375;0,0106666666666667;0,00266666666666667;2018;"09";2018-09-19;2,84797139953661;0,853832139562224;35538;79678;793;6,7;6,4;"Kent Max Magelund";"Kent Max Magelund";0;"S";"S";0;0;0;0,3;2,59151330234212
"298";"Broendby.20-01-2016.pdf";1;1;753;"Brøndby Kommune";"20-01-2016";755;0,00132450331125828;0,00132450331125828;2016;"01";2016-01-20;0,353638832723917;0,42408881104084;35322;75700;770;6,2;6,2;"Kent Max Magelund";"Kent Max Magelund";0;"S";"S";0;0;0;0;2,51634961261467
"299";"Broendby.20-02-2019.pdf";0;0;337;"Brøndby Kommune";"20-02-2019";337;0;0;2019;"02";2019-02-20;0;0;35397;82036;791;5,8;6,1;"Kent Max Magelund";"Kent Max Magelund";0;"S";"S";0;0;0;-0,3;2,58497732932234
"300";"Broendby.20-03-2019.pdf";1;0;401;"Brøndby Kommune";"20-03-2019";402;0,00248756218905473;0;2019;"03";2019-03-20;0,664172434593426;0;35397;82036;791;5,8;6,1;"Kent Max Magelund";"Kent Max Magelund";0;"S";"S";0;0;0;-0,3;2,58497732932234
"301";"Broendby.20-06-2018.pdf";0;2;232;"Brøndby Kommune";"20-06-2018";234;0;0,00854700854700855;2018;"06";2018-06-20;0;2,73664147295585;35538;79678;793;6,7;6,4;"Kent Max Magelund";"Kent Max Magelund";0;"S";"S";0;0;0;0,3;2,59151330234212
"302";"Broendby.20-09-2017.pdf";0;4;315;"Brøndby Kommune";"20-09-2017";319;0;0,0125391849529781;2017;"09";2017-09-20;0;4,01488466878789;35594;78387;788;6,1;6,3;"Kent Max Magelund";"Kent Max Magelund";0;"S";"S";0;0;0;-0,2;2,57517336979267
"303";"Broendby.21-02-2018.pdf";0;4;619;"Brøndby Kommune";"21-02-2018";623;0;0,00642054574638844;2018;"02";2018-02-21;0;2,05577561692349;35538;79678;793;6,7;6,4;"Kent Max Magelund";"Kent Max Magelund";0;"S";"S";0;0;0;0,3;2,59151330234212
"304";"Broendby.21-03-2018.pdf";0;0;195;"Brøndby Kommune";"21-03-2018";195;0;0;2018;"03";2018-03-21;0;0;35538;79678;793;6,7;6,4;"Kent Max Magelund";"Kent Max Magelund";0;"S";"S";0;0;0;0,3;2,59151330234212
"305";"Broendby.21-06-2017.pdf";5;8;490;"Brøndby Kommune";"21-06-2017";503;0,0099403578528827;0,0159045725646123;2017;"06";2017-06-21;2,65404889370335;5,0924382081246;35594;78387;788;6,1;6,3;"Kent Max Magelund";"Kent Max Magelund";0;"S";"S";0;0;0;-0,2;2,57517336979267
"306";"Broendby.21-11-2018.pdf";0;0;798;"Brøndby Kommune";"21-11-2018";798;0;0;2018;"11";2018-11-21;0;0;35538;79678;793;6,7;6,4;"Kent Max Magelund";"Kent Max Magelund";0;"S";"S";0;0;0;0,3;2,59151330234212
"307";"Broendby.22-03-2017.pdf";0;0;477;"Brøndby Kommune";"22-03-2017";477;0;0;2017;"03";2017-03-22;0;0;35594;78387;788;6,1;6,3;"Kent Max Magelund";"Kent Max Magelund";0;"S";"S";0;0;0;-0,2;2,57517336979267
"308";"Broendby.22-08-2018.pdf";6;3;450;"Brøndby Kommune";"22-08-2018";459;0,0130718954248366;0,0065359477124183;2018;"08";2018-08-22;3,49016102884388;2,09272583226035;35538;79678;793;6,7;6,4;"Kent Max Magelund";"Kent Max Magelund";0;"S";"S";0;0;0;0,3;2,59151330234212
"309";"Broendby.23-01-2019.pdf";0;1;326;"Brøndby Kommune";"23-01-2019";327;0;0,00305810397553517;2019;"01";2019-01-23;0;0,979165297663101;35397;82036;791;5,8;6,1;"Kent Max Magelund";"Kent Max Magelund";0;"S";"S";0;0;0;-0,3;2,58497732932234
"310";"Broendby.23-05-2018.pdf";1;1;258;"Brøndby Kommune";"23-05-2018";260;0,00384615384615385;0,00384615384615385;2018;"05";2018-05-23;1,02691276425599;1,23148866283013;35538;79678;793;6,7;6,4;"Kent Max Magelund";"Kent Max Magelund";0;"S";"S";0;0;0;0,3;2,59151330234212
"311";"Broendby.23-08-2017.pdf";1;1;902;"Brøndby Kommune";"23-08-2017";904;0,00110619469026549;0,00110619469026549;2017;"08";2017-08-23;0,295351016268315;0,354189217185657;35594;78387;788;6,1;6,3;"Kent Max Magelund";"Kent Max Magelund";0;"S";"S";0;0;0;-0,2;2,57517336979267
"312";"Broendby.23-11-2017.pdf";3;8;923;"Brøndby Kommune";"23-11-2017";934;0,00321199143468951;0,00856531049250535;2017;"11";2017-11-23;0,857593100770526;2,74250151893648;35594;78387;788;6,1;6,3;"Kent Max Magelund";"Kent Max Magelund";0;"S";"S";0;0;0;-0,2;2,57517336979267
"313";"Broendby.24-01-2018.pdf";0;0;259;"Brøndby Kommune";"24-01-2018";259;0;0;2018;"01";2018-01-24;0;0;35538;79678;793;6,7;6,4;"Kent Max Magelund";"Kent Max Magelund";0;"S";"S";0;0;0;0,3;2,59151330234212
"314";"Broendby.24-05-2017.pdf";0;4;495;"Brøndby Kommune";"24-05-2017";499;0;0,00801603206412826;2017;"05";2017-05-24;0;2,56662967804276;35594;78387;788;6,1;6,3;"Kent Max Magelund";"Kent Max Magelund";0;"S";"S";0;0;0;-0,2;2,57517336979267
"315";"Broendby.24-10-2018.pdf";0;0;78;"Brøndby Kommune";"24-10-2018";78;0;0;2018;"10";2018-10-24;0;0;35538;79678;793;6,7;6,4;"Kent Max Magelund";"Kent Max Magelund";0;"S";"S";0;0;0;0,3;2,59151330234212
"316";"Broenderslev.01-12-2017.pdf";0;0;64;"Brønderslev Kommune";"01-12-2017";64;0;0;2017;"12";2017-12-01;0;0;36128;60571;1042;6,9;6,8;"Mikael Klitgaard";"Mikael Klitgaard";0;"V";"V";0;0;0;0,100000000000001;3,40524194330453
"317";"Broenderslev.02-02-2016.pdf";1;4;580;"Brønderslev Kommune";"02-02-2016";585;0,00170940170940171;0,00683760683760684;2016;"02";2016-02-02;0,456405673002662;2,18931317836468;36047;59342;573;7,2;6,8;"Mikael Klitgaard";"Mikael Klitgaard";0;"V";"V";0;0;0;0,4;1,8725562701665
"318";"Broenderslev.02-05-2017.pdf";1;11;1954;"Brønderslev Kommune";"02-05-2017";1966;0,000508646998982706;0,00559511698880977;2017;"05";2017-05-02;0,135807384896519;1,79148401612115;36128;60571;1042;6,9;6,8;"Mikael Klitgaard";"Mikael Klitgaard";0;"V";"V";0;0;0;0,100000000000001;3,40524194330453
"319";"Broenderslev.02-05-2018.pdf";1;4;786;"Brønderslev Kommune";"02-05-2018";791;0,00126422250316056;0,00505689001264223;2018;"05";2018-05-02;0,337544018592361;1,61915070713443;36289;60811;1011;7,5;7,1;"Mikael Klitgaard";"Mikael Klitgaard";0;"V";"V";0;0;0;0,4;3,30393436149796
"320";"Broenderslev.03-10-2017.pdf";3;10;1661;"Brønderslev Kommune";"03-10-2017";1674;0,0017921146953405;0,00597371565113501;2017;"10";2017-10-03;0,478489818470533;1,91270640582936;36128;60571;1042;6,9;6,8;"Mikael Klitgaard";"Mikael Klitgaard";0;"V";"V";0;0;0;0,100000000000001;3,40524194330453
"321";"Broenderslev.04-04-2017.pdf";0;3;704;"Brønderslev Kommune";"04-04-2017";707;0;0,00424328147100424;2017;"04";2017-04-04;0;1,35864378643211;36128;60571;1042;6,9;6,8;"Mikael Klitgaard";"Mikael Klitgaard";0;"V";"V";0;0;0;0,100000000000001;3,40524194330453
"322";"Broenderslev.04-10-2016.pdf";0;3;777;"Brønderslev Kommune";"04-10-2016";780;0;0,00384615384615385;2016;"10";2016-10-04;0;1,23148866283013;36047;59342;573;7,2;6,8;"Mikael Klitgaard";"Mikael Klitgaard";0;"V";"V";0;0;0;0,4;1,8725562701665
"323";"Broenderslev.04-12-2018.pdf";0;3;162;"Brønderslev Kommune";"04-12-2018";165;0;0,0181818181818182;2018;"12";2018-12-04;0;5,82158276974244;36289;60811;1011;7,5;7,1;"Mikael Klitgaard";"Mikael Klitgaard";0;"V";"V";0;0;0;0,4;3,30393436149796
"324";"Broenderslev.05-02-2019.pdf";2;11;414;"Brønderslev Kommune";"05-02-2019";427;0,00468384074941452;0,0257611241217799;2019;"02";2019-02-05;1,25057292134219;8,24837839741025;36370;61218;998;7;7;"Mikael Klitgaard";"Mikael Klitgaard";0;"V";"V";0;0;0;0;3,2614505368694
"325";"Broenderslev.05-03-2019.pdf";1;15;1996;"Brønderslev Kommune";"05-03-2019";2012;0,000497017892644135;0,00745526838966203;2019;"03";2019-03-05;0,132702444685168;2,38708041005841;36370;61218;998;7;7;"Mikael Klitgaard";"Mikael Klitgaard";0;"V";"V";0;0;0;0;3,2614505368694
"326";"Broenderslev.05-09-2017.pdf";0;5;859;"Brønderslev Kommune";"05-09-2017";864;0;0,00578703703703704;2017;"09";2017-09-05;0;1,85293433064719;36128;60571;1042;6,9;6,8;"Mikael Klitgaard";"Mikael Klitgaard";0;"V";"V";0;0;0;0,100000000000001;3,40524194330453
"327";"Broenderslev.05-12-2017.pdf";0;6;1097;"Brønderslev Kommune";"05-12-2017";1103;0;0,00543970988213962;2017;"12";2017-12-05;0;1,74172467272439;36128;60571;1042;6,9;6,8;"Mikael Klitgaard";"Mikael Klitgaard";0;"V";"V";0;0;0;0,100000000000001;3,40524194330453
"328";"Broenderslev.06-02-2018.pdf";0;8;1071;"Brønderslev Kommune";"06-02-2018";1079;0;0,00741427247451344;2018;"02";2018-02-06;0;2,37395404882917;36289;60811;1011;7,5;7,1;"Mikael Klitgaard";"Mikael Klitgaard";0;"V";"V";0;0;0;0,4;3,30393436149796
"329";"Broenderslev.06-03-2018.pdf";11;5;896;"Brønderslev Kommune";"06-03-2018";912;0,0120614035087719;0,00548245614035088;2018;"03";2018-03-06;3,22036239667997;1,75541147113944;36289;60811;1011;7,5;7,1;"Mikael Klitgaard";"Mikael Klitgaard";0;"V";"V";0;0;0;0,4;3,30393436149796
"330";"Broenderslev.06-06-2017.pdf";13;3;1897;"Brønderslev Kommune";"06-06-2017";1913;0,00679560899111343;0,00156821745948772;2017;"06";2017-06-06;1,81440937960546;0,502122925774962;36128;60571;1042;6,9;6,8;"Mikael Klitgaard";"Mikael Klitgaard";0;"V";"V";0;0;0;0,100000000000001;3,40524194330453
"331";"Broenderslev.07-02-2017.pdf";0;4;1349;"Brønderslev Kommune";"07-02-2017";1353;0;0,00295639320029564;2017;"02";2017-02-07;0;0,946598824348364;36128;60571;1042;6,9;6,8;"Mikael Klitgaard";"Mikael Klitgaard";0;"V";"V";0;0;0;0,100000000000001;3,40524194330453
"332";"Broenderslev.07-03-2017.pdf";0;4;368;"Brønderslev Kommune";"07-03-2017";372;0;0,010752688172043;2017;"03";2017-03-07;0;3,44287153049284;36128;60571;1042;6,9;6,8;"Mikael Klitgaard";"Mikael Klitgaard";0;"V";"V";0;0;0;0,100000000000001;3,40524194330453
"333";"Broenderslev.07-06-2016.pdf";29;6;1579;"Brønderslev Kommune";"07-06-2016";1614;0,0179677819083024;0,00371747211895911;2016;"06";2016-06-07;4,79734959262092;1,19028643991016;36047;59342;573;7,2;6,8;"Mikael Klitgaard";"Mikael Klitgaard";0;"V";"V";0;0;0;0,4;1,8725562701665
"334";"Broenderslev.07-11-2017.pdf";1;3;711;"Brønderslev Kommune";"07-11-2017";715;0,0013986013986014;0,0041958041958042;2017;"11";2017-11-07;0,373422823365814;1,34344217763287;36128;60571;1042;6,9;6,8;"Mikael Klitgaard";"Mikael Klitgaard";0;"V";"V";0;0;0;0,100000000000001;3,40524194330453
"335";"Broenderslev.08-03-2016.pdf";22;23;4696;"Brønderslev Kommune";"08-03-2016";4741;0,00464037122969838;0,00485129719468467;2016;"03";2016-03-08;1,23896667613252;1,55332254877118;36047;59342;573;7,2;6,8;"Mikael Klitgaard";"Mikael Klitgaard";0;"V";"V";0;0;0;0,4;1,8725562701665
"336";"Broenderslev.08-11-2016.pdf";3;10;1307;"Brønderslev Kommune";"08-11-2016";1320;0,00227272727272727;0,00757575757575758;2016;"11";2016-11-08;0,606812087969448;2,42565948739268;36047;59342;573;7,2;6,8;"Mikael Klitgaard";"Mikael Klitgaard";0;"V";"V";0;0;0;0,4;1,8725562701665
"337";"Broenderslev.09-10-2018.pdf";0;4;568;"Brønderslev Kommune";"09-10-2018";572;0;0,00699300699300699;2018;"10";2018-10-09;0;2,23907029605478;36289;60811;1011;7,5;7,1;"Mikael Klitgaard";"Mikael Klitgaard";0;"V";"V";0;0;0;0,4;3,30393436149796
"338";"Broenderslev.10-01-2017.pdf";2;6;1227;"Brønderslev Kommune";"10-01-2017";1235;0,00161943319838057;0,0048582995951417;2017;"01";2017-01-10;0,432384321791995;1,5555646267328;36128;60571;1042;6,9;6,8;"Mikael Klitgaard";"Mikael Klitgaard";0;"V";"V";0;0;0;0,100000000000001;3,40524194330453
"339";"Broenderslev.10-04-2018.pdf";1;12;975;"Brønderslev Kommune";"10-04-2018";988;0,00101214574898785;0,0121457489878543;2018;"04";2018-04-10;0,270240201119997;3,88891156683199;36289;60811;1011;7,5;7,1;"Mikael Klitgaard";"Mikael Klitgaard";0;"V";"V";0;0;0;0,4;3,30393436149796
"340";"Broenderslev.10-05-2016.pdf";2;10;1556;"Brønderslev Kommune";"10-05-2016";1568;0,00127551020408163;0,00637755102040816;2016;"05";2016-05-10;0,340557804472649;2,04200926234588;36047;59342;573;7,2;6,8;"Mikael Klitgaard";"Mikael Klitgaard";0;"V";"V";0;0;0;0,4;1,8725562701665
"341";"Broenderslev.11-09-2018.pdf";0;3;436;"Brønderslev Kommune";"11-09-2018";439;0;0,00683371298405467;2018;"09";2018-09-11;0;2,18806641687358;36289;60811;1011;7,5;7,1;"Mikael Klitgaard";"Mikael Klitgaard";0;"V";"V";0;0;0;0,4;3,30393436149796
"342";"Broenderslev.12-01-2016.pdf";0;8;1056;"Brønderslev Kommune";"12-01-2016";1064;0;0,0075187969924812;2016;"01";2016-01-12;0;2,40742144613409;36047;59342;573;7,2;6,8;"Mikael Klitgaard";"Mikael Klitgaard";0;"V";"V";0;0;0;0,4;1,8725562701665
"343";"Broenderslev.12-04-2016.pdf";1;3;1297;"Brønderslev Kommune";"12-04-2016";1301;0,000768639508070715;0,00230591852421214;2016;"04";2016-04-12;0,205224687706808;0,738325255194083;36047;59342;573;7,2;6,8;"Mikael Klitgaard";"Mikael Klitgaard";0;"V";"V";0;0;0;0,4;1,8725562701665
"344";"Broenderslev.12-09-2018.pdf";0;0;168;"Brønderslev Kommune";"12-09-2018";168;0;0;2018;"09";2018-09-12;0;0;36289;60811;1011;7,5;7,1;"Mikael Klitgaard";"Mikael Klitgaard";0;"V";"V";0;0;0;0,4;3,30393436149796
"345";"Broenderslev.13-09-2016.pdf";4;8;962;"Brønderslev Kommune";"13-09-2016";974;0,00410677618069815;0,0082135523613963;2016;"09";2016-09-13;1,09649822877436;2,62987311980151;36047;59342;573;7,2;6,8;"Mikael Klitgaard";"Mikael Klitgaard";0;"V";"V";0;0;0;0,4;1,8725562701665
"346";"Broenderslev.13-11-2018.pdf";1;7;1755;"Brønderslev Kommune";"13-11-2018";1763;0,000567214974475326;0,00397050482132728;2018;"11";2018-11-13;0,15144487731512;1,271304235026;36289;60811;1011;7,5;7,1;"Mikael Klitgaard";"Mikael Klitgaard";0;"V";"V";0;0;0;0,4;3,30393436149796
"347";"Broenderslev.15-01-2019.pdf";2;25;1649;"Brønderslev Kommune";"15-01-2019";1676;0,00119331742243437;0,0149164677804296;2019;"01";2019-01-15;0,318612552155796;4,77605984987819;36370;61218;998;7;7;"Mikael Klitgaard";"Mikael Klitgaard";0;"V";"V";0;0;0;0;3,2614505368694
"348";"Broenderslev.15-08-2017.pdf";4;12;1679;"Brønderslev Kommune";"15-08-2017";1695;0,0023598820058997;0,00707964601769911;2017;"08";2017-08-15;0,630082168039073;2,26681098998821;36128;60571;1042;6,9;6,8;"Mikael Klitgaard";"Mikael Klitgaard";0;"V";"V";0;0;0;0,100000000000001;3,40524194330453
"349";"Broenderslev.16-01-2018.pdf";0;4;569;"Brønderslev Kommune";"16-01-2018";573;0;0,00698080279232112;2018;"01";2018-01-16;0;2,23516266901106;36289;60811;1011;7,5;7,1;"Mikael Klitgaard";"Mikael Klitgaard";0;"V";"V";0;0;0;0,4;3,30393436149796
"350";"Broenderslev.16-08-2016.pdf";3;8;975;"Brønderslev Kommune";"16-08-2016";986;0,00304259634888438;0,00811359026369168;2016;"08";2016-08-16;0,81236506705849;2,59786655039216;36047;59342;573;7,2;6,8;"Mikael Klitgaard";"Mikael Klitgaard";0;"V";"V";0;0;0;0,4;1,8725562701665
"351";"Broenderslev.21-08-2017.pdf";0;0;460;"Brønderslev Kommune";"21-08-2017";460;0;0;2017;"08";2017-08-21;0;0;36128;60571;1042;6,9;6,8;"Mikael Klitgaard";"Mikael Klitgaard";0;"V";"V";0;0;0;0,100000000000001;3,40524194330453
"352";"Broenderslev.21-08-2018.pdf";2;9;1583;"Brønderslev Kommune";"21-08-2018";1594;0,00125470514429109;0,00564617314930991;2018;"08";2018-08-21;0,335002909293045;1,80783153765527;36289;60811;1011;7,5;7,1;"Mikael Klitgaard";"Mikael Klitgaard";0;"V";"V";0;0;0;0,4;3,30393436149796
"353";"Broenderslev.23-11-2016.pdf";4;5;637;"Brønderslev Kommune";"23-11-2016";646;0,00619195046439629;0,00773993808049536;2016;"11";2016-11-23;1,65323417155763;2,47822795925568;36047;59342;573;7,2;6,8;"Mikael Klitgaard";"Mikael Klitgaard";0;"V";"V";0;0;0;0,4;1,8725562701665
"354";"Broenderslev.29-05-2018.pdf";0;8;2107;"Brønderslev Kommune";"29-05-2018";2115;0;0,00378250591016548;2018;"05";2018-05-29;0;1,21110941781876;36289;60811;1011;7,5;7,1;"Mikael Klitgaard";"Mikael Klitgaard";0;"V";"V";0;0;0;0,4;3,30393436149796
"355";"Broenderslev.29-11-2016.pdf";1;4;759;"Brønderslev Kommune";"29-11-2016";764;0,00130890052356021;0,00523560209424084;2016;"11";2016-11-29;0,349472930244185;1,67637200175829;36047;59342;573;7,2;6,8;"Mikael Klitgaard";"Mikael Klitgaard";0;"V";"V";0;0;0;0,4;1,8725562701665
"356";"Dragoer.01-02-2017.pdf";2;15;2756;"Dragør Kommune";"01-02-2017";2773;0,000721240533717995;0,00540930400288496;2017;"02";2017-02-01;0,192569288645191;1,73198910387216;14288;65691;966;7,7;7,9;"Eik Dahl Bidstrup";"Eik Dahl Bidstrup";0;"V";"V";0;0;0;-0,2;3,15687496855295
"357";"Dragoer.01-11-2017.pdf";1;2;2190;"Dragør Kommune";"01-11-2017";2193;0,000455996352029184;0,000911992704058368;2017;"11";2017-11-01;0,121749803331763;0,292008255664235;14288;65691;966;7,7;7,9;"Eik Dahl Bidstrup";"Eik Dahl Bidstrup";0;"V";"V";0;0;0;-0,2;3,15687496855295
"358";"Dragoer.02-03-2016.pdf";0;43;4473;"Dragør Kommune";"02-03-2016";4516;0;0,00952170062001772;2016;"03";2016-03-02;0;3,04872525474776;14142;58575;963;7,8;7,8;"Eik Dahl Bidstrup";"Eik Dahl Bidstrup";0;"V";"V";0;0;0;0;3,14707100902328
"359";"Dragoer.02-08-2016.pdf";1;1;803;"Dragør Kommune";"02-08-2016";805;0,00124223602484472;0,00124223602484472;2016;"08";2016-08-02;0,331673687834233;0,397747891100415;14142;58575;963;7,8;7,8;"Eik Dahl Bidstrup";"Eik Dahl Bidstrup";0;"V";"V";0;0;0;0;3,14707100902328
"360";"Dragoer.02-11-2016.pdf";4;0;2373;"Dragør Kommune";"02-11-2016";2377;0,0016827934371056;0;2016;"11";2016-11-02;0,449301335644185;0;14142;58575;963;7,8;7,8;"Eik Dahl Bidstrup";"Eik Dahl Bidstrup";0;"V";"V";0;0;0;0;3,14707100902328
"361";"Dragoer.03-02-2016.pdf";1;14;2460;"Dragør Kommune";"03-02-2016";2475;0,000404040404040404;0,00565656565656566;2016;"02";2016-02-03;0,107877704527902;1,81115908391987;14142;58575;963;7,8;7,8;"Eik Dahl Bidstrup";"Eik Dahl Bidstrup";0;"V";"V";0;0;0;0;3,14707100902328
"362";"Dragoer.03-04-2019.pdf";10;12;2194;"Dragør Kommune";"03-04-2019";2216;0,00451263537906137;0,00541516245487365;2019;"04";2019-04-03;1,20486154650973;1,73386490434567;14270;60141;645;7,8;7,8;"Eik Dahl Bidstrup";"Eik Dahl Bidstrup";0;"V";"V";0;0;0;0;2,10785129887852
"363";"Dragoer.03-05-2017.pdf";0;0;1463;"Dragør Kommune";"03-05-2017";1463;0;0;2017;"05";2017-05-03;0;0;14288;65691;966;7,7;7,9;"Eik Dahl Bidstrup";"Eik Dahl Bidstrup";0;"V";"V";0;0;0;-0,2;3,15687496855295
"364";"Dragoer.03-05-2018.pdf";5;3;1308;"Dragør Kommune";"03-05-2018";1316;0,00379939209726444;0,00227963525835866;2018;"05";2018-05-03;1,01442750268449;0,729909693774698;14272;66548;770;7,9;7,6;"Eik Dahl Bidstrup";"Eik Dahl Bidstrup";0;"V";"V";0;0;0;0,300000000000001;2,51634961261467
"365";"Dragoer.04-10-2017.pdf";1;4;3381;"Dragør Kommune";"04-10-2017";3386;0,000295333727111636;0,00118133490844654;2017;"10";2017-10-04;0,0788533132624209;0,378248142156922;14288;65691;966;7,7;7,9;"Eik Dahl Bidstrup";"Eik Dahl Bidstrup";0;"V";"V";0;0;0;-0,2;3,15687496855295
"366";"Dragoer.05-04-2017.pdf";2;19;2991;"Dragør Kommune";"05-04-2017";3012;0,000664010624169987;0,00630810092961487;2017;"04";2017-04-05;0,177289056246054;2,01977224249032;14288;65691;966;7,7;7,9;"Eik Dahl Bidstrup";"Eik Dahl Bidstrup";0;"V";"V";0;0;0;-0,2;3,15687496855295
"367";"Dragoer.05-04-2018.pdf";2;4;1301;"Dragør Kommune";"05-04-2018";1307;0,00153022188217292;0,00306044376434583;2018;"04";2018-04-05;0,40856513956627;0,979914467745476;14272;66548;770;7,9;7,6;"Eik Dahl Bidstrup";"Eik Dahl Bidstrup";0;"V";"V";0;0;0;0,300000000000001;2,51634961261467
"368";"Dragoer.05-10-2016.pdf";6;1;1863;"Dragør Kommune";"05-10-2016";1870;0,00320855614973262;0,00053475935828877;2016;"10";2016-10-05;0,856675888898044;0,171223022639483;14142;58575;963;7,8;7,8;"Eik Dahl Bidstrup";"Eik Dahl Bidstrup";0;"V";"V";0;0;0;0;3,14707100902328
"369";"Dragoer.06-04-2016.pdf";11;50;5235;"Dragør Kommune";"06-04-2016";5296;0,00207703927492447;0,00944108761329305;2016;"04";2016-04-06;0,554563917253045;3,02291401374466;14142;58575;963;7,8;7,8;"Eik Dahl Bidstrup";"Eik Dahl Bidstrup";0;"V";"V";0;0;0;0;3,14707100902328
"370";"Dragoer.06-09-2017.pdf";5;2;3008;"Dragør Kommune";"06-09-2017";3015;0,00165837479270315;0,00066334991708126;2017;"09";2017-09-06;0,442781623062284;0,212396054617469;14288;65691;966;7,7;7,9;"Eik Dahl Bidstrup";"Eik Dahl Bidstrup";0;"V";"V";0;0;0;-0,2;3,15687496855295
"371";"Dragoer.06-12-2018.pdf";0;3;1337;"Dragør Kommune";"06-12-2018";1340;0;0,00223880597014925;2018;"12";2018-12-06;0;0,716836684333957;14272;66548;770;7,9;7,6;"Eik Dahl Bidstrup";"Eik Dahl Bidstrup";0;"V";"V";0;0;0;0,300000000000001;2,51634961261467
"372";"Dragoer.07-02-2019.pdf";2;8;1513;"Dragør Kommune";"07-02-2019";1523;0,00131319763624425;0,00525279054497702;2019;"02";2019-02-07;0,350620247809005;1,68187552113373;14270;60141;645;7,8;7,8;"Eik Dahl Bidstrup";"Eik Dahl Bidstrup";0;"V";"V";0;0;0;0;2,10785129887852
"373";"Dragoer.07-03-2018.pdf";9;9;2087;"Dragør Kommune";"07-03-2018";2105;0,00427553444180523;0,00427553444180523;2018;"03";2018-03-07;1,14155623199953;1,36897077008195;14272;66548;770;7,9;7,6;"Eik Dahl Bidstrup";"Eik Dahl Bidstrup";0;"V";"V";0;0;0;0,300000000000001;2,51634961261467
"374";"Dragoer.07-03-2019.pdf";2;8;1383;"Dragør Kommune";"07-03-2019";1393;0,00143575017946877;0,00574300071787509;2019;"03";2019-03-07;0,38334144825062;1,838834471419;14270;60141;645;7,8;7,8;"Eik Dahl Bidstrup";"Eik Dahl Bidstrup";0;"V";"V";0;0;0;0;2,10785129887852
"375";"Dragoer.07-06-2017.pdf";3;10;4733;"Dragør Kommune";"07-06-2017";4746;0,000632111251580278;0,00210703750526759;2017;"06";2017-06-07;0,16877200929618;0,674646127972681;14288;65691;966;7,7;7,9;"Eik Dahl Bidstrup";"Eik Dahl Bidstrup";0;"V";"V";0;0;0;-0,2;3,15687496855295
"376";"Dragoer.07-09-2016.pdf";10;5;4008;"Dragør Kommune";"07-09-2016";4023;0,00248570718369376;0,00124285359184688;2016;"09";2016-09-07;0,663677153135862;0,397945628058457;14142;58575;963;7,8;7,8;"Eik Dahl Bidstrup";"Eik Dahl Bidstrup";0;"V";"V";0;0;0;0;3,14707100902328
"377";"Dragoer.08-03-2017.pdf";15;32;6373;"Dragør Kommune";"08-03-2017";6420;0,00233644859813084;0,00498442367601246;2017;"03";2017-03-08;0,623825510996629;1,59594792441537;14288;65691;966;7,7;7,9;"Eik Dahl Bidstrup";"Eik Dahl Bidstrup";0;"V";"V";0;0;0;-0,2;3,15687496855295
"378";"Dragoer.08-06-2016.pdf";4;16;6539;"Dragør Kommune";"08-06-2016";6559;0,000609849062357067;0,00243939624942827;2016;"06";2016-06-08;0,162828064465045;0,781063094583526;14142;58575;963;7,8;7,8;"Eik Dahl Bidstrup";"Eik Dahl Bidstrup";0;"V";"V";0;0;0;0;3,14707100902328
"379";"Dragoer.08-11-2018.pdf";3;20;3674;"Dragør Kommune";"08-11-2018";3697;0,0008114687584528;0,00540979172301866;2018;"11";2018-11-08;0,216659982721036;1,73214526554414;14272;66548;770;7,9;7,6;"Eik Dahl Bidstrup";"Eik Dahl Bidstrup";0;"V";"V";0;0;0;0,300000000000001;2,51634961261467
"380";"Dragoer.10-08-2016.pdf";4;23;6060;"Dragør Kommune";"10-08-2016";6087;0,000657138163298834;0,00377854443896829;2016;"08";2016-08-10;0,17545412762054;1,20984100603322;14142;58575;963;7,8;7,8;"Eik Dahl Bidstrup";"Eik Dahl Bidstrup";0;"V";"V";0;0;0;0;3,14707100902328
"381";"Dragoer.11-01-2017.pdf";5;7;2593;"Dragør Kommune";"11-01-2017";2605;0,00191938579654511;0,00268714011516315;2017;"01";2017-01-11;0,512470861240993;0,860387472687462;14288;65691;966;7,7;7,9;"Eik Dahl Bidstrup";"Eik Dahl Bidstrup";0;"V";"V";0;0;0;-0,2;3,15687496855295
"382";"Dragoer.11-05-2016.pdf";9;21;6325;"Dragør Kommune";"11-05-2016";6355;0,0014162077104642;0,0033044846577498;2016;"05";2016-05-11;0,378123661425494;1,0580532020539;14142;58575;963;7,8;7,8;"Eik Dahl Bidstrup";"Eik Dahl Bidstrup";0;"V";"V";0;0;0;0;3,14707100902328
"383";"Dragoer.11-10-2018.pdf";0;0;1063;"Dragør Kommune";"11-10-2018";1063;0;0;2018;"10";2018-10-11;0;0;14272;66548;770;7,9;7,6;"Eik Dahl Bidstrup";"Eik Dahl Bidstrup";0;"V";"V";0;0;0;0,300000000000001;2,51634961261467
"384";"Dragoer.12-09-2016.pdf";5;3;1595;"Dragør Kommune";"12-09-2016";1603;0,00311915159076731;0,00187149095446039;2016;"09";2016-09-12;0,832805111374165;0,599227172181848;14142;58575;963;7,8;7,8;"Eik Dahl Bidstrup";"Eik Dahl Bidstrup";0;"V";"V";0;0;0;0;3,14707100902328
"385";"Dragoer.13-01-2016.pdf";3;24;3457;"Dragør Kommune";"13-01-2016";3484;0,000861079219288174;0,0068886337543054;2016;"01";2016-01-13;0,229905842743878;2,20565133641218;14142;58575;963;7,8;7,8;"Eik Dahl Bidstrup";"Eik Dahl Bidstrup";0;"V";"V";0;0;0;0;3,14707100902328
"386";"Dragoer.13-09-2018.pdf";7;34;5201;"Dragør Kommune";"13-09-2018";5242;0,00133536818008394;0,00648607401755055;2018;"09";2018-09-13;0,356539723568466;2,07675692091155;14272;66548;770;7,9;7,6;"Eik Dahl Bidstrup";"Eik Dahl Bidstrup";0;"V";"V";0;0;0;0,300000000000001;2,51634961261467
"387";"Dragoer.16-08-2017.pdf";3;31;4057;"Dragør Kommune";"16-08-2017";4091;0,000733317037399169;0,00757760938645808;2017;"08";2017-08-16;0,195793682747414;2,42625241320236;14288;65691;966;7,7;7,9;"Eik Dahl Bidstrup";"Eik Dahl Bidstrup";0;"V";"V";0;0;0;-0,2;3,15687496855295
"388";"Dragoer.16-08-2018.pdf";2;10;1909;"Dragør Kommune";"16-08-2018";1921;0,00104112441436752;0,00520562207183758;2018;"08";2018-08-16;0,277977427076062;1,66677278675603;14272;66548;770;7,9;7,6;"Eik Dahl Bidstrup";"Eik Dahl Bidstrup";0;"V";"V";0;0;0;0,300000000000001;2,51634961261467
"389";"Dragoer.17-01-2019.pdf";13;4;1957;"Dragør Kommune";"17-01-2019";1974;0,00658561296859169;0,00202634245187437;2019;"01";2019-01-17;1,75834100465311;0,64880861668862;14270;60141;645;7,8;7,8;"Eik Dahl Bidstrup";"Eik Dahl Bidstrup";0;"V";"V";0;0;0;0;2,10785129887852
"390";"Dragoer.20-06-2018.pdf";1;4;905;"Dragør Kommune";"20-06-2018";910;0,0010989010989011;0,0043956043956044;2018;"06";2018-06-20;0,293403646930283;1,40741561466301;14272;66548;770;7,9;7,6;"Eik Dahl Bidstrup";"Eik Dahl Bidstrup";0;"V";"V";0;0;0;0,300000000000001;2,51634961261467
"391";"Dragoer.23-03-2017.pdf";2;0;595;"Dragør Kommune";"23-03-2017";597;0,0033500837520938;0;2017;"03";2017-03-23;0,894463379251448;0;14288;65691;966;7,7;7,9;"Eik Dahl Bidstrup";"Eik Dahl Bidstrup";0;"V";"V";0;0;0;-0,2;3,15687496855295
"392";"Dragoer.27-06-2016.pdf";1;0;457;"Dragør Kommune";"27-06-2016";458;0,00218340611353712;0;2016;"06";2016-06-27;0,582963577961915;0;14142;58575;963;7,8;7,8;"Eik Dahl Bidstrup";"Eik Dahl Bidstrup";0;"V";"V";0;0;0;0;3,14707100902328
"393";"Dragoer.29-11-2017.pdf";17;3;3777;"Dragør Kommune";"29-11-2017";3797;0,00447721885699236;0,000790097445351593;2017;"11";2017-11-29;1,1954054300794;0,252978972085199;14288;65691;966;7,7;7,9;"Eik Dahl Bidstrup";"Eik Dahl Bidstrup";0;"V";"V";0;0;0;-0,2;3,15687496855295
"394";"Dragoer.30-11-2016.pdf";20;11;5464;"Dragør Kommune";"30-11-2016";5495;0,00363967242948135;0,00200181983621474;2016;"11";2016-11-30;0,9717827796417;0,640956792665;14142;58575;963;7,8;7,8;"Eik Dahl Bidstrup";"Eik Dahl Bidstrup";0;"V";"V";0;0;0;0;3,14707100902328
"395";"Dragoer.31-01-2018.pdf";0;6;1457;"Dragør Kommune";"31-01-2018";1463;0;0,00410116199589884;2018;"01";2018-01-31;0;1,3131389706186;14272;66548;770;7,9;7,6;"Eik Dahl Bidstrup";"Eik Dahl Bidstrup";0;"V";"V";0;0;0;0,300000000000001;2,51634961261467
"396";"Dragoer.31-05-2018.pdf";0;11;3166;"Dragør Kommune";"31-05-2018";3177;0;0,00346238589864652;2018;"05";2018-05-31;0;1,10861113493679;14272;66548;770;7,9;7,6;"Eik Dahl Bidstrup";"Eik Dahl Bidstrup";0;"V";"V";0;0;0;0,300000000000001;2,51634961261467
"397";"Egedal.02-02-2016.pdf";1;6;1989;"Egedal Kommune";"02-02-2016";1996;0,000501002004008016;0,0030060120240481;2016;"02";2016-02-02;0,133766191736752;0,962486129266034;42773;65310;1431;7,8;7,4;"Karsten Søndergaard";"Karsten Søndergaard";0;"V";"V";0;0;0;0,399999999999999;4,67648869565142
"398";"Egedal.02-10-2018.pdf";2;0;595;"Egedal Kommune";"02-10-2018";597;0,0033500837520938;0;2018;"10";2018-10-02;0,894463379251448;0;43000;67713;1230;7,1;7,3;"Karsten Søndergaard";"Karsten Søndergaard";0;"V";"V";0;0;0;-0,2;4,01962340716369
"399";"Egedal.03-05-2016.pdf";1;7;1697;"Egedal Kommune";"03-05-2016";1705;0,000586510263929619;0,00410557184750733;2016;"05";2016-05-03;0,156596667863083;1,31455094800636;42773;65310;1431;7,8;7,4;"Karsten Søndergaard";"Karsten Søndergaard";0;"V";"V";0;0;0;0,399999999999999;4,67648869565142
"400";"Egedal.04-04-2017.pdf";25;5;1662;"Egedal Kommune";"04-04-2017";1692;0,0147754137115839;0,00295508274231678;2017;"04";2017-04-04;3,94499584377301;0,946179232670905;43082;66832;1408;7,6;7,5;"Karsten Søndergaard";"Karsten Søndergaard";0;"V";"V";0;0;0;0,0999999999999996;4,60132500592397
"401";"Egedal.04-09-2018.pdf";1;3;1384;"Egedal Kommune";"04-09-2018";1388;0,000720461095100865;0,00216138328530259;2018;"09";2018-09-04;0,192361180624321;0,692046943088979;43000;67713;1230;7,1;7,3;"Karsten Søndergaard";"Karsten Søndergaard";0;"V";"V";0;0;0;-0,2;4,01962340716369
"402";"Egedal.04-10-2016.pdf";3;1;743;"Egedal Kommune";"04-10-2016";747;0,00401606425702811;0,00133868808567604;2016;"10";2016-10-04;1,07227838837975;0,428630592149711;42773;65310;1431;7,8;7,4;"Karsten Søndergaard";"Karsten Søndergaard";0;"V";"V";0;0;0;0,399999999999999;4,67648869565142
"403";"Egedal.05-02-2019.pdf";0;9;1022;"Egedal Kommune";"05-02-2019";1031;0;0,00872938894277401;2019;"02";2019-02-05;0;2,79503731427983;43335;68453;1082;7,3;7,3;"Karsten Søndergaard";"Karsten Søndergaard";0;"V";"V";0;0;0;0;3,53596140370009
"404";"Egedal.05-09-2017.pdf";2;0;1030;"Egedal Kommune";"05-09-2017";1032;0,00193798449612403;0;2017;"09";2017-09-05;0,517436664159994;0;43082;66832;1408;7,6;7,5;"Karsten Søndergaard";"Karsten Søndergaard";0;"V";"V";0;0;0;0,0999999999999996;4,60132500592397
"405";"Egedal.05-12-2017.pdf";2;5;2198;"Egedal Kommune";"05-12-2017";2205;0,00090702947845805;0,00226757369614512;2017;"12";2017-12-05;0,242174438736106;0,72604773772298;43082;66832;1408;7,6;7,5;"Karsten Søndergaard";"Karsten Søndergaard";0;"V";"V";0;0;0;0,0999999999999996;4,60132500592397
"406";"Egedal.06-02-2018.pdf";1;4;1804;"Egedal Kommune";"06-02-2018";1809;0,000552791597567717;0,00221116639027087;2018;"02";2018-02-06;0,147593874354095;0,707986848724896;43000;67713;1230;7,1;7,3;"Karsten Søndergaard";"Karsten Søndergaard";0;"V";"V";0;0;0;-0,2;4,01962340716369
"407";"Egedal.06-03-2018.pdf";26;1;1493;"Egedal Kommune";"06-03-2018";1520;0,0171052631578947;0,000657894736842105;2018;"03";2018-03-06;4,56705939892795;0,210649376536733;43000;67713;1230;7,1;7,3;"Karsten Søndergaard";"Karsten Søndergaard";0;"V";"V";0;0;0;-0,2;4,01962340716369
"408";"Egedal.06-06-2017.pdf";8;0;2071;"Egedal Kommune";"06-06-2017";2079;0,00384800384800385;0;2017;"06";2017-06-06;1,02740670978954;0;43082;66832;1408;7,6;7,5;"Karsten Søndergaard";"Karsten Søndergaard";0;"V";"V";0;0;0;0,0999999999999996;4,60132500592397
"409";"Egedal.06-09-2016.pdf";0;2;1033;"Egedal Kommune";"06-09-2016";1035;0;0,00193236714975845;2016;"09";2016-09-06;0;0,618718941711757;42773;65310;1431;7,8;7,4;"Karsten Søndergaard";"Karsten Søndergaard";0;"V";"V";0;0;0;0,399999999999999;4,67648869565142
"410";"Egedal.06-12-2016.pdf";6;1;1615;"Egedal Kommune";"06-12-2016";1622;0,00369913686806412;0,00061652281134402;2016;"12";2016-12-06;0,987659625301691;0,197402621662043;42773;65310;1431;7,8;7,4;"Karsten Søndergaard";"Karsten Søndergaard";0;"V";"V";0;0;0;0,399999999999999;4,67648869565142
"411";"Egedal.06-12-2017.pdf";0;0;172;"Egedal Kommune";"06-12-2017";172;0;0;2017;"12";2017-12-06;0;0;43082;66832;1408;7,6;7,5;"Karsten Søndergaard";"Karsten Søndergaard";0;"V";"V";0;0;0;0,0999999999999996;4,60132500592397
"412";"Egedal.07-02-2017.pdf";0;4;1490;"Egedal Kommune";"07-02-2017";1494;0;0,00267737617135207;2017;"02";2017-02-07;0;0,857261184299422;43082;66832;1408;7,6;7,5;"Karsten Søndergaard";"Karsten Søndergaard";0;"V";"V";0;0;0;0,0999999999999996;4,60132500592397
"413";"Egedal.07-06-2016.pdf";7;18;3444;"Egedal Kommune";"07-06-2016";3469;0,00201787258575958;0,00518881522052465;2016;"06";2016-06-07;0,538766569889277;1,6613914505751;42773;65310;1431;7,8;7,4;"Karsten Søndergaard";"Karsten Søndergaard";0;"V";"V";0;0;0;0,399999999999999;4,67648869565142
"414";"Egedal.07-06-2018.pdf";1;0;469;"Egedal Kommune";"07-06-2018";470;0,00212765957446809;0;2018;"06";2018-06-07;0,568079401503313;0;43000;67713;1230;7,1;7,3;"Karsten Søndergaard";"Karsten Søndergaard";0;"V";"V";0;0;0;-0,2;4,01962340716369
"415";"Egedal.07-11-2017.pdf";1;0;785;"Egedal Kommune";"07-11-2017";786;0,00127226463104326;0;2017;"11";2017-11-07;0,339691245173737;0;43082;66832;1408;7,6;7,5;"Karsten Søndergaard";"Karsten Søndergaard";0;"V";"V";0;0;0;0,0999999999999996;4,60132500592397
"416";"Egedal.08-03-2016.pdf";5;15;2024;"Egedal Kommune";"08-03-2016";2044;0,00244618395303327;0,0073385518590998;2016;"03";2016-03-08;0,653124556522889;2,34970928817882;42773;65310;1431;7,8;7,4;"Karsten Søndergaard";"Karsten Søndergaard";0;"V";"V";0;0;0;0,399999999999999;4,67648869565142
"417";"Egedal.08-11-2016.pdf";1;0;2443;"Egedal Kommune";"08-11-2016";2444;0,000409165302782324;0;2016;"11";2016-11-08;0,109246038750637;0;42773;65310;1431;7,8;7,4;"Karsten Søndergaard";"Karsten Søndergaard";0;"V";"V";0;0;0;0,399999999999999;4,67648869565142
"418";"Egedal.10-04-2018.pdf";1;1;1927;"Egedal Kommune";"10-04-2018";1929;0,000518403317781234;0,000518403317781234;2018;"04";2018-04-10;0,138412295856173;0,16598603024149;43000;67713;1230;7,1;7,3;"Karsten Søndergaard";"Karsten Søndergaard";0;"V";"V";0;0;0;-0,2;4,01962340716369
"419";"Egedal.10-10-2017.pdf";0;2;1291;"Egedal Kommune";"10-10-2017";1293;0;0,00154679040989946;2017;"10";2017-10-10;0;0,495262261927044;43082;66832;1408;7,6;7,5;"Karsten Søndergaard";"Karsten Søndergaard";0;"V";"V";0;0;0;0,0999999999999996;4,60132500592397
"420";"Egedal.11-05-2016.pdf";0;5;917;"Egedal Kommune";"11-05-2016";922;0;0,00542299349240781;2016;"05";2016-05-11;0;1,73637230117047;42773;65310;1431;7,8;7,4;"Karsten Søndergaard";"Karsten Søndergaard";0;"V";"V";0;0;0;0,399999999999999;4,67648869565142
"421";"Egedal.12-01-2016.pdf";1;1;805;"Egedal Kommune";"12-01-2016";807;0,00123915737298637;0,00123915737298637;2016;"01";2016-01-12;0,330851696042822;0,396762146636721;42773;65310;1431;7,8;7,4;"Karsten Søndergaard";"Karsten Søndergaard";0;"V";"V";0;0;0;0,399999999999999;4,67648869565142
"422";"Egedal.12-03-2019.pdf";1;4;1567;"Egedal Kommune";"12-03-2019";1572;0,000636132315521629;0,00254452926208651;2019;"03";2019-03-12;0,169845622586868;0,814725324009756;43335;68453;1082;7,3;7,3;"Karsten Søndergaard";"Karsten Søndergaard";0;"V";"V";0;0;0;0;3,53596140370009
"423";"Egedal.12-04-2016.pdf";3;13;2245;"Egedal Kommune";"12-04-2016";2261;0,00132684652808492;0,00574966828836798;2016;"04";2016-04-12;0,354264465333778;1,84096934116136;42773;65310;1431;7,8;7,4;"Karsten Søndergaard";"Karsten Søndergaard";0;"V";"V";0;0;0;0,399999999999999;4,67648869565142
"424";"Egedal.14-03-2017.pdf";20;12;2534;"Egedal Kommune";"14-03-2017";2566;0,00779423226812159;0,00467653936087295;2017;"03";2017-03-14;2,08103911696459;1,49736735309042;43082;66832;1408;7,6;7,5;"Karsten Søndergaard";"Karsten Søndergaard";0;"V";"V";0;0;0;0,0999999999999996;4,60132500592397
"425";"Egedal.14-08-2018.pdf";1;0;670;"Egedal Kommune";"14-08-2018";671;0,0014903129657228;0;2018;"08";2018-08-14;0,397909565881605;0;43000;67713;1230;7,1;7,3;"Karsten Søndergaard";"Karsten Søndergaard";0;"V";"V";0;0;0;-0,2;4,01962340716369
"426";"Egedal.15-01-2019.pdf";1;5;1994;"Egedal Kommune";"15-01-2019";2000;5e-04;0,0025;2019;"01";2019-01-15;0,133498659353279;0,800467630839585;43335;68453;1082;7,3;7,3;"Karsten Søndergaard";"Karsten Søndergaard";0;"V";"V";0;0;0;0;3,53596140370009
"427";"Egedal.15-05-2018.pdf";0;1;2337;"Egedal Kommune";"15-05-2018";2338;0;0,000427715996578272;2018;"05";2018-05-15;0;0,136949124181281;43000;67713;1230;7,1;7,3;"Karsten Søndergaard";"Karsten Søndergaard";0;"V";"V";0;0;0;-0,2;4,01962340716369
"428";"Egedal.15-08-2017.pdf";1;5;2160;"Egedal Kommune";"15-08-2017";2166;0,000461680517082179;0,0023084025854109;2017;"08";2017-08-15;0,123267460159999;0,739120619427133;43082;66832;1408;7,6;7,5;"Karsten Søndergaard";"Karsten Søndergaard";0;"V";"V";0;0;0;0,0999999999999996;4,60132500592397
"429";"Egedal.16-01-2018.pdf";2;1;753;"Egedal Kommune";"16-01-2018";756;0,00264550264550265;0,00132275132275132;2018;"01";2018-01-16;0,70634211298031;0,423527847005072;43000;67713;1230;7,1;7,3;"Karsten Søndergaard";"Karsten Søndergaard";0;"V";"V";0;0;0;-0,2;4,01962340716369
"430";"Egedal.16-05-2017.pdf";25;2;2296;"Egedal Kommune";"16-05-2017";2323;0,0107619457597934;0,00086095566078347;2017;"05";2017-05-16;2,87341066193023;0,275666855218109;43082;66832;1408;7,6;7,5;"Karsten Søndergaard";"Karsten Søndergaard";0;"V";"V";0;0;0;0,0999999999999996;4,60132500592397
"431";"Egedal.16-08-2016.pdf";0;12;1785;"Egedal Kommune";"16-08-2016";1797;0;0,00667779632721202;2016;"08";2016-08-16;0;2,13814392210908;42773;65310;1431;7,8;7,4;"Karsten Søndergaard";"Karsten Søndergaard";0;"V";"V";0;0;0;0,399999999999999;4,67648869565142
"432";"Egedal.16-08-2018.pdf";0;0;310;"Egedal Kommune";"16-08-2018";310;0;0;2018;"08";2018-08-16;0;0;43000;67713;1230;7,1;7,3;"Karsten Søndergaard";"Karsten Søndergaard";0;"V";"V";0;0;0;-0,2;4,01962340716369
"433";"Egedal.17-01-2017.pdf";0;10;1741;"Egedal Kommune";"17-01-2017";1751;0;0,00571102227298686;2017;"01";2017-01-17;0;1,82859538741196;43082;66832;1408;7,6;7,5;"Karsten Søndergaard";"Karsten Søndergaard";0;"V";"V";0;0;0;0,0999999999999996;4,60132500592397
"434";"Egedal.27-04-2016.pdf";0;8;580;"Egedal Kommune";"27-04-2016";588;0;0,0136054421768707;2016;"04";2016-04-27;0;4,35628642633788;42773;65310;1431;7,8;7,4;"Karsten Søndergaard";"Karsten Søndergaard";0;"V";"V";0;0;0;0,399999999999999;4,67648869565142
"435";"Egedal.30-03-2016.pdf";0;0;264;"Egedal Kommune";"30-03-2016";264;0;0;2016;"03";2016-03-30;0;0;42773;65310;1431;7,8;7,4;"Karsten Søndergaard";"Karsten Søndergaard";0;"V";"V";0;0;0;0,399999999999999;4,67648869565142
"436";"Egedal.30-10-2018.pdf";2;2;1627;"Egedal Kommune";"30-10-2018";1631;0,00122624156958921;0,00122624156958921;2018;"10";2018-10-30;0,327403211166839;0,392626673618436;43000;67713;1230;7,1;7,3;"Karsten Søndergaard";"Karsten Søndergaard";0;"V";"V";0;0;0;-0,2;4,01962340716369
"437";"Egedal.30-11-2018.pdf";6;15;1790;"Egedal Kommune";"30-11-2018";1811;0,00331308669243512;0,0082827167310878;2018;"11";2018-11-30;0,884585263522553;2,6520186554597;43000;67713;1230;7,1;7,3;"Karsten Søndergaard";"Karsten Søndergaard";0;"V";"V";0;0;0;-0,2;4,01962340716369
"438";"Esbjerg.01-06-2017.pdf";2;33;2015;"Esbjerg Kommune";"01-06-2017";2050;0,000975609756097561;0,0160975609756098;2017;"06";2017-06-01;0,260485188982007;5,15423059857684;115905;61940;1246;7,1;6,9;"Johnny Søtrup";"Jesper Frost";1;"V";"V";0;0;0;0,199999999999999;4,07191119132192
"439";"Esbjerg.01-09-2016.pdf";5;4;1820;"Esbjerg Kommune";"01-09-2016";1829;0,00273373428102788;0,00218698742482231;2016;"09";2016-09-01;0,729899723090643;0,700245057049391;115748;61710;1267;6,9;6,9;"Johnny Søtrup";"Jesper Frost";1;"V";"V";0;0;0;0;4,14053890802959
"440";"Esbjerg.02-03-2017.pdf";1;25;2410;"Esbjerg Kommune";"02-03-2017";2436;0,000410509031198686;0,0102627257799672;2017;"03";2017-03-02;0,109604810634876;3,28599191641866;115905;61940;1246;7,1;6,9;"Johnny Søtrup";"Jesper Frost";1;"V";"V";0;0;0;0,199999999999999;4,07191119132192
"441";"Esbjerg.02-11-2017.pdf";2;6;1597;"Esbjerg Kommune";"02-11-2017";1605;0,00124610591900312;0,00373831775700935;2017;"11";2017-11-02;0,332706939198202;1,19696094331153;115905;61940;1246;7,1;6,9;"Johnny Søtrup";"Jesper Frost";1;"V";"V";0;0;0;0,199999999999999;4,07191119132192
"442";"Esbjerg.03-03-2016.pdf";1;11;2792;"Esbjerg Kommune";"03-03-2016";2804;0,000356633380884451;0,00392296718972896;2016;"03";2016-03-03;0,0952201564574027;1,25608330088951;115748;61710;1267;6,9;6,9;"Johnny Søtrup";"Jesper Frost";1;"V";"V";0;0;0;0;4,14053890802959
"443";"Esbjerg.03-11-2016.pdf";3;5;2287;"Esbjerg Kommune";"03-11-2016";2295;0,00130718954248366;0,00217864923747277;2016;"11";2016-11-03;0,349016102884388;0,697575277420118;115748;61710;1267;6,9;6,9;"Johnny Søtrup";"Jesper Frost";1;"V";"V";0;0;0;0;4,14053890802959
"444";"Esbjerg.04-02-2016.pdf";10;9;1451;"Esbjerg Kommune";"04-02-2016";1470;0,00680272108843537;0,00612244897959184;2016;"02";2016-02-04;1,8163082905208;1,96032889185205;115748;61710;1267;6,9;6,9;"Johnny Søtrup";"Jesper Frost";1;"V";"V";0;0;0;0;4,14053890802959
"445";"Esbjerg.04-05-2017.pdf";1;0;589;"Esbjerg Kommune";"04-05-2017";590;0,00169491525423729;0;2017;"05";2017-05-04;0,452537828316199;0;115905;61940;1246;7,1;6,9;"Johnny Søtrup";"Jesper Frost";1;"V";"V";0;0;0;0,199999999999999;4,07191119132192
"446";"Esbjerg.04-06-2018.pdf";0;2;622;"Esbjerg Kommune";"04-06-2018";624;0;0,00320512820512821;2018;"06";2018-06-04;0;1,02624055235844;116032;64247;1230;7;6,9;"Johnny Søtrup";"Jesper Frost";1;"V";"V";0;0;0;0,0999999999999996;4,01962340716369
"447";"Esbjerg.05-01-2017.pdf";2;1;743;"Esbjerg Kommune";"05-01-2017";746;0,00268096514745308;0,00134048257372654;2017;"01";2017-01-05;0,715810505915703;0,429205163989054;115905;61940;1246;7,1;6,9;"Johnny Søtrup";"Jesper Frost";1;"V";"V";0;0;0;0,199999999999999;4,07191119132192
"448";"Esbjerg.05-10-2017.pdf";3;14;2707;"Esbjerg Kommune";"05-10-2017";2724;0,00110132158590308;0,00513950073421439;2017;"10";2017-10-05;0,294049910469777;1,64560159056596;115905;61940;1246;7,1;6,9;"Johnny Søtrup";"Jesper Frost";1;"V";"V";0;0;0;0,199999999999999;4,07191119132192
"449";"Esbjerg.06-04-2017.pdf";15;4;1539;"Esbjerg Kommune";"06-04-2017";1558;0,00962772785622593;0,00256739409499358;2017;"04";2017-04-06;2,57057752284875;0,822046347460421;115905;61940;1246;7,1;6,9;"Johnny Søtrup";"Jesper Frost";1;"V";"V";0;0;0;0,199999999999999;4,07191119132192
"450";"Esbjerg.06-10-2016.pdf";0;0;471;"Esbjerg Kommune";"06-10-2016";471;0;0;2016;"10";2016-10-06;0;0;115748;61710;1267;6,9;6,9;"Johnny Søtrup";"Jesper Frost";1;"V";"V";0;0;0;0;4,14053890802959
"451";"Esbjerg.07-04-2016.pdf";2;10;1706;"Esbjerg Kommune";"07-04-2016";1718;0,00116414435389988;0,00582072176949942;2016;"04";2016-04-07;0,310823421078646;1,86371974584304;115748;61710;1267;6,9;6,9;"Johnny Søtrup";"Jesper Frost";1;"V";"V";0;0;0;0;4,14053890802959
"452";"Esbjerg.07-06-2016.pdf";17;0;1849;"Esbjerg Kommune";"07-06-2016";1866;0,00911039657020364;0;2016;"06";2016-06-07;2,43245145659779;0;115748;61710;1267;6,9;6,9;"Johnny Søtrup";"Jesper Frost";1;"V";"V";0;0;0;0;4,14053890802959
"453";"Esbjerg.07-09-2017.pdf";1;8;1672;"Esbjerg Kommune";"07-09-2017";1681;0,000594883997620464;0,00475907198096371;2017;"09";2017-09-07;0,158832432306102;1,52379322943883;115905;61940;1246;7,1;6,9;"Johnny Søtrup";"Jesper Frost";1;"V";"V";0;0;0;0,199999999999999;4,07191119132192
"454";"Esbjerg.07-12-2017.pdf";3;7;2917;"Esbjerg Kommune";"07-12-2017";2927;0,00102494021182098;0,00239152716091561;2017;"12";2017-12-07;0,273656288390732;0,765736032234656;115905;61940;1246;7,1;6,9;"Johnny Søtrup";"Jesper Frost";1;"V";"V";0;0;0;0,199999999999999;4,07191119132192
"455";"Esbjerg.08-01-2018.pdf";1;0;627;"Esbjerg Kommune";"08-01-2018";628;0,00159235668789809;0;2018;"01";2018-01-08;0,425154966093244;0;116032;64247;1230;7;6,9;"Johnny Søtrup";"Jesper Frost";1;"V";"V";0;0;0;0,0999999999999996;4,01962340716369
"456";"Esbjerg.08-04-2019.pdf";0;9;1051;"Esbjerg Kommune";"08-04-2019";1060;0;0,00849056603773585;2019;"04";2019-04-08;0;2,71856931228538;115652;66416;1218;7,1;7;"Johnny Søtrup";"Jesper Frost";1;"V";"V";0;0;0;0,0999999999999996;3,98040756904502
"457";"Esbjerg.08-10-2018.pdf";0;15;1964;"Esbjerg Kommune";"08-10-2018";1979;0;0,00757958564931784;2018;"10";2018-10-08;0;2,42688518698207;116032;64247;1230;7;6,9;"Johnny Søtrup";"Jesper Frost";1;"V";"V";0;0;0;0,0999999999999996;4,01962340716369
"458";"Esbjerg.09-02-2017.pdf";0;0;1159;"Esbjerg Kommune";"09-02-2017";1159;0;0;2017;"02";2017-02-09;0;0;115905;61940;1246;7,1;6,9;"Johnny Søtrup";"Jesper Frost";1;"V";"V";0;0;0;0,199999999999999;4,07191119132192
"459";"Esbjerg.09-03-2017.pdf";0;11;2013;"Esbjerg Kommune";"09-03-2017";2024;0;0,00543478260869565;2017;"03";2017-03-09;0;1,74014702356432;115905;61940;1246;7,1;6,9;"Johnny Søtrup";"Jesper Frost";1;"V";"V";0;0;0;0,199999999999999;4,07191119132192
"460";"Esbjerg.10-09-2018.pdf";0;18;1629;"Esbjerg Kommune";"10-09-2018";1647;0;0,0109289617486339;2018;"09";2018-09-10;0;3,49931204738617;116032;64247;1230;7;6,9;"Johnny Søtrup";"Jesper Frost";1;"V";"V";0;0;0;0,0999999999999996;4,01962340716369
"461";"Esbjerg.10-12-2018.pdf";1;29;1752;"Esbjerg Kommune";"10-12-2018";1782;0,000561167227833895;0,0162738496071829;2018;"12";2018-12-10;0,149830145177642;5,21067593588058;116032;64247;1230;7;6,9;"Johnny Søtrup";"Jesper Frost";1;"V";"V";0;0;0;0,0999999999999996;4,01962340716369
"462";"Esbjerg.11-03-2019.pdf";4;2;1994;"Esbjerg Kommune";"11-03-2019";2000;0,002;0,001;2019;"03";2019-03-11;0,533994637413114;0,320187052335834;115652;66416;1218;7,1;7;"Johnny Søtrup";"Jesper Frost";1;"V";"V";0;0;0;0,0999999999999996;3,98040756904502
"463";"Esbjerg.11-06-2018.pdf";12;33;3526;"Esbjerg Kommune";"11-06-2018";3571;0,00336040324838981;0,00924110893307197;2018;"06";2018-06-11;0,897218657092883;2,95888342959466;116032;64247;1230;7;6,9;"Johnny Søtrup";"Jesper Frost";1;"V";"V";0;0;0;0,0999999999999996;4,01962340716369
"464";"Esbjerg.12-03-2018.pdf";1;0;1293;"Esbjerg Kommune";"12-03-2018";1294;0,000772797527047913;0;2018;"03";2018-03-12;0,206334867624851;0;116032;64247;1230;7;6,9;"Johnny Søtrup";"Jesper Frost";1;"V";"V";0;0;0;0,0999999999999996;4,01962340716369
"465";"Esbjerg.12-11-2018.pdf";0;75;3890;"Esbjerg Kommune";"12-11-2018";3965;0;0,0189155107187894;2018;"11";2018-11-12;0;6,05650162047606;116032;64247;1230;7;6,9;"Johnny Søtrup";"Jesper Frost";1;"V";"V";0;0;0;0,0999999999999996;4,01962340716369
"466";"Esbjerg.14-01-2019.pdf";1;3;1520;"Esbjerg Kommune";"14-01-2019";1524;0,000656167979002625;0,00196850393700787;2019;"01";2019-01-14;0,175195091014801;0,630289473102036;115652;66416;1218;7,1;7;"Johnny Søtrup";"Jesper Frost";1;"V";"V";0;0;0;0,0999999999999996;3,98040756904502
"467";"Esbjerg.14-05-2018.pdf";0;6;2529;"Esbjerg Kommune";"14-05-2018";2535;0;0,00236686390532544;2018;"05";2018-05-14;0;0,757839177126235;116032;64247;1230;7;6,9;"Johnny Søtrup";"Jesper Frost";1;"V";"V";0;0;0;0,0999999999999996;4,01962340716369
"468";"Esbjerg.15-09-2016.pdf";0;0;1269;"Esbjerg Kommune";"15-09-2016";1269;0;0;2016;"09";2016-09-15;0;0;115748;61710;1267;6,9;6,9;"Johnny Søtrup";"Jesper Frost";1;"V";"V";0;0;0;0;4,14053890802959
"469";"Esbjerg.15-12-2016.pdf";27;4;2673;"Esbjerg Kommune";"15-12-2016";2704;0,00998520710059172;0,0014792899408284;2016;"12";2016-12-15;2,66602352258766;0,473649485703897;115748;61710;1267;6,9;6,9;"Johnny Søtrup";"Jesper Frost";1;"V";"V";0;0;0;0;4,14053890802959
"470";"Esbjerg.16-11-2017.pdf";5;0;569;"Esbjerg Kommune";"16-11-2017";574;0,00871080139372822;0;2017;"11";2017-11-16;2,32576061591078;0;115905;61940;1246;7,1;6,9;"Johnny Søtrup";"Jesper Frost";1;"V";"V";0;0;0;0,199999999999999;4,07191119132192
"471";"Esbjerg.17-08-2017.pdf";6;1;2686;"Esbjerg Kommune";"17-08-2017";2693;0,00222799851466766;0,000371333085777943;2017;"08";2017-08-17;0,594869629498456;0,118896046170009;115905;61940;1246;7,1;6,9;"Johnny Søtrup";"Jesper Frost";1;"V";"V";0;0;0;0,199999999999999;4,07191119132192
"472";"Esbjerg.17-11-2016.pdf";4;2;2786;"Esbjerg Kommune";"17-11-2016";2792;0,00143266475644699;0,000716332378223496;2016;"11";2016-11-17;0,382517648576729;0,229360352676099;115748;61710;1267;6,9;6,9;"Johnny Søtrup";"Jesper Frost";1;"V";"V";0;0;0;0;4,14053890802959
"473";"Esbjerg.18-05-2017.pdf";8;3;2069;"Esbjerg Kommune";"18-05-2017";2080;0,00384615384615385;0,00144230769230769;2017;"05";2017-05-18;1,02691276425599;0,461808248561299;115905;61940;1246;7,1;6,9;"Johnny Søtrup";"Jesper Frost";1;"V";"V";0;0;0;0,199999999999999;4,07191119132192
"474";"Esbjerg.18-08-2016.pdf";4;8;3915;"Esbjerg Kommune";"18-08-2016";3927;0,00101858925388337;0,00203717850776674;2016;"08";2016-08-18;0,271960599650173;0,652278181483747;115748;61710;1267;6,9;6,9;"Johnny Søtrup";"Jesper Frost";1;"V";"V";0;0;0;0;4,14053890802959
"475";"Esbjerg.19-05-2016.pdf";1;5;1685;"Esbjerg Kommune";"19-05-2016";1691;0,000591366055588409;0,00295683027794205;2016;"05";2016-05-19;0,157893151216178;0,946738770951609;115748;61710;1267;6,9;6,9;"Johnny Søtrup";"Jesper Frost";1;"V";"V";0;0;0;0;4,14053890802959
"476";"Esbjerg.20-04-2017.pdf";2;1;1317;"Esbjerg Kommune";"20-04-2017";1320;0,00151515151515152;0,000757575757575758;2017;"04";2017-04-20;0,404541391979632;0,242565948739268;115905;61940;1246;7,1;6,9;"Johnny Søtrup";"Jesper Frost";1;"V";"V";0;0;0;0,199999999999999;4,07191119132192
"477";"Esbjerg.20-11-2017.pdf";2;0;1245;"Esbjerg Kommune";"20-11-2017";1247;0,00160384923817161;0;2017;"11";2017-11-20;0,428223446201375;0;115905;61940;1246;7,1;6,9;"Johnny Søtrup";"Jesper Frost";1;"V";"V";0;0;0;0,199999999999999;4,07191119132192
"478";"Esbjerg.21-04-2016.pdf";15;19;4885;"Esbjerg Kommune";"21-04-2016";4919;0,00304940028461069;0,00386257369384021;2016;"04";2016-04-21;0,814181699654067;1,23674608546063;115748;61710;1267;6,9;6,9;"Johnny Søtrup";"Jesper Frost";1;"V";"V";0;0;0;0;4,14053890802959
"479";"Esbjerg.21-09-2017.pdf";0;4;973;"Esbjerg Kommune";"21-09-2017";977;0;0,00409416581371546;2017;"09";2017-09-21;0;1,31089888366769;115905;61940;1246;7,1;6,9;"Johnny Søtrup";"Jesper Frost";1;"V";"V";0;0;0;0,199999999999999;4,07191119132192
"480";"Esbjerg.22-01-2018.pdf";0;0;1283;"Esbjerg Kommune";"22-01-2018";1283;0;0;2018;"01";2018-01-22;0;0;116032;64247;1230;7;6,9;"Johnny Søtrup";"Jesper Frost";1;"V";"V";0;0;0;0,0999999999999996;4,01962340716369
"481";"Esbjerg.22-06-2017.pdf";0;7;773;"Esbjerg Kommune";"22-06-2017";780;0;0,00897435897435897;2017;"06";2017-06-22;0;2,87347354660364;115905;61940;1246;7,1;6,9;"Johnny Søtrup";"Jesper Frost";1;"V";"V";0;0;0;0,199999999999999;4,07191119132192
"482";"Esbjerg.22-10-2018.pdf";2;36;4046;"Esbjerg Kommune";"22-10-2018";4084;0,000489715964740451;0,00881488736532811;2018;"10";2018-10-22;0,130752849513495;2,82241280217679;116032;64247;1230;7;6,9;"Johnny Søtrup";"Jesper Frost";1;"V";"V";0;0;0;0,0999999999999996;4,01962340716369
"483";"Esbjerg.23-03-2019.pdf";21;6;3338;"Esbjerg Kommune";"23-03-2019";3365;0,0062407132243685;0,00178306092124814;2019;"03";2019-03-23;1,66625369772294;0,57091302050966;115652;66416;1218;7,1;7;"Johnny Søtrup";"Jesper Frost";1;"V";"V";0;0;0;0,0999999999999996;3,98040756904502
"484";"Esbjerg.23-04-2018.pdf";20;10;4251;"Esbjerg Kommune";"23-04-2018";4281;0,00467180565288484;0,00233590282644242;2018;"04";2018-04-23;1,24735958283839;0,747925840541542;116032;64247;1230;7;6,9;"Johnny Søtrup";"Jesper Frost";1;"V";"V";0;0;0;0,0999999999999996;4,01962340716369
"485";"Esbjerg.24-09-2018.pdf";0;12;1221;"Esbjerg Kommune";"24-09-2018";1233;0;0,0097323600973236;2018;"09";2018-09-24;0;3,11617569183294;116032;64247;1230;7;6,9;"Johnny Søtrup";"Jesper Frost";1;"V";"V";0;0;0;0,0999999999999996;4,01962340716369
"486";"Esbjerg.25-02-2019.pdf";0;1;2423;"Esbjerg Kommune";"25-02-2019";2424;0;0,000412541254125413;2019;"02";2019-02-25;0;0,132090368125344;115652;66416;1218;7,1;7;"Johnny Søtrup";"Jesper Frost";1;"V";"V";0;0;0;0,0999999999999996;3,98040756904502
"487";"Esbjerg.25-06-2018.pdf";3;3;1533;"Esbjerg Kommune";"25-06-2018";1539;0,00194931773879142;0,00194931773879142;2018;"06";2018-06-25;0,520462609564439;0,624146300849579;116032;64247;1230;7;6,9;"Johnny Søtrup";"Jesper Frost";1;"V";"V";0;0;0;0,0999999999999996;4,01962340716369
"488";"Esbjerg.26-02-2018.pdf";16;15;3021;"Esbjerg Kommune";"26-02-2018";3052;0,00524246395806029;0,00491480996068152;2018;"02";2018-02-26;1,39972382021786;1,57365851410141;116032;64247;1230;7;6,9;"Johnny Søtrup";"Jesper Frost";1;"V";"V";0;0;0;0,0999999999999996;4,01962340716369
"489";"Esbjerg.26-11-2018.pdf";0;5;1842;"Esbjerg Kommune";"26-11-2018";1847;0;0,00270709258256632;2018;"11";2018-11-26;0;0,866775994412112;116032;64247;1230;7;6,9;"Johnny Søtrup";"Jesper Frost";1;"V";"V";0;0;0;0,0999999999999996;4,01962340716369
"490";"Esbjerg.27-08-2018.pdf";18;56;5811;"Esbjerg Kommune";"27-08-2018";5885;0,00305862361937128;0,00951571792693288;2018;"08";2018-08-27;0,816644305304678;3,04680967388389;116032;64247;1230;7;6,9;"Johnny Søtrup";"Jesper Frost";1;"V";"V";0;0;0;0,0999999999999996;4,01962340716369
"491";"Esbjerg.28-01-2016.pdf";3;20;3279;"Esbjerg Kommune";"28-01-2016";3302;0,000908540278619019;0,00605693519079346;2016;"01";2016-01-28;0,242577818328186;1,93935222492934;115748;61710;1267;6,9;6,9;"Johnny Søtrup";"Jesper Frost";1;"V";"V";0;0;0;0;4,14053890802959
"492";"Esbjerg.28-01-2019.pdf";0;11;2358;"Esbjerg Kommune";"28-01-2019";2369;0;0,00464330941325454;2019;"01";2019-01-28;0;1,4867275541132;115652;66416;1218;7,1;7;"Johnny Søtrup";"Jesper Frost";1;"V";"V";0;0;0;0,0999999999999996;3,98040756904502
"493";"Fanoe.04-12-2018.pdf";2;1;452;"Fanø Kommune";"04-12-2018";455;0,0043956043956044;0,0021978021978022;2018;"12";2018-12-04;1,17361458772113;0,703707807331504;3401;69491;380;6,3;6,7;"Erik Nørreby";"Sofie Valbjørn";1;"V";"Å";1;1;1;-0,4;1,24183487375789
"494";"Fanoe.13-12-2017.pdf";2;0;446;"Fanø Kommune";"13-12-2017";448;0,00446428571428571;0;2017;"12";2017-12-13;1,19195231565427;0;3345;69995;390;7,7;7,7;"Erik Nørreby";"Sofie Valbjørn";1;"V";"Å";1;1;1;0;1,27451473885678
"495";"Fanoe.14-12-2016.pdf";0;0;396;"Fanø Kommune";"14-12-2016";396;0;0;2016;"12";2016-12-14;0;0;3290;70175;374;7,9;7,7;"Erik Nørreby";"Sofie Valbjørn";1;"V";"Å";1;1;1;0,2;1,22222695469855
"496";"Fanoe.19-12-2018.pdf";5;6;1229;"Fanø Kommune";"19-12-2018";1240;0,00403225806451613;0,00483870967741936;2018;"12";2018-12-19;1,0766020915587;1,54929218872178;3401;69491;380;6,3;6,7;"Erik Nørreby";"Sofie Valbjørn";1;"V";"Å";1;1;1;-0,4;1,24183487375789
"497";"Fanoe.21-03-2018.pdf";1;3;1597;"Fanø Kommune";"21-03-2018";1601;0,000624609618988132;0,0018738288569644;2018;"03";2018-03-21;0,166769093508156;0,599975738293256;3401;69491;380;6,3;6,7;"Erik Nørreby";"Sofie Valbjørn";1;"V";"Å";1;1;1;-0,4;1,24183487375789
"498";"Fanoe.22-02-2017.pdf";1;3;2124;"Fanø Kommune";"22-02-2017";2128;0,000469924812030075;0,00140977443609023;2017;"02";2017-02-22;0,125468664805713;0,451391521150142;3345;69995;390;7,7;7,7;"Erik Nørreby";"Sofie Valbjørn";1;"V";"Å";1;1;1;0;1,27451473885678
"499";"Fanoe.23-01-2019.pdf";0;1;607;"Fanø Kommune";"23-01-2019";608;0;0,00164473684210526;2019;"01";2019-01-23;0;0,526623441341832;3404;68991;368;8,3;7,5;"Erik Nørreby";"Sofie Valbjørn";1;"V";"Å";1;1;1;0,800000000000001;1,20261903563922
"500";"Fanoe.24-02-2016.pdf";0;0;127;"Fanø Kommune";"24-02-2016";127;0;0;2016;"02";2016-02-24;0;0;3290;70175;374;7,9;7,7;"Erik Nørreby";"Sofie Valbjørn";1;"V";"Å";1;1;1;0,2;1,22222695469855
"501";"Fanoe.25-01-2017.pdf";1;0;2014;"Fanø Kommune";"25-01-2017";2015;0,000496277915632754;0;2017;"01";2017-01-25;0,132504872807224;0;3345;69995;390;7,7;7,7;"Erik Nørreby";"Sofie Valbjørn";1;"V";"Å";1;1;1;0;1,27451473885678
"502";"Fanoe.25-04-2018.pdf";5;3;2553;"Fanø Kommune";"25-04-2018";2561;0,00195236235845373;0,00117141741507224;2018;"04";2018-04-25;0,521275514850756;0,375072689186842;3401;69491;380;6,3;6,7;"Erik Nørreby";"Sofie Valbjørn";1;"V";"Å";1;1;1;-0,4;1,24183487375789
"503";"Fanoe.25-05-2016.pdf";3;14;2959;"Fanø Kommune";"25-05-2016";2976;0,00100806451612903;0,00470430107526882;2016;"05";2016-05-25;0,269150522889675;1,50625629459062;3290;70175;374;7,9;7,7;"Erik Nørreby";"Sofie Valbjørn";1;"V";"Å";1;1;1;0,2;1,22222695469855
"504";"Fanoe.25-10-2017.pdf";0;1;849;"Fanø Kommune";"25-10-2017";850;0;0,00117647058823529;2017;"10";2017-10-25;0;0,376690649806864;3345;69995;390;7,7;7,7;"Erik Nørreby";"Sofie Valbjørn";1;"V";"Å";1;1;1;0;1,27451473885678
"505";"Fanoe.26-04-2017.pdf";6;2;2741;"Fanø Kommune";"26-04-2017";2749;0,00218261185885777;0,000727537286285922;2017;"04";2017-04-26;0,582751514092158;0,232948019160301;3345;69995;390;7,7;7,7;"Erik Nørreby";"Sofie Valbjørn";1;"V";"Å";1;1;1;0;1,27451473885678
"506";"Fanoe.26-09-2018.pdf";1;0;883;"Fanø Kommune";"26-09-2018";884;0,00113122171945701;0;2018;"09";2018-09-26;0,302033165957644;0;3401;69491;380;6,3;6,7;"Erik Nørreby";"Sofie Valbjørn";1;"V";"Å";1;1;1;-0,4;1,24183487375789
"507";"Fanoe.26-10-2016.pdf";1;5;1654;"Fanø Kommune";"26-10-2016";1660;0,000602409638554217;0,00301204819277108;2016;"10";2016-10-26;0,160841758256962;0,96441883233685;3290;70175;374;7,9;7,7;"Erik Nørreby";"Sofie Valbjørn";1;"V";"Å";1;1;1;0,2;1,22222695469855
"508";"Fanoe.27-01-2016.pdf";3;2;2528;"Fanø Kommune";"27-01-2016";2533;0,00118436636399526;0,000789577575996842;2016;"01";2016-01-27;0,316222643552969;0,252812516648902;3290;70175;374;7,9;7,7;"Erik Nørreby";"Sofie Valbjørn";1;"V";"Å";1;1;1;0,2;1,22222695469855
"509";"Fanoe.27-02-2019.pdf";1;2;1403;"Fanø Kommune";"27-02-2019";1406;0,000711237553342817;0,00142247510668563;2019;"02";2019-02-27;0,189898519705944;0,455458111430774;3404;68991;368;8,3;7,5;"Erik Nørreby";"Sofie Valbjørn";1;"V";"Å";1;1;1;0,800000000000001;1,20261903563922
"510";"Fanoe.27-03-2019.pdf";0;7;1951;"Fanø Kommune";"27-03-2019";1958;0;0,00357507660878447;2019;"03";2019-03-27;0;1,14469324124149;3404;68991;368;8,3;7,5;"Erik Nørreby";"Sofie Valbjørn";1;"V";"Å";1;1;1;0,800000000000001;1,20261903563922
"511";"Fanoe.27-04-2016.pdf";1;5;3612;"Fanø Kommune";"27-04-2016";3618;0,000276395798783858;0,00138197899391929;2016;"04";2016-04-27;0,0737969371770473;0,44249178045306;3290;70175;374;7,9;7,7;"Erik Nørreby";"Sofie Valbjørn";1;"V";"Å";1;1;1;0,2;1,22222695469855
"512";"Fanoe.27-06-2018.pdf";13;3;1615;"Fanø Kommune";"27-06-2018";1631;0,00797057020232986;0,00183936235438381;2018;"06";2018-06-27;2,12812087258445;0,588940010427653;3401;69491;380;6,3;6,7;"Erik Nørreby";"Sofie Valbjørn";1;"V";"Å";1;1;1;-0,4;1,24183487375789
"513";"Fanoe.27-09-2017.pdf";1;0;773;"Fanø Kommune";"27-09-2017";774;0,00129198966408269;0;2017;"09";2017-09-27;0,344957776106663;0;3345;69995;390;7,7;7,7;"Erik Nørreby";"Sofie Valbjørn";1;"V";"Å";1;1;1;0;1,27451473885678
"514";"Fanoe.28-02-2018.pdf";3;7;3060;"Fanø Kommune";"28-02-2018";3070;0,000977198697068404;0,00228013029315961;2018;"02";2018-02-28;0,260909431960805;0,730068197508417;3401;69491;380;6,3;6,7;"Erik Nørreby";"Sofie Valbjørn";1;"V";"Å";1;1;1;-0,4;1,24183487375789
"515";"Fanoe.28-06-2017.pdf";1;1;730;"Fanø Kommune";"28-06-2017";732;0,00136612021857923;0,00136612021857923;2017;"06";2017-06-28;0,364750435391472;0,437414005923271;3345;69995;390;7,7;7,7;"Erik Nørreby";"Sofie Valbjørn";1;"V";"Å";1;1;1;0;1,27451473885678
"516";"Fanoe.28-09-2016.pdf";2;5;1235;"Fanø Kommune";"28-09-2016";1242;0,00161030595813205;0,00402576489533011;2016;"09";2016-09-28;0,42994737311845;1,28899779523283;3290;70175;374;7,9;7,7;"Erik Nørreby";"Sofie Valbjørn";1;"V";"Å";1;1;1;0,2;1,22222695469855
"517";"Fanoe.28-11-2018.pdf";2;1;783;"Fanø Kommune";"28-11-2018";786;0,00254452926208651;0,00127226463104326;2018;"11";2018-11-28;0,679382490347474;0,407362662004878;3401;69491;380;6,3;6,7;"Erik Nørreby";"Sofie Valbjørn";1;"V";"Å";1;1;1;-0,4;1,24183487375789
"518";"Fanoe.29-03-2017.pdf";2;1;3148;"Fanø Kommune";"29-03-2017";3151;0,000634719136781974;0,000317359568390987;2017;"03";2017-03-29;0,169468307652528;0,101614424733683;3345;69995;390;7,7;7,7;"Erik Nørreby";"Sofie Valbjørn";1;"V";"Å";1;1;1;0;1,27451473885678
"519";"Fanoe.29-06-2016.pdf";3;0;1192;"Fanø Kommune";"29-06-2016";1195;0,00251046025104603;0;2016;"06";2016-06-29;0,670286155748679;0;3290;70175;374;7,9;7,7;"Erik Nørreby";"Sofie Valbjørn";1;"V";"Å";1;1;1;0,2;1,22222695469855
"520";"Fanoe.29-08-2018.pdf";4;0;1239;"Fanø Kommune";"29-08-2018";1243;0,00321802091713596;0;2018;"08";2018-08-29;0,859202956416918;0;3401;69491;380;6,3;6,7;"Erik Nørreby";"Sofie Valbjørn";1;"V";"Å";1;1;1;-0,4;1,24183487375789
"521";"Fanoe.29-11-2017.pdf";3;4;1478;"Fanø Kommune";"29-11-2017";1485;0,00202020202020202;0,00269360269360269;2017;"11";2017-11-29;0,539388522639509;0,86245670662851;3345;69995;390;7,7;7,7;"Erik Nørreby";"Sofie Valbjørn";1;"V";"Å";1;1;1;0;1,27451473885678
"522";"Fanoe.30-03-2016.pdf";2;7;3280;"Fanø Kommune";"30-03-2016";3289;0,000608087564609304;0,00212830647613256;2016;"03";2016-03-30;0,162357749289484;0,681456177060152;3290;70175;374;7,9;7,7;"Erik Nørreby";"Sofie Valbjørn";1;"V";"Å";1;1;1;0,2;1,22222695469855
"523";"Fanoe.30-05-2018.pdf";25;1;2311;"Fanø Kommune";"30-05-2018";2337;0,0106974753958066;0,000427899015832264;2018;"05";2018-05-30;2,85619724760973;0,137007724576737;3401;69491;380;6,3;6,7;"Erik Nørreby";"Sofie Valbjørn";1;"V";"Å";1;1;1;-0,4;1,24183487375789
"524";"Fanoe.30-08-2017.pdf";5;14;2315;"Fanø Kommune";"30-08-2017";2334;0,00214224507283633;0,00599828620394173;2017;"08";2017-08-30;0,571973690459634;1,9205735787068;3345;69995;390;7,7;7,7;"Erik Nørreby";"Sofie Valbjørn";1;"V";"Å";1;1;1;0;1,27451473885678
"525";"Fanoe.30-11-2016.pdf";2;4;2223;"Fanø Kommune";"30-11-2016";2229;0,000897263346792284;0,00179452669358457;2016;"11";2016-11-30;0,239566907767211;0,574584212356813;3290;70175;374;7,9;7,7;"Erik Nørreby";"Sofie Valbjørn";1;"V";"Å";1;1;1;0,2;1,22222695469855
"526";"Fanoe.31-01-2018.pdf";4;2;1836;"Fanø Kommune";"31-01-2018";1842;0,00217155266015201;0,001085776330076;2018;"01";2018-01-31;0,579798737690678;0,347651522623056;3401;69491;380;6,3;6,7;"Erik Nørreby";"Sofie Valbjørn";1;"V";"Å";1;1;1;-0,4;1,24183487375789
"527";"Fanoe.31-05-2017.pdf";3;16;3265;"Fanø Kommune";"31-05-2017";3284;0,000913520097442144;0,0048721071863581;2017;"05";2017-05-31;0,243907416601605;1,55998563866423;3345;69995;390;7,7;7,7;"Erik Nørreby";"Sofie Valbjørn";1;"V";"Å";1;1;1;0;1,27451473885678
"528";"Fanoe.31-08-2016.pdf";0;0;1042;"Fanø Kommune";"31-08-2016";1042;0;0;2016;"08";2016-08-31;0;0;3290;70175;374;7,9;7,7;"Erik Nørreby";"Sofie Valbjørn";1;"V";"Å";1;1;1;0,2;1,22222695469855
"529";"Fanoe.31-10-2018.pdf";2;1;1960;"Fanø Kommune";"31-10-2018";1963;0,00101884870096791;0,000509424350483953;2018;"10";2018-10-31;0,27202987132609;0,163111081169554;3401;69491;380;6,3;6,7;"Erik Nørreby";"Sofie Valbjørn";1;"V";"Å";1;1;1;-0,4;1,24183487375789
"530";"Favrskov.03-03-2016.pdf";21;1;1448;"Favrskov Kommune";"03-03-2016";1470;0,0142857142857143;0,000680272108843537;2016;"03";2016-03-03;3,81424741009367;0,217814321316894;47655;57903;479;7,7;7,3;"Niels Borring";"Niels Borring";0;"S";"S";0;0;0;0,4;1,56536553823692
"531";"Favrskov.03-05-2018.pdf";20;4;3025;"Favrskov Kommune";"03-05-2018";3049;0,00655952771400459;0,00131190554280092;2018;"05";2018-05-03;1,75137631162058;0,420055168692469;48271;60181;474;7,3;7,1;"Niels Borring";"Niels Borring";0;"S";"S";0;0;0;0,2;1,54902560568747
"532";"Favrskov.04-02-2016.pdf";2;19;1952;"Favrskov Kommune";"04-02-2016";1973;0,0010136847440446;0,00963000506842372;2016;"02";2016-02-04;0,270651108673651;3,08340293683773;47655;57903;479;7,7;7,3;"Niels Borring";"Niels Borring";0;"S";"S";0;0;0;0,4;1,56536553823692
"533";"Favrskov.04-04-2019.pdf";5;12;4343;"Favrskov Kommune";"04-04-2019";4360;0,00114678899082569;0,00275229357798165;2019;"04";2019-04-04;0,306189585672657;0,881248767896791;48374;61567;473;7,2;7,2;"Niels Borring";"Niels Borring";0;"S";"S";0;0;0;0;1,54575761917758
"534";"Favrskov.04-05-2017.pdf";5;1;1125;"Favrskov Kommune";"04-05-2017";1131;0,00442086648983201;0,000884173297966401;2017;"05";2017-05-04;1,18035949914482;0,283100842029915;47915;56972;476;7,5;7,2;"Niels Borring";"Niels Borring";0;"S";"S";0;0;0;0,3;1,55556157870725
"535";"Favrskov.04-10-2018.pdf";2;4;2298;"Favrskov Kommune";"04-10-2018";2304;0,000868055555555556;0,00173611111111111;2018;"10";2018-10-04;0,231768505821664;0,555880299194156;48271;60181;474;7,3;7,1;"Niels Borring";"Niels Borring";0;"S";"S";0;0;0;0,2;1,54902560568747
"536";"Favrskov.05-01-2017.pdf";3;6;1168;"Favrskov Kommune";"05-01-2017";1177;0,00254885301614274;0,00509770603228547;2017;"01";2017-01-05;0,680536921087232;1,63221946815209;47915;56972;476;7,5;7,2;"Niels Borring";"Niels Borring";0;"S";"S";0;0;0;0,3;1,55556157870725
"537";"Favrskov.05-03-2018.pdf";38;2;3641;"Favrskov Kommune";"05-03-2018";3681;0,0103232817169247;0,00054333061668025;2018;"03";2018-03-05;2,75628853867133;0,17396742859866;48271;60181;474;7,3;7,1;"Niels Borring";"Niels Borring";0;"S";"S";0;0;0;0,2;1,54902560568747
"538";"Favrskov.05-04-2018.pdf";5;3;2520;"Favrskov Kommune";"05-04-2018";2528;0,00197784810126582;0,00118670886075949;2018;"04";2018-04-05;0,52808013984683;0,379968812107398;48271;60181;474;7,3;7,1;"Niels Borring";"Niels Borring";0;"S";"S";0;0;0;0,2;1,54902560568747
"539";"Favrskov.06-02-2017.pdf";11;7;3272;"Favrskov Kommune";"06-02-2017";3290;0,00334346504559271;0,00212765957446809;2017;"02";2017-02-06;0,892696202362349;0,681249047523051;47915;56972;476;7,5;7,2;"Niels Borring";"Niels Borring";0;"S";"S";0;0;0;0,3;1,55556157870725
"540";"Favrskov.06-04-2017.pdf";2;5;2576;"Favrskov Kommune";"06-04-2017";2583;0,000774293457220286;0,00193573364305072;2017;"04";2017-04-06;0,206734276969847;0,619796849275715;47915;56972;476;7,5;7,2;"Niels Borring";"Niels Borring";0;"S";"S";0;0;0;0,3;1,55556157870725
"541";"Favrskov.06-06-2017.pdf";19;5;3040;"Favrskov Kommune";"06-06-2017";3064;0,00620104438642298;0,00163185378590078;2017;"06";2017-06-06;1,65566222435528;0,522498453550643;47915;56972;476;7,5;7,2;"Niels Borring";"Niels Borring";0;"S";"S";0;0;0;0,3;1,55556157870725
"542";"Favrskov.06-09-2018.pdf";4;10;3584;"Favrskov Kommune";"06-09-2018";3598;0,00111172873818788;0,00277932184546971;2018;"09";2018-09-06;0,296828592225189;0,889902869193536;48271;60181;474;7,3;7,1;"Niels Borring";"Niels Borring";0;"S";"S";0;0;0;0,2;1,54902560568747
"543";"Favrskov.06-10-2016.pdf";2;21;990;"Favrskov Kommune";"06-10-2016";1013;0,00197433366238894;0,0207305034550839;2016;"10";2016-10-06;0,527141794089945;6,63763879472114;47655;57903;479;7,7;7,3;"Niels Borring";"Niels Borring";0;"S";"S";0;0;0;0,4;1,56536553823692
"544";"Favrskov.06-12-2018.pdf";7;0;727;"Favrskov Kommune";"06-12-2018";734;0,00953678474114441;0;2018;"12";2018-12-06;2,54629595496717;0;48271;60181;474;7,3;7,1;"Niels Borring";"Niels Borring";0;"S";"S";0;0;0;0,2;1,54902560568747
"545";"Favrskov.07-02-2019.pdf";19;15;4892;"Favrskov Kommune";"07-02-2019";4926;0,00385708485586683;0,00304506699147381;2019;"02";2019-02-07;1,02983131454011;0,974991024165147;48374;61567;473;7,2;7,2;"Niels Borring";"Niels Borring";0;"S";"S";0;0;0;0;1,54575761917758
"546";"Favrskov.07-03-2019.pdf";1;0;1411;"Favrskov Kommune";"07-03-2019";1412;0,000708215297450425;0;2019;"03";2019-03-07;0,18909158548623;0;48374;61567;473;7,2;7,2;"Niels Borring";"Niels Borring";0;"S";"S";0;0;0;0;1,54575761917758
"547";"Favrskov.07-06-2018.pdf";9;5;3775;"Favrskov Kommune";"07-06-2018";3789;0,00237529691211401;0,0013196093956189;2018;"06";2018-06-07;0,634197906666407;0,422521842617886;48271;60181;474;7,3;7,1;"Niels Borring";"Niels Borring";0;"S";"S";0;0;0;0,2;1,54902560568747
"548";"Favrskov.07-09-2017.pdf";14;16;2193;"Favrskov Kommune";"07-09-2017";2223;0,00629779577147998;0,00719748088169141;2017;"09";2017-09-07;1,68149458474665;2,30454018775229;47915;56972;476;7,5;7,2;"Niels Borring";"Niels Borring";0;"S";"S";0;0;0;0,3;1,55556157870725
"549";"Favrskov.07-11-2016.pdf";16;17;3229;"Favrskov Kommune";"07-11-2016";3262;0,00490496627835684;0,00521152667075414;2016;"11";2016-11-07;1,30961284466736;1,66866336287835;47655;57903;479;7,7;7,3;"Niels Borring";"Niels Borring";0;"S";"S";0;0;0;0,4;1,56536553823692
"550";"Favrskov.07-12-2017.pdf";0;8;3003;"Favrskov Kommune";"07-12-2017";3011;0;0,0026569246097642;2017;"12";2017-12-07;0;0,850712859078935;47915;56972;476;7,5;7,2;"Niels Borring";"Niels Borring";0;"S";"S";0;0;0;0,3;1,55556157870725
"551";"Favrskov.08-02-2018.pdf";2;1;1376;"Favrskov Kommune";"08-02-2018";1379;0,00145032632342277;0,000725163161711385;2018;"02";2018-02-08;0,387233239603419;0,232187855210902;48271;60181;474;7,3;7,1;"Niels Borring";"Niels Borring";0;"S";"S";0;0;0;0,2;1,54902560568747
"552";"Favrskov.08-09-2016.pdf";13;9;2776;"Favrskov Kommune";"08-09-2016";2798;0,00464617583988563;0,00321658327376698;2016;"09";2016-09-08;1,24051649148865;1,0299083170202;47655;57903;479;7,7;7,3;"Niels Borring";"Niels Borring";0;"S";"S";0;0;0;0,4;1,56536553823692
"553";"Favrskov.08-11-2018.pdf";12;34;3830;"Favrskov Kommune";"08-11-2018";3876;0,00309597523219814;0,0087719298245614;2018;"11";2018-11-08;0,826617085778815;2,80865835382311;48271;60181;474;7,3;7,1;"Niels Borring";"Niels Borring";0;"S";"S";0;0;0;0,2;1,54902560568747
"554";"Favrskov.08-12-2016.pdf";17;1;1230;"Favrskov Kommune";"08-12-2016";1248;0,0136217948717949;0,000801282051282051;2016;"12";2016-12-08;3,63698270673996;0,256560138089611;47655;57903;479;7,7;7,3;"Niels Borring";"Niels Borring";0;"S";"S";0;0;0;0,4;1,56536553823692
"555";"Favrskov.09-03-2017.pdf";1;0;1287;"Favrskov Kommune";"09-03-2017";1288;0,00077639751552795;0;2017;"03";2017-03-09;0,207296054896395;0;47915;56972;476;7,5;7,2;"Niels Borring";"Niels Borring";0;"S";"S";0;0;0;0,3;1,55556157870725
"556";"Favrskov.09-06-2016.pdf";6;17;3219;"Favrskov Kommune";"09-06-2016";3242;0,00185070943861814;0,00524367674275139;2016;"06";2016-06-09;0,49413445781596;1,67895739966354;47655;57903;479;7,7;7,3;"Niels Borring";"Niels Borring";0;"S";"S";0;0;0;0,4;1,56536553823692
"557";"Favrskov.09-11-2017.pdf";3;3;1837;"Favrskov Kommune";"09-11-2017";1843;0,00162778079218665;0,00162778079218665;2017;"11";2017-11-09;0,434613106955872;0,521194333699133;47915;56972;476;7,5;7,2;"Niels Borring";"Niels Borring";0;"S";"S";0;0;0;0,3;1,55556157870725
"558";"Favrskov.10-08-2017.pdf";14;0;1897;"Favrskov Kommune";"10-08-2017";1911;0,00732600732600733;0;2017;"08";2017-08-10;1,95602431286855;0;47915;56972;476;7,5;7,2;"Niels Borring";"Niels Borring";0;"S";"S";0;0;0;0,3;1,55556157870725
"559";"Favrskov.10-08-2018.pdf";1;3;1434;"Favrskov Kommune";"10-08-2018";1438;0,000695410292072323;0,00208623087621697;2018;"08";2018-08-10;0,185672683384254;0,667984114747916;48271;60181;474;7,3;7,1;"Niels Borring";"Niels Borring";0;"S";"S";0;0;0;0,2;1,54902560568747
"560";"Favrskov.11-04-2016.pdf";2;17;2362;"Favrskov Kommune";"11-04-2016";2381;0,000839983200335993;0,00713985720285594;2016;"04";2016-04-11;0,224273262248263;2,28608983188122;47655;57903;479;7,7;7,3;"Niels Borring";"Niels Borring";0;"S";"S";0;0;0;0,4;1,56536553823692
"561";"Favrskov.12-05-2016.pdf";8;10;2289;"Favrskov Kommune";"12-05-2016";2307;0,00346770697876029;0,00433463372345037;2016;"05";2016-05-12;0,925868465389015;1,38789359486707;47655;57903;479;7,7;7,3;"Niels Borring";"Niels Borring";0;"S";"S";0;0;0;0,4;1,56536553823692
"562";"Favrskov.13-01-2016.pdf";2;1;1497;"Favrskov Kommune";"13-01-2016";1500;0,00133333333333333;0,000666666666666667;2016;"01";2016-01-13;0,355996424942076;0,213458034890556;47655;57903;479;7,7;7,3;"Niels Borring";"Niels Borring";0;"S";"S";0;0;0;0,4;1,56536553823692
"563";"Favrskov.15-08-2016.pdf";0;4;1357;"Favrskov Kommune";"15-08-2016";1361;0;0,00293901542983101;2016;"08";2016-08-15;0;0,941034687247125;47655;57903;479;7,7;7,3;"Niels Borring";"Niels Borring";0;"S";"S";0;0;0;0,4;1,56536553823692
"564";"Favrskov.17-01-2019.pdf";1;15;3561;"Favrskov Kommune";"17-01-2019";3577;0,000279563880346659;0,00419345820519989;2019;"01";2019-01-17;0,0746428064597588;1,34269102181647;48374;61567;473;7,2;7,2;"Niels Borring";"Niels Borring";0;"S";"S";0;0;0;0;1,54575761917758
"565";"Favrskov.18-01-2018.pdf";0;0;680;"Favrskov Kommune";"18-01-2018";680;0;0;2018;"01";2018-01-18;0;0;48271;60181;474;7,3;7,1;"Niels Borring";"Niels Borring";0;"S";"S";0;0;0;0,2;1,54902560568747
"566";"Faxe.01-03-2016.pdf";5;3;2528;"Faxe Kommune";"01-03-2016";2536;0,00197160883280757;0,00118296529968454;2016;"03";2016-03-01;0,526414271897786;0,37877017232157;35614;59444;1008;6,7;6,6;"Erik Buhl";"Erik Buhl";0;"V";"V";0;0;0;0,100000000000001;3,29413040196829
"567";"Faxe.01-11-2016.pdf";15;12;4046;"Faxe Kommune";"01-11-2016";4073;0,00368278909894427;0,00294623127915541;2016;"11";2016-11-01;0,983294814779857;0,943345108772406;35614;59444;1008;6,7;6,6;"Erik Buhl";"Erik Buhl";0;"V";"V";0;0;0;0,100000000000001;3,29413040196829
"568";"Faxe.02-05-2017.pdf";1;3;1641;"Faxe Kommune";"02-05-2017";1645;0,00060790273556231;0,00182370820668693;2017;"05";2017-05-02;0,162308400429518;0,583927755019758;35916;60187;869;6,4;6,6;"Erik Buhl";"Erik Buhl";0;"V";"V";0;0;0;-0,199999999999999;2,8398802770937
"569";"Faxe.02-10-2017.pdf";3;0;1068;"Faxe Kommune";"02-10-2017";1071;0,00280112044817927;0;2017;"10";2017-10-02;0,747891649037975;0;35916;60187;869;6,4;6,6;"Erik Buhl";"Erik Buhl";0;"V";"V";0;0;0;-0,199999999999999;2,8398802770937
"570";"Faxe.03-05-2016.pdf";0;0;386;"Faxe Kommune";"03-05-2016";386;0;0;2016;"05";2016-05-03;0;0;35614;59444;1008;6,7;6,6;"Erik Buhl";"Erik Buhl";0;"V";"V";0;0;0;0,100000000000001;3,29413040196829
"571";"Faxe.06-03-2018.pdf";0;0;514;"Faxe Kommune";"06-03-2018";514;0;0;2018;"03";2018-03-06;0;0;36139;63934;845;6,5;6,6;"Erik Buhl";"Erik Buhl";0;"V";"V";0;0;0;-0,0999999999999996;2,76144860085636
"572";"Faxe.13-12-2016.pdf";5;0;762;"Faxe Kommune";"13-12-2016";767;0,00651890482398957;0;2016;"12";2016-12-13;1,74053010890846;0;35614;59444;1008;6,7;6,6;"Erik Buhl";"Erik Buhl";0;"V";"V";0;0;0;0,100000000000001;3,29413040196829
"573";"Faxe.14-06-2016.pdf";0;0;251;"Faxe Kommune";"14-06-2016";251;0;0;2016;"06";2016-06-14;0;0;35614;59444;1008;6,7;6,6;"Erik Buhl";"Erik Buhl";0;"V";"V";0;0;0;0,100000000000001;3,29413040196829
"574";"Faxe.15-11-2018.pdf";0;0;828;"Faxe Kommune";"15-11-2018";828;0;0;2018;"11";2018-11-15;0;0;36139;63934;845;6,5;6,6;"Erik Buhl";"Erik Buhl";0;"V";"V";0;0;0;-0,0999999999999996;2,76144860085636
"575";"Faxe.21-03-2018.pdf";0;33;1368;"Faxe Kommune";"21-03-2018";1401;0;0,0235546038543897;2018;"03";2018-03-21;0;7,54187917707532;36139;63934;845;6,5;6,6;"Erik Buhl";"Erik Buhl";0;"V";"V";0;0;0;-0,0999999999999996;2,76144860085636
"576";"Faxe.23-01-2019.pdf";7;3;1927;"Faxe Kommune";"23-01-2019";1937;0,00361383582860093;0,00154878678368611;2019;"01";2019-01-23;0,964884476482137;0,495901474965154;36513;63146;834;6,4;6,7;"Erik Buhl";"Erik Buhl";0;"V";"V";0;0;0;-0,3;2,72550074924758
"577";"Faxe.24-01-2017.pdf";6;0;1582;"Faxe Kommune";"24-01-2017";1588;0,00377833753148615;0;2017;"01";2017-01-24;1,00880599007515;0;35916;60187;869;6,4;6,6;"Erik Buhl";"Erik Buhl";0;"V";"V";0;0;0;-0,199999999999999;2,8398802770937
"578";"Faxe.24-01-2018.pdf";5;1;1691;"Faxe Kommune";"24-01-2018";1697;0,00294637595757219;0,000589275191514437;2018;"01";2018-01-24;0,786674480573239;0,188678286585642;36139;63934;845;6,5;6,6;"Erik Buhl";"Erik Buhl";0;"V";"V";0;0;0;-0,0999999999999996;2,76144860085636
"579";"Faxe.25-04-2018.pdf";10;0;2462;"Faxe Kommune";"25-04-2018";2472;0,0040453074433657;0;2018;"04";2018-04-25;1,08008624072232;0;36139;63934;845;6,5;6,6;"Erik Buhl";"Erik Buhl";0;"V";"V";0;0;0;-0,0999999999999996;2,76144860085636
"580";"Faxe.26-01-2016.pdf";2;14;2167;"Faxe Kommune";"26-01-2016";2183;0,000916170407695831;0,00641319285387082;2016;"01";2016-01-26;0,24461504233308;2,05342131594213;35614;59444;1008;6,7;6,6;"Erik Buhl";"Erik Buhl";0;"V";"V";0;0;0;0,100000000000001;3,29413040196829
"581";"Faxe.26-04-2016.pdf";11;3;3146;"Faxe Kommune";"26-04-2016";3160;0,00348101265822785;0,000949367088607595;2016;"04";2016-04-26;0,92942104613042;0,303975049685918;35614;59444;1008;6,7;6,6;"Erik Buhl";"Erik Buhl";0;"V";"V";0;0;0;0,100000000000001;3,29413040196829
"582";"Faxe.26-09-2017.pdf";6;4;2461;"Faxe Kommune";"26-09-2017";2471;0,00242816673411574;0,00161877782274383;2017;"09";2017-09-26;0,648314007381361;0,518311699450966;35916;60187;869;6,4;6,6;"Erik Buhl";"Erik Buhl";0;"V";"V";0;0;0;-0,199999999999999;2,8398802770937
"583";"Faxe.26-09-2018.pdf";1;3;1139;"Faxe Kommune";"26-09-2018";1143;0,000874890638670166;0,0026246719160105;2018;"09";2018-09-26;0,233593454686402;0,840385964136048;36139;63934;845;6,5;6,6;"Erik Buhl";"Erik Buhl";0;"V";"V";0;0;0;-0,0999999999999996;2,76144860085636
"584";"Faxe.27-02-2019.pdf";8;1;3168;"Faxe Kommune";"27-02-2019";3177;0,00251809883537929;0,000314762354422411;2019;"02";2019-02-27;0,672325637284374;0,100782830448799;36513;63146;834;6,4;6,7;"Erik Buhl";"Erik Buhl";0;"V";"V";0;0;0;-0,3;2,72550074924758
"585";"Faxe.27-03-2019.pdf";1;9;1578;"Faxe Kommune";"27-03-2019";1588;0,000629722921914358;0,00566750629722922;2019;"03";2019-03-27;0,168134331679192;1,8146621354046;36513;63146;834;6,4;6,7;"Erik Buhl";"Erik Buhl";0;"V";"V";0;0;0;-0,3;2,72550074924758
"586";"Faxe.27-06-2017.pdf";18;13;2742;"Faxe Kommune";"27-06-2017";2773;0,00649116480346195;0,00468806346916697;2017;"06";2017-06-27;1,73312359780672;1,50105722335588;35916;60187;869;6,4;6,6;"Erik Buhl";"Erik Buhl";0;"V";"V";0;0;0;-0,199999999999999;2,8398802770937
"587";"Faxe.27-06-2018.pdf";0;6;1781;"Faxe Kommune";"27-06-2018";1787;0;0,00335758254057079;2018;"06";2018-06-27;0;1,07505445663962;36139;63934;845;6,5;6,6;"Erik Buhl";"Erik Buhl";0;"V";"V";0;0;0;-0,0999999999999996;2,76144860085636
"588";"Faxe.27-09-2016.pdf";14;9;2855;"Faxe Kommune";"27-09-2016";2878;0,00486448922863099;0,00312717164697707;2016;"09";2016-09-27;1,2988055809214;1,00127987179378;35614;59444;1008;6,7;6,6;"Erik Buhl";"Erik Buhl";0;"V";"V";0;0;0;0,100000000000001;3,29413040196829
"589";"Faxe.28-02-2017.pdf";11;0;1048;"Faxe Kommune";"28-02-2017";1059;0,0103871576959396;0;2017;"02";2017-02-28;2,77334325379804;0;35916;60187;869;6,4;6,6;"Erik Buhl";"Erik Buhl";0;"V";"V";0;0;0;-0,199999999999999;2,8398802770937
"590";"Faxe.28-02-2018.pdf";34;5;3611;"Faxe Kommune";"28-02-2018";3650;0,00931506849315068;0,00136986301369863;2018;"02";2018-02-28;2,48709831123916;0,438612400460047;36139;63934;845;6,5;6,6;"Erik Buhl";"Erik Buhl";0;"V";"V";0;0;0;-0,0999999999999996;2,76144860085636
"591";"Faxe.28-03-2017.pdf";0;0;1277;"Faxe Kommune";"28-03-2017";1277;0;0;2017;"03";2017-03-28;0;0;35916;60187;869;6,4;6,6;"Erik Buhl";"Erik Buhl";0;"V";"V";0;0;0;-0,199999999999999;2,8398802770937
"592";"Faxe.28-06-2016.pdf";26;1;1747;"Faxe Kommune";"28-06-2016";1774;0,0146561443066516;0,00056369785794814;2016;"06";2016-06-28;3,91315123245236;0,180488755544439;35614;59444;1008;6,7;6,6;"Erik Buhl";"Erik Buhl";0;"V";"V";0;0;0;0,100000000000001;3,29413040196829
"593";"Faxe.28-11-2017.pdf";5;4;634;"Faxe Kommune";"28-11-2017";643;0,00777604976671851;0,00622083981337481;2017;"11";2017-11-28;2,07618443784259;1,99183236289788;35916;60187;869;6,4;6,6;"Erik Buhl";"Erik Buhl";0;"V";"V";0;0;0;-0,199999999999999;2,8398802770937
"594";"Faxe.28-11-2018.pdf";6;3;3297;"Faxe Kommune";"28-11-2018";3306;0,00181488203266788;0,000907441016333938;2018;"11";2018-11-28;0,484568636491029;0,290550864188597;36139;63934;845;6,5;6,6;"Erik Buhl";"Erik Buhl";0;"V";"V";0;0;0;-0,0999999999999996;2,76144860085636
"595";"Faxe.29-08-2017.pdf";32;9;6037;"Faxe Kommune";"29-08-2017";6078;0,00526488976637052;0,00148075024679171;2017;"08";2017-08-29;1,40571145090652;0,474117056765796;35916;60187;869;6,4;6,6;"Erik Buhl";"Erik Buhl";0;"V";"V";0;0;0;-0,199999999999999;2,8398802770937
"596";"Faxe.29-08-2018.pdf";21;7;3643;"Faxe Kommune";"29-08-2018";3671;0,00572051212203759;0,00190683737401253;2018;"08";2018-08-29;1,52736139821239;0,610544638068875;36139;63934;845;6,5;6,6;"Erik Buhl";"Erik Buhl";0;"V";"V";0;0;0;-0,0999999999999996;2,76144860085636
"597";"Faxe.29-11-2016.pdf";0;0;876;"Faxe Kommune";"29-11-2016";876;0;0;2016;"11";2016-11-29;0;0;35614;59444;1008;6,7;6,6;"Erik Buhl";"Erik Buhl";0;"V";"V";0;0;0;0,100000000000001;3,29413040196829
"598";"Faxe.30-03-2016.pdf";0;6;1431;"Faxe Kommune";"30-03-2016";1437;0;0,00417536534446764;2016;"03";2016-03-30;0;1,33689792207029;35614;59444;1008;6,7;6,6;"Erik Buhl";"Erik Buhl";0;"V";"V";0;0;0;0,100000000000001;3,29413040196829
"599";"Faxe.30-05-2017.pdf";13;14;3615;"Faxe Kommune";"30-05-2017";3642;0,00356946732564525;0,00384404173531027;2017;"05";2017-05-30;0,953038205157947;1,23081239228492;35916;60187;869;6,4;6,6;"Erik Buhl";"Erik Buhl";0;"V";"V";0;0;0;-0,199999999999999;2,8398802770937
"600";"Faxe.30-05-2018.pdf";15;14;4183;"Faxe Kommune";"30-05-2018";4212;0,00356125356125356;0,00332383665716999;2018;"05";2018-05-30;0,950845152088879;1,06424946170505;36139;63934;845;6,5;6,6;"Erik Buhl";"Erik Buhl";0;"V";"V";0;0;0;-0,0999999999999996;2,76144860085636
"601";"Faxe.30-07-2016.pdf";1;2;751;"Faxe Kommune";"30-07-2016";754;0,0013262599469496;0,0026525198938992;2016;"07";2016-07-30;0,354107849743445;0,849302526089746;35614;59444;1008;6,7;6,6;"Erik Buhl";"Erik Buhl";0;"V";"V";0;0;0;0,100000000000001;3,29413040196829
"602";"Faxe.30-08-2016.pdf";1;2;751;"Faxe Kommune";"30-08-2016";754;0,0013262599469496;0,0026525198938992;2016;"08";2016-08-30;0,354107849743445;0,849302526089746;35614;59444;1008;6,7;6,6;"Erik Buhl";"Erik Buhl";0;"V";"V";0;0;0;0,100000000000001;3,29413040196829
"603";"Faxe.31-05-2016.pdf";17;11;5124;"Faxe Kommune";"31-05-2016";5152;0,00329968944099379;0,00213509316770186;2016;"05";2016-05-31;0,88100823330968;0,683629187828839;35614;59444;1008;6,7;6,6;"Erik Buhl";"Erik Buhl";0;"V";"V";0;0;0;0,100000000000001;3,29413040196829
"604";"Faxe.31-10-2017.pdf";4;9;2697;"Faxe Kommune";"31-10-2017";2710;0,0014760147601476;0,0033210332103321;2017;"10";2017-10-31;0,394091983330712;1,06335183432565;35916;60187;869;6,4;6,6;"Erik Buhl";"Erik Buhl";0;"V";"V";0;0;0;-0,199999999999999;2,8398802770937
"605";"Faxe.31-10-2018.pdf";1;0;1737;"Faxe Kommune";"31-10-2018";1738;0,000575373993095512;0;2018;"10";2018-10-31;0,153623313409987;0;36139;63934;845;6,5;6,6;"Erik Buhl";"Erik Buhl";0;"V";"V";0;0;0;-0,0999999999999996;2,76144860085636
"606";"Fredensborg.01-02-2016.pdf";8;9;4557;"Fredensborg Kommune";"01-02-2016";4574;0,00174901617839965;0,00196764320069961;2016;"02";2016-02-01;0,466982630007096;0,630013876480653;40112;66208;644;7,7;7,6;"Thomas Pedersen";"Thomas Pedersen";0;"S";"S";0;0;0;0,100000000000001;2,10458331236863
"607";"Fredensborg.01-03-2016.pdf";72;7;5036;"Fredensborg Kommune";"01-03-2016";5115;0,0140762463343109;0,00136852394916911;2016;"03";2016-03-01;3,758320028714;0,438183649335452;40112;66208;644;7,7;7,6;"Thomas Pedersen";"Thomas Pedersen";0;"S";"S";0;0;0;0,100000000000001;2,10458331236863
"608";"Fredensborg.01-11-2016.pdf";11;4;1641;"Fredensborg Kommune";"01-11-2016";1656;0,00664251207729469;0,00241545893719807;2016;"11";2016-11-01;1,7735329141136;0,773398677139696;40112;66208;644;7,7;7,6;"Thomas Pedersen";"Thomas Pedersen";0;"S";"S";0;0;0;0,100000000000001;2,10458331236863
"609";"Fredensborg.02-05-2016.pdf";7;4;991;"Fredensborg Kommune";"02-05-2016";1002;0,00698602794411178;0,00399201596806387;2016;"05";2016-05-02;1,86525072948693;1,27819182569195;40112;66208;644;7,7;7,6;"Thomas Pedersen";"Thomas Pedersen";0;"S";"S";0;0;0;0,100000000000001;2,10458331236863
"610";"Fredensborg.02-10-2017.pdf";2;5;2026;"Fredensborg Kommune";"02-10-2017";2033;0,000983767830791933;0,00245941957697983;2017;"10";2017-10-02;0,262663373051212;0,787474304810217;40504;63890;645;7,7;7,5;"Thomas Pedersen";"Thomas Pedersen";0;"S";"S";0;0;0;0,2;2,10785129887852
"611";"Fredensborg.03-04-2017.pdf";3;10;2396;"Fredensborg Kommune";"03-04-2017";2409;0,0012453300124533;0,004151100041511;2017;"04";2017-04-03;0,332499774229835;1,32912848624257;40504;63890;645;7,7;7,5;"Thomas Pedersen";"Thomas Pedersen";0;"S";"S";0;0;0;0,2;2,10785129887852
"612";"Fredensborg.03-10-2016.pdf";8;3;5193;"Fredensborg Kommune";"03-10-2016";5204;0,00153727901614143;0,000576479631053036;2016;"10";2016-10-03;0,410449375413616;0,184581313798521;40112;66208;644;7,7;7,6;"Thomas Pedersen";"Thomas Pedersen";0;"S";"S";0;0;0;0,100000000000001;2,10458331236863
"613";"Fredensborg.03-12-2018.pdf";5;7;3164;"Fredensborg Kommune";"03-12-2018";3176;0,00157430730478589;0,00220403022670025;2018;"12";2018-12-03;0,42033582919798;0,705701941546234;40779;66682;630;7,7;7,6;"Thomas Pedersen";"Thomas Pedersen";0;"S";"S";0;0;0;0,100000000000001;2,05883150123018
"614";"Fredensborg.04-01-2016.pdf";6;3;2365;"Fredensborg Kommune";"04-01-2016";2374;0,0025273799494524;0,0012636899747262;2016;"01";2016-01-04;0,674803669856505;0,404617168073927;40112;66208;644;7,7;7,6;"Thomas Pedersen";"Thomas Pedersen";0;"S";"S";0;0;0;0,100000000000001;2,10458331236863
"615";"Fredensborg.04-02-2019.pdf";3;3;2146;"Fredensborg Kommune";"04-02-2019";2152;0,00139405204460967;0,00139405204460967;2019;"02";2019-02-04;0,372208158048174;0,446357414966312;40819;70766;619;7,5;7,4;"Thomas Pedersen";"Thomas Pedersen";0;"S";"S";0;0;0;0,0999999999999996;2,0228836496214
"616";"Fredensborg.04-04-2016.pdf";5;3;2806;"Fredensborg Kommune";"04-04-2016";2814;0,00177683013503909;0,00106609808102345;2016;"04";2016-04-04;0,474408881852447;0,341350802063789;40112;66208;644;7,7;7,6;"Thomas Pedersen";"Thomas Pedersen";0;"S";"S";0;0;0;0,100000000000001;2,10458331236863
"617";"Fredensborg.04-04-2019.pdf";3;17;2541;"Fredensborg Kommune";"04-04-2019";2561;0,00117141741507224;0,00663803201874268;2019;"04";2019-04-04;0,312765308910454;2,12541190539211;40819;70766;619;7,5;7,4;"Thomas Pedersen";"Thomas Pedersen";0;"S";"S";0;0;0;0,0999999999999996;2,0228836496214
"618";"Fredensborg.05-02-2018.pdf";71;2;2299;"Fredensborg Kommune";"05-02-2018";2372;0,0299325463743676;0,000843170320404722;2018;"02";2018-02-05;7,99190962401583;0,269972219507449;40779;66682;630;7,7;7,6;"Thomas Pedersen";"Thomas Pedersen";0;"S";"S";0;0;0;0,100000000000001;2,05883150123018
"619";"Fredensborg.05-09-2017.pdf";1;24;2711;"Fredensborg Kommune";"05-09-2017";2736;0,000365497076023392;0,0087719298245614;2017;"09";2017-09-05;0,0975867392933323;2,80865835382311;40504;63890;645;7,7;7,5;"Thomas Pedersen";"Thomas Pedersen";0;"S";"S";0;0;0;0,2;2,10785129887852
"620";"Fredensborg.06-03-2017.pdf";22;5;3964;"Fredensborg Kommune";"06-03-2017";3991;0,00551240290653971;0,00125281884239539;2017;"03";2017-03-06;1,47179679567634;0,401136372257372;40504;63890;645;7,7;7,5;"Thomas Pedersen";"Thomas Pedersen";0;"S";"S";0;0;0;0,2;2,10785129887852
"621";"Fredensborg.06-11-2017.pdf";0;30;1357;"Fredensborg Kommune";"06-11-2017";1387;0;0,0216294160057678;2017;"11";2017-11-06;0;6,92545895463232;40504;63890;645;7,7;7,5;"Thomas Pedersen";"Thomas Pedersen";0;"S";"S";0;0;0;0,2;2,10785129887852
"622";"Fredensborg.07-03-2019.pdf";41;15;5053;"Fredensborg Kommune";"07-03-2019";5109;0,00802505382658054;0,00293599530240752;2019;"03";2019-03-07;2,1426678541728;0,940067681549719;40819;70766;619;7,5;7,4;"Thomas Pedersen";"Thomas Pedersen";0;"S";"S";0;0;0;0,0999999999999996;2,0228836496214
"623";"Fredensborg.07-06-2017.pdf";26;7;2525;"Fredensborg Kommune";"07-06-2017";2558;0,0101641907740422;0,00273651290070367;2017;"06";2017-06-07;2,7138116834912;0,876195999355293;40504;63890;645;7,7;7,5;"Thomas Pedersen";"Thomas Pedersen";0;"S";"S";0;0;0;0,2;2,10785129887852
"624";"Fredensborg.08-05-2017.pdf";6;1;3679;"Fredensborg Kommune";"08-05-2017";3686;0,00162778079218665;0,000271296798697775;2017;"05";2017-05-08;0,434613106955872;0,0868657222831889;40504;63890;645;7,7;7,5;"Thomas Pedersen";"Thomas Pedersen";0;"S";"S";0;0;0;0,2;2,10785129887852
"625";"Fredensborg.08-09-2016.pdf";0;1;672;"Fredensborg Kommune";"08-09-2016";673;0;0,00148588410104012;2016;"09";2016-09-08;0;0,475760850424716;40112;66208;644;7,7;7,6;"Thomas Pedersen";"Thomas Pedersen";0;"S";"S";0;0;0;0,100000000000001;2,10458331236863
"626";"Fredensborg.09-01-2017.pdf";31;5;4174;"Fredensborg Kommune";"09-01-2017";4210;0,00736342042755344;0,00118764845605701;2017;"01";2017-01-09;1,96601351066586;0,380269658356098;40504;63890;645;7,7;7,5;"Thomas Pedersen";"Thomas Pedersen";0;"S";"S";0;0;0;0,2;2,10785129887852
"627";"Fredensborg.09-10-2018.pdf";17;5;3631;"Fredensborg Kommune";"09-10-2018";3653;0,0046537092800438;0,00136873802354229;2018;"10";2018-10-09;1,24252789981152;0,438252193177983;40779;66682;630;7,7;7,6;"Thomas Pedersen";"Thomas Pedersen";0;"S";"S";0;0;0;0,100000000000001;2,05883150123018
"628";"Fredensborg.10-09-2018.pdf";28;25;3836;"Fredensborg Kommune";"10-09-2018";3889;0,00719979429159167;0,0064283877603497;2018;"09";2018-09-10;1,92232577109375;2,05828652825813;40779;66682;630;7,7;7,6;"Thomas Pedersen";"Thomas Pedersen";0;"S";"S";0;0;0;0,100000000000001;2,05883150123018
"629";"Fredensborg.12-03-2018.pdf";5;0;1298;"Fredensborg Kommune";"12-03-2018";1303;0,00383729854182655;0;2018;"03";2018-03-12;1,02454842174427;0;40779;66682;630;7,7;7,6;"Thomas Pedersen";"Thomas Pedersen";0;"S";"S";0;0;0;0,100000000000001;2,05883150123018
"630";"Fredensborg.12-11-2018.pdf";6;28;5361;"Fredensborg Kommune";"12-11-2018";5395;0,00111214087117702;0,00518999073215941;2018;"11";2018-11-12;0,296938630628238;1,66176783418042;40779;66682;630;7,7;7,6;"Thomas Pedersen";"Thomas Pedersen";0;"S";"S";0;0;0;0,100000000000001;2,05883150123018
"631";"Fredensborg.12-12-2017.pdf";0;0;105;"Fredensborg Kommune";"12-12-2017";105;0;0;2017;"12";2017-12-12;0;0;40504;63890;645;7,7;7,5;"Thomas Pedersen";"Thomas Pedersen";0;"S";"S";0;0;0;0,2;2,10785129887852
"632";"Fredensborg.14-01-2019.pdf";2;10;2466;"Fredensborg Kommune";"14-01-2019";2478;0,000807102502017756;0,00403551251008878;2019;"01";2019-01-14;0,215494203960095;1,29211885526971;40819;70766;619;7,5;7,4;"Thomas Pedersen";"Thomas Pedersen";0;"S";"S";0;0;0;0,0999999999999996;2,0228836496214
"633";"Fredensborg.14-05-2018.pdf";1;6;3331;"Fredensborg Kommune";"14-05-2018";3338;0,000299580587177951;0,00179748352306771;2018;"05";2018-05-14;0,0799872135130489;0,575530950873279;40779;66682;630;7,7;7,6;"Thomas Pedersen";"Thomas Pedersen";0;"S";"S";0;0;0;0,100000000000001;2,05883150123018
"634";"Fredensborg.14-08-2017.pdf";1;27;3960;"Fredensborg Kommune";"14-08-2017";3988;0,000250752256770311;0,00677031093279839;2017;"08";2017-08-14;0,0669501802172912;2,16776590096979;40504;63890;645;7,7;7,5;"Thomas Pedersen";"Thomas Pedersen";0;"S";"S";0;0;0;0,2;2,10785129887852
"635";"Fredensborg.15-01-2018.pdf";1;1;1136;"Fredensborg Kommune";"15-01-2018";1138;0,000878734622144112;0,000878734622144112;2018;"01";2018-01-15;0,234619787967098;0,281359448449766;40779;66682;630;7,7;7,6;"Thomas Pedersen";"Thomas Pedersen";0;"S";"S";0;0;0;0,100000000000001;2,05883150123018
"636";"Fredensborg.15-08-2016.pdf";21;5;4485;"Fredensborg Kommune";"15-08-2016";4511;0,00465528707603636;0,00110840168477056;2016;"08";2016-08-15;1,242949167111;0,354895868250758;40112;66208;644;7,7;7,6;"Thomas Pedersen";"Thomas Pedersen";0;"S";"S";0;0;0;0,100000000000001;2,10458331236863
"637";"Fredensborg.17-04-2018.pdf";3;5;2813;"Fredensborg Kommune";"17-04-2018";2821;0,0010634526763559;0,00177242112725984;2018;"04";2018-04-17;0,283939013158338;0,567506296235084;40779;66682;630;7,7;7,6;"Thomas Pedersen";"Thomas Pedersen";0;"S";"S";0;0;0;0,100000000000001;2,05883150123018
"638";"Fredensborg.20-08-2018.pdf";5;20;4156;"Fredensborg Kommune";"20-08-2018";4181;0,00119588615163836;0,00478354460655346;2018;"08";2018-08-20;0,319298395965746;1,53162904728933;40779;66682;630;7,7;7,6;"Thomas Pedersen";"Thomas Pedersen";0;"S";"S";0;0;0;0,100000000000001;2,05883150123018
"639";"Fredensborg.29-03-2016.pdf";0;10;2796;"Fredensborg Kommune";"29-03-2016";2806;0;0,00356379187455453;2016;"03";2016-03-29;0;1,14108001545201;40112;66208;644;7,7;7,6;"Thomas Pedersen";"Thomas Pedersen";0;"S";"S";0;0;0;0,100000000000001;2,10458331236863
"640";"Fredensborg.29-11-2017.pdf";15;1;3522;"Fredensborg Kommune";"29-11-2017";3538;0,00423968343697004;0,000282645562464669;2017;"11";2017-11-29;1,1319841098356;0,0904994495013663;40504;63890;645;7,7;7,5;"Thomas Pedersen";"Thomas Pedersen";0;"S";"S";0;0;0;0,2;2,10785129887852
"641";"Fredensborg.30-11-2016.pdf";10;11;6672;"Fredensborg Kommune";"30-11-2016";6693;0,00149409831166891;0,0016435081428358;2016;"11";2016-11-30;0,398920243099592;0,526230027744535;40112;66208;644;7,7;7,6;"Thomas Pedersen";"Thomas Pedersen";0;"S";"S";0;0;0;0,100000000000001;2,10458331236863
"642";"Fredensborg.31-01-2017.pdf";77;5;4294;"Fredensborg Kommune";"31-01-2017";4376;0,0175959780621572;0,00114259597806216;2017;"01";2017-01-31;4,69807896261538;0,365844438226502;40504;63890;645;7,7;7,5;"Thomas Pedersen";"Thomas Pedersen";0;"S";"S";0;0;0;0,2;2,10785129887852
"643";"Fredensborg.31-05-2016.pdf";34;3;4367;"Fredensborg Kommune";"31-05-2016";4404;0,00772025431425976;0,000681198910081744;2016;"05";2016-05-31;2,06128720164009;0,218111071073457;40112;66208;644;7,7;7,6;"Thomas Pedersen";"Thomas Pedersen";0;"S";"S";0;0;0;0,100000000000001;2,10458331236863
"644";"Fredensborg.31-05-2018.pdf";2;30;4224;"Fredensborg Kommune";"31-05-2018";4256;0,000469924812030075;0,00704887218045113;2018;"05";2018-05-31;0,125468664805713;2,25695760575071;40779;66682;630;7,7;7,6;"Thomas Pedersen";"Thomas Pedersen";0;"S";"S";0;0;0;0,100000000000001;2,05883150123018
"645";"Fredericia.05-04-2016.pdf";4;4;1822;"Fredericia Kommune";"05-04-2016";1830;0,00218579234972678;0,00218579234972678;2016;"04";2016-04-05;0,583600696626354;0,699862409477233;50689;59575;1045;6,7;7;"Jacob Bjerregaard ";"Jacob Bjerregaard";0;"S";"S";0;0;0;-0,3;3,41504590283419
"646";"Fredericia.06-02-2019.pdf";1;1;964;"Fredericia Kommune";"06-02-2019";966;0,0010351966873706;0,0010351966873706;2019;"02";2019-02-06;0,27639473986186;0,331456575917013;51427;67463;987;6,7;6,8;"Jacob Bjerregaard ";"Jacob Bjerregaard";0;"S";"S";0;0;0;-0,0999999999999996;3,22550268526062
"647";"Fredericia.07-02-2017.pdf";1;2;828;"Fredericia Kommune";"07-02-2017";831;0,00120336943441637;0,00240673886883273;2017;"02";2017-02-07;0,321296412402596;0,770606624153632;50868;61538;1025;6,6;6,8;"Jacob Bjerregaard ";"Jacob Bjerregaard";0;"S";"S";0;0;0;-0,2;3,34968617263641
"648";"Fredericia.07-02-2018.pdf";0;0;582;"Fredericia Kommune";"07-02-2018";582;0;0;2018;"02";2018-02-07;0;0;51326;64293;999;6,5;6,5;"Jacob Bjerregaard ";"Jacob Bjerregaard";0;"S";"S";0;0;0;0;3,26471852337929
"649";"Fredericia.07-11-2017.pdf";1;4;1038;"Fredericia Kommune";"07-11-2017";1043;0,000958772770853308;0,00383509108341323;2017;"11";2017-11-07;0,25598975906669;1,22794650943752;50868;61538;1025;6,6;6,8;"Jacob Bjerregaard ";"Jacob Bjerregaard";0;"S";"S";0;0;0;-0,2;3,34968617263641
"650";"Fredericia.07-11-2018.pdf";7;6;2369;"Fredericia Kommune";"07-11-2018";2382;0,00293870696893367;0,00251889168765743;2018;"11";2018-11-07;0,784626881169563;0,806516504624267;51326;64293;999;6,5;6,5;"Jacob Bjerregaard ";"Jacob Bjerregaard";0;"S";"S";0;0;0;0;3,26471852337929
"651";"Fredericia.08-02-2016.pdf";0;0;203;"Fredericia Kommune";"08-02-2016";203;0;0;2016;"02";2016-02-08;0;0;50689;59575;1045;6,7;7;"Jacob Bjerregaard ";"Jacob Bjerregaard";0;"S";"S";0;0;0;-0,3;3,41504590283419
"652";"Fredericia.08-11-2016.pdf";6;6;2882;"Fredericia Kommune";"08-11-2016";2894;0,00207325501036628;0,00207325501036628;2016;"11";2016-11-08;0,553553528762731;0,663829410509677;50689;59575;1045;6,7;7;"Jacob Bjerregaard ";"Jacob Bjerregaard";0;"S";"S";0;0;0;-0,3;3,41504590283419
"653";"Fredericia.09-05-2016.pdf";3;0;268;"Fredericia Kommune";"09-05-2016";271;0,011070110701107;0;2016;"05";2016-05-09;2,95568987498034;0;50689;59575;1045;6,7;7;"Jacob Bjerregaard ";"Jacob Bjerregaard";0;"S";"S";0;0;0;-0,3;3,41504590283419
"654";"Fredericia.09-08-2016.pdf";1;3;1607;"Fredericia Kommune";"09-08-2016";1611;0,000620732464307883;0,00186219739292365;2016;"08";2016-08-09;0,165733903604319;0,596251494107699;50689;59575;1045;6,7;7;"Jacob Bjerregaard ";"Jacob Bjerregaard";0;"S";"S";0;0;0;-0,3;3,41504590283419
"655";"Fredericia.10-12-2018.pdf";1;0;325;"Fredericia Kommune";"10-12-2018";326;0,00306748466257669;0;2018;"12";2018-12-10;0,819010180081464;0;51326;64293;999;6,5;6,5;"Jacob Bjerregaard ";"Jacob Bjerregaard";0;"S";"S";0;0;0;0;3,26471852337929
"656";"Fredericia.13-12-2016.pdf";3;7;1758;"Fredericia Kommune";"13-12-2016";1768;0,00169683257918552;0,00395927601809955;2016;"12";2016-12-13;0,453049748936466;1,26770891761925;50689;59575;1045;6,7;7;"Jacob Bjerregaard ";"Jacob Bjerregaard";0;"S";"S";0;0;0;-0,3;3,41504590283419
"657";"Fredericia.15-01-2018.pdf";0;0;139;"Fredericia Kommune";"15-01-2018";139;0;0;2018;"01";2018-01-15;0;0;51326;64293;999;6,5;6,5;"Jacob Bjerregaard ";"Jacob Bjerregaard";0;"S";"S";0;0;0;0;3,26471852337929
"658";"Fredericia.15-05-2017.pdf";0;0;337;"Fredericia Kommune";"15-05-2017";337;0;0;2017;"05";2017-05-15;0;0;50868;61538;1025;6,6;6,8;"Jacob Bjerregaard ";"Jacob Bjerregaard";0;"S";"S";0;0;0;-0,2;3,34968617263641
"659";"Fredericia.15-08-2017.pdf";3;8;948;"Fredericia Kommune";"15-08-2017";959;0,00312825860271116;0,00834202294056309;2017;"08";2017-08-15;0,8352366591446;2,6710077358568;50868;61538;1025;6,6;6,8;"Jacob Bjerregaard ";"Jacob Bjerregaard";0;"S";"S";0;0;0;-0,2;3,34968617263641
"660";"Fredericia.15-08-2018.pdf";7;7;1908;"Fredericia Kommune";"15-08-2018";1922;0,0036420395421436;0,0036420395421436;2018;"08";2018-08-15;0,972414792375598;1,16613390548951;51326;64293;999;6,5;6,5;"Jacob Bjerregaard ";"Jacob Bjerregaard";0;"S";"S";0;0;0;0;3,26471852337929
"661";"Fredericia.18-05-2016.pdf";0;1;321;"Fredericia Kommune";"18-05-2016";322;0;0,0031055900621118;2016;"05";2016-05-18;0;0,994369727751038;50689;59575;1045;6,7;7;"Jacob Bjerregaard ";"Jacob Bjerregaard";0;"S";"S";0;0;0;-0,3;3,41504590283419
"662";"Fredericia.19-09-2017.pdf";3;7;1518;"Fredericia Kommune";"19-09-2017";1528;0,00196335078534031;0,00458115183246073;2017;"09";2017-09-19;0,524209395366277;1,46682550153851;50868;61538;1025;6,6;6,8;"Jacob Bjerregaard ";"Jacob Bjerregaard";0;"S";"S";0;0;0;-0,2;3,34968617263641
"663";"Fredericia.19-09-2018.pdf";2;5;1016;"Fredericia Kommune";"19-09-2018";1023;0,00195503421309873;0,00488758553274682;2018;"09";2018-09-19;0,521988892876945;1,56494160476947;51326;64293;999;6,5;6,5;"Jacob Bjerregaard ";"Jacob Bjerregaard";0;"S";"S";0;0;0;0;3,26471852337929
"664";"Fredericia.19-12-2017.pdf";1;0;530;"Fredericia Kommune";"19-12-2017";531;0,00188323917137476;0;2017;"12";2017-12-19;0,502819809240221;0;50868;61538;1025;6,6;6,8;"Jacob Bjerregaard ";"Jacob Bjerregaard";0;"S";"S";0;0;0;-0,2;3,34968617263641
"665";"Fredericia.19-12-2018.pdf";10;15;2197;"Fredericia Kommune";"19-12-2018";2222;0,0045004500450045;0,00675067506750675;2018;"12";2018-12-19;1,20160809498901;2,16147875114199;51326;64293;999;6,5;6,5;"Jacob Bjerregaard ";"Jacob Bjerregaard";0;"S";"S";0;0;0;0;3,26471852337929
"666";"Fredericia.20-04-2016.pdf";0;0;259;"Fredericia Kommune";"20-04-2016";259;0;0;2016;"04";2016-04-20;0;0;50689;59575;1045;6,7;7;"Jacob Bjerregaard ";"Jacob Bjerregaard";0;"S";"S";0;0;0;-0,3;3,41504590283419
"667";"Fredericia.21-03-2018.pdf";16;6;1734;"Fredericia Kommune";"21-03-2018";1756;0,00911161731207289;0,00341685649202733;2018;"03";2018-03-21;2,43277739140371;1,09403320843679;51326;64293;999;6,5;6,5;"Jacob Bjerregaard ";"Jacob Bjerregaard";0;"S";"S";0;0;0;0;3,26471852337929
"668";"Fredericia.21-12-2016.pdf";0;1;233;"Fredericia Kommune";"21-12-2016";234;0;0,00427350427350427;2016;"12";2016-12-21;0;1,36832073647792;50689;59575;1045;6,7;7;"Jacob Bjerregaard ";"Jacob Bjerregaard";0;"S";"S";0;0;0;-0,3;3,41504590283419
"669";"Fredericia.22-10-2018.pdf";1;0;745;"Fredericia Kommune";"22-10-2018";746;0,00134048257372654;0;2018;"10";2018-10-22;0,357905252957851;0;51326;64293;999;6,5;6,5;"Jacob Bjerregaard ";"Jacob Bjerregaard";0;"S";"S";0;0;0;0;3,26471852337929
"670";"Fredericia.23-02-2016.pdf";4;0;2270;"Fredericia Kommune";"23-02-2016";2274;0,00175901495162709;0;2016;"02";2016-02-23;0,469652275649177;0;50689;59575;1045;6,7;7;"Jacob Bjerregaard ";"Jacob Bjerregaard";0;"S";"S";0;0;0;-0,3;3,41504590283419
"671";"Fredericia.24-05-2016.pdf";3;5;2097;"Fredericia Kommune";"24-05-2016";2105;0,00142517814726841;0,00237529691211401;2016;"05";2016-05-24;0,380518743999844;0,760539316712195;50689;59575;1045;6,7;7;"Jacob Bjerregaard ";"Jacob Bjerregaard";0;"S";"S";0;0;0;-0,3;3,41504590283419
"672";"Fredericia.24-10-2016.pdf";0;0;180;"Fredericia Kommune";"24-10-2016";180;0;0;2016;"10";2016-10-24;0;0;50689;59575;1045;6,7;7;"Jacob Bjerregaard ";"Jacob Bjerregaard";0;"S";"S";0;0;0;-0,3;3,41504590283419
"673";"Fredericia.26-09-2016.pdf";0;7;956;"Fredericia Kommune";"26-09-2016";963;0;0,00726895119418484;2016;"09";2016-09-26;0;2,32742405643909;50689;59575;1045;6,7;7;"Jacob Bjerregaard ";"Jacob Bjerregaard";0;"S";"S";0;0;0;-0,3;3,41504590283419
"674";"Fredericia.28-03-2017.pdf";11;0;1893;"Fredericia Kommune";"28-03-2017";1904;0,00577731092436975;0;2017;"03";2017-03-28;1,54252652614082;0;50868;61538;1025;6,6;6,8;"Jacob Bjerregaard ";"Jacob Bjerregaard";0;"S";"S";0;0;0;-0,2;3,34968617263641
"675";"Fredericia.30-05-2017.pdf";5;6;2636;"Fredericia Kommune";"30-05-2017";2647;0,00188893086513034;0,0022667170381564;2017;"05";2017-05-30;0,504339476211857;0,725773446926711;50868;61538;1025;6,6;6,8;"Jacob Bjerregaard ";"Jacob Bjerregaard";0;"S";"S";0;0;0;-0,2;3,34968617263641
"676";"Fredericia.30-05-2018.pdf";6;8;2614;"Fredericia Kommune";"30-05-2018";2628;0,00228310502283105;0,0030441400304414;2018;"05";2018-05-30;0,609582919421363;0,974694223244548;51326;64293;999;6,5;6,5;"Jacob Bjerregaard ";"Jacob Bjerregaard";0;"S";"S";0;0;0;0;3,26471852337929
"677";"Frederiksberg.01-02-2016.pdf";6;13;2416;"Frederiksberg Kommune";"01-02-2016";2435;0,00246406570841889;0,0053388090349076;2016;"02";2016-02-01;0,657898937264617;1,70941752787098;104481;62242;729;7,6;7,6;"Jørgen Glenthøj";"Jørgen Glenthøj";0;"C";"C";0;0;0;0;2,38236216570921
"678";"Frederiksberg.02-05-2016.pdf";4;4;2396;"Frederiksberg Kommune";"02-05-2016";2404;0,00166389351081531;0,00166389351081531;2016;"05";2016-05-02;0,444255106000927;0,532757158628676;104481;62242;729;7,6;7,6;"Jørgen Glenthøj";"Jørgen Glenthøj";0;"C";"C";0;0;0;0;2,38236216570921
"679";"Frederiksberg.03-04-2017.pdf";1;0;1714;"Frederiksberg Kommune";"03-04-2017";1715;0,000583090379008746;0;2017;"04";2017-04-03;0,155683567758925;0;105037;63991;719;7,6;7,7;"Jørgen Glenthøj";"Jørgen Glenthøj";0;"C";"C";0;0;0;-0,100000000000001;2,34968230061032
"680";"Frederiksberg.04-02-2019.pdf";3;17;8064;"Frederiksberg Kommune";"04-02-2019";8084;0,00037110341415141;0,00210291934685799;2019;"02";2019-02-04;0,0990836165412755;0,673327546970458;103960;64146;716;7,5;7,5;"Jørgen Glenthøj";"Jørgen Glenthøj";0;"C";"C";0;0;0;0;2,33987834108065
"681";"Frederiksberg.04-03-2019.pdf";0;0;637;"Frederiksberg Kommune";"04-03-2019";637;0;0;2019;"03";2019-03-04;0;0;103960;64146;716;7,5;7,5;"Jørgen Glenthøj";"Jørgen Glenthøj";0;"C";"C";0;0;0;0;2,33987834108065
"682";"Frederiksberg.04-04-2016.pdf";11;2;4054;"Frederiksberg Kommune";"04-04-2016";4067;0,00270469633636587;0,00049176297024834;2016;"04";2016-04-04;0,722146669725136;0,157456135891731;104481;62242;729;7,6;7,6;"Jørgen Glenthøj";"Jørgen Glenthøj";0;"C";"C";0;0;0;0;2,38236216570921
"683";"Frederiksberg.04-06-2018.pdf";7;2;5073;"Frederiksberg Kommune";"04-06-2018";5082;0,00137741046831956;0,000393545848091303;2018;"06";2018-06-04;0,367764901799666;0,12600828505936;104410;67244;707;7,6;7,7;"Jørgen Glenthøj";"Jørgen Glenthøj";0;"C";"C";0;0;0;-0,100000000000001;2,31046646249165
"684";"Frederiksberg.04-09-2017.pdf";1;0;1569;"Frederiksberg Kommune";"04-09-2017";1570;0,000636942675159236;0;2017;"09";2017-09-04;0,170061986437298;0;105037;63991;719;7,6;7,7;"Jørgen Glenthøj";"Jørgen Glenthøj";0;"C";"C";0;0;0;-0,100000000000001;2,34968230061032
"685";"Frederiksberg.05-02-2018.pdf";5;7;3248;"Frederiksberg Kommune";"05-02-2018";3260;0,00153374233128834;0,00214723926380368;2018;"02";2018-02-05;0,409505090040732;0,687518210537067;104410;67244;707;7,6;7,7;"Jørgen Glenthøj";"Jørgen Glenthøj";0;"C";"C";0;0;0;-0,100000000000001;2,31046646249165
"686";"Frederiksberg.05-03-2018.pdf";2;4;2533;"Frederiksberg Kommune";"05-03-2018";2539;0,000787711697518708;0,00157542339503742;2018;"03";2018-03-05;0,210316911151286;0,504430173037943;104410;67244;707;7,6;7,7;"Jørgen Glenthøj";"Jørgen Glenthøj";0;"C";"C";0;0;0;-0,100000000000001;2,31046646249165
"687";"Frederiksberg.05-11-2018.pdf";3;1;2097;"Frederiksberg Kommune";"05-11-2018";2101;0,0014278914802475;0,000475963826749167;2018;"11";2018-11-05;0,38124319663002;0,152397454705299;104410;67244;707;7,6;7,7;"Jørgen Glenthøj";"Jørgen Glenthøj";0;"C";"C";0;0;0;-0,100000000000001;2,31046646249165
"688";"Frederiksberg.06-06-2016.pdf";2;3;900;"Frederiksberg Kommune";"06-06-2016";905;0,00220994475138122;0,00331491712707182;2016;"06";2016-06-06;0,590049323108414;1,0613935436547;104481;62242;729;7,6;7,6;"Jørgen Glenthøj";"Jørgen Glenthøj";0;"C";"C";0;0;0;0;2,38236216570921
"689";"Frederiksberg.07-05-2018.pdf";19;33;11473;"Frederiksberg Kommune";"07-05-2018";11525;0,00164859002169197;0,00286334056399132;2018;"05";2018-05-07;0,440169115438142;0,916804575018007;104410;67244;707;7,6;7,7;"Jørgen Glenthøj";"Jørgen Glenthøj";0;"C";"C";0;0;0;-0,100000000000001;2,31046646249165
"690";"Frederiksberg.07-11-2016.pdf";4;1;1369;"Frederiksberg Kommune";"07-11-2016";1374;0,00291120815138282;0,000727802037845706;2016;"11";2016-11-07;0,777284770615887;0,23303278918183;104481;62242;729;7,6;7,6;"Jørgen Glenthøj";"Jørgen Glenthøj";0;"C";"C";0;0;0;0;2,38236216570921
"691";"Frederiksberg.08-02-2016.pdf";0;6;1607;"Frederiksberg Kommune";"08-02-2016";1613;0;0,0037197768133912;2016;"02";2016-02-08;0;1,19102437322691;104481;62242;729;7,6;7,6;"Jørgen Glenthøj";"Jørgen Glenthøj";0;"C";"C";0;0;0;0;2,38236216570921
"692";"Frederiksberg.08-05-2017.pdf";36;17;10574;"Frederiksberg Kommune";"08-05-2017";10627;0,00338759762868166;0,00159969888021078;2017;"05";2017-05-08;0,904479483714694;0,512202869079626;105037;63991;719;7,6;7,7;"Jørgen Glenthøj";"Jørgen Glenthøj";0;"C";"C";0;0;0;-0,100000000000001;2,34968230061032
"693";"Frederiksberg.09-04-2018.pdf";16;11;5007;"Frederiksberg Kommune";"09-04-2018";5034;0,00317838696861343;0,00218514104092173;2018;"04";2018-04-09;0,848620798431648;0,699653868830786;104410;67244;707;7,6;7,7;"Jørgen Glenthøj";"Jørgen Glenthøj";0;"C";"C";0;0;0;-0,100000000000001;2,31046646249165
"694";"Frederiksberg.11-01-2016.pdf";0;7;833;"Frederiksberg Kommune";"11-01-2016";840;0;0,00833333333333333;2016;"01";2016-01-11;0;2,66822543613195;104481;62242;729;7,6;7,6;"Jørgen Glenthøj";"Jørgen Glenthøj";0;"C";"C";0;0;0;0;2,38236216570921
"695";"Frederiksberg.11-03-2019.pdf";0;1;1668;"Frederiksberg Kommune";"11-03-2019";1669;0;0,000599161174355902;2019;"03";2019-03-11;0;0,191843650291093;103960;64146;716;7,5;7,5;"Jørgen Glenthøj";"Jørgen Glenthøj";0;"C";"C";0;0;0;0;2,33987834108065
"696";"Frederiksberg.11-04-2016.pdf";14;5;3458;"Frederiksberg Kommune";"11-04-2016";3477;0,00402645959160196;0,00143802128271498;2016;"04";2016-04-11;1,07505391483802;0,460435795708706;104481;62242;729;7,6;7,6;"Jørgen Glenthøj";"Jørgen Glenthøj";0;"C";"C";0;0;0;0;2,38236216570921
"697";"Frederiksberg.12-03-2018.pdf";0;2;1666;"Frederiksberg Kommune";"12-03-2018";1668;0;0,00119904076738609;2018;"03";2018-03-12;0;0,383917328939849;104410;67244;707;7,6;7,7;"Jørgen Glenthøj";"Jørgen Glenthøj";0;"C";"C";0;0;0;-0,100000000000001;2,31046646249165
"698";"Frederiksberg.12-06-2017.pdf";43;18;7307;"Frederiksberg Kommune";"12-06-2017";7368;0,00583604777415852;0,00244299674267101;2017;"06";2017-06-12;1,5582091075437;0,782215925901875;105037;63991;719;7,6;7,7;"Jørgen Glenthøj";"Jørgen Glenthøj";0;"C";"C";0;0;0;-0,100000000000001;2,34968230061032
"699";"Frederiksberg.13-03-2017.pdf";4;5;1524;"Frederiksberg Kommune";"13-03-2017";1533;0,00260926288323549;0,00326157860404436;2017;"03";2017-03-13;0,696666193624415;1,04431523919059;105037;63991;719;7,6;7,7;"Jørgen Glenthøj";"Jørgen Glenthøj";0;"C";"C";0;0;0;-0,100000000000001;2,34968230061032
"700";"Frederiksberg.13-08-2018.pdf";24;10;10693;"Frederiksberg Kommune";"13-08-2018";10727;0,0022373450172462;0,000932227090519251;2018;"08";2018-08-13;0,597365120626212;0,29848704422097;104410;67244;707;7,6;7,7;"Jørgen Glenthøj";"Jørgen Glenthøj";0;"C";"C";0;0;0;-0,100000000000001;2,31046646249165
"701";"Frederiksberg.14-01-2019.pdf";5;5;6087;"Frederiksberg Kommune";"14-01-2019";6097;0,000820075446941119;0,000820075446941119;2019;"01";2019-01-14;0,21895794547036;0,262577540049069;103960;64146;716;7,5;7,5;"Jørgen Glenthøj";"Jørgen Glenthøj";0;"C";"C";0;0;0;0;2,33987834108065
"702";"Frederiksberg.14-08-2017.pdf";9;7;4812;"Frederiksberg Kommune";"14-08-2017";4828;0,00186412593206297;0,00144987572493786;2017;"08";2017-08-14;0,497716625592174;0,464231434621135;105037;63991;719;7,6;7,7;"Jørgen Glenthøj";"Jørgen Glenthøj";0;"C";"C";0;0;0;-0,100000000000001;2,34968230061032
"703";"Frederiksberg.15-01-2018.pdf";2;2;3174;"Frederiksberg Kommune";"15-01-2018";3178;0,000629326620516048;0,000629326620516048;2018;"01";2018-01-15;0,168028520268444;0,201502235579505;104410;67244;707;7,6;7,7;"Jørgen Glenthøj";"Jørgen Glenthøj";0;"C";"C";0;0;0;-0,100000000000001;2,31046646249165
"704";"Frederiksberg.15-05-2017.pdf";22;16;5122;"Frederiksberg Kommune";"15-05-2017";5160;0,00426356589147287;0,00310077519379845;2017;"05";2017-05-15;1,13836066115199;0,992828069258401;105037;63991;719;7,6;7,7;"Jørgen Glenthøj";"Jørgen Glenthøj";0;"C";"C";0;0;0;-0,100000000000001;2,34968230061032
"705";"Frederiksberg.15-08-2016.pdf";8;5;7745;"Frederiksberg Kommune";"15-08-2016";7758;0,00103119360659964;0,000644496004124774;2016;"08";2016-08-15;0,275325928029448;0,206359275802935;104481;62242;729;7,6;7,6;"Jørgen Glenthøj";"Jørgen Glenthøj";0;"C";"C";0;0;0;0;2,38236216570921
"706";"Frederiksberg.16-01-2017.pdf";0;10;1199;"Frederiksberg Kommune";"16-01-2017";1209;0;0,00827129859387924;2017;"01";2017-01-16;0;2,64836271576372;105037;63991;719;7,6;7,7;"Jørgen Glenthøj";"Jørgen Glenthøj";0;"C";"C";0;0;0;-0,100000000000001;2,34968230061032
"707";"Frederiksberg.16-04-2018.pdf";12;12;3407;"Frederiksberg Kommune";"16-04-2018";3431;0,00349752258816672;0,00349752258816672;2018;"04";2018-04-16;0,933829153156131;1,1198614479831;104410;67244;707;7,6;7,7;"Jørgen Glenthøj";"Jørgen Glenthøj";0;"C";"C";0;0;0;-0,100000000000001;2,31046646249165
"708";"Frederiksberg.17-08-2018.pdf";13;4;7390;"Frederiksberg Kommune";"17-08-2018";7407;0,00175509653030917;0,00054002970163359;2018;"08";2018-08-17;0,468606067663729;0,172910518339859;104410;67244;707;7,6;7,7;"Jørgen Glenthøj";"Jørgen Glenthøj";0;"C";"C";0;0;0;-0,100000000000001;2,31046646249165
"709";"Frederiksberg.17-09-2018.pdf";13;4;7390;"Frederiksberg Kommune";"17-09-2018";7407;0,00175509653030917;0,00054002970163359;2018;"09";2018-09-17;0,468606067663729;0,172910518339859;104410;67244;707;7,6;7,7;"Jørgen Glenthøj";"Jørgen Glenthøj";0;"C";"C";0;0;0;-0,100000000000001;2,31046646249165
"710";"Frederiksberg.18-01-2016.pdf";2;3;2378;"Frederiksberg Kommune";"18-01-2016";2383;0,000839278220730172;0,00125891733109526;2016;"01";2016-01-18;0,224085034583766;0,403089029377886;104481;62242;729;7,6;7,6;"Jørgen Glenthøj";"Jørgen Glenthøj";0;"C";"C";0;0;0;0;2,38236216570921
"711";"Frederiksberg.18-09-2017.pdf";0;0;712;"Frederiksberg Kommune";"18-09-2017";712;0;0;2017;"09";2017-09-18;0;0;105037;63991;719;7,6;7,7;"Jørgen Glenthøj";"Jørgen Glenthøj";0;"C";"C";0;0;0;-0,100000000000001;2,34968230061032
"712";"Frederiksberg.19-09-2016.pdf";6;1;3547;"Frederiksberg Kommune";"19-09-2016";3554;0,00168823860438942;0,00028137310073157;2016;"09";2016-09-19;0,450755180708875;0,0900920237298352;104481;62242;729;7,6;7,6;"Jørgen Glenthøj";"Jørgen Glenthøj";0;"C";"C";0;0;0;0;2,38236216570921
"713";"Frederiksberg.19-11-2018.pdf";2;7;5255;"Frederiksberg Kommune";"19-11-2018";5264;0,000379939209726444;0,00132978723404255;2018;"11";2018-11-19;0,101442750268449;0,425780654701907;104410;67244;707;7,6;7,7;"Jørgen Glenthøj";"Jørgen Glenthøj";0;"C";"C";0;0;0;-0,100000000000001;2,31046646249165
"714";"Frederiksberg.20-02-2017.pdf";24;9;2709;"Frederiksberg Kommune";"20-02-2017";2742;0,0087527352297593;0,00328227571115974;2017;"02";2017-02-20;2,33695683769415;1,05094218490974;105037;63991;719;7,6;7,7;"Jørgen Glenthøj";"Jørgen Glenthøj";0;"C";"C";0;0;0;-0,100000000000001;2,34968230061032
"715";"Frederiksberg.20-08-2018.pdf";16;35;8066;"Frederiksberg Kommune";"20-08-2018";8117;0,00197117161512874;0,00431193790809412;2018;"08";2018-08-20;0,526297535949848;1,3806266886478;104410;67244;707;7,6;7,7;"Jørgen Glenthøj";"Jørgen Glenthøj";0;"C";"C";0;0;0;-0,100000000000001;2,31046646249165
"716";"Frederiksberg.21-08-2017.pdf";45;18;9489;"Frederiksberg Kommune";"21-08-2017";9552;0,00471105527638191;0,00188442211055276;2017;"08";2017-08-21;1,25783912707235;0,603367560934361;105037;63991;719;7,6;7,7;"Jørgen Glenthøj";"Jørgen Glenthøj";0;"C";"C";0;0;0;-0,100000000000001;2,34968230061032
"717";"Frederiksberg.22-08-2016.pdf";36;28;7343;"Frederiksberg Kommune";"22-08-2016";7407;0,00486026731470231;0,00378020791143513;2016;"08";2016-08-22;1,29767834122263;1,21037362837901;104481;62242;729;7,6;7,6;"Jørgen Glenthøj";"Jørgen Glenthøj";0;"C";"C";0;0;0;0;2,38236216570921
"718";"Frederiksberg.23-01-2017.pdf";0;1;1753;"Frederiksberg Kommune";"23-01-2017";1754;0;0,000570125427594071;2017;"01";2017-01-23;0;0,182546780123053;105037;63991;719;7,6;7,7;"Jørgen Glenthøj";"Jørgen Glenthøj";0;"C";"C";0;0;0;-0,100000000000001;2,34968230061032
"719";"Frederiksberg.23-05-2016.pdf";0;0;164;"Frederiksberg Kommune";"23-05-2016";164;0;0;2016;"05";2016-05-23;0;0;104481;62242;729;7,6;7,6;"Jørgen Glenthøj";"Jørgen Glenthøj";0;"C";"C";0;0;0;0;2,38236216570921
"720";"Frederiksberg.23-10-2017.pdf";7;3;5273;"Frederiksberg Kommune";"23-10-2017";5283;0,00132500473215976;0,00056785917092561;2017;"10";2017-10-23;0,353772710760155;0,181821154080542;105037;63991;719;7,6;7,7;"Jørgen Glenthøj";"Jørgen Glenthøj";0;"C";"C";0;0;0;-0,100000000000001;2,34968230061032
"721";"Frederiksberg.24-09-2018.pdf";5;5;3270;"Frederiksberg Kommune";"24-09-2018";3280;0,00152439024390244;0,00152439024390244;2018;"09";2018-09-24;0,407008107784386;0,488090018804625;104410;67244;707;7,6;7,7;"Jørgen Glenthøj";"Jørgen Glenthøj";0;"C";"C";0;0;0;-0,100000000000001;2,31046646249165
"722";"Frederiksberg.25-03-2019.pdf";7;1;4556;"Frederiksberg Kommune";"25-03-2019";4564;0,00153374233128834;0,000219106047326906;2019;"03";2019-03-25;0,409505090040732;0,0701549194425579;103960;64146;716;7,5;7,5;"Jørgen Glenthøj";"Jørgen Glenthøj";0;"C";"C";0;0;0;0;2,33987834108065
"723";"Frederiksberg.25-04-2016.pdf";2;5;3165;"Frederiksberg Kommune";"25-04-2016";3172;0,000630517023959647;0,00157629255989912;2016;"04";2016-04-25;0,168346354796064;0,504708468373005;104481;62242;729;7,6;7,6;"Jørgen Glenthøj";"Jørgen Glenthøj";0;"C";"C";0;0;0;0;2,38236216570921
"724";"Frederiksberg.25-09-2017.pdf";4;1;2571;"Frederiksberg Kommune";"25-09-2017";2576;0,0015527950310559;0,000388198757763975;2017;"09";2017-09-25;0,414592109792791;0,12429621596888;105037;63991;719;7,6;7,7;"Jørgen Glenthøj";"Jørgen Glenthøj";0;"C";"C";0;0;0;-0,100000000000001;2,34968230061032
"725";"Frederiksberg.26-11-2018.pdf";15;7;4378;"Frederiksberg Kommune";"26-11-2018";4400;0,00340909090909091;0,00159090909090909;2018;"11";2018-11-26;0,910218131954172;0,509388492352463;104410;67244;707;7,6;7,7;"Jørgen Glenthøj";"Jørgen Glenthøj";0;"C";"C";0;0;0;-0,100000000000001;2,31046646249165
"726";"Frederiksberg.27-03-2017.pdf";1;0;756;"Frederiksberg Kommune";"27-03-2017";757;0,00132100396301189;0;2017;"03";2017-03-27;0,35270451612491;0;105037;63991;719;7,6;7,7;"Jørgen Glenthøj";"Jørgen Glenthøj";0;"C";"C";0;0;0;-0,100000000000001;2,34968230061032
"727";"Frederiksberg.27-11-2017.pdf";4;0;891;"Frederiksberg Kommune";"27-11-2017";895;0,00446927374301676;0;2017;"11";2017-11-27;1,19328410595109;0;105037;63991;719;7,6;7,7;"Jørgen Glenthøj";"Jørgen Glenthøj";0;"C";"C";0;0;0;-0,100000000000001;2,34968230061032
"728";"Frederiksberg.28-05-2018.pdf";27;1;5106;"Frederiksberg Kommune";"28-05-2018";5134;0,00525905726529022;0,000194779898714453;2018;"05";2018-05-28;1,40415418875673;0,0623660016236529;104410;67244;707;7,6;7,7;"Jørgen Glenthøj";"Jørgen Glenthøj";0;"C";"C";0;0;0;-0,100000000000001;2,31046646249165
"729";"Frederiksberg.28-11-2016.pdf";22;5;4447;"Frederiksberg Kommune";"28-11-2016";4474;0,00491729995529727;0,00111756817165847;2016;"11";2016-11-28;1,31290590334025;0,357830858667673;104481;62242;729;7,6;7,6;"Jørgen Glenthøj";"Jørgen Glenthøj";0;"C";"C";0;0;0;0;2,38236216570921
"730";"Frederiksberg.29-02-2016.pdf";20;15;6683;"Frederiksberg Kommune";"29-02-2016";6718;0,00297707651086633;0,00223280738314975;2016;"02";2016-02-29;0,794871445985582;0,714916014444405;104481;62242;729;7,6;7,6;"Jørgen Glenthøj";"Jørgen Glenthøj";0;"C";"C";0;0;0;0;2,38236216570921
"731";"Frederiksberg.29-10-2018.pdf";21;11;8675;"Frederiksberg Kommune";"29-10-2018";8707;0,00241185253244516;0,00126335132651889;2018;"10";2018-10-29;0,643958159278477;0,40450873730265;104410;67244;707;7,6;7,7;"Jørgen Glenthøj";"Jørgen Glenthøj";0;"C";"C";0;0;0;-0,100000000000001;2,31046646249165
"732";"Frederiksberg.30-05-2016.pdf";13;5;5026;"Frederiksberg Kommune";"30-05-2016";5044;0,00257731958762887;0,000991276764472641;2016;"05";2016-05-30;0,688137419346797;0,317393985265498;104481;62242;729;7,6;7,6;"Jørgen Glenthøj";"Jørgen Glenthøj";0;"C";"C";0;0;0;0;2,38236216570921
"733";"Frederiksberg.30-10-2017.pdf";0;0;906;"Frederiksberg Kommune";"30-10-2017";906;0;0;2017;"10";2017-10-30;0;0;105037;63991;719;7,6;7,7;"Jørgen Glenthøj";"Jørgen Glenthøj";0;"C";"C";0;0;0;-0,100000000000001;2,34968230061032
"734";"Frederiksberg.31-10-2016.pdf";1;0;2245;"Frederiksberg Kommune";"31-10-2016";2246;0,000445235975066785;0;2016;"10";2016-10-31;0,118876811534531;0;104481;62242;729;7,6;7,6;"Jørgen Glenthøj";"Jørgen Glenthøj";0;"C";"C";0;0;0;0;2,38236216570921
"735";"Frederikshavn.01-12-2016.pdf";2;6;2109;"Frederikshavn Kommune";"01-12-2016";2117;0,000944733112895607;0,00283419933868682;2016;"12";2016-12-01;0,252241208036426;0,907473931986304;60246;63640;1419;6,8;6,7;"Birgit Hansen";"Birgit Hansen";0;"S";"S";0;0;0;0,0999999999999996;4,63727285753275
"736";"Frederikshavn.02-02-2017.pdf";1;5;809;"Frederikshavn Kommune";"02-02-2017";815;0,00122699386503067;0,00613496932515337;2017;"02";2017-02-02;0,327604072032586;1,96433774439162;60356;66731;1235;6,8;6,7;"Birgit Hansen";"Birgit Hansen";0;"S";"S";0;0;0;0,0999999999999996;4,03596333971314
"737";"Frederikshavn.02-05-2016.pdf";0;2;769;"Frederikshavn Kommune";"02-05-2016";771;0;0,00259403372243839;2016;"05";2016-05-02;0;0,8305760112473;60246;63640;1419;6,8;6,7;"Birgit Hansen";"Birgit Hansen";0;"S";"S";0;0;0;0,0999999999999996;4,63727285753275
"738";"Frederikshavn.02-06-2016.pdf";9;7;4149;"Frederikshavn Kommune";"02-06-2016";4165;0,0021608643457383;0,00168067226890756;2016;"06";2016-06-02;0,576944986400724;0,538129499724091;60246;63640;1419;6,8;6,7;"Birgit Hansen";"Birgit Hansen";0;"S";"S";0;0;0;0,0999999999999996;4,63727285753275
"739";"Frederikshavn.03-03-2016.pdf";21;7;2473;"Frederikshavn Kommune";"03-03-2016";2501;0,00839664134346262;0,00279888044782087;2016;"03";2016-03-03;2,24188072484514;0,896165280428164;60246;63640;1419;6,8;6,7;"Birgit Hansen";"Birgit Hansen";0;"S";"S";0;0;0;0,0999999999999996;4,63727285753275
"740";"Frederikshavn.03-04-2018.pdf";4;9;1896;"Frederikshavn Kommune";"03-04-2018";1909;0,00209533787323206;0,00471451021477213;2018;"04";2018-04-03;0,55944959393726;1,50952512887507;60140;66149;1063;6,7;6,6;"Birgit Hansen";"Birgit Hansen";0;"S";"S";0;0;0;0,100000000000001;3,4738696600122
"741";"Frederikshavn.03-11-2016.pdf";1;4;1086;"Frederikshavn Kommune";"03-11-2016";1091;0,000916590284142988;0,00366636113657195;2016;"11";2016-11-03;0,244727148218659;1,17392136511763;60246;63640;1419;6,8;6,7;"Birgit Hansen";"Birgit Hansen";0;"S";"S";0;0;0;0,0999999999999996;4,63727285753275
"742";"Frederikshavn.04-02-2016.pdf";3;5;1649;"Frederikshavn Kommune";"04-02-2016";1657;0,00181050090525045;0,00301750150875075;2016;"02";2016-02-04;0,483398887217665;0,966164913505836;60246;63640;1419;6,8;6,7;"Birgit Hansen";"Birgit Hansen";0;"S";"S";0;0;0;0,0999999999999996;4,63727285753275
"743";"Frederikshavn.04-05-2017.pdf";0;2;1484;"Frederikshavn Kommune";"04-05-2017";1486;0;0,00134589502018843;2017;"05";2017-05-04;0;0,43093815926761;60356;66731;1235;6,8;6,7;"Birgit Hansen";"Birgit Hansen";0;"S";"S";0;0;0;0,0999999999999996;4,03596333971314
"744";"Frederikshavn.06-02-2018.pdf";2;5;3127;"Frederikshavn Kommune";"06-02-2018";3134;0,000638162093171666;0,00159540523292916;2018;"02";2018-02-06;0,170387567776999;0,510828098812754;60140;66149;1063;6,7;6,6;"Birgit Hansen";"Birgit Hansen";0;"S";"S";0;0;0;0,100000000000001;3,4738696600122
"745";"Frederikshavn.06-04-2017.pdf";5;3;1474;"Frederikshavn Kommune";"06-04-2017";1482;0,00337381916329285;0,00202429149797571;2017;"04";2017-04-06;0,90080067039999;0,648151927805332;60356;66731;1235;6,8;6,7;"Birgit Hansen";"Birgit Hansen";0;"S";"S";0;0;0;0,0999999999999996;4,03596333971314
"746";"Frederikshavn.06-10-2016.pdf";2;1;1681;"Frederikshavn Kommune";"06-10-2016";1684;0,00118764845605701;0,000593824228028504;2016;"10";2016-10-06;0,317098953333203;0,190134829178049;60246;63640;1419;6,8;6,7;"Birgit Hansen";"Birgit Hansen";0;"S";"S";0;0;0;0,0999999999999996;4,63727285753275
"747";"Frederikshavn.07-04-2016.pdf";8;5;2681;"Frederikshavn Kommune";"07-04-2016";2694;0,00296956198960653;0,00185597624350408;2016;"04";2016-04-07;0,792865088957853;0,594259562612907;60246;63640;1419;6,8;6,7;"Birgit Hansen";"Birgit Hansen";0;"S";"S";0;0;0;0,0999999999999996;4,63727285753275
"748";"Frederikshavn.07-09-2017.pdf";5;11;3344;"Frederikshavn Kommune";"07-09-2017";3360;0,00148809523809524;0,00327380952380952;2017;"09";2017-09-07;0,397317438551424;1,04823142133755;60356;66731;1235;6,8;6,7;"Birgit Hansen";"Birgit Hansen";0;"S";"S";0;0;0;0,0999999999999996;4,03596333971314
"749";"Frederikshavn.07-12-2017.pdf";0;0;1055;"Frederikshavn Kommune";"07-12-2017";1055;0;0;2017;"12";2017-12-07;0;0;60356;66731;1235;6,8;6,7;"Birgit Hansen";"Birgit Hansen";0;"S";"S";0;0;0;0,0999999999999996;4,03596333971314
"750";"Frederikshavn.08-06-2017.pdf";4;18;3263;"Frederikshavn Kommune";"08-06-2017";3285;0,00121765601217656;0,00547945205479452;2017;"06";2017-06-08;0,325110890358061;1,75444960184019;60356;66731;1235;6,8;6,7;"Birgit Hansen";"Birgit Hansen";0;"S";"S";0;0;0;0,0999999999999996;4,03596333971314
"751";"Frederikshavn.08-09-2016.pdf";26;5;1421;"Frederikshavn Kommune";"08-09-2016";1452;0,0179063360881543;0,0034435261707989;2016;"09";2016-09-08;4,78094372339565;1,1025724942694;60246;63640;1419;6,8;6,7;"Birgit Hansen";"Birgit Hansen";0;"S";"S";0;0;0;0,0999999999999996;4,63727285753275
"752";"Frederikshavn.09-04-2019.pdf";11;1;1493;"Frederikshavn Kommune";"09-04-2019";1505;0,00730897009966777;0,000664451827242525;2019;"04";2019-04-09;1,95147541911769;0,212748871983943;59987;66598;1034;6,7;6,6;"Birgit Hansen";"Birgit Hansen";0;"S";"S";0;0;0;0,100000000000001;3,37909805122541
"753";"Frederikshavn.09-10-2018.pdf";0;6;939;"Frederikshavn Kommune";"09-10-2018";945;0;0,00634920634920635;2018;"10";2018-10-09;0;2,03293366562434;60140;66149;1063;6,7;6,6;"Birgit Hansen";"Birgit Hansen";0;"S";"S";0;0;0;0,100000000000001;3,4738696600122
"754";"Frederikshavn.09-11-2017.pdf";0;0;882;"Frederikshavn Kommune";"09-11-2017";882;0;0;2017;"11";2017-11-09;0;0;60356;66731;1235;6,8;6,7;"Birgit Hansen";"Birgit Hansen";0;"S";"S";0;0;0;0,0999999999999996;4,03596333971314
"755";"Frederikshavn.10-08-2017.pdf";48;25;3237;"Frederikshavn Kommune";"10-08-2017";3310;0,0145015105740181;0,00755287009063444;2017;"08";2017-08-10;3,87186444045763;2,41833121099573;60356;66731;1235;6,8;6,7;"Birgit Hansen";"Birgit Hansen";0;"S";"S";0;0;0;0,0999999999999996;4,03596333971314
"756";"Frederikshavn.11-09-2018.pdf";2;10;2998;"Frederikshavn Kommune";"11-09-2018";3010;0,000664451827242525;0,00332225913621262;2018;"09";2018-09-11;0,177406856283427;1,06374435991971;60140;66149;1063;6,7;6,6;"Birgit Hansen";"Birgit Hansen";0;"S";"S";0;0;0;0,100000000000001;3,4738696600122
"757";"Frederikshavn.11-12-2018.pdf";8;16;1823;"Frederikshavn Kommune";"11-12-2018";1847;0,00433134813210612;0,00866269626421224;2018;"12";2018-12-11;1,15645833765699;2,77368318211876;60140;66149;1063;6,7;6,6;"Birgit Hansen";"Birgit Hansen";0;"S";"S";0;0;0;0,100000000000001;3,4738696600122
"758";"Frederikshavn.12-01-2017.pdf";0;25;4774;"Frederikshavn Kommune";"12-01-2017";4799;0;0,00520941862888102;2017;"01";2017-01-12;0;1,6679883951648;60356;66731;1235;6,8;6,7;"Birgit Hansen";"Birgit Hansen";0;"S";"S";0;0;0;0,0999999999999996;4,03596333971314
"759";"Frederikshavn.12-02-2019.pdf";1;6;1991;"Frederikshavn Kommune";"12-02-2019";1998;0,0005005005005005;0,003003003003003;2019;"02";2019-02-12;0,133632291644923;0,96152267968719;59987;66598;1034;6,7;6,6;"Birgit Hansen";"Birgit Hansen";0;"S";"S";0;0;0;0,100000000000001;3,37909805122541
"760";"Frederikshavn.12-03-2019.pdf";16;4;4378;"Frederikshavn Kommune";"12-03-2019";4398;0,00363801728058208;0,000909504320145521;2019;"03";2019-03-12;0,971340859323537;0,291211507354101;59987;66598;1034;6,7;6,6;"Birgit Hansen";"Birgit Hansen";0;"S";"S";0;0;0;0,100000000000001;3,37909805122541
"761";"Frederikshavn.12-06-2018.pdf";6;32;4187;"Frederikshavn Kommune";"12-06-2018";4225;0,00142011834319527;0,00757396449704142;2018;"06";2018-06-12;0,379167789879134;2,42508536680395;60140;66149;1063;6,7;6,6;"Birgit Hansen";"Birgit Hansen";0;"S";"S";0;0;0;0,100000000000001;3,4738696600122
"762";"Frederikshavn.12-10-2017.pdf";6;11;3419;"Frederikshavn Kommune";"12-10-2017";3436;0,00174621653084983;0,00320139697322468;2017;"10";2017-10-12;0,466235131617969;1,02504586021367;60356;66731;1235;6,8;6,7;"Birgit Hansen";"Birgit Hansen";0;"S";"S";0;0;0;0,0999999999999996;4,03596333971314
"763";"Frederikshavn.13-03-2018.pdf";11;8;2284;"Frederikshavn Kommune";"13-03-2018";2303;0,00477637863656101;0,00347372991749891;2018;"03";2018-03-13;1,27528028908907;1,11224334289478;60140;66149;1063;6,7;6,6;"Birgit Hansen";"Birgit Hansen";0;"S";"S";0;0;0;0,100000000000001;3,4738696600122
"764";"Frederikshavn.13-11-2018.pdf";1;23;2006;"Frederikshavn Kommune";"13-11-2018";2030;0,000492610837438424;0,0113300492610837;2018;"11";2018-11-13;0,131525772761851;3,6277350757262;60140;66149;1063;6,7;6,6;"Birgit Hansen";"Birgit Hansen";0;"S";"S";0;0;0;0,100000000000001;3,4738696600122
"765";"Frederikshavn.14-03-2016.pdf";179;4;4209;"Frederikshavn Kommune";"14-03-2016";4392;0,0407559198542805;0,000910746812386157;2016;"03";2016-03-14;10,8817213225122;0,29160933728218;60246;63640;1419;6,8;6,7;"Birgit Hansen";"Birgit Hansen";0;"S";"S";0;0;0;0,0999999999999996;4,63727285753275
"766";"Frederikshavn.15-01-2019.pdf";2;6;1756;"Frederikshavn Kommune";"15-01-2019";1764;0,00113378684807256;0,00340136054421769;2019;"01";2019-01-15;0,302718048420133;1,08907160658447;59987;66598;1034;6,7;6,6;"Birgit Hansen";"Birgit Hansen";0;"S";"S";0;0;0;0,100000000000001;3,37909805122541
"767";"Frederikshavn.15-03-2017.pdf";0;8;3400;"Frederikshavn Kommune";"15-03-2017";3408;0;0,00234741784037559;2017;"03";2017-03-15;0;0,751612798910409;60356;66731;1235;6,8;6,7;"Birgit Hansen";"Birgit Hansen";0;"S";"S";0;0;0;0,0999999999999996;4,03596333971314
"768";"Frederikshavn.15-05-2018.pdf";0;1;2293;"Frederikshavn Kommune";"15-05-2018";2294;0;0,0004359197907585;2018;"05";2018-05-15;0;0,139575872857818;60140;66149;1063;6,7;6,6;"Birgit Hansen";"Birgit Hansen";0;"S";"S";0;0;0;0,100000000000001;3,4738696600122
"769";"Frederikshavn.16-01-2018.pdf";1;5;2379;"Frederikshavn Kommune";"16-01-2018";2385;0,000419287211740042;0,00209643605870021;2018;"01";2018-01-16;0,11194856130254;0,671251682045774;60140;66149;1063;6,7;6,6;"Birgit Hansen";"Birgit Hansen";0;"S";"S";0;0;0;0,100000000000001;3,4738696600122
"770";"Frederikshavn.19-05-2016.pdf";3;18;4318;"Frederikshavn Kommune";"19-05-2016";4339;0,000691403549204886;0,00414842129522932;2016;"05";2016-05-19;0,184602893781902;1,32827078636668;60246;63640;1419;6,8;6,7;"Birgit Hansen";"Birgit Hansen";0;"S";"S";0;0;0;0,0999999999999996;4,63727285753275
"771";"Frederikshavn.21-01-2016.pdf";5;10;3654;"Frederikshavn Kommune";"21-01-2016";3669;0,00136276914690651;0,00272553829381303;2016;"01";2016-01-21;0,363855708240062;0,872682072324432;60246;63640;1419;6,8;6,7;"Birgit Hansen";"Birgit Hansen";0;"S";"S";0;0;0;0,0999999999999996;4,63727285753275
"772";"Frederikshavn.21-08-2018.pdf";1;14;2357;"Frederikshavn Kommune";"21-08-2018";2372;0,000421585160202361;0,00590219224283305;2018;"08";2018-08-21;0,112562107380505;1,88980553655214;60140;66149;1063;6,7;6,6;"Birgit Hansen";"Birgit Hansen";0;"S";"S";0;0;0;0,100000000000001;3,4738696600122
"773";"Frederikshavn.21-09-2016.pdf";0;1;592;"Frederikshavn Kommune";"21-09-2016";593;0;0,00168634064080944;2016;"09";2016-09-21;0;0,539944439014897;60246;63640;1419;6,8;6,7;"Birgit Hansen";"Birgit Hansen";0;"S";"S";0;0;0;0,0999999999999996;4,63727285753275
"774";"Frederikshavn.29-06-2016.pdf";0;1;1037;"Frederikshavn Kommune";"29-06-2016";1038;0;0,000963391136801541;2016;"06";2016-06-29;0;0,308465368338954;60246;63640;1419;6,8;6,7;"Birgit Hansen";"Birgit Hansen";0;"S";"S";0;0;0;0,0999999999999996;4,63727285753275
"775";"Frederikssund.01-02-2016.pdf";9;4;3995;"Frederikssund Kommune";"01-02-2016";4008;0,00224550898203593;0,000998003992015968;2016;"02";2016-02-01;0,599544877335083;0,319547956422988;44725;68446;802;6,8;7,1;"John Andersen";"John Andersen ";0;"V";"V";0;0;0;-0,3;2,62092518093112
"776";"Frederikssund.01-06-2017.pdf";11;5;1442;"Frederikssund Kommune";"01-06-2017";1458;0,00754458161865569;0,00342935528120713;2017;"06";2017-06-01;2,01438306294385;1,09803515890204;45036;70121;710;6,8;6,9;"John Andersen";"John Andersen ";0;"V";"V";0;0;0;-0,100000000000001;2,32027042202132
"777";"Frederikssund.02-05-2016.pdf";9;2;2654;"Frederikssund Kommune";"02-05-2016";2665;0,00337711069418386;0,00075046904315197;2016;"05";2016-05-02;0,901679500322332;0,240290470796123;44725;68446;802;6,8;7,1;"John Andersen";"John Andersen ";0;"V";"V";0;0;0;-0,3;2,62092518093112
"778";"Frederikssund.02-05-2018.pdf";1;3;2660;"Frederikssund Kommune";"02-05-2018";2664;0,000375375375375375;0,00112612612612613;2018;"05";2018-05-02;0,100224218733693;0,360571004882696;45189;67857;683;7,1;7,2;"John Andersen";"John Andersen ";0;"V";"V";0;0;0;-0,100000000000001;2,23203478625431
"779";"Frederikssund.02-10-2017.pdf";26;6;1559;"Frederikssund Kommune";"02-10-2017";1591;0,0163419233186675;0,00377121307353866;2017;"10";2017-10-02;4,36324970859239;1,2074935977467;45036;70121;710;6,8;6,9;"John Andersen";"John Andersen ";0;"V";"V";0;0;0;-0,100000000000001;2,32027042202132
"780";"Frederikssund.03-04-2017.pdf";11;0;2025;"Frederikssund Kommune";"03-04-2017";2036;0,00540275049115914;0;2017;"04";2017-04-03;1,44251989478002;0;45036;70121;710;6,8;6,9;"John Andersen";"John Andersen ";0;"V";"V";0;0;0;-0,100000000000001;2,32027042202132
"781";"Frederikssund.03-09-2018.pdf";3;24;2049;"Frederikssund Kommune";"03-09-2018";2076;0,00144508670520231;0,0115606936416185;2018;"09";2018-09-03;0,38583427558751;3,70158442006745;45189;67857;683;7,1;7,2;"John Andersen";"John Andersen ";0;"V";"V";0;0;0;-0,100000000000001;2,23203478625431
"782";"Frederikssund.03-10-2018.pdf";13;10;3848;"Frederikssund Kommune";"03-10-2018";3871;0,00335830534745544;0,00258331180573495;2018;"10";2018-10-03;0,896658523168495;0,827142992342635;45189;67857;683;7,1;7,2;"John Andersen";"John Andersen ";0;"V";"V";0;0;0;-0,100000000000001;2,23203478625431
"783";"Frederikssund.04-04-2016.pdf";5;2;1940;"Frederikssund Kommune";"04-04-2016";1947;0,00256805341551104;0,00102722136620442;2016;"04";2016-04-04;0,685663376236665;0,328902981341381;44725;68446;802;6,8;7,1;"John Andersen";"John Andersen ";0;"V";"V";0;0;0;-0,3;2,62092518093112
"784";"Frederikssund.04-04-2018.pdf";17;8;4688;"Frederikssund Kommune";"04-04-2018";4713;0,00360704434542754;0,00169743263314237;2018;"04";2018-04-04;0,963071168684802;0,543495951344509;45189;67857;683;7,1;7,2;"John Andersen";"John Andersen ";0;"V";"V";0;0;0;-0,100000000000001;2,23203478625431
"785";"Frederikssund.04-12-2017.pdf";2;2;731;"Frederikssund Kommune";"04-12-2017";735;0,00272108843537415;0,00272108843537415;2017;"12";2017-12-04;0,726523316208319;0,871257285267576;45036;70121;710;6,8;6,9;"John Andersen";"John Andersen ";0;"V";"V";0;0;0;-0,100000000000001;2,32027042202132
"786";"Frederikssund.05-09-2016.pdf";2;6;1267;"Frederikssund Kommune";"05-09-2016";1275;0,00156862745098039;0,00470588235294118;2016;"09";2016-09-05;0,418819323461266;1,50676259922745;44725;68446;802;6,8;7,1;"John Andersen";"John Andersen ";0;"V";"V";0;0;0;-0,3;2,62092518093112
"787";"Frederikssund.05-12-2018.pdf";1;5;3090;"Frederikssund Kommune";"05-12-2018";3096;0,000322997416020672;0,00161498708010336;2018;"12";2018-12-05;0,0862394440266658;0,51709795273875;45189;67857;683;7,1;7,2;"John Andersen";"John Andersen ";0;"V";"V";0;0;0;-0,100000000000001;2,23203478625431
"788";"Frederikssund.06-02-2017.pdf";18;8;3956;"Frederikssund Kommune";"06-02-2017";3982;0,00452034153691612;0,00200904068307383;2017;"02";2017-02-06;1,20691906999448;0,643268814336181;45036;70121;710;6,8;6,9;"John Andersen";"John Andersen ";0;"V";"V";0;0;0;-0,100000000000001;2,32027042202132
"789";"Frederikssund.06-02-2019.pdf";15;24;3831;"Frederikssund Kommune";"06-02-2019";3870;0,00387596899224806;0,0062015503875969;2019;"02";2019-02-06;1,03487332831999;1,9856561385168;45332;69504;667;6,8;7;"John Andersen";"John Andersen ";0;"V";"V";0;0;0;-0,2;2,17974700209608
"790";"Frederikssund.06-03-2017.pdf";10;9;2731;"Frederikssund Kommune";"06-03-2017";2750;0,00363636363636364;0,00327272727272727;2017;"03";2017-03-06;0,970899340751117;1,04788489855364;45036;70121;710;6,8;6,9;"John Andersen";"John Andersen ";0;"V";"V";0;0;0;-0,100000000000001;2,32027042202132
"791";"Frederikssund.06-03-2019.pdf";11;9;2852;"Frederikssund Kommune";"06-03-2019";2872;0,00383008356545961;0,00313370473537604;2019;"03";2019-03-06;1,02262204239977;1,0033716821109;45332;69504;667;6,8;7;"John Andersen";"John Andersen ";0;"V";"V";0;0;0;-0,2;2,17974700209608
"792";"Frederikssund.06-06-2016.pdf";23;7;2094;"Frederikssund Kommune";"06-06-2016";2124;0,0108286252354049;0,00329566854990584;2016;"06";2016-06-06;2,89121390313127;1,05523039847026;44725;68446;802;6,8;7,1;"John Andersen";"John Andersen ";0;"V";"V";0;0;0;-0,3;2,62092518093112
"793";"Frederikssund.06-06-2018.pdf";3;6;1275;"Frederikssund Kommune";"06-06-2018";1284;0,00233644859813084;0,00467289719626168;2018;"06";2018-06-06;0,623825510996629;1,49620117913941;45189;67857;683;7,1;7,2;"John Andersen";"John Andersen ";0;"V";"V";0;0;0;-0,100000000000001;2,23203478625431
"794";"Frederikssund.06-11-2017.pdf";3;3;1840;"Frederikssund Kommune";"06-11-2017";1846;0,00162513542795233;0,00162513542795233;2017;"11";2017-11-06;0,433906801798305;0,520347322322591;45036;70121;710;6,8;6,9;"John Andersen";"John Andersen ";0;"V";"V";0;0;0;-0,100000000000001;2,32027042202132
"795";"Frederikssund.07-02-2018.pdf";20;6;1857;"Frederikssund Kommune";"07-02-2018";1883;0,0106213489113117;0,00318640467339352;2018;"02";2018-02-07;2,83587168036704;1,020245519923;45189;67857;683;7,1;7,2;"John Andersen";"John Andersen ";0;"V";"V";0;0;0;-0,100000000000001;2,23203478625431
"796";"Frederikssund.07-03-2018.pdf";36;10;3593;"Frederikssund Kommune";"07-03-2018";3639;0,00989282769991756;0,00274800769442154;2018;"03";2018-03-07;2,64135847030395;0,879876483473026;45189;67857;683;7,1;7,2;"John Andersen";"John Andersen ";0;"V";"V";0;0;0;-0,100000000000001;2,23203478625431
"797";"Frederikssund.07-11-2018.pdf";2;5;2755;"Frederikssund Kommune";"07-11-2018";2762;0,000724112961622013;0,00181028240405503;2018;"11";2018-11-07;0,193336219193742;0,579628986849808;45189;67857;683;7,1;7,2;"John Andersen";"John Andersen ";0;"V";"V";0;0;0;-0,100000000000001;2,23203478625431
"798";"Frederikssund.08-05-2017.pdf";3;3;535;"Frederikssund Kommune";"08-05-2017";541;0,0055452865064695;0,0055452865064695;2017;"05";2017-05-08;1,48057662868701;1,77552894086415;45036;70121;710;6,8;6,9;"John Andersen";"John Andersen ";0;"V";"V";0;0;0;-0,100000000000001;2,32027042202132
"799";"Frederikssund.10-01-2018.pdf";0;2;701;"Frederikssund Kommune";"10-01-2018";703;0;0,00284495021337127;2018;"01";2018-01-10;0;0,910916222861548;45189;67857;683;7,1;7,2;"John Andersen";"John Andersen ";0;"V";"V";0;0;0;-0,100000000000001;2,23203478625431
"800";"Frederikssund.10-03-2016.pdf";16;3;1552;"Frederikssund Kommune";"10-03-2016";1571;0,0101845957988542;0,00190961171228517;2016;"03";2016-03-10;2,71925977040415;0,611432945262573;44725;68446;802;6,8;7,1;"John Andersen";"John Andersen ";0;"V";"V";0;0;0;-0,3;2,62092518093112
"801";"Frederikssund.11-09-2017.pdf";18;7;3008;"Frederikssund Kommune";"11-09-2017";3033;0,00593471810089021;0,00230794592812397;2017;"09";2017-09-11;1,58455382021696;0,738974403676505;45036;70121;710;6,8;6,9;"John Andersen";"John Andersen ";0;"V";"V";0;0;0;-0,100000000000001;2,32027042202132
"802";"Frederikssund.14-03-2018.pdf";1;2;1204;"Frederikssund Kommune";"14-03-2018";1207;0,000828500414250207;0,00165700082850041;2018;"03";2018-03-14;0,221207389152077;0,530550210995583;45189;67857;683;7,1;7,2;"John Andersen";"John Andersen ";0;"V";"V";0;0;0;-0,100000000000001;2,23203478625431
"803";"Frederikssund.14-08-2017.pdf";30;11;2290;"Frederikssund Kommune";"14-08-2017";2331;0,0128700128700129;0,00471900471900472;2017;"08";2017-08-14;3,43625892801232;1,51096421093701;45036;70121;710;6,8;6,9;"John Andersen";"John Andersen ";0;"V";"V";0;0;0;-0,100000000000001;2,32027042202132
"804";"Frederikssund.14-12-2017.pdf";0;1;336;"Frederikssund Kommune";"14-12-2017";337;0;0,0029673590504451;2017;"12";2017-12-14;0;0,950109947584078;45036;70121;710;6,8;6,9;"John Andersen";"John Andersen ";0;"V";"V";0;0;0;-0,100000000000001;2,32027042202132
"805";"Frederikssund.15-08-2016.pdf";6;1;2138;"Frederikssund Kommune";"15-08-2016";2145;0,0027972027972028;0,000466200466200466;2016;"08";2016-08-15;0,746845646731628;0,149271353070319;44725;68446;802;6,8;7,1;"John Andersen";"John Andersen ";0;"V";"V";0;0;0;-0,3;2,62092518093112
"806";"Frederikssund.15-08-2018.pdf";52;0;2652;"Frederikssund Kommune";"15-08-2018";2704;0,0192307692307692;0;2018;"08";2018-08-15;5,13456382127995;0;45189;67857;683;7,1;7,2;"John Andersen";"John Andersen ";0;"V";"V";0;0;0;-0,100000000000001;2,23203478625431
"807";"Frederikssund.16-01-2019.pdf";4;5;2251;"Frederikssund Kommune";"16-01-2019";2260;0,00176991150442478;0,00221238938053097;2019;"01";2019-01-16;0,472561626029305;0,708378434371315;45332;69504;667;6,8;7;"John Andersen";"John Andersen ";0;"V";"V";0;0;0;-0,2;2,17974700209608
"808";"Frederikssund.19-03-2019.pdf";1;0;466;"Frederikssund Kommune";"19-03-2019";467;0,00214132762312634;0;2019;"03";2019-03-19;0,571728733847018;0;45332;69504;667;6,8;7;"John Andersen";"John Andersen ";0;"V";"V";0;0;0;-0,2;2,17974700209608
"809";"Frederikssund.23-01-2018.pdf";0;2;525;"Frederikssund Kommune";"23-01-2018";527;0;0,00379506641366224;2018;"01";2018-01-23;0;1,21513112840924;45189;67857;683;7,1;7,2;"John Andersen";"John Andersen ";0;"V";"V";0;0;0;-0,100000000000001;2,23203478625431
"810";"Frederikssund.23-10-2017.pdf";3;3;1840;"Frederikssund Kommune";"23-10-2017";1846;0,00162513542795233;0,00162513542795233;2017;"10";2017-10-23;0,433906801798305;0,520347322322591;45036;70121;710;6,8;6,9;"John Andersen";"John Andersen ";0;"V";"V";0;0;0;-0,100000000000001;2,32027042202132
"811";"Frederikssund.28-11-2016.pdf";23;3;2830;"Frederikssund Kommune";"28-11-2016";2856;0,00805322128851541;0,00105042016806723;2016;"11";2016-11-28;2,15018849098418;0,336330937327557;44725;68446;802;6,8;7,1;"John Andersen";"John Andersen ";0;"V";"V";0;0;0;-0,3;2,62092518093112
"812";"Frederikssund.29-02-2016.pdf";27;1;2528;"Frederikssund Kommune";"29-02-2016";2556;0,0105633802816901;0,000391236306729264;2016;"02";2016-02-29;2,82039421168898;0,125268799818401;44725;68446;802;6,8;7,1;"John Andersen";"John Andersen ";0;"V";"V";0;0;0;-0,3;2,62092518093112
"813";"Frederikssund.31-10-2016.pdf";6;4;1068;"Frederikssund Kommune";"31-10-2016";1078;0,00556586270871985;0,00371057513914657;2016;"10";2016-10-31;1,48607041951702;1,18807811627397;44725;68446;802;6,8;7,1;"John Andersen";"John Andersen ";0;"V";"V";0;0;0;-0,3;2,62092518093112
"814";"Furesoe.02-10-2018.pdf";6;1;3177;"Furesø Kommune";"02-10-2018";3184;0,00188442211055276;0,000314070351758794;2018;"10";2018-10-02;0,503135650828939;0,100561260155727;40911;70150;607;7,7;7,7;"Ole Christensen";"Ole Christensen";0;"S";"S";0;0;0;0;1,98366781150273
"815";"Furesoe.03-04-2019.pdf";3;6;3596;"Furesø Kommune";"03-04-2019";3605;0,000832177531206657;0,00166435506241331;2019;"04";2019-04-03;0,22218916952002;0,532904941474343;41069;70613;613;7,8;7,8;"Ole Christensen";"Ole Christensen";0;"S";"S";0;0;0;0;2,00327573056207
"816";"Furesoe.04-10-2017.pdf";3;2;1349;"Furesø Kommune";"04-10-2017";1354;0,00221565731166913;0,00147710487444609;2017;"10";2017-10-04;0,591574561388236;0,472949855739785;40613;68966;596;8,1;7,9;"Ole Christensen";"Ole Christensen";0;"S";"S";0;0;0;0,199999999999999;1,94771995989395
"817";"Furesoe.04-12-2018.pdf";27;12;7075;"Furesø Kommune";"04-12-2018";7114;0,00379533314590947;0,00168681473151532;2018;"12";2018-12-04;1,01334377355595;0,540096236720552;40911;70150;607;7,7;7,7;"Ole Christensen";"Ole Christensen";0;"S";"S";0;0;0;0;1,98366781150273
"818";"Furesoe.05-04-2017.pdf";6;1;2413;"Furesø Kommune";"05-04-2017";2420;0,00247933884297521;0,000413223140495868;2017;"04";2017-04-05;0,661976823239398;0,132308699312328;40613;68966;596;8,1;7,9;"Ole Christensen";"Ole Christensen";0;"S";"S";0;0;0;0,199999999999999;1,94771995989395
"819";"Furesoe.05-10-2016.pdf";7;1;2408;"Furesø Kommune";"05-10-2016";2416;0,00289735099337748;0,000413907284768212;2016;"10";2016-10-05;0,773584946583568;0,132527753450262;40156;67234;590;8;7,9;"Ole Christensen";"Ole Christensen";0;"S";"S";0;0;0;0,0999999999999996;1,92811204083462
"820";"Furesoe.06-02-2019.pdf";1;2;1455;"Furesø Kommune";"06-02-2019";1458;0,000685871056241427;0,00137174211248285;2019;"02";2019-02-06;0,183125732994895;0,439214063560815;41069;70613;613;7,8;7,8;"Ole Christensen";"Ole Christensen";0;"S";"S";0;0;0;0;2,00327573056207
"821";"Furesoe.06-04-2016.pdf";107;13;3737;"Furesø Kommune";"06-04-2016";3857;0,0277417682136375;0,00337049520352606;2016;"04";2016-04-06;7,40697772922002;1,07918892412908;40156;67234;590;8;7,9;"Ole Christensen";"Ole Christensen";0;"S";"S";0;0;0;0,0999999999999996;1,92811204083462
"822";"Furesoe.06-09-2017.pdf";3;32;3921;"Furesø Kommune";"06-09-2017";3956;0,000758341759352882;0,00808897876643074;2017;"09";2017-09-06;0,202475216410433;2,58998626763061;40613;68966;596;8,1;7,9;"Ole Christensen";"Ole Christensen";0;"S";"S";0;0;0;0,199999999999999;1,94771995989395
"823";"Furesoe.06-11-2018.pdf";2;1;2691;"Furesø Kommune";"06-11-2018";2694;0,000742390497401633;0,000371195248700817;2018;"11";2018-11-06;0,198216272239463;0,118851912522581;40911;70150;607;7,7;7,7;"Ole Christensen";"Ole Christensen";0;"S";"S";0;0;0;0;1,98366781150273
"824";"Furesoe.06-12-2017.pdf";45;17;6869;"Furesø Kommune";"06-12-2017";6931;0,0064925696147742;0,00245274852113692;2017;"12";2017-12-06;1,73349867866038;0,785338319103907;40613;68966;596;8,1;7,9;"Ole Christensen";"Ole Christensen";0;"S";"S";0;0;0;0,199999999999999;1,94771995989395
"825";"Furesoe.07-06-2017.pdf";7;11;5825;"Furesø Kommune";"07-06-2017";5843;0,00119801471846654;0,00188259455759028;2017;"06";2017-06-07;0,319866717601557;0,602782402138315;40613;68966;596;8,1;7,9;"Ole Christensen";"Ole Christensen";0;"S";"S";0;0;0;0,199999999999999;1,94771995989395
"826";"Furesoe.07-06-2018.pdf";4;6;2844;"Furesø Kommune";"07-06-2018";2854;0,00140154169586545;0,00210231254379818;2018;"06";2018-06-07;0,374207874851517;0,673133256487388;40911;70150;607;7,7;7,7;"Ole Christensen";"Ole Christensen";0;"S";"S";0;0;0;0;1,98366781150273
"827";"Furesoe.07-09-2016.pdf";0;1;2389;"Furesø Kommune";"07-09-2016";2390;0;0,000418410041841004;2016;"09";2016-09-07;0;0,133969477964784;40156;67234;590;8;7,9;"Ole Christensen";"Ole Christensen";0;"S";"S";0;0;0;0,0999999999999996;1,92811204083462
"828";"Furesoe.07-12-2016.pdf";9;4;4403;"Furesø Kommune";"07-12-2016";4416;0,00203804347826087;0,000905797101449275;2016;"12";2016-12-07;0,544152144103038;0,290024503927386;40156;67234;590;8;7,9;"Ole Christensen";"Ole Christensen";0;"S";"S";0;0;0;0,0999999999999996;1,92811204083462
"829";"Furesoe.08-03-2017.pdf";129;4;5714;"Furesø Kommune";"08-03-2017";5847;0,0220625962031811;0,000684111510176159;2017;"03";2017-03-08;5,89065402995483;0,21904364791232;40613;68966;596;8,1;7,9;"Ole Christensen";"Ole Christensen";0;"S";"S";0;0;0;0,199999999999999;1,94771995989395
"830";"Furesoe.08-05-2018.pdf";1;5;3878;"Furesø Kommune";"08-05-2018";3884;0,000257466529351184;0,00128733264675592;2018;"05";2018-05-08;0,0687428729934493;0,412187245540466;40911;70150;607;7,7;7,7;"Ole Christensen";"Ole Christensen";0;"S";"S";0;0;0;0;1,98366781150273
"831";"Furesoe.08-06-2016.pdf";19;12;5332;"Furesø Kommune";"08-06-2016";5363;0,00354279321275406;0,00223755360805519;2016;"06";2016-06-08;0,945916288537122;0,716435694206603;40156;67234;590;8;7,9;"Ole Christensen";"Ole Christensen";0;"S";"S";0;0;0;0,0999999999999996;1,92811204083462
"832";"Furesoe.08-11-2017.pdf";5;1;1791;"Furesø Kommune";"08-11-2017";1797;0,00278241513633834;0,000556483027267668;2017;"11";2017-11-08;0,742897380930877;0,178178660175756;40613;68966;596;8,1;7,9;"Ole Christensen";"Ole Christensen";0;"S";"S";0;0;0;0,199999999999999;1,94771995989395
"833";"Furesoe.09-03-2016.pdf";91;7;3824;"Furesø Kommune";"09-03-2016";3922;0,0232024477307496;0,00178480367159612;2016;"03";2016-03-09;6,19499133153919;0,571471026606537;40156;67234;590;8;7,9;"Ole Christensen";"Ole Christensen";0;"S";"S";0;0;0;0,0999999999999996;1,92811204083462
"834";"Furesoe.09-11-2016.pdf";51;2;3970;"Furesø Kommune";"09-11-2016";4023;0,0126771066368382;0,000497141436738752;2016;"11";2016-11-09;3,38475348099289;0,159178251223383;40156;67234;590;8;7,9;"Ole Christensen";"Ole Christensen";0;"S";"S";0;0;0;0,0999999999999996;1,92811204083462
"835";"Furesoe.10-02-2016.pdf";4;2;2372;"Furesø Kommune";"10-02-2016";2378;0,00168208578637511;0,000841042893187553;2016;"02";2016-02-10;0,449112394796564;0,269291044857724;40156;67234;590;8;7,9;"Ole Christensen";"Ole Christensen";0;"S";"S";0;0;0;0,0999999999999996;1,92811204083462
"836";"Furesoe.11-05-2016.pdf";7;3;2578;"Furesø Kommune";"11-05-2016";2588;0,0027047913446677;0,00115919629057187;2016;"05";2016-05-11;0,722172036686978;0,37115964335684;40156;67234;590;8;7,9;"Ole Christensen";"Ole Christensen";0;"S";"S";0;0;0;0,0999999999999996;1,92811204083462
"837";"Furesoe.11-05-2017.pdf";9;4;3106;"Furesø Kommune";"11-05-2017";3119;0,00288554023725553;0,00128246232766912;2017;"05";2017-05-11;0,770431506367109;0,41062783242813;40613;68966;596;8,1;7,9;"Ole Christensen";"Ole Christensen";0;"S";"S";0;0;0;0,199999999999999;1,94771995989395
"838";"Furesoe.13-01-2016.pdf";48;24;4089;"Furesø Kommune";"13-01-2016";4161;0,0115356885364095;0,00576784426820476;2016;"01";2016-01-13;3,07999790865531;1,84678905456862;40156;67234;590;8;7,9;"Ole Christensen";"Ole Christensen";0;"S";"S";0;0;0;0,0999999999999996;1,92811204083462
"839";"Furesoe.14-08-2018.pdf";43;8;4537;"Furesø Kommune";"14-08-2018";4588;0,00937227550130776;0,001743679163034;2018;"08";2018-08-14;2,50237242902833;0,558303491431271;40911;70150;607;7,7;7,7;"Ole Christensen";"Ole Christensen";0;"S";"S";0;0;0;0;1,98366781150273
"840";"Furesoe.18-01-2017.pdf";34;8;2290;"Furesø Kommune";"18-01-2017";2332;0,0145797598627787;0,00343053173241852;2017;"01";2017-01-18;3,8927567907474;1,09841184334763;40613;68966;596;8,1;7,9;"Ole Christensen";"Ole Christensen";0;"S";"S";0;0;0;0,199999999999999;1,94771995989395
"841";"Furesoe.23-08-2017.pdf";6;9;2328;"Furesø Kommune";"23-08-2017";2343;0,00256081946222791;0,00384122919334187;2017;"08";2017-08-23;0,68373193010642;1,22991185276249;40613;68966;596;8,1;7,9;"Ole Christensen";"Ole Christensen";0;"S";"S";0;0;0;0,199999999999999;1,94771995989395
"842";"Furesoe.24-08-2016.pdf";7;7;3733;"Furesø Kommune";"24-08-2016";3747;0,00186816119562317;0,00186816119562317;2016;"08";2016-08-24;0,498794030143021;0,598161026514769;40156;67234;590;8;7,9;"Ole Christensen";"Ole Christensen";0;"S";"S";0;0;0;0,0999999999999996;1,92811204083462
"843";"Furesoe.31-01-2017.pdf";0;1;550;"Furesø Kommune";"31-01-2017";551;0;0,00181488203266788;2017;"01";2017-01-31;0;0,581101728377194;40613;68966;596;8,1;7,9;"Ole Christensen";"Ole Christensen";0;"S";"S";0;0;0;0,199999999999999;1,94771995989395
"844";"Faaborg.03-01-2019.pdf";1;1;676;"Faaborg-Midtfyn Kommune";"03-01-2019";678;0,00147492625368732;0,00147492625368732;2019;"01";2019-01-03;0,393801355024421;0,472252289580876;51809;65106;402;6,6;6,4;"Christian Thygesen";"Hans Stavnsager";1;"V";"S";1;1;0;0,199999999999999;1,31373057697545
"845";"Faaborg.08-02-2017.pdf";5;2;2518;"Faaborg-Midtfyn Kommune";"08-02-2017";2525;0,00198019801980198;0,000792079207920792;2017;"02";2017-02-08;0,528707561795163;0,253613506800661;51376;63786;383;7,1;6,8;"Christian Thygesen";"Hans Stavnsager";1;"V";"S";1;1;0;0,3;1,25163883328756
"846";"Faaborg.11-10-2017.pdf";0;0;1632;"Faaborg-Midtfyn Kommune";"11-10-2017";1632;0;0;2017;"10";2017-10-11;0;0;51376;63786;383;7,1;6,8;"Christian Thygesen";"Hans Stavnsager";1;"V";"S";1;1;0;0,3;1,25163883328756
"847";"Faaborg.12-10-2016.pdf";8;1;1378;"Faaborg-Midtfyn Kommune";"12-10-2016";1387;0,00576784426820476;0,000720980533525595;2016;"10";2016-10-12;1,53999895432765;0,230848631821077;51236;61068;370;6,7;6,6;"Christian Thygesen";"Hans Stavnsager";1;"V";"S";1;1;0;0,100000000000001;1,209155008659
"848";"Faaborg.12-12-2016.pdf";0;0;62;"Faaborg-Midtfyn Kommune";"12-12-2016";62;0;0;2016;"12";2016-12-12;0;0;51236;61068;370;6,7;6,6;"Christian Thygesen";"Hans Stavnsager";1;"V";"S";1;1;0;0,100000000000001;1,209155008659
"849";"Faaborg.13-12-2017.pdf";3;7;2228;"Faaborg-Midtfyn Kommune";"13-12-2017";2238;0,00134048257372654;0,0031277926720286;2017;"12";2017-12-13;0,357905252957851;1,00147871597446;51376;63786;383;7,1;6,8;"Christian Thygesen";"Hans Stavnsager";1;"V";"S";1;1;0;0,3;1,25163883328756
"850";"Faaborg.14-08-2017.pdf";0;1;620;"Faaborg-Midtfyn Kommune";"14-08-2017";621;0;0,00161030595813205;2017;"08";2017-08-14;0;0,515599118093131;51376;63786;383;7,1;6,8;"Christian Thygesen";"Hans Stavnsager";1;"V";"S";1;1;0;0,3;1,25163883328756
"851";"Faaborg.14-09-2016.pdf";1;6;1431;"Faaborg-Midtfyn Kommune";"14-09-2016";1438;0,000695410292072323;0,00417246175243394;2016;"09";2016-09-14;0,185672683384254;1,33596822949583;51236;61068;370;6,7;6,6;"Christian Thygesen";"Hans Stavnsager";1;"V";"S";1;1;0;0,100000000000001;1,209155008659
"852";"Faaborg.15-03-2017.pdf";5;3;3055;"Faaborg-Midtfyn Kommune";"15-03-2017";3063;0,00163238654913484;0,000979431929480901;2017;"03";2017-03-15;0,435842831711651;0,313601422464088;51376;63786;383;7,1;6,8;"Christian Thygesen";"Hans Stavnsager";1;"V";"S";1;1;0;0,3;1,25163883328756
"853";"Faaborg.15-06-2016.pdf";2;4;2119;"Faaborg-Midtfyn Kommune";"15-06-2016";2125;0,000941176470588235;0,00188235294117647;2016;"06";2016-06-15;0,25129159407676;0,602705039690982;51236;61068;370;6,7;6,6;"Christian Thygesen";"Hans Stavnsager";1;"V";"S";1;1;0;0,100000000000001;1,209155008659
"854";"Faaborg.15-11-2017.pdf";26;2;1913;"Faaborg-Midtfyn Kommune";"15-11-2017";1941;0,0133951571354972;0,00103039670273055;2017;"11";2017-11-15;3,57647103883075;0,329919682983858;51376;63786;383;7,1;6,8;"Christian Thygesen";"Hans Stavnsager";1;"V";"S";1;1;0;0,3;1,25163883328756
"855";"Faaborg.16-03-2016.pdf";16;0;1944;"Faaborg-Midtfyn Kommune";"16-03-2016";1960;0,00816326530612245;0;2016;"03";2016-03-16;2,17956994862496;0;51236;61068;370;6,7;6,6;"Christian Thygesen";"Hans Stavnsager";1;"V";"S";1;1;0;0,100000000000001;1,209155008659
"856";"Faaborg.16-11-2016.pdf";3;3;1767;"Faaborg-Midtfyn Kommune";"16-11-2016";1773;0,00169204737732657;0,00169204737732657;2016;"11";2016-11-16;0,451772112870655;0,541771662158772;51236;61068;370;6,7;6,6;"Christian Thygesen";"Hans Stavnsager";1;"V";"S";1;1;0;0,100000000000001;1,209155008659
"857";"Faaborg.17-01-2017.pdf";4;8;2116;"Faaborg-Midtfyn Kommune";"17-01-2017";2128;0,0018796992481203;0,0037593984962406;2017;"01";2017-01-17;0,501874659222852;1,20371072306705;51376;63786;383;7,1;6,8;"Christian Thygesen";"Hans Stavnsager";1;"V";"S";1;1;0;0,3;1,25163883328756
"858";"Faaborg.17-04-2018.pdf";11;19;3185;"Faaborg-Midtfyn Kommune";"17-04-2018";3215;0,00342146189735614;0,00590979782270607;2018;"04";2018-04-17;0,91352115265074;1,89224074475299;51536;65149;399;7,1;6,9;"Christian Thygesen";"Hans Stavnsager";1;"V";"S";1;1;0;0,199999999999999;1,30392661744578
"859";"Faaborg.17-05-2017.pdf";2;1;2370;"Faaborg-Midtfyn Kommune";"17-05-2017";2373;0,000842815002107038;0,000421407501053519;2017;"05";2017-05-17;0,22502934572824;0,134929225594536;51376;63786;383;7,1;6,8;"Christian Thygesen";"Hans Stavnsager";1;"V";"S";1;1;0;0,3;1,25163883328756
"860";"Faaborg.17-08-2016.pdf";11;2;2289;"Faaborg-Midtfyn Kommune";"17-08-2016";2302;0,00477845351867941;0,000868809730668983;2016;"08";2016-08-17;1,27583427705132;0,278181626703592;51236;61068;370;6,7;6,6;"Christian Thygesen";"Hans Stavnsager";1;"V";"S";1;1;0;0,100000000000001;1,209155008659
"861";"Faaborg.18-05-2016.pdf";8;2;604;"Faaborg-Midtfyn Kommune";"18-05-2016";614;0,0130293159609121;0,00325732899022801;2016;"05";2016-05-18;3,47879242614407;1,04295456786917;51236;61068;370;6,7;6,6;"Christian Thygesen";"Hans Stavnsager";1;"V";"S";1;1;0;0,100000000000001;1,209155008659
"862";"Faaborg.18-09-2018.pdf";13;24;2225;"Faaborg-Midtfyn Kommune";"18-09-2018";2262;0,00574712643678161;0,0106100795755968;2018;"09";2018-09-18;1,53446734888826;3,39721010435898;51536;65149;399;7,1;6,9;"Christian Thygesen";"Hans Stavnsager";1;"V";"S";1;1;0;0,199999999999999;1,30392661744578
"863";"Faaborg.18-12-2018.pdf";0;9;2614;"Faaborg-Midtfyn Kommune";"18-12-2018";2623;0;0,00343118566526878;2018;"12";2018-12-18;0;1,09862122417938;51536;65149;399;7,1;6,9;"Christian Thygesen";"Hans Stavnsager";1;"V";"S";1;1;0;0,199999999999999;1,30392661744578
"864";"Faaborg.19-04-2017.pdf";2;4;1530;"Faaborg-Midtfyn Kommune";"19-04-2017";1536;0,00130208333333333;0,00260416666666667;2017;"04";2017-04-19;0,347652758732496;0,833820448791235;51376;63786;383;7,1;6,8;"Christian Thygesen";"Hans Stavnsager";1;"V";"S";1;1;0;0,3;1,25163883328756
"865";"Faaborg.19-06-2018.pdf";30;3;3104;"Faaborg-Midtfyn Kommune";"19-06-2018";3137;0,00956327701625757;0,000956327701625757;2018;"06";2018-06-19;2,55336932138882;0,306203747850654;51536;65149;399;7,1;6,9;"Christian Thygesen";"Hans Stavnsager";1;"V";"S";1;1;0;0,199999999999999;1,30392661744578
"866";"Faaborg.20-01-2016.pdf";0;2;887;"Faaborg-Midtfyn Kommune";"20-01-2016";889;0;0,00224971878515186;2016;"01";2016-01-20;0;0,720330826402327;51236;61068;370;6,7;6,6;"Christian Thygesen";"Hans Stavnsager";1;"V";"S";1;1;0;0,100000000000001;1,209155008659
"867";"Faaborg.20-02-2018.pdf";6;4;1506;"Faaborg-Midtfyn Kommune";"20-02-2018";1516;0,00395778364116095;0,00263852242744063;2018;"02";2018-02-20;1,05671762021065;0,844820718564206;51536;65149;399;7,1;6,9;"Christian Thygesen";"Hans Stavnsager";1;"V";"S";1;1;0;0,199999999999999;1,30392661744578
"868";"Faaborg.20-03-2018.pdf";1;0;3163;"Faaborg-Midtfyn Kommune";"20-03-2018";3164;0,000316055625790139;0;2018;"03";2018-03-20;0,0843860046480901;0;51536;65149;399;7,1;6,9;"Christian Thygesen";"Hans Stavnsager";1;"V";"S";1;1;0;0,199999999999999;1,30392661744578
"869";"Faaborg.20-04-2016.pdf";20;5;3023;"Faaborg-Midtfyn Kommune";"20-04-2016";3048;0,00656167979002625;0,00164041994750656;2016;"04";2016-04-20;1,75195091014801;0,52524122758503;51236;61068;370;6,7;6,6;"Christian Thygesen";"Hans Stavnsager";1;"V";"S";1;1;0;0,100000000000001;1,209155008659
"870";"Faaborg.20-09-2017.pdf";1;0;1535;"Faaborg-Midtfyn Kommune";"20-09-2017";1536;0,000651041666666667;0;2017;"09";2017-09-20;0,173826379366248;0;51376;63786;383;7,1;6,8;"Christian Thygesen";"Hans Stavnsager";1;"V";"S";1;1;0;0,3;1,25163883328756
"871";"Faaborg.20-11-2018.pdf";7;0;709;"Faaborg-Midtfyn Kommune";"20-11-2018";716;0,00977653631284916;0;2018;"11";2018-11-20;2,61030898176802;0;51536;65149;399;7,1;6,9;"Christian Thygesen";"Hans Stavnsager";1;"V";"S";1;1;0;0,199999999999999;1,30392661744578
"872";"Faaborg.21-06-2017.pdf";4;5;3793;"Faaborg-Midtfyn Kommune";"21-06-2017";3802;0,00105207785376118;0,00131509731720147;2017;"06";2017-06-21;0,280901966024784;0,421077133529503;51376;63786;383;7,1;6,8;"Christian Thygesen";"Hans Stavnsager";1;"V";"S";1;1;0;0,3;1,25163883328756
"873";"Faaborg.21-08-2018.pdf";0;0;861;"Faaborg-Midtfyn Kommune";"21-08-2018";861;0;0;2018;"08";2018-08-21;0;0;51536;65149;399;7,1;6,9;"Christian Thygesen";"Hans Stavnsager";1;"V";"S";1;1;0;0,199999999999999;1,30392661744578
"874";"Faaborg.21-12-2016.pdf";5;13;3187;"Faaborg-Midtfyn Kommune";"21-12-2016";3205;0,0015600624024961;0,00405616224648986;2016;"12";2016-12-21;0,416532478481368;1,29873063349948;51236;61068;370;6,7;6,6;"Christian Thygesen";"Hans Stavnsager";1;"V";"S";1;1;0;0,100000000000001;1,209155008659
"875";"Faaborg.22-01-2019.pdf";0;4;834;"Faaborg-Midtfyn Kommune";"22-01-2019";838;0;0,00477326968973747;2019;"01";2019-01-22;0;1,52833915196102;51809;65106;402;6,6;6,4;"Christian Thygesen";"Hans Stavnsager";1;"V";"S";1;1;0;0,199999999999999;1,31373057697545
"876";"Faaborg.22-05-2018.pdf";0;8;2005;"Faaborg-Midtfyn Kommune";"22-05-2018";2013;0;0,00397416790859414;2018;"05";2018-05-22;0;1,27247710814042;51536;65149;399;7,1;6,9;"Christian Thygesen";"Hans Stavnsager";1;"V";"S";1;1;0;0,199999999999999;1,30392661744578
"877";"Faaborg.23-01-2019.pdf";0;0;411;"Faaborg-Midtfyn Kommune";"23-01-2019";411;0;0;2019;"01";2019-01-23;0;0;51809;65106;402;6,6;6,4;"Christian Thygesen";"Hans Stavnsager";1;"V";"S";1;1;0;0,199999999999999;1,31373057697545
"878";"Faaborg.23-08-2017.pdf";1;2;1504;"Faaborg-Midtfyn Kommune";"23-08-2017";1507;0,0006635700066357;0,0013271400132714;2017;"08";2017-08-23;0,177171412545824;0,424933048886309;51376;63786;383;7,1;6,8;"Christian Thygesen";"Hans Stavnsager";1;"V";"S";1;1;0;0,3;1,25163883328756
"879";"Faaborg.23-10-2018.pdf";8;26;2476;"Faaborg-Midtfyn Kommune";"23-10-2018";2510;0,00318725099601594;0,0103585657370518;2018;"10";2018-10-23;0,850987469981059;3,31667862977358;51536;65149;399;7,1;6,9;"Christian Thygesen";"Hans Stavnsager";1;"V";"S";1;1;0;0,199999999999999;1,30392661744578
"880";"Faaborg.24-02-2016.pdf";18;1;1170;"Faaborg-Midtfyn Kommune";"24-02-2016";1189;0,0151387720773759;0,000841042893187553;2016;"02";2016-02-24;4,04201155316907;0,269291044857724;51236;61068;370;6,7;6,6;"Christian Thygesen";"Hans Stavnsager";1;"V";"S";1;1;0;0,100000000000001;1,209155008659
"881";"Faaborg.26-02-2019.pdf";21;4;2443;"Faaborg-Midtfyn Kommune";"26-02-2019";2468;0,00850891410048622;0,00162074554294976;2019;"02";2019-02-26;2,27185724993424;0,518941737983524;51809;65106;402;6,6;6,4;"Christian Thygesen";"Hans Stavnsager";1;"V";"S";1;1;0;0,199999999999999;1,31373057697545
"882";"Faaborg.26-03-2019.pdf";4;12;3225;"Faaborg-Midtfyn Kommune";"26-03-2019";3241;0,00123418697932737;0,0037025609379821;2019;"03";2019-03-26;0,329524614262952;1,18551207282629;51809;65106;402;6,6;6,4;"Christian Thygesen";"Hans Stavnsager";1;"V";"S";1;1;0;0,199999999999999;1,31373057697545
"883";"Gentofte.03-04-2018.pdf";0;0;126;"Gentofte Kommune";"03-04-2018";126;0;0;2018;"04";2018-04-03;0;0;75803;58893;631;8,3;8,1;"Hans Toft";"Hans Toft";0;"C";"C";0;0;0;0,200000000000001;2,06209948774007
"884";"Gentofte.05-02-2019.pdf";19;7;2938;"Gentofte Kommune";"05-02-2019";2964;0,00641025641025641;0,00236167341430499;2019;"02";2019-02-05;1,71152127375998;0,756177249106221;75176;58904;629;8,2;8,1;"Hans Toft";"Hans Toft";0;"C";"C";0;0;0;0,0999999999999996;2,05556351472029
"885";"Gentofte.05-12-2016.pdf";1;0;1039;"Gentofte Kommune";"05-12-2016";1040;0,000961538461538462;0;2016;"12";2016-12-05;0,256728191063997;0;75350;56148;698;8,2;8,2;"Hans Toft";"Hans Toft";0;"C";"C";0;0;0;0;2,28105458390265
"886";"Gentofte.06-02-2017.pdf";2;13;1506;"Gentofte Kommune";"06-02-2017";1521;0,00131492439184747;0,00854700854700855;2017;"02";2017-02-06;0,351081286925124;2,73664147295585;75805;56815;663;8,2;8,2;"Hans Toft";"Hans Toft";0;"C";"C";0;0;0;0;2,16667505605653
"887";"Gentofte.07-12-2017.pdf";0;16;2439;"Gentofte Kommune";"07-12-2017";2455;0;0,0065173116089613;2017;"12";2017-12-07;0;2,08675879322743;75805;56815;663;8,2;8,2;"Hans Toft";"Hans Toft";0;"C";"C";0;0;0;0;2,16667505605653
"888";"Gentofte.08-02-2016.pdf";5;26;2124;"Gentofte Kommune";"08-02-2016";2155;0,00232018561484919;0,0120649651972158;2016;"02";2016-02-08;0,619483338066258;3,86304564303095;75350;56148;698;8,2;8,2;"Hans Toft";"Hans Toft";0;"C";"C";0;0;0;0;2,28105458390265
"889";"Gentofte.08-11-2017.pdf";10;1;1310;"Gentofte Kommune";"08-11-2017";1321;0,00757002271006813;0,000757002271006813;2017;"11";2017-11-08;2,02117576613594;0,242382325765204;75805;56815;663;8,2;8,2;"Hans Toft";"Hans Toft";0;"C";"C";0;0;0;0;2,16667505605653
"890";"Gentofte.09-05-2016.pdf";18;32;2800;"Gentofte Kommune";"09-05-2016";2850;0,00631578947368421;0,0112280701754386;2016;"05";2016-05-09;1,68629885498878;3,59508269289358;75350;56148;698;8,2;8,2;"Hans Toft";"Hans Toft";0;"C";"C";0;0;0;0;2,28105458390265
"891";"Gentofte.09-05-2018.pdf";3;2;1872;"Gentofte Kommune";"09-05-2018";1877;0,00159829515183804;0,00106553010122536;2018;"05";2018-05-09;0,426740520042446;0,341168942286451;75803;58893;631;8,3;8,1;"Hans Toft";"Hans Toft";0;"C";"C";0;0;0;0,200000000000001;2,06209948774007
"892";"Gentofte.11-12-2017.pdf";0;0;290;"Gentofte Kommune";"11-12-2017";290;0;0;2017;"12";2017-12-11;0;0;75805;56815;663;8,2;8,2;"Hans Toft";"Hans Toft";0;"C";"C";0;0;0;0;2,16667505605653
"893";"Gentofte.13-11-2018.pdf";4;27;2271;"Gentofte Kommune";"13-11-2018";2302;0,00173761946133797;0,0117289313640313;2018;"11";2018-11-13;0,463939737109569;3,75545196049849;75803;58893;631;8,3;8,1;"Hans Toft";"Hans Toft";0;"C";"C";0;0;0;0,200000000000001;2,06209948774007
"894";"Gentofte.14-03-2016.pdf";44;20;2438;"Gentofte Kommune";"14-03-2016";2502;0,017585931254996;0,00799360511590727;2016;"03";2016-03-14;4,69539649204177;2,55944885959899;75350;56148;698;8,2;8,2;"Hans Toft";"Hans Toft";0;"C";"C";0;0;0;0;2,28105458390265
"895";"Gentofte.14-08-2017.pdf";6;6;1562;"Gentofte Kommune";"14-08-2017";1574;0,00381194409148666;0,00381194409148666;2017;"08";2017-08-14;1,01777885148624;1,22053514232211;75805;56815;663;8,2;8,2;"Hans Toft";"Hans Toft";0;"C";"C";0;0;0;0;2,16667505605653
"896";"Gentofte.14-11-2016.pdf";6;14;1810;"Gentofte Kommune";"14-11-2016";1830;0,00327868852459016;0,00765027322404372;2016;"11";2016-11-14;0,875401044939532;2,44951843317032;75350;56148;698;8,2;8,2;"Hans Toft";"Hans Toft";0;"C";"C";0;0;0;0;2,28105458390265
"897";"Gentofte.15-05-2017.pdf";6;17;1473;"Gentofte Kommune";"15-05-2017";1496;0,00401069518716578;0,0113636363636364;2017;"05";2017-05-15;1,07084486112256;3,63848923108902;75805;56815;663;8,2;8,2;"Hans Toft";"Hans Toft";0;"C";"C";0;0;0;0;2,16667505605653
"898";"Gentofte.15-08-2016.pdf";2;41;2765;"Gentofte Kommune";"15-08-2016";2808;0,000712250712250712;0,0146011396011396;2016;"08";2016-08-15;0,190169030417776;4,67509584963291;75350;56148;698;8,2;8,2;"Hans Toft";"Hans Toft";0;"C";"C";0;0;0;0;2,28105458390265
"899";"Gentofte.17-12-2018.pdf";2;3;590;"Gentofte Kommune";"17-12-2018";595;0,00336134453781513;0,00504201680672269;2018;"12";2018-12-17;0,89746997884557;1,61438849917227;75803;58893;631;8,3;8,1;"Hans Toft";"Hans Toft";0;"C";"C";0;0;0;0,200000000000001;2,06209948774007
"900";"Gentofte.19-06-2017.pdf";0;0;520;"Gentofte Kommune";"19-06-2017";520;0;0;2017;"06";2017-06-19;0;0;75805;56815;663;8,2;8,2;"Hans Toft";"Hans Toft";0;"C";"C";0;0;0;0;2,16667505605653
"901";"Gentofte.19-08-2016.pdf";2;1;521;"Gentofte Kommune";"19-08-2016";524;0,00381679389312977;0,00190839694656489;2016;"08";2016-08-19;1,01907373552121;0,611043993007317;75350;56148;698;8,2;8,2;"Hans Toft";"Hans Toft";0;"C";"C";0;0;0;0;2,28105458390265
"902";"Gentofte.20-02-2018.pdf";1;4;1531;"Gentofte Kommune";"20-02-2018";1536;0,000651041666666667;0,00260416666666667;2018;"02";2018-02-20;0,173826379366248;0,833820448791235;75803;58893;631;8,3;8,1;"Hans Toft";"Hans Toft";0;"C";"C";0;0;0;0,200000000000001;2,06209948774007
"903";"Gentofte.21-08-2018.pdf";1;14;2566;"Gentofte Kommune";"21-08-2018";2581;0,000387446726075165;0,00542425416505231;2018;"08";2018-08-21;0,103447237003703;1,73677595222847;75803;58893;631;8,3;8,1;"Hans Toft";"Hans Toft";0;"C";"C";0;0;0;0,200000000000001;2,06209948774007
"904";"Gentofte.24-09-2018.pdf";0;0;100;"Gentofte Kommune";"24-09-2018";100;0;0;2018;"09";2018-09-24;0;0;75803;58893;631;8,3;8,1;"Hans Toft";"Hans Toft";0;"C";"C";0;0;0;0,200000000000001;2,06209948774007
"905";"Gentofte.25-09-2017.pdf";1;0;927;"Gentofte Kommune";"25-09-2017";928;0,00107758620689655;0;2017;"09";2017-09-25;0,287712627916549;0;75805;56815;663;8,2;8,2;"Hans Toft";"Hans Toft";0;"C";"C";0;0;0;0;2,16667505605653
"906";"Gentofte.27-02-2017.pdf";0;3;743;"Gentofte Kommune";"27-02-2017";746;0;0,00402144772117962;2017;"02";2017-02-27;0;1,28761549196716;75805;56815;663;8,2;8,2;"Hans Toft";"Hans Toft";0;"C";"C";0;0;0;0;2,16667505605653
"907";"Gentofte.27-03-2017.pdf";0;0;122;"Gentofte Kommune";"27-03-2017";122;0;0;2017;"03";2017-03-27;0;0;75805;56815;663;8,2;8,2;"Hans Toft";"Hans Toft";0;"C";"C";0;0;0;0;2,16667505605653
"908";"Gentofte.27-11-2017.pdf";1;1;435;"Gentofte Kommune";"27-11-2017";437;0,0022883295194508;0,0022883295194508;2017;"11";2017-11-27;0,610977846010428;0,732693483606028;75805;56815;663;8,2;8,2;"Hans Toft";"Hans Toft";0;"C";"C";0;0;0;0;2,16667505605653
"909";"Gentofte.28-05-2018.pdf";1;0;469;"Gentofte Kommune";"28-05-2018";470;0,00212765957446809;0;2018;"05";2018-05-28;0,568079401503313;0;75803;58893;631;8,3;8,1;"Hans Toft";"Hans Toft";0;"C";"C";0;0;0;0,200000000000001;2,06209948774007
"910";"Gentofte.28-08-2017.pdf";1;0;293;"Gentofte Kommune";"28-08-2017";294;0,00340136054421769;0;2017;"08";2017-08-28;0,908154145260399;0;75805;56815;663;8,2;8,2;"Hans Toft";"Hans Toft";0;"C";"C";0;0;0;0;2,16667505605653
"911";"Gentofte.29-05-2017.pdf";0;0;273;"Gentofte Kommune";"29-05-2017";273;0;0;2017;"05";2017-05-29;0;0;75805;56815;663;8,2;8,2;"Hans Toft";"Hans Toft";0;"C";"C";0;0;0;0;2,16667505605653
"912";"Gentofte.29-10-2018.pdf";0;0;362;"Gentofte Kommune";"29-10-2018";362;0;0;2018;"10";2018-10-29;0;0;75803;58893;631;8,3;8,1;"Hans Toft";"Hans Toft";0;"C";"C";0;0;0;0,200000000000001;2,06209948774007
"913";"Gladsaxe.03-01-2018.pdf";0;0;177;"Gladsaxe Kommune";"03-01-2018";177;0;0;2018;"01";2018-01-03;0;0;69484;69693;605;7,1;7,3;"Trine Græse";"Trine Græse";0;"S";"S";0;0;0;-0,2;1,97713183848295
"914";"Gladsaxe.07-02-2019.pdf";15;20;5494;"Gladsaxe Kommune";"07-02-2019";5529;0,00271296798697775;0,00361729064930367;2019;"02";2019-02-07;0,724355178259786;1,15820963044252;69681;71758;610;7,5;7,4;"Trine Græse";"Trine Græse";0;"S";"S";0;0;0;0,0999999999999996;1,9934717710324
"915";"Gladsaxe.07-03-2019.pdf";27;12;1719;"Gladsaxe Kommune";"07-03-2019";1758;0,015358361774744;0,0068259385665529;2019;"03";2019-03-07;4,10064141358194;2,18557714905006;69681;71758;610;7,5;7,4;"Trine Græse";"Trine Græse";0;"S";"S";0;0;0;0,0999999999999996;1,9934717710324
"916";"Gladsaxe.13-03-2017.pdf";1;1;933;"Gladsaxe Kommune";"13-03-2017";935;0,00106951871657754;0,00106951871657754;2017;"03";2017-03-13;0,285558629632681;0,342446045278967;68775;67488;601;7,3;7,3;"Trine Græse";"Trine Græse";0;"S";"S";0;0;0;0;1,9640598924434
"917";"Gladsaxe.13-11-2018.pdf";0;2;1339;"Gladsaxe Kommune";"13-11-2018";1341;0;0,00149142431021626;2018;"11";2018-11-13;0;0,477534753670148;69484;69693;605;7,1;7,3;"Trine Græse";"Trine Græse";0;"S";"S";0;0;0;-0,2;1,97713183848295
"918";"Gladsaxe.15-03-2016.pdf";17;17;6823;"Gladsaxe Kommune";"15-03-2016";6857;0,00247921831704827;0,00247921831704827;2016;"03";2016-03-15;0,661944643140072;0,793813605032694;67914;65689;601;7,1;7,3;"Trine Græse";"Trine Græse";0;"S";"S";0;0;0;-0,2;1,9640598924434
"919";"Gladsaxe.16-01-2018.pdf";0;3;941;"Gladsaxe Kommune";"16-01-2018";944;0;0,00317796610169492;2018;"01";2018-01-16;0;1,0175435985249;69484;69693;605;7,1;7,3;"Trine Græse";"Trine Græse";0;"S";"S";0;0;0;-0,2;1,97713183848295
"920";"Gladsaxe.17-01-2017.pdf";9;20;2226;"Gladsaxe Kommune";"17-01-2017";2255;0,00399113082039911;0,00886917960088692;2017;"01";2017-01-17;1,06562122765366;2,83979647304509;68775;67488;601;7,3;7,3;"Trine Græse";"Trine Græse";0;"S";"S";0;0;0;0;1,9640598924434
"921";"Gladsaxe.17-04-2018.pdf";14;14;3457;"Gladsaxe Kommune";"17-04-2018";3485;0,00401721664275466;0,00401721664275466;2018;"04";2018-04-17;1,07258607227885;1,28626075543807;69484;69693;605;7,1;7,3;"Trine Græse";"Trine Græse";0;"S";"S";0;0;0;-0,2;1,97713183848295
"922";"Gladsaxe.17-05-2016.pdf";6;3;2568;"Gladsaxe Kommune";"17-05-2016";2577;0,00232828870779977;0,00116414435389988;2016;"05";2016-05-17;0,621646842157293;0,372743949168608;67914;65689;601;7,1;7,3;"Trine Græse";"Trine Græse";0;"S";"S";0;0;0;-0,2;1,9640598924434
"923";"Gladsaxe.18-12-2018.pdf";11;44;7262;"Gladsaxe Kommune";"18-12-2018";7317;0,001503348366817;0,00601339346726801;2018;"12";2018-12-18;0,401389983022021;1,9254107288201;69484;69693;605;7,1;7,3;"Trine Græse";"Trine Græse";0;"S";"S";0;0;0;-0,2;1,97713183848295
"924";"Gladsaxe.19-04-2016.pdf";13;29;5497;"Gladsaxe Kommune";"19-04-2016";5539;0,00234699404224589;0,00523560209424084;2016;"04";2016-04-19;0,626641116299917;1,67637200175829;67914;65689;601;7,1;7,3;"Trine Græse";"Trine Græse";0;"S";"S";0;0;0;-0,2;1,9640598924434
"925";"Gladsaxe.19-06-2018.pdf";27;64;10536;"Gladsaxe Kommune";"19-06-2018";10627;0,00254069822151124;0,00602239578432295;2018;"06";2018-06-19;0,678359612786021;1,92829315418212;69484;69693;605;7,1;7,3;"Trine Græse";"Trine Græse";0;"S";"S";0;0;0;-0,2;1,97713183848295
"926";"Gladsaxe.19-12-2017.pdf";8;28;5758;"Gladsaxe Kommune";"19-12-2017";5794;0,00138073869520193;0,00483258543320677;2017;"12";2017-12-19;0,368653529453306;1,54733128501956;68775;67488;601;7,3;7,3;"Trine Græse";"Trine Græse";0;"S";"S";0;0;0;0;1,9640598924434
"927";"Gladsaxe.20-06-2017.pdf";40;15;5248;"Gladsaxe Kommune";"20-06-2017";5303;0,00754290024514426;0,0028285875919291;2017;"06";2017-06-20;2,01393414072455;0,905677123333493;68775;67488;601;7,3;7,3;"Trine Græse";"Trine Græse";0;"S";"S";0;0;0;0;1,9640598924434
"928";"Gladsaxe.20-11-2018.pdf";17;16;5846;"Gladsaxe Kommune";"20-11-2018";5879;0,00289164823949651;0,00272155128423201;2018;"11";2018-11-20;0,772062326588105;0,871405483479052;69484;69693;605;7,1;7,3;"Trine Græse";"Trine Græse";0;"S";"S";0;0;0;-0,2;1,97713183848295
"929";"Gladsaxe.20-12-2016.pdf";2;13;3590;"Gladsaxe Kommune";"20-12-2016";3605;0,000554785020804438;0,00360610263522885;2016;"12";2016-12-20;0,148126113013347;1,15462737319441;67914;65689;601;7,1;7,3;"Trine Græse";"Trine Græse";0;"S";"S";0;0;0;-0,2;1,9640598924434
"930";"Gladsaxe.21-06-2016.pdf";8;26;6477;"Gladsaxe Kommune";"21-06-2016";6511;0,00122868990938412;0,00399324220549839;2016;"06";2016-06-21;0,328056911327363;1,27858445104157;67914;65689;601;7,1;7,3;"Trine Græse";"Trine Græse";0;"S";"S";0;0;0;-0,2;1,9640598924434
"931";"Gladsaxe.22-05-2018.pdf";12;20;6637;"Gladsaxe Kommune";"22-05-2018";6669;0,00179937022042285;0,00299895036737142;2018;"05";2018-05-22;0,480427024213328;0,960225078230122;69484;69693;605;7,1;7,3;"Trine Græse";"Trine Græse";0;"S";"S";0;0;0;-0,2;1,97713183848295
"932";"Gladsaxe.22-11-2016.pdf";7;37;4346;"Gladsaxe Kommune";"22-11-2016";4390;0,00159453302961276;0,00842824601366743;2016;"11";2016-11-22;0,425736043495649;2,69861524747742;67914;65689;601;7,1;7,3;"Trine Græse";"Trine Græse";0;"S";"S";0;0;0;-0,2;1,9640598924434
"933";"Gladsaxe.23-02-2016.pdf";0;6;1419;"Gladsaxe Kommune";"23-02-2016";1425;0;0,00421052631578947;2016;"02";2016-02-23;0;1,34815600983509;67914;65689;601;7,1;7,3;"Trine Græse";"Trine Græse";0;"S";"S";0;0;0;-0,2;1,9640598924434
"934";"Gladsaxe.23-05-2017.pdf";8;14;2200;"Gladsaxe Kommune";"23-05-2017";2222;0,0036003600360036;0,0063006300630063;2017;"05";2017-05-23;0,961286475991205;2,01738016773253;68775;67488;601;7,3;7,3;"Trine Græse";"Trine Græse";0;"S";"S";0;0;0;0;1,9640598924434
"935";"Gladsaxe.23-10-2017.pdf";0;0;164;"Gladsaxe Kommune";"23-10-2017";164;0;0;2017;"10";2017-10-23;0;0;68775;67488;601;7,3;7,3;"Trine Græse";"Trine Græse";0;"S";"S";0;0;0;0;1,9640598924434
"936";"Gladsaxe.23-10-2018.pdf";6;48;4998;"Gladsaxe Kommune";"23-10-2018";5052;0,00118764845605701;0,00950118764845606;2018;"10";2018-10-23;0,317098953333203;3,04215726684878;69484;69693;605;7,1;7,3;"Trine Græse";"Trine Græse";0;"S";"S";0;0;0;-0,2;1,97713183848295
"937";"Gladsaxe.25-09-2018.pdf";8;11;3085;"Gladsaxe Kommune";"25-09-2018";3104;0,00257731958762887;0,00354381443298969;2018;"09";2018-09-25;0,688137419346797;1,13468349732415;69484;69693;605;7,1;7,3;"Trine Græse";"Trine Græse";0;"S";"S";0;0;0;-0,2;1,97713183848295
"938";"Gladsaxe.25-10-2016.pdf";10;3;3419;"Gladsaxe Kommune";"25-10-2016";3432;0,00291375291375291;0,000874125874125874;2016;"10";2016-10-25;0,777964215345446;0,279883787006848;67914;65689;601;7,1;7,3;"Trine Græse";"Trine Græse";0;"S";"S";0;0;0;-0,2;1,9640598924434
"939";"Gladsaxe.26-09-2017.pdf";4;9;4827;"Gladsaxe Kommune";"26-09-2017";4840;0,000826446280991736;0,0018595041322314;2017;"09";2017-09-26;0,220658941079799;0,595389146905477;68775;67488;601;7,3;7,3;"Trine Græse";"Trine Græse";0;"S";"S";0;0;0;0;1,9640598924434
"940";"Gladsaxe.27-02-2018.pdf";6;26;5488;"Gladsaxe Kommune";"27-02-2018";5520;0,00108695652173913;0,00471014492753623;2018;"02";2018-02-27;0,290214476854953;1,50812742042241;69484;69693;605;7,1;7,3;"Trine Græse";"Trine Græse";0;"S";"S";0;0;0;-0,2;1,97713183848295
"941";"Gladsaxe.27-04-2017.pdf";4;11;6157;"Gladsaxe Kommune";"27-04-2017";6172;0,000648088139987038;0,00178224238496436;2017;"04";2017-04-27;0,173037795662059;0,570650935789724;68775;67488;601;7,3;7,3;"Trine Græse";"Trine Græse";0;"S";"S";0;0;0;0;1,9640598924434
"942";"Gladsaxe.27-09-2016.pdf";4;12;2570;"Gladsaxe Kommune";"27-09-2016";2586;0,00154679040989946;0,00464037122969838;2016;"09";2016-09-27;0,412988892044172;1,48578678578113;67914;65689;601;7,1;7,3;"Trine Græse";"Trine Græse";0;"S";"S";0;0;0;-0,2;1,9640598924434
"943";"Gladsaxe.28-02-2017.pdf";4;11;3066;"Gladsaxe Kommune";"28-02-2017";3081;0,00129827977929244;0,0035702693930542;2017;"02";2017-02-28;0,346637220002022;1,14315403300687;68775;67488;601;7,3;7,3;"Trine Græse";"Trine Græse";0;"S";"S";0;0;0;0;1,9640598924434
"944";"Gladsaxe.28-03-2017.pdf";8;21;7413;"Gladsaxe Kommune";"28-03-2017";7442;0,00107497984412792;0,0028218220908358;2017;"03";2017-03-28;0,287016736045748;0,903510897480854;68775;67488;601;7,3;7,3;"Trine Græse";"Trine Græse";0;"S";"S";0;0;0;0;1,9640598924434
"945";"Gladsaxe.28-11-2017.pdf";8;7;3745;"Gladsaxe Kommune";"28-11-2017";3760;0,00212765957446809;0,00186170212765957;2017;"11";2017-11-28;0,568079401503313;0,59609291658267;68775;67488;601;7,3;7,3;"Trine Græse";"Trine Græse";0;"S";"S";0;0;0;0;1,9640598924434
"946";"Gladsaxe.30-08-2016.pdf";21;13;5102;"Gladsaxe Kommune";"30-08-2016";5136;0,00408878504672897;0,00253115264797508;2016;"08";2016-08-30;1,0916946442441;0,810442305367181;67914;65689;601;7,1;7,3;"Trine Græse";"Trine Græse";0;"S";"S";0;0;0;-0,2;1,9640598924434
"947";"Gladsaxe.30-08-2018.pdf";37;27;6640;"Gladsaxe Kommune";"30-08-2018";6704;0,00551909307875895;0,00402744630071599;2018;"08";2018-08-30;1,47358305372056;1,28953615946711;69484;69693;605;7,1;7,3;"Trine Græse";"Trine Græse";0;"S";"S";0;0;0;-0,2;1,97713183848295
"948";"Gladsaxe.31-08-2017.pdf";7;12;6247;"Gladsaxe Kommune";"31-08-2017";6266;0,0011171401212895;0,001915097350782;2017;"08";2017-08-31;0,298273417003814;0,613189375683053;68775;67488;601;7,3;7,3;"Trine Græse";"Trine Græse";0;"S";"S";0;0;0;0;1,9640598924434
"949";"Gladsaxe.31-10-2017.pdf";9;1;4437;"Gladsaxe Kommune";"31-10-2017";4447;0,00202383629413087;0,000224870699347875;2017;"10";2017-10-31;0,540358864033959;0,0720006863808937;68775;67488;601;7,3;7,3;"Trine Græse";"Trine Græse";0;"S";"S";0;0;0;0;1,9640598924434
"950";"Glostrup.01-03-2017.pdf";0;0;298;"Glostrup Kommune";"01-03-2017";298;0;0;2017;"03";2017-03-01;0;0;22528;74427;2110;6,8;6,8;"John Engelhardt";"John Engelhardt";0;"V";"V";0;0;0;0;6,89545153586617
"951";"Glostrup.06-12-2017.pdf";0;0;258;"Glostrup Kommune";"06-12-2017";258;0;0;2017;"12";2017-12-06;0;0;22528;74427;2110;6,8;6,8;"John Engelhardt";"John Engelhardt";0;"V";"V";0;0;0;0;6,89545153586617
"952";"Glostrup.12-06-2018.pdf";5;11;4942;"Glostrup Kommune";"12-06-2018";4958;0,00100847115772489;0,00221863654699476;2018;"06";2018-06-12;0,269259095105443;0,710378696186804;22663;75819;2056;6,3;6,8;"John Engelhardt";"John Engelhardt";0;"V";"V";0;0;0;-0,5;6,71898026433215
"953";"Glostrup.15-02-2018.pdf";36;10;3730;"Glostrup Kommune";"15-02-2018";3776;0,00953389830508475;0,00264830508474576;2018;"02";2018-02-15;2,54552528427862;0,847952998770747;22663;75819;2056;6,3;6,8;"John Engelhardt";"John Engelhardt";0;"V";"V";0;0;0;-0,5;6,71898026433215
"954";"Glostrup.15-06-2017.pdf";37;15;3862;"Glostrup Kommune";"15-06-2017";3914;0,00945324476239142;0,00383239652529382;2017;"06";2017-06-15;2,52399100463531;1,22708374681592;22528;74427;2110;6,8;6,8;"John Engelhardt";"John Engelhardt";0;"V";"V";0;0;0;0;6,89545153586617
"955";"Glostrup.16-02-2017.pdf";6;6;2782;"Glostrup Kommune";"16-02-2017";2794;0,00214745884037223;0,00214745884037223;2017;"02";2017-02-16;0,573365752412077;0,687588516111312;22528;74427;2110;6,8;6,8;"John Engelhardt";"John Engelhardt";0;"V";"V";0;0;0;0;6,89545153586617
"956";"Glostrup.16-06-2016.pdf";10;9;3797;"Glostrup Kommune";"16-06-2016";3816;0,00262054507337526;0,00235849056603774;2016;"06";2016-06-16;0,699678508140873;0,755158142301496;22461;74607;2126;6,8;6,9;"John Engelhardt";"John Engelhardt";0;"V";"V";0;0;0;-0,100000000000001;6,9477393200244
"957";"Glostrup.17-03-2016.pdf";5;3;1942;"Glostrup Kommune";"17-03-2016";1950;0,00256410256410256;0,00153846153846154;2016;"03";2016-03-17;0,684608509503993;0,492595465132053;22461;74607;2126;6,8;6,9;"John Engelhardt";"John Engelhardt";0;"V";"V";0;0;0;-0,100000000000001;6,9477393200244
"958";"Glostrup.17-05-2018.pdf";2;33;3734;"Glostrup Kommune";"17-05-2018";3769;0,000530644733351021;0,00875563810029185;2018;"05";2018-05-17;0,141680720990479;2,80344195465177;22663;75819;2056;6,3;6,8;"John Engelhardt";"John Engelhardt";0;"V";"V";0;0;0;-0,5;6,71898026433215
"959";"Glostrup.17-11-2016.pdf";0;16;2466;"Glostrup Kommune";"17-11-2016";2482;0;0,0064464141821112;2016;"11";2016-11-17;0;2,0640583551061;22461;74607;2126;6,8;6,9;"John Engelhardt";"John Engelhardt";0;"V";"V";0;0;0;-0,100000000000001;6,9477393200244
"960";"Glostrup.18-02-2016.pdf";13;2;2124;"Glostrup Kommune";"18-02-2016";2139;0,00607760635811127;0,000935016362786349;2016;"02";2016-02-18;1,62270460176963;0,299380133086334;22461;74607;2126;6,8;6,9;"John Engelhardt";"John Engelhardt";0;"V";"V";0;0;0;-0,100000000000001;6,9477393200244
"961";"Glostrup.18-05-2017.pdf";0;9;3574;"Glostrup Kommune";"18-05-2017";3583;0;0,002511861568518;2017;"05";2017-05-18;0;0,804265551499444;22528;74427;2110;6,8;6,8;"John Engelhardt";"John Engelhardt";0;"V";"V";0;0;0;0;6,89545153586617
"962";"Glostrup.19-04-2018.pdf";8;6;2435;"Glostrup Kommune";"19-04-2018";2449;0,00326663944467129;0,00244997958350347;2018;"04";2018-04-19;0,872183972908313;0,784451741124951;22663;75819;2056;6,3;6,8;"John Engelhardt";"John Engelhardt";0;"V";"V";0;0;0;-0,5;6,71898026433215
"963";"Glostrup.19-05-2016.pdf";19;2;2333;"Glostrup Kommune";"19-05-2016";2354;0,008071367884452;0,000849617672047579;2016;"05";2016-05-19;2,1550335834429;0,272036578025348;22461;74607;2126;6,8;6,9;"John Engelhardt";"John Engelhardt";0;"V";"V";0;0;0;-0,100000000000001;6,9477393200244
"964";"Glostrup.19-09-2018.pdf";4;23;4293;"Glostrup Kommune";"19-09-2018";4320;0,000925925925925926;0,00532407407407407;2018;"09";2018-09-19;0,247219739543108;1,70469958419541;22663;75819;2056;6,3;6,8;"John Engelhardt";"John Engelhardt";0;"V";"V";0;0;0;-0,5;6,71898026433215
"965";"Glostrup.19-12-2018.pdf";10;12;4761;"Glostrup Kommune";"19-12-2018";4783;0,00209073803052478;0,00250888563662973;2018;"12";2018-12-19;0,558221448267943;0,803312696640186;22663;75819;2056;6,3;6,8;"John Engelhardt";"John Engelhardt";0;"V";"V";0;0;0;-0,5;6,71898026433215
"966";"Glostrup.20-03-2019.pdf";2;0;1212;"Glostrup Kommune";"20-03-2019";1214;0,00164744645799012;0;2019;"03";2019-03-20;0,439863786995976;0;22615;72725;2043;6,5;6,6;"John Engelhardt";"John Engelhardt";0;"V";"V";0;0;0;-0,0999999999999996;6,6764964397036
"967";"Glostrup.20-04-2017.pdf";20;10;1897;"Glostrup Kommune";"20-04-2017";1927;0,0103788271925272;0,00518941359626362;2017;"04";2017-04-20;2,77111903172348;1,66158304273915;22528;74427;2110;6,8;6,8;"John Engelhardt";"John Engelhardt";0;"V";"V";0;0;0;0;6,89545153586617
"968";"Glostrup.20-12-2017.pdf";17;7;5351;"Glostrup Kommune";"20-12-2017";5375;0,00316279069767442;0,00130232558139535;2017;"12";2017-12-20;0,844456635909111;0,416987789088528;22528;74427;2110;6,8;6,8;"John Engelhardt";"John Engelhardt";0;"V";"V";0;0;0;0;6,89545153586617
"969";"Glostrup.21-04-2016.pdf";15;9;4807;"Glostrup Kommune";"21-04-2016";4831;0,00310494721589733;0,0018629683295384;2016;"04";2016-04-21;0,829012581369977;0,596498338029912;22461;74607;2126;6,8;6,9;"John Engelhardt";"John Engelhardt";0;"V";"V";0;0;0;-0,100000000000001;6,9477393200244
"970";"Glostrup.21-09-2017.pdf";23;11;2147;"Glostrup Kommune";"21-09-2017";2181;0,0105456212746447;0,00504355800091701;2017;"09";2017-09-21;2,81565260442495;1,61488196959843;22528;74427;2110;6,8;6,8;"John Engelhardt";"John Engelhardt";0;"V";"V";0;0;0;0;6,89545153586617
"971";"Glostrup.21-11-2018.pdf";10;31;3532;"Glostrup Kommune";"21-11-2018";3573;0,00279876854184159;0,00867618247970893;2018;"11";2018-11-21;0,747263696351965;2,77800129370581;22663;75819;2056;6,3;6,8;"John Engelhardt";"John Engelhardt";0;"V";"V";0;0;0;-0,5;6,71898026433215
"972";"Glostrup.21-12-2016.pdf";0;6;2701;"Glostrup Kommune";"21-12-2016";2707;0;0,00221647580347248;2016;"12";2016-12-21;0;0,709686854087553;22461;74607;2126;6,8;6,9;"John Engelhardt";"John Engelhardt";0;"V";"V";0;0;0;-0,100000000000001;6,9477393200244
"973";"Glostrup.22-03-2018.pdf";0;15;1974;"Glostrup Kommune";"22-03-2018";1989;0;0,00754147812971342;2018;"03";2018-03-22;0;2,4146836526081;22663;75819;2056;6,3;6,8;"John Engelhardt";"John Engelhardt";0;"V";"V";0;0;0;-0,5;6,71898026433215
"974";"Glostrup.22-09-2016.pdf";14;13;2508;"Glostrup Kommune";"22-09-2016";2535;0,00552268244575937;0,00512820512820513;2016;"09";2016-09-22;1,47454140508552;1,64198488377351;22461;74607;2126;6,8;6,9;"John Engelhardt";"John Engelhardt";0;"V";"V";0;0;0;-0,100000000000001;6,9477393200244
"975";"Glostrup.23-01-2019.pdf";3;1;2028;"Glostrup Kommune";"23-01-2019";2032;0,00147637795275591;0,000492125984251968;2019;"01";2019-01-23;0,394188954783303;0,157572368275509;22615;72725;2043;6,5;6,6;"John Engelhardt";"John Engelhardt";0;"V";"V";0;0;0;-0,0999999999999996;6,6764964397036
"976";"Glostrup.23-03-2017.pdf";1;0;752;"Glostrup Kommune";"23-03-2017";753;0,00132802124833997;0;2017;"03";2017-03-23;0,354578112492108;0;22528;74427;2110;6,8;6,8;"John Engelhardt";"John Engelhardt";0;"V";"V";0;0;0;0;6,89545153586617
"977";"Glostrup.23-08-2018.pdf";11;6;4070;"Glostrup Kommune";"23-08-2018";4087;0,00269146072914118;0,00146806948862246;2018;"08";2018-08-23;0,71861279808469;0,470056842186201;22663;75819;2056;6,3;6,8;"John Engelhardt";"John Engelhardt";0;"V";"V";0;0;0;-0,5;6,71898026433215
"978";"Glostrup.23-11-2017.pdf";2;28;2667;"Glostrup Kommune";"23-11-2017";2697;0,000741564701520208;0,0103819058212829;2017;"11";2017-11-23;0,197995786953324;3,32415182254481;22528;74427;2110;6,8;6,8;"John Engelhardt";"John Engelhardt";0;"V";"V";0;0;0;0;6,89545153586617
"979";"Glostrup.24-08-2016.pdf";0;8;3308;"Glostrup Kommune";"24-08-2016";3316;0;0,00241254523522316;2016;"08";2016-08-24;0;0,772465747492965;22461;74607;2126;6,8;6,9;"John Engelhardt";"John Engelhardt";0;"V";"V";0;0;0;-0,100000000000001;6,9477393200244
"980";"Glostrup.24-08-2017.pdf";0;2;1079;"Glostrup Kommune";"24-08-2017";1081;0;0,00185013876040703;2017;"08";2017-08-24;0;0,592390476107001;22528;74427;2110;6,8;6,8;"John Engelhardt";"John Engelhardt";0;"V";"V";0;0;0;0;6,89545153586617
"981";"Glostrup.24-10-2018.pdf";4;2;3362;"Glostrup Kommune";"24-10-2018";3368;0,00118764845605701;0,000593824228028504;2018;"10";2018-10-24;0,317098953333203;0,190134829178049;22663;75819;2056;6,3;6,8;"John Engelhardt";"John Engelhardt";0;"V";"V";0;0;0;-0,5;6,71898026433215
"982";"Glostrup.25-01-2018.pdf";5;3;2725;"Glostrup Kommune";"25-01-2018";2733;0,00182949140139041;0,00109769484083425;2018;"01";2018-01-25;0,488469298767942;0,351467675450971;22663;75819;2056;6,3;6,8;"John Engelhardt";"John Engelhardt";0;"V";"V";0;0;0;-0,5;6,71898026433215
"983";"Glostrup.26-01-2017.pdf";66;24;4401;"Glostrup Kommune";"26-01-2017";4491;0,0146960587842351;0,0053440213760855;2017;"01";2017-01-26;3,92380829094473;1,71108645202851;22528;74427;2110;6,8;6,8;"John Engelhardt";"John Engelhardt";0;"V";"V";0;0;0;0;6,89545153586617
"984";"Glostrup.26-10-2017.pdf";16;8;2696;"Glostrup Kommune";"26-10-2017";2720;0,00588235294117647;0,00294117647058824;2017;"10";2017-10-26;1,57057246297975;0,941726624517159;22528;74427;2110;6,8;6,8;"John Engelhardt";"John Engelhardt";0;"V";"V";0;0;0;0;6,89545153586617
"985";"Glostrup.27-02-2019.pdf";6;19;3296;"Glostrup Kommune";"27-02-2019";3321;0,001806684733514;0,00572116832279434;2019;"02";2019-02-27;0,482379979596309;1,83184402119267;22615;72725;2043;6,5;6,6;"John Engelhardt";"John Engelhardt";0;"V";"V";0;0;0;-0,0999999999999996;6,6764964397036
"986";"Glostrup.27-10-2016.pdf";19;10;3086;"Glostrup Kommune";"27-10-2016";3115;0,00609951845906902;0,00321027287319422;2016;"10";2016-10-27;1,62855507397258;1,02788780846175;22461;74607;2126;6,8;6,9;"John Engelhardt";"John Engelhardt";0;"V";"V";0;0;0;-0,100000000000001;6,9477393200244
"987";"Glostrup.28-01-2016.pdf";1;0;2578;"Glostrup Kommune";"28-01-2016";2579;0,000387747188832881;0;2016;"01";2016-01-28;0,103527459754384;0;22461;74607;2126;6,8;6,9;"John Engelhardt";"John Engelhardt";0;"V";"V";0;0;0;-0,100000000000001;6,9477393200244
"988";"Greve.01-06-2016.pdf";6;10;7058;"Greve Kommune";"01-06-2016";7074;0,000848176420695505;0,00141362736782584;2016;"06";2016-06-01;0,226460830115825;0,45262518000542;49518;63268;543;6,8;7;"Pernille Beckmann";"Pernille Beckmann";0;"V";"V";0;0;0;-0,2;1,77451667486982
"989";"Greve.02-03-2016.pdf";26;16;7565;"Greve Kommune";"02-03-2016";7607;0,00341790456158801;0,00210332588405416;2016;"03";2016-03-02;0,91257135353891;0,673457714916964;49518;63268;543;6,8;7;"Pernille Beckmann";"Pernille Beckmann";0;"V";"V";0;0;0;-0,2;1,77451667486982
"990";"Greve.03-02-2016.pdf";5;7;3587;"Greve Kommune";"03-02-2016";3599;0,00138927479855515;0,00194498471797722;2016;"02";2016-02-03;0,370932646160819;0,622758923687369;49518;63268;543;6,8;7;"Pernille Beckmann";"Pernille Beckmann";0;"V";"V";0;0;0;-0,2;1,77451667486982
"991";"Greve.03-05-2017.pdf";6;6;3928;"Greve Kommune";"03-05-2017";3940;0,00152284263959391;0,00152284263959391;2017;"05";2017-05-03;0,40659490158359;0,487594495942895;49921;65078;563;7,1;7,1;"Pernille Beckmann";"Pernille Beckmann";0;"V";"V";0;0;0;0;1,83987640506761
"992";"Greve.03-05-2018.pdf";12;21;5376;"Greve Kommune";"03-05-2018";5409;0,00221852468108708;0,00388241819190238;2018;"05";2018-05-03;0,592340141334569;1,24310003680024;49974;67577;585;6,7;6,9;"Pernille Beckmann";"Pernille Beckmann";0;"V";"V";0;0;0;-0,2;1,91177210828517
"993";"Greve.04-05-2016.pdf";4;9;5747;"Greve Kommune";"04-05-2016";5760;0,000694444444444444;0,0015625;2016;"05";2016-05-04;0,185414804657331;0,500292269274741;49518;63268;543;6,8;7;"Pernille Beckmann";"Pernille Beckmann";0;"V";"V";0;0;0;-0,2;1,77451667486982
"994";"Greve.05-04-2017.pdf";11;2;3350;"Greve Kommune";"05-04-2017";3363;0,00327088908712459;0,000594707106749926;2017;"04";2017-04-05;0,873318616048804;0,190417515513431;49921;65078;563;7,1;7,1;"Pernille Beckmann";"Pernille Beckmann";0;"V";"V";0;0;0;0;1,83987640506761
"995";"Greve.05-10-2016.pdf";23;15;4612;"Greve Kommune";"05-10-2016";4650;0,00494623655913979;0,0032258064516129;2016;"10";2016-10-05;1,32063189897867;1,03286145914785;49518;63268;543;6,8;7;"Pernille Beckmann";"Pernille Beckmann";0;"V";"V";0;0;0;-0,2;1,77451667486982
"996";"Greve.06-01-2016.pdf";1;10;2697;"Greve Kommune";"06-01-2016";2708;0,000369276218611521;0,00369276218611521;2016;"01";2016-01-06;0,0985957602313727;1,18237463934946;49518;63268;543;6,8;7;"Pernille Beckmann";"Pernille Beckmann";0;"V";"V";0;0;0;-0,2;1,77451667486982
"997";"Greve.06-04-2016.pdf";8;14;3555;"Greve Kommune";"06-04-2016";3577;0,00223651104277327;0,00391389432485323;2016;"04";2016-04-06;0,59714245167807;1,2531782870287;49518;63268;543;6,8;7;"Pernille Beckmann";"Pernille Beckmann";0;"V";"V";0;0;0;-0,2;1,77451667486982
"998";"Greve.07-09-2016.pdf";2;5;1978;"Greve Kommune";"07-09-2016";1985;0,00100755667506297;0,00251889168765743;2016;"09";2016-09-07;0,269014930686707;0,806516504624267;49518;63268;543;6,8;7;"Pernille Beckmann";"Pernille Beckmann";0;"V";"V";0;0;0;-0,2;1,77451667486982
"999";"Greve.08-01-2018.pdf";0;0;172;"Greve Kommune";"08-01-2018";172;0;0;2018;"01";2018-01-08;0;0;49974;67577;585;6,7;6,9;"Pernille Beckmann";"Pernille Beckmann";0;"V";"V";0;0;0;-0,2;1,91177210828517
"1000";"Greve.08-02-2017.pdf";15;3;3754;"Greve Kommune";"08-02-2017";3772;0,00397667020148462;0,000795334040296925;2017;"02";2017-02-08;1,06176028117666;0,254655661985022;49921;65078;563;7,1;7,1;"Pernille Beckmann";"Pernille Beckmann";0;"V";"V";0;0;0;0;1,83987640506761
"1001";"Greve.08-03-2017.pdf";7;3;5356;"Greve Kommune";"08-03-2017";5366;0,00130450987700335;0,000559075661572866;2017;"03";2017-03-08;0,348300639386116;0,179008788111722;49921;65078;563;7,1;7,1;"Pernille Beckmann";"Pernille Beckmann";0;"V";"V";0;0;0;0;1,83987640506761
"1002";"Greve.08-06-2016.pdf";0;3;1176;"Greve Kommune";"08-06-2016";1179;0;0,00254452926208651;2016;"06";2016-06-08;0;0,814725324009756;49518;63268;543;6,8;7;"Pernille Beckmann";"Pernille Beckmann";0;"V";"V";0;0;0;-0,2;1,77451667486982
"1003";"Greve.09-11-2016.pdf";5;8;2218;"Greve Kommune";"09-11-2016";2231;0,00224114746750336;0,00358583594800538;2016;"11";2016-11-09;0,598380364649388;1,14813824235171;49518;63268;543;6,8;7;"Pernille Beckmann";"Pernille Beckmann";0;"V";"V";0;0;0;-0,2;1,77451667486982
"1004";"Greve.11-01-2017.pdf";10;4;2814;"Greve Kommune";"11-01-2017";2828;0,00353606789250354;0,00141442715700141;2017;"01";2017-01-11;0,94412064606279;0,452881262144037;49921;65078;563;7,1;7,1;"Pernille Beckmann";"Pernille Beckmann";0;"V";"V";0;0;0;0;1,83987640506761
"1005";"Greve.11-10-2017.pdf";3;0;969;"Greve Kommune";"11-10-2017";972;0,00308641975308642;0;2017;"10";2017-10-11;0,824065798477028;0;49921;65078;563;7,1;7,1;"Pernille Beckmann";"Pernille Beckmann";0;"V";"V";0;0;0;0;1,83987640506761
"1006";"Greve.11-10-2018.pdf";7;12;2385;"Greve Kommune";"11-10-2018";2404;0,00291181364392679;0,00499168053244592;2018;"10";2018-10-11;0,777446435501622;1,59827147588603;49974;67577;585;6,7;6,9;"Pernille Beckmann";"Pernille Beckmann";0;"V";"V";0;0;0;-0,2;1,91177210828517
"1007";"Greve.13-09-2017.pdf";3;18;4276;"Greve Kommune";"13-09-2017";4297;0,000698161508028857;0,00418896904817314;2017;"09";2017-09-13;0,186407250667831;1,3412536518606;49921;65078;563;7,1;7,1;"Pernille Beckmann";"Pernille Beckmann";0;"V";"V";0;0;0;0;1,83987640506761
"1008";"Greve.13-09-2018.pdf";7;3;3935;"Greve Kommune";"13-09-2018";3945;0,0017743979721166;0,000760456273764259;2018;"09";2018-09-13;0,473759500873486;0,24348825272687;49974;67577;585;6,7;6,9;"Pernille Beckmann";"Pernille Beckmann";0;"V";"V";0;0;0;-0,2;1,91177210828517
"1009";"Greve.14-01-2019.pdf";7;6;2823;"Greve Kommune";"14-01-2019";2836;0,00246826516220028;0,00211565585331453;2019;"01";2019-01-14;0,659020180164281;0,677405611429833;50267;66126;580;6,9;7,2;"Pernille Beckmann";"Pernille Beckmann";0;"V";"V";0;0;0;-0,3;1,89543217573572
"1010";"Greve.15-02-2018.pdf";1;2;1672;"Greve Kommune";"15-02-2018";1675;0,000597014925373134;0,00119402985074627;2018;"02";2018-02-15;0,159401384302422;0,382312898311444;49974;67577;585;6,7;6,9;"Pernille Beckmann";"Pernille Beckmann";0;"V";"V";0;0;0;-0,2;1,91177210828517
"1011";"Greve.15-11-2017.pdf";9;10;3904;"Greve Kommune";"15-11-2017";3923;0,00229416263063982;0,0025490695895998;2017;"11";2017-11-15;0,612535271057613;0,816179078092873;49921;65078;563;7,1;7,1;"Pernille Beckmann";"Pernille Beckmann";0;"V";"V";0;0;0;0;1,83987640506761
"1012";"Greve.16-01-2018.pdf";3;3;1962;"Greve Kommune";"16-01-2018";1968;0,00152439024390244;0,00152439024390244;2018;"01";2018-01-16;0,407008107784386;0,488090018804625;49974;67577;585;6,7;6,9;"Pernille Beckmann";"Pernille Beckmann";0;"V";"V";0;0;0;-0,2;1,91177210828517
"1013";"Greve.16-08-2017.pdf";10;9;4441;"Greve Kommune";"16-08-2017";4460;0,00224215246636771;0,00201793721973094;2017;"08";2017-08-16;0,598648696651473;0,646117370184419;49921;65078;563;7,1;7,1;"Pernille Beckmann";"Pernille Beckmann";0;"V";"V";0;0;0;0;1,83987640506761
"1014";"Greve.16-08-2018.pdf";6;17;4544;"Greve Kommune";"16-08-2018";4567;0,0013137727173199;0,00372235603240639;2018;"08";2018-08-16;0,350773792914242;1,19185020576071;49974;67577;585;6,7;6,9;"Pernille Beckmann";"Pernille Beckmann";0;"V";"V";0;0;0;-0,2;1,91177210828517
"1015";"Greve.17-06-2016.pdf";10;11;3960;"Greve Kommune";"17-06-2016";3981;0,00251193167545843;0,00276312484300427;2016;"06";2016-06-17;0,67067902212147;0,884716798717452;49518;63268;543;6,8;7;"Pernille Beckmann";"Pernille Beckmann";0;"V";"V";0;0;0;-0,2;1,77451667486982
"1016";"Greve.22-03-2018.pdf";31;13;3553;"Greve Kommune";"22-03-2018";3597;0,00861829302196275;0,00361412288017793;2018;"03";2018-03-22;2,30106112869149;1,15719535178367;49974;67577;585;6,7;6,9;"Pernille Beckmann";"Pernille Beckmann";0;"V";"V";0;0;0;-0,2;1,91177210828517
"1017";"Greve.22-11-2018.pdf";10;14;4636;"Greve Kommune";"22-11-2018";4660;0,00214592274678112;0,00300429184549356;2018;"11";2018-11-22;0,572955619541968;0,961935350365167;49974;67577;585;6,7;6,9;"Pernille Beckmann";"Pernille Beckmann";0;"V";"V";0;0;0;-0,2;1,91177210828517
"1018";"Greve.28-02-2019.pdf";10;12;3196;"Greve Kommune";"28-02-2019";3218;0,00310752019888129;0,00372902423865755;2019;"02";2019-02-28;0,829699560927772;1,19398527906464;50267;66126;580;6,9;7,2;"Pernille Beckmann";"Pernille Beckmann";0;"V";"V";0;0;0;-0,3;1,89543217573572
"1019";"Greve.28-03-2019.pdf";16;26;3222;"Greve Kommune";"28-03-2019";3264;0,00490196078431373;0,0079656862745098;2019;"03";2019-03-28;1,30881038581646;2,55050960806731;50267;66126;580;6,9;7,2;"Pernille Beckmann";"Pernille Beckmann";0;"V";"V";0;0;0;-0,3;1,89543217573572
"1020";"Greve.30-11-2016.pdf";5;14;4309;"Greve Kommune";"30-11-2016";4328;0,00115526802218115;0,00323475046210721;2016;"11";2016-11-30;0,308453464309793;1,03572521550408;49518;63268;543;6,8;7;"Pernille Beckmann";"Pernille Beckmann";0;"V";"V";0;0;0;-0,2;1,77451667486982
"1021";"Greve.31-01-2019.pdf";9;10;4505;"Greve Kommune";"31-01-2019";4524;0,0019893899204244;0,002210433244916;2019;"01";2019-01-31;0,531161774615167;0,707752105074788;50267;66126;580;6,9;7,2;"Pernille Beckmann";"Pernille Beckmann";0;"V";"V";0;0;0;-0,3;1,89543217573572
"1022";"Greve.31-05-2017.pdf";39;15;5431;"Greve Kommune";"31-05-2017";5485;0,00711030082041933;0,00273473108477666;2017;"05";2017-05-31;1,89843125424899;0,875625484965818;49921;65078;563;7,1;7,1;"Pernille Beckmann";"Pernille Beckmann";0;"V";"V";0;0;0;0;1,83987640506761
"1023";"Greve.31-05-2018.pdf";8;10;3344;"Greve Kommune";"31-05-2018";3362;0,00237953599048186;0,00297441998810232;2018;"05";2018-05-31;0,635329729224407;0,952370768399269;49974;67577;585;6,7;6,9;"Pernille Beckmann";"Pernille Beckmann";0;"V";"V";0;0;0;-0,2;1,91177210828517
"1024";"Gribskov.01-03-2016.pdf";1;0;176;"Gribskov Kommune";"01-03-2016";177;0,00564971751412429;0;2016;"03";2016-03-01;1,50845942772066;0;41107;61034;584;6,6;7;"Kim Valentin ";"Anders Frost";1;"V";"Lokal";1;1;0;-0,4;1,90850412177528
"1025";"Gribskov.03-09-2018.pdf";0;0;247;"Gribskov Kommune";"03-09-2018";247;0;0;2018;"09";2018-09-03;0;0;41217;68338;449;6,8;7;"Kim Valentin ";"Anders Frost";1;"V";"Lokal";1;1;0;-0,2;1,46732594294024
"1026";"Gribskov.04-04-2016.pdf";31;7;4206;"Gribskov Kommune";"04-04-2016";4244;0,00730442978322337;0,00164938737040528;2016;"04";2016-04-04;1,95026316680096;0,528112480290019;41107;61034;584;6,6;7;"Kim Valentin ";"Anders Frost";1;"V";"Lokal";1;1;0;-0,4;1,90850412177528
"1027";"Gribskov.05-03-2018.pdf";10;0;1758;"Gribskov Kommune";"05-03-2018";1768;0,00565610859728507;0;2018;"03";2018-03-05;1,51016582978822;0;41217;68338;449;6,8;7;"Kim Valentin ";"Anders Frost";1;"V";"Lokal";1;1;0;-0,2;1,46732594294024
"1028";"Gribskov.05-09-2016.pdf";1;1;923;"Gribskov Kommune";"05-09-2016";925;0,00108108108108108;0,00108108108108108;2016;"09";2016-09-05;0,288645749953035;0,346148164687388;41107;61034;584;6,6;7;"Kim Valentin ";"Anders Frost";1;"V";"Lokal";1;1;0;-0,4;1,90850412177528
"1029";"Gribskov.05-11-2018.pdf";0;3;596;"Gribskov Kommune";"05-11-2018";599;0;0,00500834724540901;2018;"11";2018-11-05;0;1,60360794158181;41217;68338;449;6,8;7;"Kim Valentin ";"Anders Frost";1;"V";"Lokal";1;1;0;-0,2;1,46732594294024
"1030";"Gribskov.06-02-2017.pdf";4;7;927;"Gribskov Kommune";"06-02-2017";938;0,00426439232409382;0,00746268656716418;2017;"02";2017-02-06;1,13858131644587;2,38945561444652;41213;66874;532;6,9;7;"Kim Valentin ";"Anders Frost";1;"V";"Lokal";1;1;0;-0,0999999999999996;1,73856882326104
"1031";"Gribskov.06-04-2018.pdf";0;1;302;"Gribskov Kommune";"06-04-2018";303;0;0,0033003300330033;2018;"04";2018-04-06;0;1,05672294500275;41217;68338;449;6,8;7;"Kim Valentin ";"Anders Frost";1;"V";"Lokal";1;1;0;-0,2;1,46732594294024
"1032";"Gribskov.06-06-2016.pdf";13;29;5954;"Gribskov Kommune";"06-06-2016";5996;0,00216811207471648;0,00483655770513676;2016;"06";2016-06-06;0,57888011060461;1,54860315505991;41107;61034;584;6,6;7;"Kim Valentin ";"Anders Frost";1;"V";"Lokal";1;1;0;-0,4;1,90850412177528
"1033";"Gribskov.06-11-2017.pdf";6;16;3634;"Gribskov Kommune";"06-11-2017";3656;0,00164113785557987;0,00437636761487965;2017;"11";2017-11-06;0,438179407067654;1,40125624654632;41213;66874;532;6,9;7;"Kim Valentin ";"Anders Frost";1;"V";"Lokal";1;1;0;-0,0999999999999996;1,73856882326104
"1034";"Gribskov.08-03-2019.pdf";0;0;510;"Gribskov Kommune";"08-03-2019";510;0;0;2019;"03";2019-03-08;0;0;41195;69263;435;6,8;6,8;"Kim Valentin ";"Anders Frost";1;"V";"Lokal";1;1;0;0;1,42157413180179
"1035";"Gribskov.09-01-2017.pdf";6;6;2893;"Gribskov Kommune";"09-01-2017";2905;0,00206540447504303;0,00206540447504303;2017;"01";2017-01-09;0,551457456881013;0,661315770745268;41213;66874;532;6,9;7;"Kim Valentin ";"Anders Frost";1;"V";"Lokal";1;1;0;-0,0999999999999996;1,73856882326104
"1036";"Gribskov.09-05-2016.pdf";30;44;6828;"Gribskov Kommune";"09-05-2016";6902;0,00434656621269197;0,00637496377861489;2016;"05";2016-05-09;1,16052152436927;2,04118086102241;41107;61034;584;6,6;7;"Kim Valentin ";"Anders Frost";1;"V";"Lokal";1;1;0;-0,4;1,90850412177528
"1037";"Gribskov.11-01-2016.pdf";10;8;5390;"Gribskov Kommune";"11-01-2016";5408;0,0018491124260355;0,0014792899408284;2016;"01";2016-01-11;0,493708059738456;0,473649485703897;41107;61034;584;6,6;7;"Kim Valentin ";"Anders Frost";1;"V";"Lokal";1;1;0;-0,4;1,90850412177528
"1038";"Gribskov.12-09-2016.pdf";13;15;3706;"Gribskov Kommune";"12-09-2016";3734;0,00348152115693626;0,00401713979646492;2016;"09";2016-09-12;0,929556813922133;1,28623615025107;41107;61034;584;6,6;7;"Kim Valentin ";"Anders Frost";1;"V";"Lokal";1;1;0;-0,4;1,90850412177528
"1039";"Gribskov.13-03-2017.pdf";10;7;2916;"Gribskov Kommune";"13-03-2017";2933;0,00340947834981248;0,00238663484486874;2017;"03";2017-03-13;0,910321577587989;0,764169575980511;41213;66874;532;6,9;7;"Kim Valentin ";"Anders Frost";1;"V";"Lokal";1;1;0;-0,0999999999999996;1,73856882326104
"1040";"Gribskov.14-08-2017.pdf";8;10;2841;"Gribskov Kommune";"14-08-2017";2859;0,00279818118223155;0,00349772647778944;2017;"08";2017-08-14;0,747106872910968;1,1199267308004;41213;66874;532;6,9;7;"Kim Valentin ";"Anders Frost";1;"V";"Lokal";1;1;0;-0,0999999999999996;1,73856882326104
"1041";"Gribskov.15-08-2016.pdf";21;15;4587;"Gribskov Kommune";"15-08-2016";4623;0,0045425048669695;0,00324464633354964;2016;"08";2016-08-15;1,21283661969234;1,03889374541153;41107;61034;584;6,6;7;"Kim Valentin ";"Anders Frost";1;"V";"Lokal";1;1;0;-0,4;1,90850412177528
"1042";"Gribskov.16-12-2016.pdf";1;0;189;"Gribskov Kommune";"16-12-2016";190;0,00526315789473684;0;2016;"12";2016-12-16;1,40524904582399;0;41107;61034;584;6,6;7;"Kim Valentin ";"Anders Frost";1;"V";"Lokal";1;1;0;-0,4;1,90850412177528
"1043";"Gribskov.17-09-2018.pdf";11;51;8294;"Gribskov Kommune";"17-09-2018";8356;0,00131641933939684;0,00610339875538535;2018;"09";2018-09-17;0,351480433912414;1,95422925671703;41217;68338;449;6,8;7;"Kim Valentin ";"Anders Frost";1;"V";"Lokal";1;1;0;-0,2;1,46732594294024
"1044";"Gribskov.18-04-2016.pdf";1;8;905;"Gribskov Kommune";"18-04-2016";914;0,00109409190371991;0,0087527352297593;2016;"04";2016-04-18;0,292119604711769;2,80251249309264;41107;61034;584;6,6;7;"Kim Valentin ";"Anders Frost";1;"V";"Lokal";1;1;0;-0,4;1,90850412177528
"1045";"Gribskov.18-09-2017.pdf";8;28;5608;"Gribskov Kommune";"18-09-2017";5644;0,00141743444365698;0,00496102055279943;2017;"09";2017-09-18;0,378451195898734;1,58845454737834;41213;66874;532;6,9;7;"Kim Valentin ";"Anders Frost";1;"V";"Lokal";1;1;0;-0,0999999999999996;1,73856882326104
"1046";"Gribskov.19-12-2018.pdf";0;0;195;"Gribskov Kommune";"19-12-2018";195;0;0;2018;"12";2018-12-19;0;0;41217;68338;449;6,8;7;"Kim Valentin ";"Anders Frost";1;"V";"Lokal";1;1;0;-0,2;1,46732594294024
"1047";"Gribskov.20-02-2018.pdf";47;1;2597;"Gribskov Kommune";"20-02-2018";2645;0,0177693761814745;0,000378071833648393;2018;"02";2018-02-20;4,74437579554185;0,121053705987083;41217;68338;449;6,8;7;"Kim Valentin ";"Anders Frost";1;"V";"Lokal";1;1;0;-0,2;1,46732594294024
"1048";"Gribskov.20-03-2018.pdf";3;2;3092;"Gribskov Kommune";"20-03-2018";3097;0,00096867936712948;0,000645786244752987;2018;"03";2018-03-20;0,258634793709936;0,206772394146486;41217;68338;449;6,8;7;"Kim Valentin ";"Anders Frost";1;"V";"Lokal";1;1;0;-0,2;1,46732594294024
"1049";"Gribskov.20-06-2016.pdf";1;0;553;"Gribskov Kommune";"20-06-2016";554;0,00180505415162455;0;2016;"06";2016-06-20;0,481944618603894;0;41107;61034;584;6,6;7;"Kim Valentin ";"Anders Frost";1;"V";"Lokal";1;1;0;-0,4;1,90850412177528
"1050";"Gribskov.20-08-2018.pdf";5;29;4484;"Gribskov Kommune";"20-08-2018";4518;0,00110668437361664;0,00641876936697654;2018;"08";2018-08-20;0,29548176041009;2,05520684323577;41217;68338;449;6,8;7;"Kim Valentin ";"Anders Frost";1;"V";"Lokal";1;1;0;-0,2;1,46732594294024
"1051";"Gribskov.21-11-2016.pdf";4;32;3777;"Gribskov Kommune";"21-11-2016";3813;0,001049042748492;0,00839234198793601;2016;"11";2016-11-21;0,280091601055922;2,68711924331149;41107;61034;584;6,6;7;"Kim Valentin ";"Anders Frost";1;"V";"Lokal";1;1;0;-0,4;1,90850412177528
"1052";"Gribskov.22-01-2019.pdf";2;1;1452;"Gribskov Kommune";"22-01-2019";1455;0,0013745704467354;0,000687285223367698;2019;"01";2019-01-22;0,367006623651625;0,220059829784078;41195;69263;435;6,8;6,8;"Kim Valentin ";"Anders Frost";1;"V";"Lokal";1;1;0;0;1,42157413180179
"1053";"Gribskov.22-02-2016.pdf";45;25;7443;"Gribskov Kommune";"22-02-2016";7513;0,00598961799547451;0,0033275655530414;2016;"02";2016-02-22;1,59921194486824;1,06544340588258;41107;61034;584;6,6;7;"Kim Valentin ";"Anders Frost";1;"V";"Lokal";1;1;0;-0,4;1,90850412177528
"1054";"Gribskov.22-10-2018.pdf";2;9;1714;"Gribskov Kommune";"22-10-2018";1725;0,00115942028985507;0,00521739130434783;2018;"10";2018-10-22;0,309562108645284;1,67054114262174;41217;68338;449;6,8;7;"Kim Valentin ";"Anders Frost";1;"V";"Lokal";1;1;0;-0,2;1,46732594294024
"1055";"Gribskov.23-01-2018.pdf";0;2;1340;"Gribskov Kommune";"23-01-2018";1342;0;0,0014903129657228;2018;"01";2018-01-23;0;0,477178915552659;41217;68338;449;6,8;7;"Kim Valentin ";"Anders Frost";1;"V";"Lokal";1;1;0;-0,2;1,46732594294024
"1056";"Gribskov.23-05-2016.pdf";1;0;1087;"Gribskov Kommune";"23-05-2016";1088;0,000919117647058824;0;2016;"05";2016-05-23;0,245401947340586;0;41107;61034;584;6,6;7;"Kim Valentin ";"Anders Frost";1;"V";"Lokal";1;1;0;-0,4;1,90850412177528
"1057";"Gribskov.24-04-2017.pdf";48;20;8671;"Gribskov Kommune";"24-04-2017";8739;0,00549261929282527;0,00228859137201053;2017;"04";2017-04-24;1,46651462386025;0,732777325405273;41213;66874;532;6,9;7;"Kim Valentin ";"Anders Frost";1;"V";"Lokal";1;1;0;-0,0999999999999996;1,73856882326104
"1058";"Gribskov.24-04-2018.pdf";11;11;2898;"Gribskov Kommune";"24-04-2018";2920;0,00376712328767123;0,00376712328767123;2018;"04";2018-04-24;1,00581181704525;1,20618410126513;41217;68338;449;6,8;7;"Kim Valentin ";"Anders Frost";1;"V";"Lokal";1;1;0;-0,2;1,46732594294024
"1059";"Gribskov.24-10-2016.pdf";6;4;2784;"Gribskov Kommune";"24-10-2016";2794;0,00214745884037223;0,00143163922691482;2016;"10";2016-10-24;0,573365752412077;0,458392344074208;41107;61034;584;6,6;7;"Kim Valentin ";"Anders Frost";1;"V";"Lokal";1;1;0;-0,4;1,90850412177528
"1060";"Gribskov.26-02-2019.pdf";3;21;4833;"Gribskov Kommune";"26-02-2019";4857;0,000617665225447807;0,00432365657813465;2019;"02";2019-02-26;0,164914959052846;1,38437885506537;41195;69263;435;6,8;6,8;"Kim Valentin ";"Anders Frost";1;"V";"Lokal";1;1;0;0;1,42157413180179
"1061";"Gribskov.26-03-2019.pdf";8;5;2881;"Gribskov Kommune";"26-03-2019";2894;0,0027643400138217;0,00172771250863856;2019;"03";2019-03-26;0,738071371683641;0,553191175424731;41195;69263;435;6,8;6,8;"Kim Valentin ";"Anders Frost";1;"V";"Lokal";1;1;0;0;1,42157413180179
"1062";"Gribskov.26-11-2018.pdf";3;31;4188;"Gribskov Kommune";"26-11-2018";4222;0,000710563713879678;0,00734249171009;2018;"11";2018-11-26;0,189718606376047;2,35097077745402;41217;68338;449;6,8;7;"Kim Valentin ";"Anders Frost";1;"V";"Lokal";1;1;0;-0,2;1,46732594294024
"1063";"Gribskov.27-03-2017.pdf";1;3;603;"Gribskov Kommune";"27-03-2017";607;0,00164744645799012;0,00494233937397035;2017;"03";2017-03-27;0,439863786995976;1,5824730757949;41213;66874;532;6,9;7;"Kim Valentin ";"Anders Frost";1;"V";"Lokal";1;1;0;-0,0999999999999996;1,73856882326104
"1064";"Gribskov.29-05-2017.pdf";3;12;3441;"Gribskov Kommune";"29-05-2017";3456;0,000868055555555556;0,00347222222222222;2017;"05";2017-05-29;0,231768505821664;1,11176059838831;41213;66874;532;6,9;7;"Kim Valentin ";"Anders Frost";1;"V";"Lokal";1;1;0;-0,0999999999999996;1,73856882326104
"1065";"Gribskov.29-05-2018.pdf";25;15;6992;"Gribskov Kommune";"29-05-2018";7032;0,0035551763367463;0,00213310580204778;2018;"05";2018-05-29;0,949222549440263;0,682992859078145;41217;68338;449;6,8;7;"Kim Valentin ";"Anders Frost";1;"V";"Lokal";1;1;0;-0,2;1,46732594294024
"1066";"Gribskov.29-08-2016.pdf";3;1;945;"Gribskov Kommune";"29-08-2016";949;0,00316122233930453;0,00105374077976818;2016;"08";2016-08-29;0,84403788842958;0,337394154200036;41107;61034;584;6,6;7;"Kim Valentin ";"Anders Frost";1;"V";"Lokal";1;1;0;-0,4;1,90850412177528
"1067";"Gribskov.29-10-2018.pdf";1;31;3834;"Gribskov Kommune";"29-10-2018";3866;0,000258665287118469;0,00801862390067253;2018;"10";2018-10-29;0,0690629381030929;2,56745955054601;41217;68338;449;6,8;7;"Kim Valentin ";"Anders Frost";1;"V";"Lokal";1;1;0;-0,2;1,46732594294024
"1068";"Gribskov.30-06-2017.pdf";3;0;173;"Gribskov Kommune";"30-06-2017";176;0,0170454545454545;0;2017;"06";2017-06-30;4,55109065977086;0;41213;66874;532;6,9;7;"Kim Valentin ";"Anders Frost";1;"V";"Lokal";1;1;0;-0,0999999999999996;1,73856882326104
"1069";"Gribskov.30-11-2016.pdf";2;7;1411;"Gribskov Kommune";"30-11-2016";1420;0,00140845070422535;0,00492957746478873;2016;"11";2016-11-30;0,376052561558531;1,57838687771186;41107;61034;584;6,6;7;"Kim Valentin ";"Anders Frost";1;"V";"Lokal";1;1;0;-0,4;1,90850412177528
"1070";"Gribskov.31-10-2016.pdf";1;1;523;"Gribskov Kommune";"31-10-2016";525;0,0019047619047619;0,0019047619047619;2016;"10";2016-10-31;0,508566321345823;0,609880099687303;41107;61034;584;6,6;7;"Kim Valentin ";"Anders Frost";1;"V";"Lokal";1;1;0;-0,4;1,90850412177528
"1071";"Guldborgsund.07-12-2017.pdf";0;0;249;"Guldborgsund Kommune";"07-12-2017";249;0;0;2017;"12";2017-12-07;0;0;61257;62918;371;6,2;6,5;"John Brædder";"John Brædder";0;"Lokal";"Lokal";0;0;0;-0,3;1,21242299516889
"1072";"Guldborgsund.11-12-2017.pdf";8;14;1908;"Guldborgsund Kommune";"11-12-2017";1930;0,00414507772020725;0,00725388601036269;2017;"12";2017-12-11;1,10672463712563;2,32260037963818;61257;62918;371;6,2;6,5;"John Brædder";"John Brædder";0;"Lokal";"Lokal";0;0;0;-0,3;1,21242299516889
"1073";"Guldborgsund.12-12-2016.pdf";12;10;3502;"Guldborgsund Kommune";"12-12-2016";3524;0,00340522133938706;0,00283768444948922;2016;"12";2016-12-12;0,909184967218696;0,908589819341187;60979;62185;379;6,4;6,5;"John Brædder";"John Brædder";0;"Lokal";"Lokal";0;0;0;-0,0999999999999996;1,238566887248
"1074";"Guldborgsund.14-03-2016.pdf";9;2;3552;"Guldborgsund Kommune";"14-03-2016";3563;0,00252596126859388;0,000561324726354196;2016;"03";2016-03-14;0,67442488587118;0,179728909534569;60979;62185;379;6,4;6,5;"John Brædder";"John Brædder";0;"Lokal";"Lokal";0;0;0;-0,0999999999999996;1,238566887248
"1075";"Guldborgsund.14-05-2018.pdf";12;1;3185;"Guldborgsund Kommune";"14-05-2018";3198;0,00375234521575985;0,000312695434646654;2018;"05";2018-05-14;1,00186611146926;0,100121029498385;61219;65721;366;6,5;6,6;"John Brædder";"John Brædder";0;"Lokal";"Lokal";0;0;0;-0,0999999999999996;1,19608306261944
"1076";"Guldborgsund.15-05-2017.pdf";15;3;3382;"Guldborgsund Kommune";"15-05-2017";3400;0,00441176470588235;0,000882352941176471;2017;"05";2017-05-15;1,17792934723481;0,282517987355148;61257;62918;371;6,2;6,5;"John Brædder";"John Brædder";0;"Lokal";"Lokal";0;0;0;-0,3;1,21242299516889
"1077";"Guldborgsund.16-01-2017.pdf";4;6;3374;"Guldborgsund Kommune";"16-01-2017";3384;0,00118203309692671;0,00177304964539007;2017;"01";2017-01-16;0,315599667501841;0,567707539602543;61257;62918;371;6,2;6,5;"John Brædder";"John Brædder";0;"Lokal";"Lokal";0;0;0;-0,3;1,21242299516889
"1078";"Guldborgsund.16-06-2016.pdf";4;1;454;"Guldborgsund Kommune";"16-06-2016";459;0,00871459694989107;0,00217864923747277;2016;"06";2016-06-16;2,32677401922926;0,697575277420118;60979;62185;379;6,4;6,5;"John Brædder";"John Brædder";0;"Lokal";"Lokal";0;0;0;-0,0999999999999996;1,238566887248
"1079";"Guldborgsund.17-09-2018.pdf";11;0;1750;"Guldborgsund Kommune";"17-09-2018";1761;0,00624645088018171;0;2018;"09";2018-09-17;1,66778563644073;0;61219;65721;366;6,5;6,6;"John Brædder";"John Brædder";0;"Lokal";"Lokal";0;0;0;-0,0999999999999996;1,19608306261944
"1080";"Guldborgsund.17-12-2018.pdf";7;15;3208;"Guldborgsund Kommune";"17-12-2018";3230;0,0021671826625387;0,00464396284829721;2018;"12";2018-12-17;0,57863196004517;1,48693677555341;61219;65721;366;6,5;6,6;"John Brædder";"John Brædder";0;"Lokal";"Lokal";0;0;0;-0,0999999999999996;1,19608306261944
"1081";"Guldborgsund.18-01-2016.pdf";7;3;1953;"Guldborgsund Kommune";"18-01-2016";1963;0,00356597045338767;0,00152827305145186;2016;"01";2016-01-18;0,952104549641314;0,489333243508661;60979;62185;379;6,4;6,5;"John Brædder";"John Brædder";0;"Lokal";"Lokal";0;0;0;-0,0999999999999996;1,238566887248
"1082";"Guldborgsund.18-02-2019.pdf";0;1;931;"Guldborgsund Kommune";"18-02-2019";932;0;0,00107296137339056;2019;"02";2019-02-18;0;0,343548339416131;60930;67266;357;6,3;6,4;"John Brædder";"John Brædder";0;"Lokal";"Lokal";0;0;0;-0,100000000000001;1,16667118403044
"1083";"Guldborgsund.18-03-2019.pdf";8;9;2852;"Guldborgsund Kommune";"18-03-2019";2869;0,00278842802370164;0,00313698152666434;2019;"03";2019-03-18;0,744502805734562;1,00442086825462;60930;67266;357;6,3;6,4;"John Brædder";"John Brædder";0;"Lokal";"Lokal";0;0;0;-0,100000000000001;1,16667118403044
"1084";"Guldborgsund.18-04-2016.pdf";7;4;1738;"Guldborgsund Kommune";"18-04-2016";1749;0,00400228702115495;0,00228702115494568;2016;"04";2016-04-18;1,06859990334242;0,732274562231753;60979;62185;379;6,4;6,5;"John Brædder";"John Brædder";0;"Lokal";"Lokal";0;0;0;-0,0999999999999996;1,238566887248
"1085";"Guldborgsund.18-09-2017.pdf";8;2;2562;"Guldborgsund Kommune";"18-09-2017";2572;0,0031104199066874;0,000777604976671851;2017;"09";2017-09-18;0,830473775137036;0,248979045362235;61257;62918;371;6,2;6,5;"John Brædder";"John Brædder";0;"Lokal";"Lokal";0;0;0;-0,3;1,21242299516889
"1086";"Guldborgsund.19-02-2018.pdf";19;2;2040;"Guldborgsund Kommune";"19-02-2018";2061;0,00921882581271228;0,000970402717127608;2018;"02";2018-02-19;2,46140177361698;0,310710385575773;61219;65721;366;6,5;6,6;"John Brædder";"John Brædder";0;"Lokal";"Lokal";0;0;0;-0,0999999999999996;1,19608306261944
"1087";"Guldborgsund.19-03-2018.pdf";16;4;4403;"Guldborgsund Kommune";"19-03-2018";4423;0,00361745421659507;0,000904363554148768;2018;"03";2018-03-19;0,965850576374613;0,289565500642853;61219;65721;366;6,5;6,6;"John Brædder";"John Brædder";0;"Lokal";"Lokal";0;0;0;-0,0999999999999996;1,19608306261944
"1088";"Guldborgsund.19-06-2017.pdf";0;9;2619;"Guldborgsund Kommune";"19-06-2017";2628;0;0,00342465753424658;2017;"06";2017-06-19;0;1,09653100115012;61257;62918;371;6,2;6,5;"John Brædder";"John Brædder";0;"Lokal";"Lokal";0;0;0;-0,3;1,21242299516889
"1089";"Guldborgsund.19-09-2016.pdf";15;11;3552;"Guldborgsund Kommune";"19-09-2016";3578;0,00419228619340414;0,00307434320849637;2016;"09";2016-09-19;1,11932917288942;0,984364889797142;60979;62185;379;6,4;6,5;"John Brædder";"John Brædder";0;"Lokal";"Lokal";0;0;0;-0,0999999999999996;1,238566887248
"1090";"Guldborgsund.19-11-2018.pdf";16;9;2774;"Guldborgsund Kommune";"19-11-2018";2799;0,00571632725973562;0,00321543408360129;2018;"11";2018-11-19;1,52624405119861;1,02954036120847;61219;65721;366;6,5;6,6;"John Brædder";"John Brædder";0;"Lokal";"Lokal";0;0;0;-0,0999999999999996;1,19608306261944
"1091";"Guldborgsund.20-02-2017.pdf";4;21;3727;"Guldborgsund Kommune";"20-02-2017";3752;0,00106609808102345;0,00559701492537313;2017;"02";2017-02-20;0,284645329111468;1,79209171083489;61257;62918;371;6,2;6,5;"John Brædder";"John Brædder";0;"Lokal";"Lokal";0;0;0;-0,3;1,21242299516889
"1092";"Guldborgsund.20-03-2017.pdf";46;5;3973;"Guldborgsund Kommune";"20-03-2017";4024;0,0114314115308151;0,00124254473161034;2017;"03";2017-03-20;3,05215622775885;0,397846735009734;61257;62918;371;6,2;6,5;"John Brædder";"John Brædder";0;"Lokal";"Lokal";0;0;0;-0,3;1,21242299516889
"1093";"Guldborgsund.20-06-2016.pdf";9;2;4478;"Guldborgsund Kommune";"20-06-2016";4489;0,00200490086879038;0,000445533526397861;2016;"06";2016-06-20;0,535303156239477;0,142654066534121;60979;62185;379;6,4;6,5;"John Brædder";"John Brædder";0;"Lokal";"Lokal";0;0;0;-0,0999999999999996;1,238566887248
"1094";"Guldborgsund.20-06-2018.pdf";4;16;4581;"Guldborgsund Kommune";"20-06-2018";4601;0,000869376222560313;0,00347750489024125;2018;"06";2018-06-20;0,232121120370839;1,11345204028979;61219;65721;366;6,5;6,6;"John Brædder";"John Brædder";0;"Lokal";"Lokal";0;0;0;-0,0999999999999996;1,19608306261944
"1095";"Guldborgsund.20-08-2018.pdf";10;8;2501;"Guldborgsund Kommune";"20-08-2018";2519;0,00396982929734021;0,00317586343787217;2018;"08";2018-08-20;1,05993377811257;1,01687035279344;61219;65721;366;6,5;6,6;"John Brædder";"John Brædder";0;"Lokal";"Lokal";0;0;0;-0,0999999999999996;1,19608306261944
"1096";"Guldborgsund.21-08-2017.pdf";31;15;3063;"Guldborgsund Kommune";"21-08-2017";3109;0,00997105178513992;0,0048247024766806;2017;"08";2017-08-21;2,66224409131659;1,54480726440576;61257;62918;371;6,2;6,5;"John Brædder";"John Brædder";0;"Lokal";"Lokal";0;0;0;-0,3;1,21242299516889
"1097";"Guldborgsund.21-11-2016.pdf";27;2;2959;"Guldborgsund Kommune";"21-11-2016";2988;0,00903614457831325;0,000669344042838019;2016;"11";2016-11-21;2,41262637385443;0,214315296074856;60979;62185;379;6,4;6,5;"John Brædder";"John Brædder";0;"Lokal";"Lokal";0;0;0;-0,0999999999999996;1,238566887248
"1098";"Guldborgsund.22-01-2018.pdf";0;7;2147;"Guldborgsund Kommune";"22-01-2018";2154;0;0,00324976787372331;2018;"01";2018-01-22;0;1,04053359626316;61219;65721;366;6,5;6,6;"John Brædder";"John Brædder";0;"Lokal";"Lokal";0;0;0;-0,0999999999999996;1,19608306261944
"1099";"Guldborgsund.22-01-2019.pdf";26;6;2873;"Guldborgsund Kommune";"22-01-2019";2905;0,00895008605851979;0,00206540447504303;2019;"01";2019-01-22;2,38964897981772;0,661315770745268;60930;67266;357;6,3;6,4;"John Brædder";"John Brædder";0;"Lokal";"Lokal";0;0;0;-0,100000000000001;1,16667118403044
"1100";"Guldborgsund.22-02-2016.pdf";32;4;4239;"Guldborgsund Kommune";"22-02-2016";4275;0,00748538011695906;0,000935672514619883;2016;"02";2016-02-22;1,99857642072745;0,299590224407798;60979;62185;379;6,4;6,5;"John Brædder";"John Brædder";0;"Lokal";"Lokal";0;0;0;-0,0999999999999996;1,238566887248
"1101";"Guldborgsund.22-08-2016.pdf";28;6;4186;"Guldborgsund Kommune";"22-08-2016";4220;0,00663507109004739;0,0014218009478673;2016;"08";2016-08-22;1,77154619047005;0,455242254505925;60979;62185;379;6,4;6,5;"John Brædder";"John Brædder";0;"Lokal";"Lokal";0;0;0;-0,0999999999999996;1,238566887248
"1102";"Guldborgsund.22-10-2018.pdf";20;13;4479;"Guldborgsund Kommune";"22-10-2018";4512;0,00443262411347518;0,00288120567375887;2018;"10";2018-10-22;1,1834987531319;0,922524751854132;61219;65721;366;6,5;6,6;"John Brædder";"John Brædder";0;"Lokal";"Lokal";0;0;0;-0,0999999999999996;1,19608306261944
"1103";"Guldborgsund.23-04-2018.pdf";0;4;3196;"Guldborgsund Kommune";"23-04-2018";3200;0;0,00125;2018;"04";2018-04-23;0;0,400233815419793;61219;65721;366;6,5;6,6;"John Brædder";"John Brædder";0;"Lokal";"Lokal";0;0;0;-0,0999999999999996;1,19608306261944
"1104";"Guldborgsund.23-05-2016.pdf";11;6;3492;"Guldborgsund Kommune";"23-05-2016";3509;0,00313479623824451;0,00170988885722428;2016;"05";2016-05-23;0,836982190302687;0,54748427301653;60979;62185;379;6,4;6,5;"John Brædder";"John Brædder";0;"Lokal";"Lokal";0;0;0;-0,0999999999999996;1,238566887248
"1105";"Guldborgsund.23-10-2017.pdf";7;8;3008;"Guldborgsund Kommune";"23-10-2017";3023;0,00231558054912339;0,00264637777042673;2017;"10";2017-10-23;0,618253797865002;0,847335897680011;61257;62918;371;6,2;6,5;"John Brædder";"John Brædder";0;"Lokal";"Lokal";0;0;0;-0,3;1,21242299516889
"1106";"Guldborgsund.24-04-2017.pdf";6;4;2978;"Guldborgsund Kommune";"24-04-2017";2988;0,00200803212851406;0,00133868808567604;2017;"04";2017-04-24;0,536139194189874;0,428630592149711;61257;62918;371;6,2;6,5;"John Brædder";"John Brædder";0;"Lokal";"Lokal";0;0;0;-0,3;1,21242299516889
"1107";"Guldborgsund.24-10-2016.pdf";1;3;2414;"Guldborgsund Kommune";"24-10-2016";2418;0,000413564929693962;0,00124069478908189;2016;"10";2016-10-24;0,110420727339354;0,397254407364559;60979;62185;379;6,4;6,5;"John Brædder";"John Brædder";0;"Lokal";"Lokal";0;0;0;-0,0999999999999996;1,238566887248
"1108";"Haderslev.01-10-2018.pdf";1;15;2735;"Haderslev Kommune";"01-10-2018";2751;0,000363504180298073;0,0054525627044711;2018;"10";2018-10-01;0,0970546414782105;1,74583998002091;55963;64031;386;6,9;6,9;"Hans Geil";"Hans Geil";0;"V";"V";0;0;0;0;1,26144279281722
"1109";"Haderslev.02-10-2017.pdf";8;18;2672;"Haderslev Kommune";"02-10-2017";2698;0,00296515937731653;0,00667160859896219;2017;"10";2017-10-02;0,791689603281118;2,13616269164011;56045;63796;434;6,9;6,8;"Hans Geil";"Hans Geil";0;"V";"V";0;0;0;0,100000000000001;1,4183061452919
"1110";"Haderslev.03-02-2016.pdf";4;12;4517;"Haderslev Kommune";"03-02-2016";4533;0,000882417824840062;0,00264725347452019;2016;"02";2016-02-03;0,235603193211169;0,847616286792413;56029;61217;486;7;6,8;"Hans Geil";"Hans Geil";0;"V";"V";0;0;0;0,2;1,58824144380614
"1111";"Haderslev.03-04-2017.pdf";11;10;3959;"Haderslev Kommune";"03-04-2017";3980;0,00276381909547739;0,00251256281407035;2017;"04";2017-04-03;0,737932287882444;0,804490081245814;56045;63796;434;6,9;6,8;"Hans Geil";"Hans Geil";0;"V";"V";0;0;0;0,100000000000001;1,4183061452919
"1112";"Haderslev.03-12-2018.pdf";2;9;2845;"Haderslev Kommune";"03-12-2018";2856;0,000700280112044818;0,00315126050420168;2018;"12";2018-12-03;0,186972912259494;1,00899281198267;55963;64031;386;6,9;6,9;"Hans Geil";"Hans Geil";0;"V";"V";0;0;0;0;1,26144279281722
"1113";"Haderslev.04-02-2019.pdf";8;9;3555;"Haderslev Kommune";"04-02-2019";3572;0,00223964165733483;0,00251959686450168;2019;"02";2019-02-04;0,597978317371909;0,806742293119403;55857;64027;379;6,6;6,7;"Hans Geil";"Hans Geil";0;"V";"V";0;0;0;-0,100000000000001;1,238566887248
"1114";"Haderslev.04-12-2017.pdf";37;12;3494;"Haderslev Kommune";"04-12-2017";3543;0,0104431272932543;0,00338696020321761;2017;"12";2017-12-04;2,78828698621017;1,08446080384703;56045;63796;434;6,9;6,8;"Hans Geil";"Hans Geil";0;"V";"V";0;0;0;0,100000000000001;1,4183061452919
"1115";"Haderslev.05-02-2018.pdf";6;19;3236;"Haderslev Kommune";"05-02-2018";3261;0,00183992640294388;0,00582643360932229;2018;"02";2018-02-05;0,491255416203417;1,86554860299934;55963;64031;386;6,9;6,9;"Hans Geil";"Hans Geil";0;"V";"V";0;0;0;0;1,26144279281722
"1116";"Haderslev.05-10-2016.pdf";8;24;3128;"Haderslev Kommune";"05-10-2016";3160;0,00253164556962025;0,00759493670886076;2016;"10";2016-10-05;0,675942579003942;2,43180039748735;56029;61217;486;7;6,8;"Hans Geil";"Hans Geil";0;"V";"V";0;0;0;0,2;1,58824144380614
"1117";"Haderslev.06-04-2016.pdf";22;23;5214;"Haderslev Kommune";"06-04-2016";5259;0,00418330481080053;0,00437345502947328;2016;"04";2016-04-06;1,11693116781598;1,40032367441038;56029;61217;486;7;6,8;"Hans Geil";"Hans Geil";0;"V";"V";0;0;0;0,2;1,58824144380614
"1118";"Haderslev.06-11-2017.pdf";2;16;1941;"Haderslev Kommune";"06-11-2017";1959;0,00102092904543134;0,00816743236345074;2017;"11";2017-11-06;0,272585317719813;2,61510609360559;56045;63796;434;6,9;6,8;"Hans Geil";"Hans Geil";0;"V";"V";0;0;0;0,100000000000001;1,4183061452919
"1119";"Haderslev.07-05-2018.pdf";7;6;4064;"Haderslev Kommune";"07-05-2018";4077;0,00171694873681629;0,00147167034584253;2018;"05";2018-05-07;0,458420709086559;0,471209790045378;55963;64031;386;6,9;6,9;"Hans Geil";"Hans Geil";0;"V";"V";0;0;0;0;1,26144279281722
"1120";"Haderslev.07-08-2017.pdf";22;5;2676;"Haderslev Kommune";"07-08-2017";2703;0,00813910469848317;0,00184979652238254;2017;"08";2017-08-07;2,17311913116695;0,592280895922742;56045;63796;434;6,9;6,8;"Hans Geil";"Hans Geil";0;"V";"V";0;0;0;0,100000000000001;1,4183061452919
"1121";"Haderslev.07-11-2018.pdf";2;15;3724;"Haderslev Kommune";"07-11-2018";3741;0,000534616412723871;0,00400962309542903;2018;"11";2018-11-07;0,142741148733792;1,2838293999031;55963;64031;386;6,9;6,9;"Hans Geil";"Hans Geil";0;"V";"V";0;0;0;0;1,26144279281722
"1122";"Haderslev.07-12-2017.pdf";0;1;427;"Haderslev Kommune";"07-12-2017";428;0;0,00233644859813084;2017;"12";2017-12-07;0;0,748100589569706;56045;63796;434;6,9;6,8;"Hans Geil";"Hans Geil";0;"V";"V";0;0;0;0,100000000000001;1,4183061452919
"1123";"Haderslev.08-03-2017.pdf";21;25;3236;"Haderslev Kommune";"08-03-2017";3282;0,00639853747714808;0,00761730652041438;2017;"03";2017-03-08;1,70839235004196;2,43896292151001;56045;63796;434;6,9;6,8;"Hans Geil";"Hans Geil";0;"V";"V";0;0;0;0,100000000000001;1,4183061452919
"1124";"Haderslev.08-04-2019.pdf";6;10;2228;"Haderslev Kommune";"08-04-2019";2244;0,00267379679144385;0,00445632798573975;2019;"04";2019-04-08;0,713896574081704;1,4268585219957;55857;64027;379;6,6;6,7;"Hans Geil";"Hans Geil";0;"V";"V";0;0;0;-0,100000000000001;1,238566887248
"1125";"Haderslev.08-05-2017.pdf";9;12;5262;"Haderslev Kommune";"08-05-2017";5283;0,00170357751277683;0,00227143668370244;2017;"05";2017-05-08;0,4548506281202;0,727284616322167;56045;63796;434;6,9;6,8;"Hans Geil";"Hans Geil";0;"V";"V";0;0;0;0,100000000000001;1,4183061452919
"1126";"Haderslev.08-06-2016.pdf";22;7;3851;"Haderslev Kommune";"08-06-2016";3880;0,0056701030927835;0,00180412371134021;2016;"06";2016-06-08;1,51390232256295;0,577657053183206;56029;61217;486;7;6,8;"Hans Geil";"Hans Geil";0;"V";"V";0;0;0;0,2;1,58824144380614
"1127";"Haderslev.09-04-2018.pdf";1;2;2443;"Haderslev Kommune";"09-04-2018";2446;0,000408830744071954;0,000817661488143908;2018;"04";2018-04-09;0,109156712472018;0,26180462169733;55963;64031;386;6,9;6,9;"Hans Geil";"Hans Geil";0;"V";"V";0;0;0;0;1,26144279281722
"1128";"Haderslev.10-08-2016.pdf";9;2;1982;"Haderslev Kommune";"10-08-2016";1993;0,00451580531861515;0,00100351229302559;2016;"08";2016-08-10;1,20570791187106;0,321311643086637;56029;61217;486;7;6,8;"Hans Geil";"Hans Geil";0;"V";"V";0;0;0;0,2;1,58824144380614
"1129";"Haderslev.10-09-2018.pdf";4;4;1775;"Haderslev Kommune";"10-09-2018";1783;0,00224340998317443;0,00224340998317443;2018;"09";2018-09-10;0,598984450267094;0,718310829693403;55963;64031;386;6,9;6,9;"Hans Geil";"Hans Geil";0;"V";"V";0;0;0;0;1,26144279281722
"1130";"Haderslev.11-03-2019.pdf";21;10;2979;"Haderslev Kommune";"11-03-2019";3010;0,00697674418604651;0,00332225913621262;2019;"03";2019-03-11;1,86277199097598;1,06374435991971;55857;64027;379;6,6;6,7;"Hans Geil";"Hans Geil";0;"V";"V";0;0;0;-0,100000000000001;1,238566887248
"1131";"Haderslev.11-05-2016.pdf";18;2;4096;"Haderslev Kommune";"11-05-2016";4116;0,0043731778425656;0,000485908649173955;2016;"05";2016-05-11;1,16762675819194;0,155581658083496;56029;61217;486;7;6,8;"Hans Geil";"Hans Geil";0;"V";"V";0;0;0;0,2;1,58824144380614
"1132";"Haderslev.11-06-2018.pdf";3;9;3910;"Haderslev Kommune";"11-06-2018";3922;0,000764915859255482;0,00229474757776645;2018;"06";2018-06-11;0,204230483457336;0,734748462779834;55963;64031;386;6,9;6,9;"Hans Geil";"Hans Geil";0;"V";"V";0;0;0;0;1,26144279281722
"1133";"Haderslev.11-09-2017.pdf";12;18;3835;"Haderslev Kommune";"11-09-2017";3865;0,00310478654592497;0,00465717981888745;2017;"09";2017-09-11;0,828969682918159;1,49116867840751;56045;63796;434;6,9;6,8;"Hans Geil";"Hans Geil";0;"V";"V";0;0;0;0,100000000000001;1,4183061452919
"1134";"Haderslev.12-03-2018.pdf";16;4;3542;"Haderslev Kommune";"12-03-2018";3562;0,00449185850645705;0,00112296462661426;2018;"03";2018-03-12;1,19931417723327;0,359558733673031;55963;64031;386;6,9;6,9;"Hans Geil";"Hans Geil";0;"V";"V";0;0;0;0;1,26144279281722
"1135";"Haderslev.12-06-2017.pdf";12;38;5479;"Haderslev Kommune";"12-06-2017";5529;0,0021703743895822;0,00687285223367698;2017;"06";2017-06-12;0,579484142607829;2,20059829784078;56045;63796;434;6,9;6,8;"Hans Geil";"Hans Geil";0;"V";"V";0;0;0;0,100000000000001;1,4183061452919
"1136";"Haderslev.14-11-2016.pdf";10;4;2367;"Haderslev Kommune";"14-11-2016";2381;0,00419991600167997;0,00167996640067199;2016;"11";2016-11-14;1,12136631124132;0,537903489854404;56029;61217;486;7;6,8;"Hans Geil";"Hans Geil";0;"V";"V";0;0;0;0,2;1,58824144380614
"1137";"Haderslev.15-01-2018.pdf";0;6;984;"Haderslev Kommune";"15-01-2018";990;0;0,00606060606060606;2018;"01";2018-01-15;0;1,94052758991415;55963;64031;386;6,9;6,9;"Hans Geil";"Hans Geil";0;"V";"V";0;0;0;0;1,26144279281722
"1138";"Haderslev.15-08-2018.pdf";15;1;2524;"Haderslev Kommune";"15-08-2018";2540;0,00590551181102362;0,000393700787401575;2018;"08";2018-08-15;1,57675581913321;0,126057894620407;55963;64031;386;6,9;6,9;"Hans Geil";"Hans Geil";0;"V";"V";0;0;0;0;1,26144279281722
"1139";"Haderslev.21-02-2017.pdf";0;0;504;"Haderslev Kommune";"21-02-2017";504;0;0;2017;"02";2017-02-21;0;0;56045;63796;434;6,9;6,8;"Hans Geil";"Hans Geil";0;"V";"V";0;0;0;0,100000000000001;1,4183061452919
"1140";"Haderslev.21-12-2016.pdf";7;29;1956;"Haderslev Kommune";"21-12-2016";1992;0,0035140562248996;0,0145582329317269;2016;"12";2016-12-21;0,938243589832279;4,66135768962811;56029;61217;486;7;6,8;"Hans Geil";"Hans Geil";0;"V";"V";0;0;0;0,2;1,58824144380614
"1141";"Haderslev.25-01-2017.pdf";8;9;2778;"Haderslev Kommune";"25-01-2017";2795;0,00286225402504472;0,00322003577817531;2017;"01";2017-01-25;0,764214150143992;1,03101376422988;56045;63796;434;6,9;6,8;"Hans Geil";"Hans Geil";0;"V";"V";0;0;0;0,100000000000001;1,4183061452919
"1142";"Haderslev.25-01-2019.pdf";0;1;678;"Haderslev Kommune";"25-01-2019";679;0;0,00147275405007364;2019;"01";2019-01-25;0;0,47155677810874;55857;64027;379;6,6;6,7;"Hans Geil";"Hans Geil";0;"V";"V";0;0;0;-0,100000000000001;1,238566887248
"1143";"Haderslev.26-03-2019.pdf";16;0;694;"Haderslev Kommune";"26-03-2019";710;0,0225352112676056;0;2019;"03";2019-03-26;6,0168409849365;0;55857;64027;379;6,6;6,7;"Hans Geil";"Hans Geil";0;"V";"V";0;0;0;-0,100000000000001;1,238566887248
"1144";"Haderslev.29-02-2016.pdf";1;0;436;"Haderslev Kommune";"29-02-2016";437;0,0022883295194508;0;2016;"02";2016-02-29;0,610977846010428;0;56029;61217;486;7;6,8;"Hans Geil";"Hans Geil";0;"V";"V";0;0;0;0,2;1,58824144380614
"1145";"Haderslev.30-11-2016.pdf";2;9;1489;"Haderslev Kommune";"30-11-2016";1500;0,00133333333333333;0,006;2016;"11";2016-11-30;0,355996424942076;1,921122314015;56029;61217;486;7;6,8;"Hans Geil";"Hans Geil";0;"V";"V";0;0;0;0,2;1,58824144380614
"1146";"Haderslev.31-08-2016.pdf";6;20;3190;"Haderslev Kommune";"31-08-2016";3216;0,00186567164179104;0,00621890547263682;2016;"08";2016-08-31;0,498129325945069;1,99121301203877;56029;61217;486;7;6,8;"Hans Geil";"Hans Geil";0;"V";"V";0;0;0;0,2;1,58824144380614
"1147";"Halsnaes.01-09-2016.pdf";3;2;676;"Halsnæs Kommune";"01-09-2016";681;0,00440528634361234;0,00293685756240822;2016;"09";2016-09-01;1,17619964187911;0,940343766037692;31049;71624;823;6,2;6,4;"Steen Hasselriis";"Steffen Jensen";1;"V";"S";1;1;0;-0,2;2,6895528976388
"1148";"Halsnaes.02-05-2018.pdf";12;1;2521;"Halsnæs Kommune";"02-05-2018";2534;0,00473559589581689;0,000394632991318074;2018;"05";2018-05-02;1,26439140666089;0,126356374244607;31168;73002;557;6,5;6,7;"Steen Hasselriis";"Steffen Jensen";1;"V";"S";1;1;0;-0,2;1,82026848600827
"1149";"Halsnaes.03-04-2017.pdf";13;2;2568;"Halsnæs Kommune";"03-04-2017";2583;0,00503290747193186;0,000774293457220286;2017;"04";2017-04-03;1,343772800304;0,247918739710286;31162;71443;674;6,7;6,8;"Steen Hasselriis";"Steffen Jensen";1;"V";"S";1;1;0;-0,0999999999999996;2,20262290766531
"1150";"Halsnaes.04-12-2017.pdf";15;1;4131;"Halsnæs Kommune";"04-12-2017";4147;0,00361707258258982;0,000241138172172655;2017;"12";2017-12-04;0,965748681118485;0,0772093205536133;31162;71443;674;6,7;6,8;"Steen Hasselriis";"Steffen Jensen";1;"V";"S";1;1;0;-0,0999999999999996;2,20262290766531
"1151";"Halsnaes.04-12-2018.pdf";26;16;3552;"Halsnæs Kommune";"04-12-2018";3594;0,00723427935447969;0,00445186421814135;2018;"12";2018-12-04;1,93153319042028;1,42542928140605;31168;73002;557;6,5;6,7;"Steen Hasselriis";"Steffen Jensen";1;"V";"S";1;1;0;-0,2;1,82026848600827
"1152";"Halsnaes.05-03-2019.pdf";21;20;2958;"Halsnæs Kommune";"05-03-2019";2999;0,00700233411137046;0,00666888962987663;2019;"03";2019-03-05;1,86960443242337;2,13529211294321;31271;85919;450;6,3;6,6;"Steen Hasselriis";"Steffen Jensen";1;"V";"S";1;1;0;-0,3;1,47059392945013
"1153";"Halsnaes.05-12-2016.pdf";29;5;4192;"Halsnæs Kommune";"05-12-2016";4226;0,00686228111689541;0,00118315191670611;2016;"12";2016-12-05;1,83221065842171;0,37882992467562;31049;71624;823;6,2;6,4;"Steen Hasselriis";"Steffen Jensen";1;"V";"S";1;1;0;-0,2;2,6895528976388
"1154";"Halsnaes.06-06-2018.pdf";7;7;2800;"Halsnæs Kommune";"06-06-2018";2814;0,00248756218905473;0,00248756218905473;2018;"06";2018-06-06;0,664172434593426;0,796485204815508;31168;73002;557;6,5;6,7;"Steen Hasselriis";"Steffen Jensen";1;"V";"S";1;1;0;-0,2;1,82026848600827
"1155";"Halsnaes.06-11-2017.pdf";1;4;2875;"Halsnæs Kommune";"06-11-2017";2880;0,000347222222222222;0,00138888888888889;2017;"11";2017-11-06;0,0927074023286657;0,444704239355325;31162;71443;674;6,7;6,8;"Steen Hasselriis";"Steffen Jensen";1;"V";"S";1;1;0;-0,0999999999999996;2,20262290766531
"1156";"Halsnaes.06-11-2018.pdf";14;8;3784;"Halsnæs Kommune";"06-11-2018";3806;0,00367840252233316;0,00210194429847609;2018;"11";2018-11-06;0,98212361058639;0,673015349103172;31168;73002;557;6,5;6,7;"Steen Hasselriis";"Steffen Jensen";1;"V";"S";1;1;0;-0,2;1,82026848600827
"1157";"Halsnaes.07-03-2018.pdf";16;8;3026;"Halsnæs Kommune";"07-03-2018";3050;0,00524590163934426;0,00262295081967213;2018;"03";2018-03-07;1,40064167190325;0,83983489137268;31168;73002;557;6,5;6,7;"Steen Hasselriis";"Steffen Jensen";1;"V";"S";1;1;0;-0,2;1,82026848600827
"1158";"Halsnaes.08-02-2016.pdf";21;8;3684;"Halsnæs Kommune";"08-02-2016";3713;0,00565580393213035;0,0021545919741449;2016;"02";2016-02-08;1,51008448500881;0,6898724531879;31049;71624;823;6,2;6,4;"Steen Hasselriis";"Steffen Jensen";1;"V";"S";1;1;0;-0,2;2,6895528976388
"1159";"Halsnaes.08-05-2017.pdf";9;19;3622;"Halsnæs Kommune";"08-05-2017";3650;0,00246575342465753;0,00520547945205479;2017;"05";2017-05-08;0,658349552975072;1,66672712174818;31162;71443;674;6,7;6,8;"Steen Hasselriis";"Steffen Jensen";1;"V";"S";1;1;0;-0,0999999999999996;2,20262290766531
"1160";"Halsnaes.09-05-2016.pdf";0;5;2562;"Halsnæs Kommune";"09-05-2016";2567;0;0,00194779898714453;2016;"05";2016-05-09;0;0,623660016236529;31049;71624;823;6,2;6,4;"Steen Hasselriis";"Steffen Jensen";1;"V";"S";1;1;0;-0,2;2,6895528976388
"1161";"Halsnaes.11-01-2016.pdf";5;11;5438;"Halsnæs Kommune";"11-01-2016";5454;0,000916758342500917;0,00201686835350202;2016;"01";2016-01-11;0,244772019349612;0,645775133057238;31049;71624;823;6,2;6,4;"Steen Hasselriis";"Steffen Jensen";1;"V";"S";1;1;0;-0,2;2,6895528976388
"1162";"Halsnaes.11-04-2016.pdf";17;26;4720;"Halsnæs Kommune";"11-04-2016";4763;0,00356917908880957;0,00545874448876758;2016;"04";2016-04-11;0,952961246695669;1,74781930731297;31049;71624;823;6,2;6,4;"Steen Hasselriis";"Steffen Jensen";1;"V";"S";1;1;0;-0,2;2,6895528976388
"1163";"Halsnaes.11-10-2017.pdf";1;6;1537;"Halsnæs Kommune";"11-10-2017";1544;0,000647668393782383;0,0038860103626943;2017;"10";2017-10-11;0,172925724550879;1,24425020337759;31162;71443;674;6,7;6,8;"Steen Hasselriis";"Steffen Jensen";1;"V";"S";1;1;0;-0,0999999999999996;2,20262290766531
"1164";"Halsnaes.12-06-2017.pdf";46;3;5155;"Halsnæs Kommune";"12-06-2017";5204;0,00883935434281322;0,000576479631053036;2017;"06";2017-06-12;2,36008390862829;0,184581313798521;31162;71443;674;6,7;6,8;"Steen Hasselriis";"Steffen Jensen";1;"V";"S";1;1;0;-0,0999999999999996;2,20262290766531
"1165";"Halsnaes.13-03-2017.pdf";21;8;6337;"Halsnæs Kommune";"13-03-2017";6366;0,00329877474081056;0,00125667609173735;2017;"03";2017-03-13;0,880764010813337;0,4023714135543;31162;71443;674;6,7;6,8;"Steen Hasselriis";"Steffen Jensen";1;"V";"S";1;1;0;-0,0999999999999996;2,20262290766531
"1166";"Halsnaes.13-06-2016.pdf";32;31;7378;"Halsnæs Kommune";"13-06-2016";7441;0,00430049724499395;0,00416610670608789;2016;"06";2016-06-13;1,14822123351832;1,33393342593883;31049;71624;823;6,2;6,4;"Steen Hasselriis";"Steffen Jensen";1;"V";"S";1;1;0;-0,2;2,6895528976388
"1167";"Halsnaes.14-11-2016.pdf";12;10;3699;"Halsnæs Kommune";"14-11-2016";3721;0,00322493953238377;0,00268744961031981;2016;"11";2016-11-14;0,861050208137244;0,860486569029385;31049;71624;823;6,2;6,4;"Steen Hasselriis";"Steffen Jensen";1;"V";"S";1;1;0;-0,2;2,6895528976388
"1168";"Halsnaes.15-01-2019.pdf";0;18;2563;"Halsnæs Kommune";"15-01-2019";2581;0;0,00697404106935296;2019;"01";2019-01-15;0;2,23299765286517;31271;85919;450;6,3;6,6;"Steen Hasselriis";"Steffen Jensen";1;"V";"S";1;1;0;-0,3;1,47059392945013
"1169";"Halsnaes.16-01-2017.pdf";17;12;3745;"Halsnæs Kommune";"16-01-2017";3774;0,0045045045045045;0,00317965023847377;2017;"01";2017-01-16;1,20269062480431;1,01808283731585;31162;71443;674;6,7;6,8;"Steen Hasselriis";"Steffen Jensen";1;"V";"S";1;1;0;-0,0999999999999996;2,20262290766531
"1170";"Halsnaes.17-01-2018.pdf";4;16;5280;"Halsnæs Kommune";"17-01-2018";5300;0,000754716981132075;0,0030188679245283;2018;"01";2018-01-17;0,201507410344571;0,966602422145914;31168;73002;557;6,5;6,7;"Steen Hasselriis";"Steffen Jensen";1;"V";"S";1;1;0;-0,2;1,82026848600827
"1171";"Halsnaes.17-04-2018.pdf";2;27;3028;"Halsnæs Kommune";"17-04-2018";3057;0,000654236179260713;0,00883218842001963;2018;"04";2018-04-17;0,174679305663433;2,82795237588077;31168;73002;557;6,5;6,7;"Steen Hasselriis";"Steffen Jensen";1;"V";"S";1;1;0;-0,2;1,82026848600827
"1172";"Halsnaes.20-06-2016.pdf";0;0;499;"Halsnæs Kommune";"20-06-2016";499;0;0;2016;"06";2016-06-20;0;0;31049;71624;823;6,2;6,4;"Steen Hasselriis";"Steffen Jensen";1;"V";"S";1;1;0;-0,2;2,6895528976388
"1173";"Halsnaes.21-08-2017.pdf";30;17;4723;"Halsnæs Kommune";"21-08-2017";4770;0,00628930817610063;0,00356394129979036;2017;"08";2017-08-21;1,6792284195381;1,14112785947782;31162;71443;674;6,7;6,8;"Steen Hasselriis";"Steffen Jensen";1;"V";"S";1;1;0;-0,0999999999999996;2,20262290766531
"1174";"Halsnaes.21-08-2018.pdf";9;10;2774;"Halsnæs Kommune";"21-08-2018";2793;0,00322234156820623;0,00358037952022914;2018;"08";2018-08-21;0,860356558667746;1,14639116482576;31168;73002;557;6,5;6,7;"Steen Hasselriis";"Steffen Jensen";1;"V";"S";1;1;0;-0,2;1,82026848600827
"1175";"Halsnaes.22-02-2019.pdf";0;1;264;"Halsnæs Kommune";"22-02-2019";265;0;0,00377358490566038;2019;"02";2019-02-22;0;1,20825302768239;31271;85919;450;6,3;6,6;"Steen Hasselriis";"Steffen Jensen";1;"V";"S";1;1;0;-0,3;1,47059392945013
"1176";"Halsnaes.22-08-2016.pdf";29;4;3502;"Halsnæs Kommune";"22-08-2016";3535;0,0082036775106082;0,00113154172560113;2016;"08";2016-08-22;2,19035989886567;0,36230500971523;31049;71624;823;6,2;6,4;"Steen Hasselriis";"Steffen Jensen";1;"V";"S";1;1;0;-0,2;2,6895528976388
"1177";"Halsnaes.25-09-2017.pdf";14;19;4679;"Halsnæs Kommune";"25-09-2017";4712;0,00297113752122241;0,00403225806451613;2017;"09";2017-09-25;0,79328575167483;1,29107682393482;31162;71443;674;6,7;6,8;"Steen Hasselriis";"Steffen Jensen";1;"V";"S";1;1;0;-0,0999999999999996;2,20262290766531
"1178";"Halsnaes.25-09-2018.pdf";9;21;4094;"Halsnæs Kommune";"25-09-2018";4124;0,0021823472356935;0,0050921435499515;2018;"09";2018-09-25;0,582680860416832;1,6304384333299;31168;73002;557;6,5;6,7;"Steen Hasselriis";"Steffen Jensen";1;"V";"S";1;1;0;-0,2;1,82026848600827
"1179";"Halsnaes.26-09-2016.pdf";23;10;6254;"Halsnæs Kommune";"26-09-2016";6287;0,00365834261173851;0,00159058374423413;2016;"09";2016-09-26;0,976767668244125;0,509284320559622;31049;71624;823;6,2;6,4;"Steen Hasselriis";"Steffen Jensen";1;"V";"S";1;1;0;-0,2;2,6895528976388
"1180";"Halsnaes.28-03-2019.pdf";1;4;1316;"Halsnæs Kommune";"28-03-2019";1321;0,000757002271006813;0,00302800908402725;2019;"03";2019-03-28;0,202117576613594;0,969529303060815;31271;85919;450;6,3;6,6;"Steen Hasselriis";"Steffen Jensen";1;"V";"S";1;1;0;-0,3;1,47059392945013
"1181";"Halsnaes.29-02-2016.pdf";23;4;2235;"Halsnæs Kommune";"29-02-2016";2262;0,0101679929266136;0,0017683465959328;2016;"02";2016-02-29;2,71482684803307;0,566201684059831;31049;71624;823;6,2;6,4;"Steen Hasselriis";"Steffen Jensen";1;"V";"S";1;1;0;-0,2;2,6895528976388
"1182";"Hedensted.01-02-2016.pdf";4;3;1343;"Hedensted Kommune";"01-02-2016";1350;0,00296296296296296;0,00222222222222222;2016;"02";2016-02-01;0,791103166537947;0,71152678296852;46206;60304;267;7;6,8;"Kirsten Terkilsen";"Kasper Glyngø";1;"V";"S";1;1;0;0,2;0,872552398140411
"1183";"Hedensted.01-04-2019.pdf";1;2;744;"Hedensted Kommune";"01-04-2019";747;0,00133868808567604;0,00267737617135207;2019;"04";2019-04-01;0,357426129459916;0,857261184299422;46747;64335;251;7;6,9;"Kirsten Terkilsen";"Kasper Glyngø";1;"V";"S";1;1;0;0,0999999999999996;0,820264613982184
"1184";"Hedensted.01-10-2018.pdf";8;6;1348;"Hedensted Kommune";"01-10-2018";1362;0,00587371512481645;0,00440528634361234;2018;"10";2018-10-01;1,56826618917214;1,41051564905654;46616;65203;257;7;6,9;"Kirsten Terkilsen";"Kasper Glyngø";1;"V";"S";1;1;0;0,0999999999999996;0,839872533041519
"1185";"Hedensted.02-05-2016.pdf";0;6;747;"Hedensted Kommune";"02-05-2016";753;0;0,00796812749003984;2016;"05";2016-05-02;0;2,55129125367199;46206;60304;267;7;6,8;"Kirsten Terkilsen";"Kasper Glyngø";1;"V";"S";1;1;0;0,2;0,872552398140411
"1186";"Hedensted.02-10-2017.pdf";0;0;664;"Hedensted Kommune";"02-10-2017";664;0;0;2017;"10";2017-10-02;0;0;46524;63679;263;7,2;6,9;"Kirsten Terkilsen";"Kasper Glyngø";1;"V";"S";1;1;0;0,3;0,859480452100854
"1187";"Hedensted.03-04-2017.pdf";0;0;802;"Hedensted Kommune";"03-04-2017";802;0;0;2017;"04";2017-04-03;0;0;46524;63679;263;7,2;6,9;"Kirsten Terkilsen";"Kasper Glyngø";1;"V";"S";1;1;0;0,3;0,859480452100854
"1188";"Hedensted.03-09-2018.pdf";1;5;877;"Hedensted Kommune";"03-09-2018";883;0,00113250283125708;0,00566251415628539;2018;"09";2018-09-03;0,302375219373224;1,81306371651095;46616;65203;257;7;6,9;"Kirsten Terkilsen";"Kasper Glyngø";1;"V";"S";1;1;0;0,0999999999999996;0,839872533041519
"1189";"Hedensted.03-10-2016.pdf";0;1;901;"Hedensted Kommune";"03-10-2016";902;0;0,00110864745011086;2016;"10";2016-10-03;0;0,354974559130637;46206;60304;267;7;6,8;"Kirsten Terkilsen";"Kasper Glyngø";1;"V";"S";1;1;0;0,2;0,872552398140411
"1190";"Hedensted.03-12-2018.pdf";0;7;764;"Hedensted Kommune";"03-12-2018";771;0;0,00907911802853437;2018;"12";2018-12-03;0;2,90701603936555;46616;65203;257;7;6,9;"Kirsten Terkilsen";"Kasper Glyngø";1;"V";"S";1;1;0;0,0999999999999996;0,839872533041519
"1191";"Hedensted.04-02-2019.pdf";0;9;1431;"Hedensted Kommune";"04-02-2019";1440;0;0,00625;2019;"02";2019-02-04;0;2,00116907709896;46747;64335;251;7;6,9;"Kirsten Terkilsen";"Kasper Glyngø";1;"V";"S";1;1;0;0,0999999999999996;0,820264613982184
"1192";"Hedensted.04-03-2019.pdf";0;6;1099;"Hedensted Kommune";"04-03-2019";1105;0;0,00542986425339366;2019;"03";2019-03-04;0;1,73857222987783;46747;64335;251;7;6,9;"Kirsten Terkilsen";"Kasper Glyngø";1;"V";"S";1;1;0;0,0999999999999996;0,820264613982184
"1193";"Hedensted.04-04-2016.pdf";2;1;546;"Hedensted Kommune";"04-04-2016";549;0,00364298724954463;0,00182149362477231;2016;"04";2016-04-04;0,972667827710591;0,583218674564361;46206;60304;267;7;6,8;"Kirsten Terkilsen";"Kasper Glyngø";1;"V";"S";1;1;0;0,2;0,872552398140411
"1194";"Hedensted.04-09-2017.pdf";0;0;320;"Hedensted Kommune";"04-09-2017";320;0;0;2017;"09";2017-09-04;0;0;46524;63679;263;7,2;6,9;"Kirsten Terkilsen";"Kasper Glyngø";1;"V";"S";1;1;0;0,3;0,859480452100854
"1195";"Hedensted.04-12-2017.pdf";3;0;267;"Hedensted Kommune";"04-12-2017";270;0,0111111111111111;0;2017;"12";2017-12-04;2,9666368745173;0;46524;63679;263;7,2;6,9;"Kirsten Terkilsen";"Kasper Glyngø";1;"V";"S";1;1;0;0,3;0,859480452100854
"1196";"Hedensted.05-02-2018.pdf";0;0;1629;"Hedensted Kommune";"05-02-2018";1629;0;0;2018;"02";2018-02-05;0;0;46616;65203;257;7;6,9;"Kirsten Terkilsen";"Kasper Glyngø";1;"V";"S";1;1;0;0,0999999999999996;0,839872533041519
"1197";"Hedensted.05-03-2018.pdf";27;4;1538;"Hedensted Kommune";"05-03-2018";1569;0,017208413001912;0,00254939451880178;2018;"03";2018-03-05;4,59460013070557;0,816283116216276;46616;65203;257;7;6,9;"Kirsten Terkilsen";"Kasper Glyngø";1;"V";"S";1;1;0;0,0999999999999996;0,839872533041519
"1198";"Hedensted.05-09-2016.pdf";5;0;503;"Hedensted Kommune";"05-09-2016";508;0,00984251968503937;0;2016;"09";2016-09-05;2,62792636522202;0;46206;60304;267;7;6,8;"Kirsten Terkilsen";"Kasper Glyngø";1;"V";"S";1;1;0;0,2;0,872552398140411
"1199";"Hedensted.05-11-2018.pdf";1;9;1340;"Hedensted Kommune";"05-11-2018";1350;0,000740740740740741;0,00666666666666667;2018;"11";2018-11-05;0,197775791634487;2,13458034890556;46616;65203;257;7;6,9;"Kirsten Terkilsen";"Kasper Glyngø";1;"V";"S";1;1;0;0,0999999999999996;0,839872533041519
"1200";"Hedensted.05-12-2016.pdf";1;1;634;"Hedensted Kommune";"05-12-2016";636;0,00157232704402516;0,00157232704402516;2016;"12";2016-12-05;0,419807104884524;0,50343876153433;46206;60304;267;7;6,8;"Kirsten Terkilsen";"Kasper Glyngø";1;"V";"S";1;1;0;0,2;0,872552398140411
"1201";"Hedensted.06-03-2017.pdf";0;0;553;"Hedensted Kommune";"06-03-2017";553;0;0;2017;"03";2017-03-06;0;0;46524;63679;263;7,2;6,9;"Kirsten Terkilsen";"Kasper Glyngø";1;"V";"S";1;1;0;0,3;0,859480452100854
"1202";"Hedensted.06-06-2016.pdf";3;8;1932;"Hedensted Kommune";"06-06-2016";1943;0,00154400411734431;0,00411734431291817;2016;"06";2016-06-06;0,412244959402816;1,31832033900498;46206;60304;267;7;6,8;"Kirsten Terkilsen";"Kasper Glyngø";1;"V";"S";1;1;0;0,2;0,872552398140411
"1203";"Hedensted.06-11-2017.pdf";0;0;1505;"Hedensted Kommune";"06-11-2017";1505;0;0;2017;"11";2017-11-06;0;0;46524;63679;263;7,2;6,9;"Kirsten Terkilsen";"Kasper Glyngø";1;"V";"S";1;1;0;0,3;0,859480452100854
"1204";"Hedensted.07-03-2016.pdf";18;1;1714;"Hedensted Kommune";"07-03-2016";1733;0,0103866128101558;0,000577034045008655;2016;"03";2016-03-07;2,77319777075478;0,184758829968744;46206;60304;267;7;6,8;"Kirsten Terkilsen";"Kasper Glyngø";1;"V";"S";1;1;0;0,2;0,872552398140411
"1205";"Hedensted.07-05-2018.pdf";0;0;523;"Hedensted Kommune";"07-05-2018";523;0;0;2018;"05";2018-05-07;0;0;46616;65203;257;7;6,9;"Kirsten Terkilsen";"Kasper Glyngø";1;"V";"S";1;1;0;0,0999999999999996;0,839872533041519
"1206";"Hedensted.07-11-2016.pdf";5;3;2525;"Hedensted Kommune";"07-11-2016";2533;0,0019739439399921;0,00118436636399526;2016;"11";2016-11-07;0,527037739254949;0,379218774973353;46206;60304;267;7;6,8;"Kirsten Terkilsen";"Kasper Glyngø";1;"V";"S";1;1;0;0,2;0,872552398140411
"1207";"Hedensted.08-01-2018.pdf";0;0;659;"Hedensted Kommune";"08-01-2018";659;0;0;2018;"01";2018-01-08;0;0;46616;65203;257;7;6,9;"Kirsten Terkilsen";"Kasper Glyngø";1;"V";"S";1;1;0;0,0999999999999996;0,839872533041519
"1208";"Hedensted.08-05-2017.pdf";0;1;846;"Hedensted Kommune";"08-05-2017";847;0;0,00118063754427391;2017;"05";2017-05-08;0;0,37802485517808;46524;63679;263;7,2;6,9;"Kirsten Terkilsen";"Kasper Glyngø";1;"V";"S";1;1;0;0,3;0,859480452100854
"1209";"Hedensted.09-01-2017.pdf";1;0;456;"Hedensted Kommune";"09-01-2017";457;0,00218818380743982;0;2017;"01";2017-01-09;0,584239209423539;0;46524;63679;263;7,2;6,9;"Kirsten Terkilsen";"Kasper Glyngø";1;"V";"S";1;1;0;0,3;0,859480452100854
"1210";"Hedensted.09-04-2018.pdf";0;0;758;"Hedensted Kommune";"09-04-2018";758;0;0;2018;"04";2018-04-09;0;0;46616;65203;257;7;6,9;"Kirsten Terkilsen";"Kasper Glyngø";1;"V";"S";1;1;0;0,0999999999999996;0,839872533041519
"1211";"Hedensted.11-01-2016.pdf";0;2;1052;"Hedensted Kommune";"11-01-2016";1054;0;0,00189753320683112;2016;"01";2016-01-11;0;0,607565564204619;46206;60304;267;7;6,8;"Kirsten Terkilsen";"Kasper Glyngø";1;"V";"S";1;1;0;0,2;0,872552398140411
"1212";"Hedensted.11-06-2018.pdf";3;17;2146;"Hedensted Kommune";"11-06-2018";2166;0,00138504155124654;0,00784856879039704;2018;"06";2018-06-11;0,369802380479996;2,51301010605225;46616;65203;257;7;6,9;"Kirsten Terkilsen";"Kasper Glyngø";1;"V";"S";1;1;0;0,0999999999999996;0,839872533041519
"1213";"Hedensted.12-06-2017.pdf";1;1;1600;"Hedensted Kommune";"12-06-2017";1602;0,000624219725343321;0,000624219725343321;2017;"06";2017-06-12;0,16666499295041;0,199867073867562;46524;63679;263;7,2;6,9;"Kirsten Terkilsen";"Kasper Glyngø";1;"V";"S";1;1;0;0,3;0,859480452100854
"1214";"Hedensted.13-08-2018.pdf";0;16;1429;"Hedensted Kommune";"13-08-2018";1445;0;0,0110726643598616;2018;"08";2018-08-13;0;3,54532376288813;46616;65203;257;7;6,9;"Kirsten Terkilsen";"Kasper Glyngø";1;"V";"S";1;1;0;0,0999999999999996;0,839872533041519
"1215";"Hedensted.14-01-2019.pdf";3;7;1555;"Hedensted Kommune";"14-01-2019";1565;0,00191693290734824;0,00447284345047923;2019;"01";2019-01-14;0,511815946402346;1,43214655996859;46747;64335;251;7;6,9;"Kirsten Terkilsen";"Kasper Glyngø";1;"V";"S";1;1;0;0,0999999999999996;0,820264613982184
"1216";"Hedensted.14-08-2017.pdf";2;0;1240;"Hedensted Kommune";"14-08-2017";1242;0,00161030595813205;0;2017;"08";2017-08-14;0,42994737311845;0;46524;63679;263;7,2;6,9;"Kirsten Terkilsen";"Kasper Glyngø";1;"V";"S";1;1;0;0,3;0,859480452100854
"1217";"Hedensted.15-08-2016.pdf";0;0;813;"Hedensted Kommune";"15-08-2016";813;0;0;2016;"08";2016-08-15;0;0;46206;60304;267;7;6,8;"Kirsten Terkilsen";"Kasper Glyngø";1;"V";"S";1;1;0;0,2;0,872552398140411
"1218";"Hedensted.30-01-2017.pdf";0;1;1917;"Hedensted Kommune";"30-01-2017";1918;0;0,000521376433785193;2017;"01";2017-01-30;0;0,16693798349105;46524;63679;263;7,2;6,9;"Kirsten Terkilsen";"Kasper Glyngø";1;"V";"S";1;1;0;0,3;0,859480452100854
"1219";"Helsingoer.01-02-2016.pdf";11;19;5642;"Helsingør Kommune";"01-02-2016";5672;0,00193935119887165;0,00334978843441467;2016;"02";2016-02-01;0,517801570129078;1,0725588847639;62092;68317;926;7;7,3;"Benedikte Kiær";"Benedikte Kiær";0;"C";"C";0;0;0;-0,3;3,02615550815738
"1220";"Helsingoer.01-03-2016.pdf";2;19;3701;"Helsingør Kommune";"01-03-2016";3722;0,000537345513164965;0,00510478237506717;2016;"03";2016-03-01;0,143469811234045;1,63448522148868;62092;68317;926;7;7,3;"Benedikte Kiær";"Benedikte Kiær";0;"C";"C";0;0;0;-0,3;3,02615550815738
"1221";"Helsingoer.03-04-2017.pdf";6;8;5167;"Helsingør Kommune";"03-04-2017";5181;0,00115807759119861;0,00154410345493148;2017;"04";2017-04-03;0,309203611704177;0,494401933736088;62443;71916;895;7,1;7,4;"Benedikte Kiær";"Benedikte Kiær";0;"C";"C";0;0;0;-0,300000000000001;2,92484792635082
"1222";"Helsingoer.03-04-2018.pdf";103;47;14009;"Helsingør Kommune";"03-04-2018";14159;0,00727452503707889;0,00331944346352144;2018;"04";2018-04-03;1,94227867976378;1,06284281798038;62686;71328;866;7;7,2;"Benedikte Kiær";"Benedikte Kiær";0;"C";"C";0;0;0;-0,2;2,83007631756403
"1223";"Helsingoer.04-12-2017.pdf";6;7;12184;"Helsingør Kommune";"04-12-2017";12197;0,000491924243666475;0,000573911617610888;2017;"12";2017-12-04;0,1313424540657;0,183759069144121;62443;71916;895;7,1;7,4;"Benedikte Kiær";"Benedikte Kiær";0;"C";"C";0;0;0;-0,300000000000001;2,92484792635082
"1224";"Helsingoer.05-12-2016.pdf";20;4;5086;"Helsingør Kommune";"05-12-2016";5110;0,00391389432485323;0,000782778864970646;2016;"12";2016-12-05;1,04499929043662;0,250635657405741;62092;68317;926;7;7,3;"Benedikte Kiær";"Benedikte Kiær";0;"C";"C";0;0;0;-0,3;3,02615550815738
"1225";"Helsingoer.06-02-2017.pdf";7;22;5048;"Helsingør Kommune";"06-02-2017";5077;0,00137876698837896;0,00433326767776246;2017;"02";2017-02-06;0,368127089018298;1,38745620472491;62443;71916;895;7,1;7,4;"Benedikte Kiær";"Benedikte Kiær";0;"C";"C";0;0;0;-0,300000000000001;2,92484792635082
"1226";"Helsingoer.06-06-2016.pdf";16;10;8135;"Helsingør Kommune";"06-06-2016";8161;0,00196054405097415;0,00122534003185884;2016;"06";2016-06-06;0,523460004816188;0,392338012909979;62092;68317;926;7;7,3;"Benedikte Kiær";"Benedikte Kiær";0;"C";"C";0;0;0;-0,3;3,02615550815738
"1227";"Helsingoer.06-11-2017.pdf";12;1;2148;"Helsingør Kommune";"06-11-2017";2161;0,00555298472929199;0,000462748727441;2017;"11";2017-11-06;1,48263203353942;0,148166151011492;62443;71916;895;7,1;7,4;"Benedikte Kiær";"Benedikte Kiær";0;"C";"C";0;0;0;-0,300000000000001;2,92484792635082
"1228";"Helsingoer.07-11-2016.pdf";5;0;2425;"Helsingør Kommune";"07-11-2016";2430;0,00205761316872428;0;2016;"11";2016-11-07;0,549377198984686;0;62092;68317;926;7;7,3;"Benedikte Kiær";"Benedikte Kiær";0;"C";"C";0;0;0;-0,3;3,02615550815738
"1229";"Helsingoer.07-12-2017.pdf";33;6;4861;"Helsingør Kommune";"07-12-2017";4900;0,00673469387755102;0,00122448979591837;2017;"12";2017-12-07;1,79814520761559;0,392065778370409;62443;71916;895;7,1;7,4;"Benedikte Kiær";"Benedikte Kiær";0;"C";"C";0;0;0;-0,300000000000001;2,92484792635082
"1230";"Helsingoer.08-05-2017.pdf";2;1;2794;"Helsingør Kommune";"08-05-2017";2797;0,000715051841258491;0,000357525920629246;2017;"05";2017-05-08;0,190916924352204;0,114475170659934;62443;71916;895;7,1;7,4;"Benedikte Kiær";"Benedikte Kiær";0;"C";"C";0;0;0;-0,300000000000001;2,92484792635082
"1231";"Helsingoer.08-06-2017.pdf";22;7;6603;"Helsingør Kommune";"08-06-2017";6632;0,00331724969843185;0,00105548854041013;2017;"06";2017-06-08;0,885696774961438;0,337953764528172;62443;71916;895;7,1;7,4;"Benedikte Kiær";"Benedikte Kiær";0;"C";"C";0;0;0;-0,300000000000001;2,92484792635082
"1232";"Helsingoer.08-09-2016.pdf";7;9;5029;"Helsingør Kommune";"08-09-2016";5045;0,00138751238850347;0,00178394449950446;2016;"09";2016-09-08;0,370462087402557;0,571195930827058;62092;68317;926;7;7,3;"Benedikte Kiær";"Benedikte Kiær";0;"C";"C";0;0;0;-0,3;3,02615550815738
"1233";"Helsingoer.08-10-2018.pdf";6;10;1324;"Helsingør Kommune";"08-10-2018";1340;0,00447761194029851;0,00746268656716418;2018;"10";2018-10-08;1,19551038226817;2,38945561444652;62686;71328;866;7;7,2;"Benedikte Kiær";"Benedikte Kiær";0;"C";"C";0;0;0;-0,2;2,83007631756403
"1234";"Helsingoer.09-05-2016.pdf";41;9;6734;"Helsingør Kommune";"09-05-2016";6784;0,0060436320754717;0,00132665094339623;2016;"05";2016-05-09;1,61363355939989;0,424776455044591;62092;68317;926;7;7,3;"Benedikte Kiær";"Benedikte Kiær";0;"C";"C";0;0;0;-0,3;3,02615550815738
"1235";"Helsingoer.09-07-2018.pdf";0;0;418;"Helsingør Kommune";"09-07-2018";418;0;0;2018;"07";2018-07-09;0;0;62686;71328;866;7;7,2;"Benedikte Kiær";"Benedikte Kiær";0;"C";"C";0;0;0;-0,2;2,83007631756403
"1236";"Helsingoer.09-10-2017.pdf";0;1;601;"Helsingør Kommune";"09-10-2017";602;0;0,00166112956810631;2017;"10";2017-10-09;0;0,531872179959857;62443;71916;895;7,1;7,4;"Benedikte Kiær";"Benedikte Kiær";0;"C";"C";0;0;0;-0,300000000000001;2,92484792635082
"1237";"Helsingoer.10-10-2016.pdf";55;10;6692;"Helsingør Kommune";"10-10-2016";6757;0,00813970697054906;0,00147994672191801;2016;"10";2016-10-10;2,17327993619367;0,473859778505008;62092;68317;926;7;7,3;"Benedikte Kiær";"Benedikte Kiær";0;"C";"C";0;0;0;-0,3;3,02615550815738
"1238";"Helsingoer.11-01-2016.pdf";25;13;5121;"Helsingør Kommune";"11-01-2016";5159;0,00484590036828843;0,00251986819150998;2016;"01";2016-01-11;1,29384240505213;0,806829168514411;62092;68317;926;7;7,3;"Benedikte Kiær";"Benedikte Kiær";0;"C";"C";0;0;0;-0,3;3,02615550815738
"1239";"Helsingoer.11-04-2016.pdf";13;8;5912;"Helsingør Kommune";"11-04-2016";5933;0,00219113433338952;0,00134839035900893;2016;"04";2016-04-11;0,58502699194088;0,431737134449127;62092;68317;926;7;7,3;"Benedikte Kiær";"Benedikte Kiær";0;"C";"C";0;0;0;-0,3;3,02615550815738
"1240";"Helsingoer.12-10-2017.pdf";40;12;5894;"Helsingør Kommune";"12-10-2017";5946;0,0067272115708039;0,00201816347124117;2017;"10";2017-10-12;1,79614745177637;0,646189812988565;62443;71916;895;7,1;7,4;"Benedikte Kiær";"Benedikte Kiær";0;"C";"C";0;0;0;-0,300000000000001;2,92484792635082
"1241";"Helsingoer.13-03-2017.pdf";20;11;7260;"Helsingør Kommune";"13-03-2017";7291;0,00274310794129749;0,00150870936771362;2017;"03";2017-03-13;0,732402465249094;0,483069205279684;62443;71916;895;7,1;7,4;"Benedikte Kiær";"Benedikte Kiær";0;"C";"C";0;0;0;-0,300000000000001;2,92484792635082
"1242";"Helsingoer.14-03-2016.pdf";1;0;2149;"Helsingør Kommune";"14-03-2016";2150;0,000465116279069767;0;2016;"03";2016-03-14;0,124184799398399;0;62092;68317;926;7;7,3;"Benedikte Kiær";"Benedikte Kiær";0;"C";"C";0;0;0;-0,3;3,02615550815738
"1243";"Helsingoer.14-08-2017.pdf";2;11;6728;"Helsingør Kommune";"14-08-2017";6741;0,000296691885476932;0,00163180537012313;2017;"08";2017-08-14;0,0792159379043338;0,522482951445509;62443;71916;895;7,1;7,4;"Benedikte Kiær";"Benedikte Kiær";0;"C";"C";0;0;0;-0,300000000000001;2,92484792635082
"1244";"Helsingoer.14-09-2017.pdf";26;30;6985;"Helsingør Kommune";"14-09-2017";7041;0,00369265729299815;0,00426075841499787;2017;"09";2017-09-14;0,985929596132721;1,36423967761327;62443;71916;895;7,1;7,4;"Benedikte Kiær";"Benedikte Kiær";0;"C";"C";0;0;0;-0,300000000000001;2,92484792635082
"1245";"Helsingoer.15-08-2016.pdf";35;2;4823;"Helsingør Kommune";"15-08-2016";4860;0,00720164609053498;0,000411522633744856;2016;"08";2016-08-15;1,9228201964464;0,131764219068245;62092;68317;926;7;7,3;"Benedikte Kiær";"Benedikte Kiær";0;"C";"C";0;0;0;-0,3;3,02615550815738
"1246";"Helsingoer.16-01-2017.pdf";15;21;8356;"Helsingør Kommune";"16-01-2017";8392;0,00178741658722593;0,0025023832221163;2017;"01";2017-01-16;0,477235436200948;0,801230707704065;62443;71916;895;7,1;7,4;"Benedikte Kiær";"Benedikte Kiær";0;"C";"C";0;0;0;-0,300000000000001;2,92484792635082
"1247";"Helsingoer.17-12-2018.pdf";47;33;5650;"Helsingør Kommune";"17-12-2018";5730;0,00820244328097731;0,00575916230366492;2018;"12";2018-12-17;2,19003036286356;1,84400920193412;62686;71328;866;7;7,2;"Benedikte Kiær";"Benedikte Kiær";0;"C";"C";0;0;0;-0,2;2,83007631756403
"1248";"Helsingoer.24-09-2018.pdf";12;35;9130;"Helsingør Kommune";"24-09-2018";9177;0,0013076168682576;0,003813882532418;2018;"09";2018-09-24;0,349130197720245;1,22115580601005;62686;71328;866;7;7,2;"Benedikte Kiær";"Benedikte Kiær";0;"C";"C";0;0;0;-0,2;2,83007631756403
"1249";"Helsingoer.25-02-2019.pdf";16;36;11100;"Helsingør Kommune";"25-02-2019";11152;0,00143472022955524;0,00322812051649928;2019;"02";2019-02-25;0,383066454385304;1,03360239276274;62567;74926;836;7;7,3;"Benedikte Kiær";"Benedikte Kiær";0;"C";"C";0;0;0;-0,3;2,73203672226735
"1250";"Helsingoer.25-03-2019.pdf";11;7;7097;"Helsingør Kommune";"25-03-2019";7115;0,00154602951510892;0,000983836964160225;2019;"03";2019-03-25;0,412785735175282;0,315011857533498;62567;74926;836;7;7,3;"Benedikte Kiær";"Benedikte Kiær";0;"C";"C";0;0;0;-0,3;2,73203672226735
"1251";"Helsingoer.25-06-2018.pdf";43;58;19270;"Helsingør Kommune";"25-06-2018";19371;0,0022198131227092;0,00299416653760776;2018;"06";2018-06-25;0,592684151792987;0,95869335787922;62686;71328;866;7;7,2;"Benedikte Kiær";"Benedikte Kiær";0;"C";"C";0;0;0;-0,2;2,83007631756403
"1252";"Helsingoer.26-02-2018.pdf";6;8;6919;"Helsingør Kommune";"26-02-2018";6933;0,000865426222414539;0,00115390162988605;2018;"02";2018-02-26;0,231066480923027;0,36946436155873;62686;71328;866;7;7,2;"Benedikte Kiær";"Benedikte Kiær";0;"C";"C";0;0;0;-0,2;2,83007631756403
"1253";"Helsingoer.26-11-2018.pdf";4;37;7316;"Helsingør Kommune";"26-11-2018";7357;0,000543699877667528;0,00502922386842463;2018;"11";2018-11-26;0,145166409518313;1,6102923659679;62686;71328;866;7;7,2;"Benedikte Kiær";"Benedikte Kiær";0;"C";"C";0;0;0;-0,2;2,83007631756403
"1254";"Helsingoer.27-08-2018.pdf";6;12;4912;"Helsingør Kommune";"27-08-2018";4930;0,00121703853955375;0,00243407707910751;2018;"08";2018-08-27;0,324946026823396;0,779359965117649;62686;71328;866;7;7,2;"Benedikte Kiær";"Benedikte Kiær";0;"C";"C";0;0;0;-0,2;2,83007631756403
"1255";"Helsingoer.28-01-2019.pdf";6;43;8818;"Helsingør Kommune";"28-01-2019";8867;0,00067666629074095;0,00484944175031014;2019;"01";2019-01-28;0,180668085286945;1,55272845950613;62567;74926;836;7;7,3;"Benedikte Kiær";"Benedikte Kiær";0;"C";"C";0;0;0;-0,3;2,73203672226735
"1256";"Helsingoer.28-05-2018.pdf";14;19;10478;"Helsingør Kommune";"28-05-2018";10511;0,00133193796974598;0,00180763010179812;2018;"05";2018-05-28;0,355623866605632;0,578779754008263;62686;71328;866;7;7,2;"Benedikte Kiær";"Benedikte Kiær";0;"C";"C";0;0;0;-0,2;2,83007631756403
"1257";"Helsingoer.29-01-2018.pdf";9;44;13057;"Helsingør Kommune";"29-01-2018";13110;0,00068649885583524;0,00335621662852784;2018;"01";2018-01-29;0,183293353803128;1,07461710928884;62686;71328;866;7;7,2;"Benedikte Kiær";"Benedikte Kiær";0;"C";"C";0;0;0;-0,2;2,83007631756403
"1258";"Helsingoer.29-10-2018.pdf";13;30;10402;"Helsingør Kommune";"29-10-2018";10445;0,00124461464815701;0,00287218764959311;2018;"10";2018-10-29;0,332308773880827;0,919637297278605;62686;71328;866;7;7,2;"Benedikte Kiær";"Benedikte Kiær";0;"C";"C";0;0;0;-0,2;2,83007631756403
"1259";"Helsingoer.30-04-2018.pdf";15;33;10144;"Helsingør Kommune";"30-04-2018";10192;0,00147174254317111;0,00323783359497645;2018;"04";2018-04-30;0,392951312853057;1,03671239472945;62686;71328;866;7;7,2;"Benedikte Kiær";"Benedikte Kiær";0;"C";"C";0;0;0;-0,2;2,83007631756403
"1260";"Helsingoer.30-05-2016.pdf";0;8;1906;"Helsingør Kommune";"30-05-2016";1914;0;0,00417972831765935;2016;"05";2016-05-30;0;1,33829488959596;62092;68317;926;7;7,3;"Benedikte Kiær";"Benedikte Kiær";0;"C";"C";0;0;0;-0,3;3,02615550815738
"1261";"Herlev.18-12-2018.pdf";0;5;799;"Herlev Kommune";"18-12-2018";804;0;0,00621890547263682;2018;"12";2018-12-18;0;1,99121301203877;28572;70328;674;6,7;6,8;"Thomas Gyldal Petersen";"Thomas Gyldal Petersen";0;"S";"S";0;0;0;-0,0999999999999996;2,20262290766531
"1262";"Herlev.19-06-2018.pdf";0;14;1062;"Herlev Kommune";"19-06-2018";1076;0;0,0130111524163569;2018;"06";2018-06-19;0;4,16600253968557;28572;70328;674;6,7;6,8;"Thomas Gyldal Petersen";"Thomas Gyldal Petersen";0;"S";"S";0;0;0;-0,0999999999999996;2,20262290766531
"1263";"Herlev.20-03-2018.pdf";1;4;1077;"Herlev Kommune";"20-03-2018";1082;0,000924214417744917;0,00369685767097967;2018;"03";2018-03-20;0,246762771447835;1,1836859605761;28572;70328;674;6,7;6,8;"Thomas Gyldal Petersen";"Thomas Gyldal Petersen";0;"S";"S";0;0;0;-0,0999999999999996;2,20262290766531
"1264";"Herlev.22-01-2019.pdf";0;7;708;"Herlev Kommune";"22-01-2019";715;0;0,00979020979020979;2019;"01";2019-01-22;0;3,1346984144767;28786;74488;687;6,7;6,7;"Thomas Gyldal Petersen";"Thomas Gyldal Petersen";0;"S";"S";0;0;0;0;2,24510673229387
"1265";"Herlev.23-01-2018.pdf";2;2;664;"Herlev Kommune";"23-01-2018";668;0,0029940119760479;0,0029940119760479;2018;"01";2018-01-23;0,799393169780111;0,958643869268965;28572;70328;674;6,7;6,8;"Thomas Gyldal Petersen";"Thomas Gyldal Petersen";0;"S";"S";0;0;0;-0,0999999999999996;2,20262290766531
"1266";"Herlev.23-05-2018.pdf";3;3;2001;"Herlev Kommune";"23-05-2018";2007;0,00149476831091181;0,00149476831091181;2018;"05";2018-05-23;0,399099131100982;0,478605459395866;28572;70328;674;6,7;6,8;"Thomas Gyldal Petersen";"Thomas Gyldal Petersen";0;"S";"S";0;0;0;-0,0999999999999996;2,20262290766531
"1267";"Herlev.24-04-2018.pdf";1;15;1336;"Herlev Kommune";"24-04-2018";1352;0,000739644970414201;0,011094674556213;2018;"04";2018-04-24;0,197483223895383;3,55237114277922;28572;70328;674;6,7;6,8;"Thomas Gyldal Petersen";"Thomas Gyldal Petersen";0;"S";"S";0;0;0;-0,0999999999999996;2,20262290766531
"1268";"Herlev.25-09-2018.pdf";13;2;1153;"Herlev Kommune";"25-09-2018";1168;0,0111301369863014;0,00171232876712329;2018;"09";2018-09-25;2,97171673217915;0,548265500575058;28572;70328;674;6,7;6,8;"Thomas Gyldal Petersen";"Thomas Gyldal Petersen";0;"S";"S";0;0;0;-0,0999999999999996;2,20262290766531
"1269";"Herlev.26-02-2019.pdf";0;6;1088;"Herlev Kommune";"26-02-2019";1094;0;0,00548446069469835;2019;"02";2019-02-26;0;1,75605330348721;28786;74488;687;6,7;6,7;"Thomas Gyldal Petersen";"Thomas Gyldal Petersen";0;"S";"S";0;0;0;0;2,24510673229387
"1270";"Herlev.26-03-2019.pdf";1;8;1342;"Herlev Kommune";"26-03-2019";1351;0,00074019245003701;0,00592153960029608;2019;"03";2019-03-26;0,197629399486719;1,89600030990871;28786;74488;687;6,7;6,7;"Thomas Gyldal Petersen";"Thomas Gyldal Petersen";0;"S";"S";0;0;0;0;2,24510673229387
"1271";"Herlev.27-02-2018.pdf";15;1;594;"Herlev Kommune";"27-02-2018";610;0,0245901639344262;0,00163934426229508;2018;"02";2018-02-27;6,56550783704649;0,524896807107925;28572;70328;674;6,7;6,8;"Thomas Gyldal Petersen";"Thomas Gyldal Petersen";0;"S";"S";0;0;0;-0,0999999999999996;2,20262290766531
"1272";"Herlev.27-11-2018.pdf";8;12;1879;"Herlev Kommune";"27-11-2018";1899;0,00421274354923644;0,00631911532385466;2018;"11";2018-11-27;1,12479123204447;2,02329890891522;28572;70328;674;6,7;6,8;"Thomas Gyldal Petersen";"Thomas Gyldal Petersen";0;"S";"S";0;0;0;-0,0999999999999996;2,20262290766531
"1273";"Herlev.28-08-2018.pdf";9;12;971;"Herlev Kommune";"28-08-2018";992;0,00907258064516129;0,0120967741935484;2018;"08";2018-08-28;2,42235470600707;3,87323047180445;28572;70328;674;6,7;6,8;"Thomas Gyldal Petersen";"Thomas Gyldal Petersen";0;"S";"S";0;0;0;-0,0999999999999996;2,20262290766531
"1274";"Herlev.30-10-2018.pdf";1;5;1353;"Herlev Kommune";"30-10-2018";1359;0,000735835172921266;0,00367917586460633;2018;"10";2018-10-30;0,196466018179954;1,17802447511344;28572;70328;674;6,7;6,8;"Thomas Gyldal Petersen";"Thomas Gyldal Petersen";0;"S";"S";0;0;0;-0,0999999999999996;2,20262290766531
"1275";"Herning.01-02-2017.pdf";30;13;4915;"Herning Kommune";"01-02-2017";4958;0,00605082694634933;0,00262202501008471;2017;"02";2017-02-01;1,61555457063266;0,83953845912986;88386;61841;335;7,3;7;"Lars Krarup";"Lars Krarup";0;"V";"V";0;0;0;0,3;1,09477548081288
"1276";"Herning.02-11-2016.pdf";14;7;3750;"Herning Kommune";"02-11-2016";3771;0,00371254309201803;0,00185627154600902;2016;"11";2016-11-02;0,991239051151366;0,594354114651509;87593;59118;329;7,3;7;"Lars Krarup";"Lars Krarup";0;"V";"V";0;0;0;0,3;1,07516756175354
"1277";"Herning.04-10-2017.pdf";11;9;2698;"Herning Kommune";"04-10-2017";2718;0,00404709345106696;0,0033112582781457;2017;"10";2017-10-04;1,08056309998975;1,0602220276021;88386;61841;335;7,3;7;"Lars Krarup";"Lars Krarup";0;"V";"V";0;0;0;0,3;1,09477548081288
"1278";"Herning.05-04-2017.pdf";0;1;2352;"Herning Kommune";"05-04-2017";2353;0;0,000424989375265618;2017;"04";2017-04-05;0;0,136076095340346;88386;61841;335;7,3;7;"Lars Krarup";"Lars Krarup";0;"V";"V";0;0;0;0,3;1,09477548081288
"1279";"Herning.05-10-2016.pdf";4;18;4210;"Herning Kommune";"05-10-2016";4232;0,000945179584120983;0,00425330812854442;2016;"10";2016-10-05;0,252360414656481;1,36185419235468;87593;59118;329;7,3;7;"Lars Krarup";"Lars Krarup";0;"V";"V";0;0;0;0,3;1,07516756175354
"1280";"Herning.06-02-2019.pdf";4;7;3660;"Herning Kommune";"06-02-2019";3671;0,00108962135657859;0,00190683737401253;2019;"02";2019-02-06;0,290925980611885;0,610544638068875;88917;62527;328;7,2;6,9;"Lars Krarup";"Lars Krarup";0;"V";"V";0;0;0;0,3;1,07189957524365
"1281";"Herning.06-03-2019.pdf";12;8;1663;"Herning Kommune";"06-03-2019";1683;0,0071301247771836;0,0047534165181224;2019;"03";2019-03-06;1,90372419755121;1,52198242346208;88917;62527;328;7,2;6,9;"Lars Krarup";"Lars Krarup";0;"V";"V";0;0;0;0,3;1,07189957524365
"1282";"Herning.06-06-2017.pdf";0;1;306;"Herning Kommune";"06-06-2017";307;0;0,00325732899022801;2017;"06";2017-06-06;0;1,04295456786917;88386;61841;335;7,3;7;"Lars Krarup";"Lars Krarup";0;"V";"V";0;0;0;0,3;1,09477548081288
"1283";"Herning.06-12-2017.pdf";1;9;1458;"Herning Kommune";"06-12-2017";1468;0,000681198910081744;0,0061307901907357;2017;"12";2017-12-06;0,181878282497655;1,96299963966111;88386;61841;335;7,3;7;"Lars Krarup";"Lars Krarup";0;"V";"V";0;0;0;0,3;1,09477548081288
"1284";"Herning.07-09-2016.pdf";1;2;2936;"Herning Kommune";"07-09-2016";2939;0,000340251786321878;0,000680503572643756;2016;"09";2016-09-07;0,0908463146330579;0,217888433028809;87593;59118;329;7,3;7;"Lars Krarup";"Lars Krarup";0;"V";"V";0;0;0;0,3;1,07516756175354
"1285";"Herning.08-06-2016.pdf";4;13;5764;"Herning Kommune";"08-06-2016";5781;0,00069192181283515;0,00224874589171424;2016;"06";2016-06-08;0,184741268781565;0,720019318520298;87593;59118;329;7,3;7;"Lars Krarup";"Lars Krarup";0;"V";"V";0;0;0;0,3;1,07516756175354
"1286";"Herning.10-02-2016.pdf";10;13;6913;"Herning Kommune";"10-02-2016";6936;0,00144175317185698;0,00187427912341407;2016;"02";2016-02-10;0,384944231122487;0,600119907780543;87593;59118;329;7,3;7;"Lars Krarup";"Lars Krarup";0;"V";"V";0;0;0;0,3;1,07516756175354
"1287";"Herning.11-05-2016.pdf";0;11;4556;"Herning Kommune";"11-05-2016";4567;0;0,00240858331508649;2016;"05";2016-05-11;0;0,771197191962815;87593;59118;329;7,3;7;"Lars Krarup";"Lars Krarup";0;"V";"V";0;0;0;0,3;1,07516756175354
"1288";"Herning.12-12-2018.pdf";6;25;6290;"Herning Kommune";"12-12-2018";6321;0,00094921689606075;0,00395507040025312;2018;"12";2018-12-12;0,253438366119181;1,26636233323776;88733;61048;331;7,3;7;"Lars Krarup";"Lars Krarup";0;"V";"V";0;0;0;0,3;1,08170353477332
"1289";"Herning.13-04-2016.pdf";13;19;6605;"Herning Kommune";"13-04-2016";6637;0,00195871628747928;0,0028627391893928;2016;"04";2016-04-13;0,52297199686383;0,916612022657955;87593;59118;329;7,3;7;"Lars Krarup";"Lars Krarup";0;"V";"V";0;0;0;0,3;1,07516756175354
"1290";"Herning.13-09-2017.pdf";1;0;2088;"Herning Kommune";"13-09-2017";2089;0,000478697941598851;0;2017;"09";2017-09-13;0,127811066877241;0;88386;61841;335;7,3;7;"Lars Krarup";"Lars Krarup";0;"V";"V";0;0;0;0,3;1,09477548081288
"1291";"Herning.14-03-2018.pdf";5;2;1631;"Herning Kommune";"14-03-2018";1638;0,00305250305250305;0,00122100122100122;2018;"03";2018-03-14;0,815010130361896;0,390948781850835;88733;61048;331;7,3;7;"Lars Krarup";"Lars Krarup";0;"V";"V";0;0;0;0,3;1,08170353477332
"1292";"Herning.14-12-2016.pdf";7;9;4017;"Herning Kommune";"14-12-2016";4033;0,0017356806347632;0,00223158938755269;2016;"12";2016-12-14;0,463422075612671;0,714526028024425;87593;59118;329;7,3;7;"Lars Krarup";"Lars Krarup";0;"V";"V";0;0;0;0,3;1,07516756175354
"1293";"Herning.15-03-2017.pdf";4;2;2283;"Herning Kommune";"15-03-2017";2289;0,0017474879860201;0,000873743993010048;2017;"03";2017-03-15;0,466574606739287;0,279761513618029;88386;61841;335;7,3;7;"Lars Krarup";"Lars Krarup";0;"V";"V";0;0;0;0,3;1,09477548081288
"1294";"Herning.15-08-2016.pdf";0;0;366;"Herning Kommune";"15-08-2016";366;0;0;2016;"08";2016-08-15;0;0;87593;59118;329;7,3;7;"Lars Krarup";"Lars Krarup";0;"V";"V";0;0;0;0,3;1,07516756175354
"1295";"Herning.16-01-2019.pdf";4;1;2360;"Herning Kommune";"16-01-2019";2365;0,00169133192389006;0,000422832980972516;2019;"01";2019-01-16;0,45158108872145;0,135385645807964;88917;62527;328;7,2;6,9;"Lars Krarup";"Lars Krarup";0;"V";"V";0;0;0;0,3;1,07189957524365
"1296";"Herning.16-03-2016.pdf";27;17;7727;"Herning Kommune";"16-03-2016";7771;0,00347445631192897;0,00218762064084416;2016;"03";2016-03-16;0,927670519248108;0,700447804620921;87593;59118;329;7,3;7;"Lars Krarup";"Lars Krarup";0;"V";"V";0;0;0;0,3;1,07516756175354
"1297";"Herning.17-08-2016.pdf";29;12;7070;"Herning Kommune";"17-08-2016";7111;0,00407818872169878;0,00168752636759949;2016;"08";2016-08-17;1,0888654538729;0,540324093380679;87593;59118;329;7,3;7;"Lars Krarup";"Lars Krarup";0;"V";"V";0;0;0;0,3;1,07516756175354
"1298";"Herning.18-04-2018.pdf";49;4;6046;"Herning Kommune";"18-04-2018";6099;0,00803410395146745;0,000655845220527955;2018;"04";2018-04-18;2,14508421325157;0,209993147949391;88733;61048;331;7,3;7;"Lars Krarup";"Lars Krarup";0;"V";"V";0;0;0;0,3;1,08170353477332
"1299";"Herning.19-01-2016.pdf";3;7;4962;"Herning Kommune";"19-01-2016";4972;0,000603378921962993;0,00140788415124698;2016;"01";2016-01-19;0,161100554328172;0,450786276418109;87593;59118;329;7,3;7;"Lars Krarup";"Lars Krarup";0;"V";"V";0;0;0;0,3;1,07516756175354
"1300";"Herning.20-02-2019.pdf";3;5;903;"Herning Kommune";"20-02-2019";911;0,00329308452250274;0,00548847420417124;2019;"02";2019-02-20;0,879244737782296;1,75733837725485;88917;62527;328;7,2;6,9;"Lars Krarup";"Lars Krarup";0;"V";"V";0;0;0;0,3;1,07189957524365
"1301";"Herning.20-06-2018.pdf";10;16;3422;"Herning Kommune";"20-06-2018";3448;0,00290023201856148;0,00464037122969838;2018;"06";2018-06-20;0,774354172582822;1,48578678578113;88733;61048;331;7,3;7;"Lars Krarup";"Lars Krarup";0;"V";"V";0;0;0;0,3;1,08170353477332
"1302";"Herning.21-11-2018.pdf";0;2;2477;"Herning Kommune";"21-11-2018";2479;0;0,000806776926179911;2018;"11";2018-11-21;0;0,258319525886111;88733;61048;331;7,3;7;"Lars Krarup";"Lars Krarup";0;"V";"V";0;0;0;0,3;1,08170353477332
"1303";"Herning.22-02-2017.pdf";3;2;2205;"Herning Kommune";"22-02-2017";2210;0,00135746606334842;0,000904977375565611;2017;"02";2017-02-22;0,362439799149173;0,289762038312972;88386;61841;335;7,3;7;"Lars Krarup";"Lars Krarup";0;"V";"V";0;0;0;0,3;1,09477548081288
"1304";"Herning.22-08-2018.pdf";9;14;5270;"Herning Kommune";"22-08-2018";5293;0,00170035896467032;0,00264500283393161;2018;"08";2018-08-22;0,453991284405633;0,846895660816489;88733;61048;331;7,3;7;"Lars Krarup";"Lars Krarup";0;"V";"V";0;0;0;0,3;1,08170353477332
"1305";"Herning.23-08-2017.pdf";4;5;3116;"Herning Kommune";"23-08-2017";3125;0,00128;0,0016;2017;"08";2017-08-23;0,341756567944393;0,512299283737335;88386;61841;335;7,3;7;"Lars Krarup";"Lars Krarup";0;"V";"V";0;0;0;0,3;1,09477548081288
"1306";"Herning.24-01-2018.pdf";16;4;3816;"Herning Kommune";"24-01-2018";3836;0,00417101147028154;0,00104275286757039;2018;"01";2018-01-24;1,11364887885947;0,3338759669821;88733;61048;331;7,3;7;"Lars Krarup";"Lars Krarup";0;"V";"V";0;0;0;0,3;1,08170353477332
"1307";"Herning.24-10-2018.pdf";7;14;4042;"Herning Kommune";"24-10-2018";4063;0,00172286487816884;0,00344572975633768;2018;"10";2018-10-24;0,46000030296478;1,10327805382763;88733;61048;331;7,3;7;"Lars Krarup";"Lars Krarup";0;"V";"V";0;0;0;0,3;1,08170353477332
"1308";"Herning.26-04-2017.pdf";4;8;4088;"Herning Kommune";"26-04-2017";4100;0,000975609756097561;0,00195121951219512;2017;"04";2017-04-26;0,260485188982007;0,62475522406992;88386;61841;335;7,3;7;"Lars Krarup";"Lars Krarup";0;"V";"V";0;0;0;0,3;1,09477548081288
"1309";"Herning.26-09-2018.pdf";1;8;5053;"Herning Kommune";"26-09-2018";5062;0,000197550375345713;0,00158040300276571;2018;"09";2018-09-26;0,0527454205267794;0,506024578958252;88733;61048;331;7,3;7;"Lars Krarup";"Lars Krarup";0;"V";"V";0;0;0;0,3;1,08170353477332
"1310";"Herning.26-11-2018.pdf";0;3;712;"Herning Kommune";"26-11-2018";715;0;0,0041958041958042;2018;"11";2018-11-26;0;1,34344217763287;88733;61048;331;7,3;7;"Lars Krarup";"Lars Krarup";0;"V";"V";0;0;0;0,3;1,08170353477332
"1311";"Herning.28-02-2018.pdf";3;11;2199;"Herning Kommune";"28-02-2018";2213;0,00135562584726615;0,00497062810664257;2018;"02";2018-02-28;0,361948466389368;1,59153076172353;88733;61048;331;7,3;7;"Lars Krarup";"Lars Krarup";0;"V";"V";0;0;0;0,3;1,08170353477332
"1312";"Herning.28-06-2017.pdf";7;15;5440;"Herning Kommune";"28-06-2017";5462;0,00128158183815452;0,0027462467960454;2017;"06";2017-06-28;0,342178914490278;0,879312666612507;88386;61841;335;7,3;7;"Lars Krarup";"Lars Krarup";0;"V";"V";0;0;0;0,3;1,09477548081288
"1313";"Herning.29-11-2017.pdf";3;5;6436;"Herning Kommune";"29-11-2017";6444;0,000465549348230912;0,000775915580384854;2017;"11";2017-11-29;0,124300427703239;0,248438122544874;88386;61841;335;7,3;7;"Lars Krarup";"Lars Krarup";0;"V";"V";0;0;0;0,3;1,09477548081288
"1314";"Herning.30-03-2016.pdf";0;0;42;"Herning Kommune";"30-03-2016";42;0;0;2016;"03";2016-03-30;0;0;87593;59118;329;7,3;7;"Lars Krarup";"Lars Krarup";0;"V";"V";0;0;0;0,3;1,07516756175354
"1315";"Herning.30-05-2018.pdf";23;18;5526;"Herning Kommune";"30-05-2018";5567;0,00413148913238728;0,00323333932099874;2018;"05";2018-05-30;1,10309652061268;1,03527338639213;88733;61048;331;7,3;7;"Lars Krarup";"Lars Krarup";0;"V";"V";0;0;0;0,3;1,08170353477332
"1316";"Herning.31-05-2017.pdf";13;12;3747;"Herning Kommune";"31-05-2017";3772;0,00344644750795334;0,0031813361611877;2017;"05";2017-05-31;0,920192243686438;1,01862264794009;88386;61841;335;7,3;7;"Lars Krarup";"Lars Krarup";0;"V";"V";0;0;0;0,3;1,09477548081288
"1317";"Hilleroed.01-02-2017.pdf";6;9;3566;"Hillerød Kommune";"01-02-2017";3581;0,0016755096341804;0,00251326445127059;2017;"02";2017-02-01;0,44735657979317;0,804714736392769;50109;67650;646;7,5;7,6;"Dorte Meldgaard";"Kirsten Jensen";1;"C";"S";1;1;0;-0,0999999999999996;2,11111928538841
"1318";"Hilleroed.01-06-2016.pdf";31;19;5391;"Hillerød Kommune";"01-06-2016";5441;0,00569748208049991;0,00349200514611285;2016;"06";2016-06-01;1,52121243887213;1,11809483447544;49672;67087;654;7,8;7,8;"Dorte Meldgaard";"Kirsten Jensen";1;"C";"S";1;1;0;0;2,13726317746752
"1319";"Hilleroed.02-03-2016.pdf";42;10;5049;"Hillerød Kommune";"02-03-2016";5101;0,00823367967065281;0,001960399921584;2016;"03";2016-03-02;2,19837039515299;0,627694672291382;49672;67087;654;7,8;7,8;"Dorte Meldgaard";"Kirsten Jensen";1;"C";"S";1;1;0;0;2,13726317746752
"1320";"Hilleroed.03-02-2016.pdf";5;8;5192;"Hillerød Kommune";"03-02-2016";5205;0,000960614793467819;0,00153698366954851;2016;"02";2016-02-03;0,256481574165761;0,492122270641052;49672;67087;654;7,8;7,8;"Dorte Meldgaard";"Kirsten Jensen";1;"C";"S";1;1;0;0;2,13726317746752
"1321";"Hilleroed.03-05-2017.pdf";22;16;9322;"Hillerød Kommune";"03-05-2017";9360;0,00235042735042735;0,00170940170940171;2017;"05";2017-05-03;0,62755780037866;0,547328294591169;50109;67650;646;7,5;7,6;"Dorte Meldgaard";"Kirsten Jensen";1;"C";"S";1;1;0;-0,0999999999999996;2,11111928538841
"1322";"Hilleroed.04-01-2017.pdf";0;1;1320;"Hillerød Kommune";"04-01-2017";1321;0;0,000757002271006813;2017;"01";2017-01-04;0;0,242382325765204;50109;67650;646;7,5;7,6;"Dorte Meldgaard";"Kirsten Jensen";1;"C";"S";1;1;0;-0,0999999999999996;2,11111928538841
"1323";"Hilleroed.04-05-2016.pdf";13;2;3424;"Hillerød Kommune";"04-05-2016";3439;0,00378016865367839;0,000581564408258215;2016;"05";2016-05-04;1,00929489479071;0,186209393623631;49672;67087;654;7,8;7,8;"Dorte Meldgaard";"Kirsten Jensen";1;"C";"S";1;1;0;0;2,13726317746752
"1324";"Hilleroed.04-10-2017.pdf";2;13;2602;"Hillerød Kommune";"04-10-2017";2617;0,000764233855559801;0,00496752006113871;2017;"10";2017-10-04;0,204048390299241;1,59053560579513;50109;67650;646;7,5;7,6;"Dorte Meldgaard";"Kirsten Jensen";1;"C";"S";1;1;0;-0,0999999999999996;2,11111928538841
"1325";"Hilleroed.04-10-2018.pdf";10;20;3732;"Hillerød Kommune";"04-10-2018";3762;0,0026581605528974;0,00531632110579479;2018;"10";2018-10-04;0,709721740315144;1,70221718413522;50650;68225;641;7,6;7,6;"Dorte Meldgaard";"Kirsten Jensen";1;"C";"S";1;1;0;0;2,09477935283896
"1326";"Hilleroed.05-03-2018.pdf";37;12;3677;"Hillerød Kommune";"05-03-2018";3726;0,00993022007514761;0,00322061191626409;2018;"03";2018-03-05;2,65134213423044;1,03119823618626;50650;68225;641;7,6;7,6;"Dorte Meldgaard";"Kirsten Jensen";1;"C";"S";1;1;0;0;2,09477935283896
"1327";"Hilleroed.05-04-2017.pdf";76;12;7515;"Hillerød Kommune";"05-04-2017";7603;0,00999605418913587;0,00157832434565303;2017;"04";2017-04-05;2,66891966614472;0,505359019864528;50109;67650;646;7,5;7,6;"Dorte Meldgaard";"Kirsten Jensen";1;"C";"S";1;1;0;-0,0999999999999996;2,11111928538841
"1328";"Hilleroed.05-04-2018.pdf";4;12;3565;"Hillerød Kommune";"05-04-2018";3581;0,00111700642278693;0,00335101926836079;2018;"04";2018-04-05;0,298237719862114;1,07295298185703;50650;68225;641;7,6;7,6;"Dorte Meldgaard";"Kirsten Jensen";1;"C";"S";1;1;0;0;2,09477935283896
"1329";"Hilleroed.05-10-2016.pdf";5;18;6653;"Hillerød Kommune";"05-10-2016";6676;0,000748951467944877;0,00269622528460156;2016;"10";2016-10-05;0,199968033782622;0,863296426309918;49672;67087;654;7,8;7,8;"Dorte Meldgaard";"Kirsten Jensen";1;"C";"S";1;1;0;0;2,13726317746752
"1330";"Hilleroed.06-04-2016.pdf";25;10;4663;"Hillerød Kommune";"06-04-2016";4698;0,00532141336739038;0,00212856534695615;2016;"04";2016-04-06;1,42080310082246;0,681539064146092;49672;67087;654;7,8;7,8;"Dorte Meldgaard";"Kirsten Jensen";1;"C";"S";1;1;0;0;2,13726317746752
"1331";"Hilleroed.06-09-2017.pdf";3;3;1503;"Hillerød Kommune";"06-09-2017";1509;0,00198807157057654;0,00198807157057654;2017;"09";2017-09-06;0,53080977874067;0,636554776015575;50109;67650;646;7,5;7,6;"Dorte Meldgaard";"Kirsten Jensen";1;"C";"S";1;1;0;-0,0999999999999996;2,11111928538841
"1332";"Hilleroed.06-12-2017.pdf";30;5;3603;"Hillerød Kommune";"06-12-2017";3638;0,00824628916987356;0,00137438152831226;2017;"12";2017-12-06;2,20173709763516;0,440059170335121;50109;67650;646;7,5;7,6;"Dorte Meldgaard";"Kirsten Jensen";1;"C";"S";1;1;0;-0,0999999999999996;2,11111928538841
"1333";"Hilleroed.06-12-2018.pdf";17;19;5789;"Hillerød Kommune";"06-12-2018";5825;0,00291845493562232;0,0032618025751073;2018;"12";2018-12-06;0,779219642577077;1,04438695182504;50650;68225;641;7,6;7,6;"Dorte Meldgaard";"Kirsten Jensen";1;"C";"S";1;1;0;0;2,09477935283896
"1334";"Hilleroed.07-02-2019.pdf";7;2;3553;"Hillerød Kommune";"07-02-2019";3562;0,00196518809657496;0,000561482313307131;2019;"02";2019-02-07;0,524699952539556;0,179779366836516;50998;74812;632;7,3;7,5;"Dorte Meldgaard";"Kirsten Jensen";1;"C";"S";1;1;0;-0,2;2,06536747424996
"1335";"Hilleroed.07-05-2018.pdf";5;9;5362;"Hillerød Kommune";"07-05-2018";5376;0,000930059523809524;0,00167410714285714;2018;"05";2018-05-07;0,24832339909464;0,536027431365794;50650;68225;641;7,6;7,6;"Dorte Meldgaard";"Kirsten Jensen";1;"C";"S";1;1;0;0;2,09477935283896
"1336";"Hilleroed.07-06-2017.pdf";40;12;7179;"Hillerød Kommune";"07-06-2017";7231;0,0055317383487761;0,00165952150463283;2017;"06";2017-06-07;1,47695930690946;0,531357298856314;50109;67650;646;7,5;7,6;"Dorte Meldgaard";"Kirsten Jensen";1;"C";"S";1;1;0;-0,0999999999999996;2,11111928538841
"1337";"Hilleroed.07-09-2016.pdf";3;2;1968;"Hillerød Kommune";"07-09-2016";1973;0,0015205271160669;0,0010136847440446;2016;"09";2016-09-07;0,405976663010477;0,324568730193446;49672;67087;654;7,8;7,8;"Dorte Meldgaard";"Kirsten Jensen";1;"C";"S";1;1;0;0;2,13726317746752
"1338";"Hilleroed.07-12-2016.pdf";4;10;4254;"Hillerød Kommune";"07-12-2016";4268;0,000937207122774133;0,00234301780693533;2016;"12";2016-12-07;0,250231788853381;0,750203965172995;49672;67087;654;7,8;7,8;"Dorte Meldgaard";"Kirsten Jensen";1;"C";"S";1;1;0;0;2,13726317746752
"1339";"Hilleroed.08-01-2018.pdf";15;2;1895;"Hillerød Kommune";"08-01-2018";1912;0,00784518828451883;0,00104602510460251;2018;"01";2018-01-08;2,09464423671462;0,33492369491196;50650;68225;641;7,6;7,6;"Dorte Meldgaard";"Kirsten Jensen";1;"C";"S";1;1;0;0;2,09477935283896
"1340";"Hilleroed.08-01-2019.pdf";24;4;2107;"Hillerød Kommune";"08-01-2019";2135;0,0112412177985948;0,00187353629976581;2019;"01";2019-01-08;3,00137501122125;0,5998820652662;50998;74812;632;7,3;7,5;"Dorte Meldgaard";"Kirsten Jensen";1;"C";"S";1;1;0;-0,2;2,06536747424996
"1341";"Hilleroed.08-02-2018.pdf";4;11;3291;"Hillerød Kommune";"08-02-2018";3306;0,00120992135511192;0,00332728372655777;2018;"02";2018-02-08;0,323045757660686;1,06535316869152;50650;68225;641;7,6;7,6;"Dorte Meldgaard";"Kirsten Jensen";1;"C";"S";1;1;0;0;2,09477935283896
"1342";"Hilleroed.08-03-2017.pdf";13;5;5246;"Hillerød Kommune";"08-03-2017";5264;0,00246960486322188;0,000949848024316109;2017;"03";2017-03-08;0,659377876744917;0,304129039072791;50109;67650;646;7,5;7,6;"Dorte Meldgaard";"Kirsten Jensen";1;"C";"S";1;1;0;-0,0999999999999996;2,11111928538841
"1343";"Hilleroed.08-11-2017.pdf";10;6;2018;"Hillerød Kommune";"08-11-2017";2034;0,00491642084562439;0,00294985250737463;2017;"11";2017-11-08;1,31267118341474;0,944504579161753;50109;67650;646;7,5;7,6;"Dorte Meldgaard";"Kirsten Jensen";1;"C";"S";1;1;0;-0,0999999999999996;2,11111928538841
"1344";"Hilleroed.08-11-2018.pdf";35;11;2712;"Hillerød Kommune";"08-11-2018";2758;0,0126903553299492;0,00398839738941262;2018;"11";2018-11-08;3,38829084652991;1,27703320365996;50650;68225;641;7,6;7,6;"Dorte Meldgaard";"Kirsten Jensen";1;"C";"S";1;1;0;0;2,09477935283896
"1345";"Hilleroed.09-08-2017.pdf";6;10;3415;"Hillerød Kommune";"09-08-2017";3431;0,00174876129408336;0,0029146021568056;2017;"08";2017-08-09;0,466914576578066;0,933217873319248;50109;67650;646;7,5;7,6;"Dorte Meldgaard";"Kirsten Jensen";1;"C";"S";1;1;0;-0,0999999999999996;2,11111928538841
"1346";"Hilleroed.09-11-2016.pdf";5;7;3252;"Hillerød Kommune";"09-11-2016";3264;0,00153186274509804;0,00214460784313726;2016;"11";2016-11-09;0,409003245567643;0,686675663710429;49672;67087;654;7,8;7,8;"Dorte Meldgaard";"Kirsten Jensen";1;"C";"S";1;1;0;0;2,13726317746752
"1347";"Hilleroed.10-09-2018.pdf";6;6;2045;"Hillerød Kommune";"10-09-2018";2057;0,00291686922702965;0,00291686922702965;2018;"09";2018-09-10;0,778796262634586;0,933943759851728;50650;68225;641;7,6;7,6;"Dorte Meldgaard";"Kirsten Jensen";1;"C";"S";1;1;0;0;2,09477935283896
"1348";"Hilleroed.11-03-2019.pdf";19;13;6607;"Hillerød Kommune";"11-03-2019";6639;0,00286187678867299;0,00195812622382889;2019;"03";2019-03-11;0,764113429044221;0,62696666370927;50998;74812;632;7,3;7,5;"Dorte Meldgaard";"Kirsten Jensen";1;"C";"S";1;1;0;-0,2;2,06536747424996
"1349";"Hilleroed.11-06-2018.pdf";4;27;4980;"Hillerød Kommune";"11-06-2018";5011;0,000798243863500299;0,00538814607862702;2018;"06";2018-06-11;0,213128971228543;1,72521461047047;50650;68225;641;7,6;7,6;"Dorte Meldgaard";"Kirsten Jensen";1;"C";"S";1;1;0;0;2,09477935283896
"1350";"Hilleroed.13-01-2016.pdf";45;2;1545;"Hillerød Kommune";"13-01-2016";1592;0,0282663316582915;0,00125628140703518;2016;"01";2016-01-13;7,54703476243409;0,402245040622907;49672;67087;654;7,8;7,8;"Dorte Meldgaard";"Kirsten Jensen";1;"C";"S";1;1;0;0;2,13726317746752
"1351";"Hilleroed.15-05-2017.pdf";0;0;261;"Hillerød Kommune";"15-05-2017";261;0;0;2017;"05";2017-05-15;0;0;50109;67650;646;7,5;7,6;"Dorte Meldgaard";"Kirsten Jensen";1;"C";"S";1;1;0;-0,0999999999999996;2,11111928538841
"1352";"Hilleroed.16-08-2018.pdf";29;10;7029;"Hillerød Kommune";"16-08-2018";7068;0,00410299943406904;0,00141482739105829;2018;"08";2018-08-16;1,09548984755096;0,453009411906953;50650;68225;641;7,6;7,6;"Dorte Meldgaard";"Kirsten Jensen";1;"C";"S";1;1;0;0;2,09477935283896
"1353";"Hilleroed.17-08-2016.pdf";7;6;4409;"Hillerød Kommune";"17-08-2016";4422;0,00158299412030755;0,00135685210312076;2016;"08";2016-08-17;0,422655185650362;0,434446475353913;49672;67087;654;7,8;7,8;"Dorte Meldgaard";"Kirsten Jensen";1;"C";"S";1;1;0;0;2,13726317746752
"1354";"Hilleroed.19-03-2018.pdf";2;2;920;"Hillerød Kommune";"19-03-2018";924;0,00216450216450216;0,00216450216450216;2018;"03";2018-03-19;0,577916274256617;0,693045567826481;50650;68225;641;7,6;7,6;"Dorte Meldgaard";"Kirsten Jensen";1;"C";"S";1;1;0;0;2,09477935283896
"1355";"Hilleroed.29-03-2016.pdf";1;3;1081;"Hillerød Kommune";"29-03-2016";1085;0,000921658986175115;0,00276497695852535;2016;"03";2016-03-29;0,24608047807056;0,88530982212673;49672;67087;654;7,8;7,8;"Dorte Meldgaard";"Kirsten Jensen";1;"C";"S";1;1;0;0;2,13726317746752
"1356";"Hjoerring.01-10-2018.pdf";0;2;1004;"Hjørring Kommune";"01-10-2018";1006;0;0,00198807157057654;2018;"10";2018-10-01;0;0,636554776015575;65257;63961;820;6,7;6,6;"Arne Boelt";"Arne Boelt";0;"S";"S";0;0;0;0,100000000000001;2,67974893810913
"1357";"Hjoerring.02-05-2018.pdf";5;0;388;"Hjørring Kommune";"02-05-2018";393;0,0127226463104326;0;2018;"05";2018-05-02;3,39691245173737;0;65257;63961;820;6,7;6,6;"Arne Boelt";"Arne Boelt";0;"S";"S";0;0;0;0,100000000000001;2,67974893810913
"1358";"Hjoerring.03-12-2018.pdf";0;29;2782;"Hjørring Kommune";"03-12-2018";2811;0;0,0103166133048737;2018;"12";2018-12-03;0;3,30324600417616;65257;63961;820;6,7;6,6;"Arne Boelt";"Arne Boelt";0;"S";"S";0;0;0;0,100000000000001;2,67974893810913
"1359";"Hjoerring.04-02-2019.pdf";4;9;3744;"Hjørring Kommune";"04-02-2019";3757;0,00106467926537131;0,00239552834708544;2019;"02";2019-02-04;0,284266509136606;0,76701716024022;64665;61960;804;6,7;6,7;"Arne Boelt";"Arne Boelt";0;"S";"S";0;0;0;0;2,6274611539509
"1360";"Hjoerring.04-03-2019.pdf";5;11;2783;"Hjørring Kommune";"04-03-2019";2799;0,00178635226866738;0,00392997499106824;2019;"03";2019-03-04;0,476951265999566;1,25832710814369;64665;61960;804;6,7;6,7;"Arne Boelt";"Arne Boelt";0;"S";"S";0;0;0;0;2,6274611539509
"1361";"Hjoerring.05-02-2018.pdf";26;11;3675;"Hjørring Kommune";"05-02-2018";3712;0,00700431034482759;0,00296336206896552;2018;"02";2018-02-05;1,87013208145757;0,948830165865888;65257;63961;820;6,7;6,6;"Arne Boelt";"Arne Boelt";0;"S";"S";0;0;0;0,100000000000001;2,67974893810913
"1362";"Hjoerring.05-03-2018.pdf";9;34;3787;"Hjørring Kommune";"05-03-2018";3830;0,00234986945169713;0,00887728459530026;2018;"03";2018-03-05;0,627408842913581;2,8423915873155;65257;63961;820;6,7;6,6;"Arne Boelt";"Arne Boelt";0;"S";"S";0;0;0;0,100000000000001;2,67974893810913
"1363";"Hjoerring.07-01-2019.pdf";0;0;1731;"Hjørring Kommune";"07-01-2019";1731;0;0;2019;"01";2019-01-07;0;0;64665;61960;804;6,7;6,7;"Arne Boelt";"Arne Boelt";0;"S";"S";0;0;0;0;2,6274611539509
"1364";"Hjoerring.07-05-2018.pdf";10;12;2681;"Hjørring Kommune";"07-05-2018";2703;0,00369959304476508;0,00443951165371809;2018;"05";2018-05-07;0,987781423257703;1,42147415021458;65257;63961;820;6,7;6,6;"Arne Boelt";"Arne Boelt";0;"S";"S";0;0;0;0,100000000000001;2,67974893810913
"1365";"Hjoerring.08-01-2018.pdf";0;5;1794;"Hjørring Kommune";"08-01-2018";1799;0;0,00277932184546971;2018;"01";2018-01-08;0;0,889902869193536;65257;63961;820;6,7;6,6;"Arne Boelt";"Arne Boelt";0;"S";"S";0;0;0;0,100000000000001;2,67974893810913
"1366";"Hjoerring.08-04-2019.pdf";6;1;1052;"Hjørring Kommune";"08-04-2019";1059;0,0056657223796034;0,000944287063267233;2019;"04";2019-04-08;1,51273268388984;0,302348491346397;64665;61960;804;6,7;6,7;"Arne Boelt";"Arne Boelt";0;"S";"S";0;0;0;0;2,6274611539509
"1367";"Hjoerring.09-04-2018.pdf";2;7;2652;"Hjørring Kommune";"09-04-2018";2661;0,000751597143930853;0,00263059000375799;2018;"04";2018-04-09;0,200674422177044;0,84228085920738;65257;63961;820;6,7;6,6;"Arne Boelt";"Arne Boelt";0;"S";"S";0;0;0;0,100000000000001;2,67974893810913
"1368";"Hjoerring.10-09-2018.pdf";0;15;1748;"Hjørring Kommune";"10-09-2018";1763;0;0,00850822461712989;2018;"09";2018-09-10;0;2,72422336077;65257;63961;820;6,7;6,6;"Arne Boelt";"Arne Boelt";0;"S";"S";0;0;0;0,100000000000001;2,67974893810913
"1369";"Hjoerring.11-06-2018.pdf";3;23;3454;"Hjørring Kommune";"11-06-2018";3480;0,000862068965517241;0,00660919540229885;2018;"06";2018-06-11;0,230170102333239;2,11617879417362;65257;63961;820;6,7;6,6;"Arne Boelt";"Arne Boelt";0;"S";"S";0;0;0;0,100000000000001;2,67974893810913
"1370";"Hjoerring.12-11-2018.pdf";27;7;3949;"Hjørring Kommune";"12-11-2018";3983;0,00677880994225458;0,00175746924428822;2018;"11";2018-11-12;1,80992407860333;0,562718896899533;65257;63961;820;6,7;6,6;"Arne Boelt";"Arne Boelt";0;"S";"S";0;0;0;0,100000000000001;2,67974893810913
"1371";"Hjoerring.13-08-2018.pdf";3;12;3586;"Hjørring Kommune";"13-08-2018";3601;0,000833101916134407;0,00333240766453763;2018;"08";2018-08-13;0,222435977817182;1,06699378728964;65257;63961;820;6,7;6,6;"Arne Boelt";"Arne Boelt";0;"S";"S";0;0;0;0,100000000000001;2,67974893810913
"1372";"Hjoerring.17-12-2018.pdf";0;2;1537;"Hjørring Kommune";"17-12-2018";1539;0;0,00129954515919428;2018;"12";2018-12-17;0;0,416097533899719;65257;63961;820;6,7;6,6;"Arne Boelt";"Arne Boelt";0;"S";"S";0;0;0;0,100000000000001;2,67974893810913
"1373";"Hjoerring.18-03-2019.pdf";10;33;4808;"Hjørring Kommune";"18-03-2019";4851;0,0020614306328592;0,00680272108843537;2019;"03";2019-03-18;0,550396451672969;2,17814321316894;64665;61960;804;6,7;6,7;"Arne Boelt";"Arne Boelt";0;"S";"S";0;0;0;0;2,6274611539509
"1374";"Hjoerring.19-03-2018.pdf";15;3;1883;"Hjørring Kommune";"19-03-2018";1901;0,00789058390320884;0,00157811678064177;2018;"03";2018-03-19;2,10676474518588;0,505292560235404;65257;63961;820;6,7;6,6;"Arne Boelt";"Arne Boelt";0;"S";"S";0;0;0;0,100000000000001;2,67974893810913
"1375";"Hjoerring.21-01-2019.pdf";0;1;732;"Hjørring Kommune";"21-01-2019";733;0;0,00136425648021828;2019;"01";2019-01-21;0;0,436817261031152;64665;61960;804;6,7;6,7;"Arne Boelt";"Arne Boelt";0;"S";"S";0;0;0;0;2,6274611539509
"1376";"Hjoerring.22-01-2018.pdf";2;11;2630;"Hjørring Kommune";"22-01-2018";2643;0,000756715853197125;0,00416193719258418;2018;"01";2018-01-22;0,202041103826377;1,33259840170041;65257;63961;820;6,7;6,6;"Arne Boelt";"Arne Boelt";0;"S";"S";0;0;0;0,100000000000001;2,67974893810913
"1377";"Hjoerring.23-04-2018.pdf";5;8;1271;"Hjørring Kommune";"23-04-2018";1284;0,00389408099688474;0,00623052959501558;2018;"04";2018-04-23;1,03970918499438;1,99493490551922;65257;63961;820;6,7;6,6;"Arne Boelt";"Arne Boelt";0;"S";"S";0;0;0;0,100000000000001;2,67974893810913
"1378";"Hjoerring.25-02-2019.pdf";3;1;1222;"Hjørring Kommune";"25-02-2019";1226;0,00244698205546493;0,000815660685154976;2019;"02";2019-02-25;0,653337647732195;0,261163990485999;64665;61960;804;6,7;6,7;"Arne Boelt";"Arne Boelt";0;"S";"S";0;0;0;0;2,6274611539509
"1379";"Hjoerring.25-06-2018.pdf";15;26;4959;"Hjørring Kommune";"25-06-2018";5000;0,003;0,0052;2018;"06";2018-06-25;0,800991956119672;1,66497267214634;65257;63961;820;6,7;6,6;"Arne Boelt";"Arne Boelt";0;"S";"S";0;0;0;0,100000000000001;2,67974893810913
"1380";"Hjoerring.27-08-2018.pdf";7;7;2536;"Hjørring Kommune";"27-08-2018";2550;0,00274509803921569;0,00274509803921569;2018;"08";2018-08-27;0,732933816057216;0,878944849549349;65257;63961;820;6,7;6,6;"Arne Boelt";"Arne Boelt";0;"S";"S";0;0;0;0,100000000000001;2,67974893810913
"1381";"Hjoerring.28-05-2018.pdf";0;3;660;"Hjørring Kommune";"28-05-2018";663;0;0,00452488687782805;2018;"05";2018-05-28;0;1,44881019156486;65257;63961;820;6,7;6,6;"Arne Boelt";"Arne Boelt";0;"S";"S";0;0;0;0,100000000000001;2,67974893810913
"1382";"Hjoerring.29-10-2018.pdf";14;7;4848;"Hjørring Kommune";"29-10-2018";4869;0,0028753337440953;0,00143766687204765;2018;"10";2018-10-29;0,76770640005993;0,460322318001815;65257;63961;820;6,7;6,6;"Arne Boelt";"Arne Boelt";0;"S";"S";0;0;0;0,100000000000001;2,67974893810913
"1383";"Hoersholm.12-12-2017.pdf";6;3;1969;"Hørsholm Kommune";"12-12-2017";1978;0,00303336703741153;0,00151668351870576;2017;"12";2017-12-12;0,809900865641731;0,485622425180739;24977;62732;628;8,6;8,4;"Morten Slotved";"Morten Slotved";0;"C";"C";0;0;0;0,199999999999999;2,05229552821041
"1384";"Hoersholm.13-12-2016.pdf";6;1;1248;"Hørsholm Kommune";"13-12-2016";1255;0,0047808764940239;0,000796812749003984;2016;"12";2016-12-13;1,27648120497159;0,255129125367199;24965;61198;634;8,2;8,1;"Morten Slotved";"Morten Slotved";0;"C";"C";0;0;0;0,0999999999999996;2,07190344726974
"1385";"Hoersholm.13-12-2018.pdf";2;2;2165;"Hørsholm Kommune";"13-12-2018";2169;0,000922083909635777;0,000922083909635777;2018;"12";2018-12-13;0,246193931495212;0,295239329032581;25028;65424;626;8,2;8,2;"Morten Slotved";"Morten Slotved";0;"C";"C";0;0;0;0;2,04575955519063
"1386";"Hoersholm.14-03-2019.pdf";3;15;3344;"Hørsholm Kommune";"14-03-2019";3362;0,000892325996430696;0,00446162998215348;2019;"03";2019-03-14;0,238248648459153;1,4285561525989;25007;61708;620;7,9;7,9;"Morten Slotved";"Morten Slotved";0;"C";"C";0;0;0;0;2,02615163613129
"1387";"Hoersholm.14-06-2018.pdf";3;2;2197;"Hørsholm Kommune";"14-06-2018";2202;0,00136239782016349;0,000908265213442325;2018;"06";2018-06-14;0,363756564995309;0,290814761431275;25028;65424;626;8,2;8,2;"Morten Slotved";"Morten Slotved";0;"C";"C";0;0;0;0;2,04575955519063
"1388";"Hoersholm.15-03-2016.pdf";4;0;1557;"Hørsholm Kommune";"15-03-2016";1561;0,0025624599615631;0;2016;"03";2016-03-15;0,684169939030255;0;24965;61198;634;8,2;8,1;"Morten Slotved";"Morten Slotved";0;"C";"C";0;0;0;0,0999999999999996;2,07190344726974
"1389";"Hoersholm.16-05-2017.pdf";0;3;1469;"Hørsholm Kommune";"16-05-2017";1472;0;0,00203804347826087;2017;"05";2017-05-16;0;0,652555133836618;24977;62732;628;8,6;8,4;"Morten Slotved";"Morten Slotved";0;"C";"C";0;0;0;0,199999999999999;2,05229552821041
"1390";"Hoersholm.20-06-2017.pdf";3;6;2736;"Hørsholm Kommune";"20-06-2017";2745;0,00109289617486339;0,00218579234972678;2017;"06";2017-06-20;0,291800348313177;0,699862409477233;24977;62732;628;8,6;8,4;"Morten Slotved";"Morten Slotved";0;"C";"C";0;0;0;0,199999999999999;2,05229552821041
"1391";"Hoersholm.20-09-2016.pdf";0;1;1166;"Hørsholm Kommune";"20-09-2016";1167;0;0,000856898029134533;2016;"09";2016-09-20;0;0,274367654100972;24965;61198;634;8,2;8,1;"Morten Slotved";"Morten Slotved";0;"C";"C";0;0;0;0,0999999999999996;2,07190344726974
"1392";"Hoersholm.20-09-2018.pdf";7;1;1257;"Hørsholm Kommune";"20-09-2018";1265;0,00553359683794466;0,000790513833992095;2018;"09";2018-09-20;1,47745551853431;0,253112294336628;25028;65424;626;8,2;8,2;"Morten Slotved";"Morten Slotved";0;"C";"C";0;0;0;0;2,04575955519063
"1393";"Hoersholm.20-11-2017.pdf";1;2;1293;"Hørsholm Kommune";"20-11-2017";1296;0,000771604938271605;0,00154320987654321;2017;"11";2017-11-20;0,206016449619257;0,494115821505917;24977;62732;628;8,6;8,4;"Morten Slotved";"Morten Slotved";0;"C";"C";0;0;0;0,199999999999999;2,05229552821041
"1394";"Hoersholm.21-02-2017.pdf";18;2;2075;"Hørsholm Kommune";"21-02-2017";2095;0,00859188544152745;0,000954653937947494;2017;"02";2017-02-21;2,29401037552173;0,305667830392204;24977;62732;628;8,6;8,4;"Morten Slotved";"Morten Slotved";0;"C";"C";0;0;0;0,199999999999999;2,05229552821041
"1395";"Hoersholm.21-02-2019.pdf";6;6;3124;"Hørsholm Kommune";"21-02-2019";3136;0,00191326530612245;0,00191326530612245;2019;"02";2019-02-21;0,510836706708974;0,612602778703764;25007;61708;620;7,9;7,9;"Morten Slotved";"Morten Slotved";0;"C";"C";0;0;0;0;2,02615163613129
"1396";"Hoersholm.21-03-2017.pdf";5;2;2594;"Hørsholm Kommune";"21-03-2017";2601;0,00192233756247597;0,000768935024990388;2017;"03";2017-03-21;0,513258974829983;0,246203039089453;24977;62732;628;8,6;8,4;"Morten Slotved";"Morten Slotved";0;"C";"C";0;0;0;0,199999999999999;2,05229552821041
"1397";"Hoersholm.21-06-2016.pdf";2;4;1591;"Hørsholm Kommune";"21-06-2016";1597;0,00125234815278647;0,00250469630557295;2016;"06";2016-06-21;0,334373598881099;0,801971327077856;24965;61198;634;8,2;8,1;"Morten Slotved";"Morten Slotved";0;"C";"C";0;0;0;0,0999999999999996;2,07190344726974
"1398";"Hoersholm.22-02-2018.pdf";28;3;3861;"Hørsholm Kommune";"22-02-2018";3892;0,00719424460431655;0,000770811921891059;2018;"02";2018-02-22;1,92084401947163;0,246803997175617;25028;65424;626;8,2;8,2;"Morten Slotved";"Morten Slotved";0;"C";"C";0;0;0;0;2,04575955519063
"1399";"Hoersholm.22-03-2018.pdf";4;3;1644;"Hørsholm Kommune";"22-03-2018";1651;0,00242277407631738;0,00181708055723804;2018;"03";2018-03-22;0,646874182208497;0,581805667478802;25028;65424;626;8,2;8,2;"Morten Slotved";"Morten Slotved";0;"C";"C";0;0;0;0;2,04575955519063
"1400";"Hoersholm.22-08-2017.pdf";0;2;1470;"Hørsholm Kommune";"22-08-2017";1472;0;0,00135869565217391;2017;"08";2017-08-22;0;0,435036755891079;24977;62732;628;8,6;8,4;"Morten Slotved";"Morten Slotved";0;"C";"C";0;0;0;0,199999999999999;2,05229552821041
"1401";"Hoersholm.22-11-2016.pdf";10;2;1372;"Hørsholm Kommune";"22-11-2016";1384;0,00722543352601156;0,00144508670520231;2016;"11";2016-11-22;1,92917137793755;0,462698052508431;24965;61198;634;8,2;8,1;"Morten Slotved";"Morten Slotved";0;"C";"C";0;0;0;0,0999999999999996;2,07190344726974
"1402";"Hoersholm.22-11-2018.pdf";2;8;2724;"Hørsholm Kommune";"22-11-2018";2734;0,000731528895391368;0,00292611558156547;2018;"11";2018-11-22;0,195316253625865;0,936904322855404;25028;65424;626;8,2;8,2;"Morten Slotved";"Morten Slotved";0;"C";"C";0;0;0;0;2,04575955519063
"1403";"Hoersholm.23-02-2016.pdf";11;3;2060;"Hørsholm Kommune";"23-02-2016";2074;0,00530376084860174;0,00144648023143684;2016;"02";2016-02-23;1,41608992563748;0,463144241565816;24965;61198;634;8,2;8,1;"Morten Slotved";"Morten Slotved";0;"C";"C";0;0;0;0,0999999999999996;2,07190344726974
"1404";"Hoersholm.23-08-2016.pdf";2;1;948;"Hørsholm Kommune";"23-08-2016";951;0,00210304942166141;0,0010515247108307;2016;"08";2016-08-23;0,561508556690972;0,336684597619174;24965;61198;634;8,2;8,1;"Morten Slotved";"Morten Slotved";0;"C";"C";0;0;0;0,0999999999999996;2,07190344726974
"1405";"Hoersholm.24-01-2017.pdf";9;0;753;"Hørsholm Kommune";"24-01-2017";762;0,0118110236220472;0;2017;"01";2017-01-24;3,15351163826642;0;24977;62732;628;8,6;8,4;"Morten Slotved";"Morten Slotved";0;"C";"C";0;0;0;0,199999999999999;2,05229552821041
"1406";"Hoersholm.24-01-2019.pdf";1;5;2446;"Hørsholm Kommune";"24-01-2019";2452;0,000407830342577488;0,00203915171288744;2019;"01";2019-01-24;0,108889607955366;0,652909976214996;25007;61708;620;7,9;7,9;"Morten Slotved";"Morten Slotved";0;"C";"C";0;0;0;0;2,02615163613129
"1407";"Hoersholm.24-05-2016.pdf";1;3;2131;"Hørsholm Kommune";"24-05-2016";2135;0,000468384074941452;0,00140515222482436;2016;"05";2016-05-24;0,125057292134219;0,44991154894965;24965;61198;634;8,2;8,1;"Morten Slotved";"Morten Slotved";0;"C";"C";0;0;0;0,0999999999999996;2,07190344726974
"1408";"Hoersholm.24-05-2018.pdf";0;3;3004;"Hørsholm Kommune";"24-05-2018";3007;0;0,00099767209843698;2018;"05";2018-05-24;0;0,319441688396243;25028;65424;626;8,2;8,2;"Morten Slotved";"Morten Slotved";0;"C";"C";0;0;0;0;2,04575955519063
"1409";"Hoersholm.24-10-2017.pdf";0;1;485;"Hørsholm Kommune";"24-10-2017";486;0;0,00205761316872428;2017;"10";2017-10-24;0;0,658821095341223;24977;62732;628;8,6;8,4;"Morten Slotved";"Morten Slotved";0;"C";"C";0;0;0;0,199999999999999;2,05229552821041
"1410";"Hoersholm.25-01-2018.pdf";0;3;876;"Hørsholm Kommune";"25-01-2018";879;0;0,00341296928327645;2018;"01";2018-01-25;0;1,09278857452503;25028;65424;626;8,2;8,2;"Morten Slotved";"Morten Slotved";0;"C";"C";0;0;0;0;2,04575955519063
"1411";"Hoersholm.25-04-2017.pdf";0;1;544;"Hørsholm Kommune";"25-04-2017";545;0;0,0018348623853211;2017;"04";2017-04-25;0;0,587499178597861;24977;62732;628;8,6;8,4;"Morten Slotved";"Morten Slotved";0;"C";"C";0;0;0;0,199999999999999;2,05229552821041
"1412";"Hoersholm.25-10-2016.pdf";3;2;1145;"Hørsholm Kommune";"25-10-2016";1150;0,00260869565217391;0,00173913043478261;2016;"10";2016-10-25;0,696514744451888;0,556847047540581;24965;61198;634;8,2;8,1;"Morten Slotved";"Morten Slotved";0;"C";"C";0;0;0;0,0999999999999996;2,07190344726974
"1413";"Hoersholm.25-10-2018.pdf";2;13;3327;"Hørsholm Kommune";"25-10-2018";3342;0,000598444045481747;0,00388988629563136;2018;"10";2018-10-25;0,159782955539532;1,24549122691976;25028;65424;626;8,2;8,2;"Morten Slotved";"Morten Slotved";0;"C";"C";0;0;0;0;2,04575955519063
"1414";"Hoersholm.26-01-2016.pdf";1;0;768;"Hørsholm Kommune";"26-01-2016";769;0,00130039011703511;0;2016;"01";2016-01-26;0,347200674520881;0;24965;61198;634;8,2;8,1;"Morten Slotved";"Morten Slotved";0;"C";"C";0;0;0;0,0999999999999996;2,07190344726974
"1415";"Hoersholm.26-04-2016.pdf";4;1;1321;"Hørsholm Kommune";"26-04-2016";1326;0,00301659125188537;0,000754147812971342;2016;"04";2016-04-26;0,80542177588705;0,24146836526081;24965;61198;634;8,2;8,1;"Morten Slotved";"Morten Slotved";0;"C";"C";0;0;0;0,0999999999999996;2,07190344726974
"1416";"Hoersholm.26-04-2018.pdf";0;1;1364;"Hørsholm Kommune";"26-04-2018";1365;0;0,000732600732600733;2018;"04";2018-04-26;0;0,234569269110501;25028;65424;626;8,2;8,2;"Morten Slotved";"Morten Slotved";0;"C";"C";0;0;0;0;2,04575955519063
"1417";"Hoersholm.26-09-2017.pdf";0;1;275;"Hørsholm Kommune";"26-09-2017";276;0;0,0036231884057971;2017;"09";2017-09-26;0;1,16009801570954;24977;62732;628;8,6;8,4;"Morten Slotved";"Morten Slotved";0;"C";"C";0;0;0;0,199999999999999;2,05229552821041
"1418";"Hoersholm.27-02-2017.pdf";0;1;400;"Hørsholm Kommune";"27-02-2017";401;0;0,00249376558603491;2017;"02";2017-02-27;0;0,798471452209063;24977;62732;628;8,6;8,4;"Morten Slotved";"Morten Slotved";0;"C";"C";0;0;0;0,199999999999999;2,05229552821041
"1419";"Hoersholm.30-08-2018.pdf";4;5;3037;"Hørsholm Kommune";"30-08-2018";3046;0,00131319763624425;0,00164149704530532;2018;"08";2018-08-30;0,350620247809005;0,525586100354291;25028;65424;626;8,2;8,2;"Morten Slotved";"Morten Slotved";0;"C";"C";0;0;0;0;2,04575955519063
"1420";"Holbaek.05-01-2016.pdf";5;7;3045;"Holbæk Kommune";"05-01-2016";3057;0,00163559044815178;0,0022898266274125;2016;"01";2016-01-05;0,436698264158582;0,733172838191312;69972;60071;930;6,6;6,8;"Søren Kjærsgaard";"Christina Hansen";1;"V";"S";1;1;0;-0,2;3,03922745419694
"1421";"Holbaek.05-09-2017.pdf";12;16;2182;"Holbæk Kommune";"05-09-2017";2210;0,00542986425339366;0,00723981900452489;2017;"09";2017-09-05;1,44975919659669;2,31809630650378;70950;57782;1262;6,4;6,7;"Søren Kjærsgaard";"Christina Hansen";1;"V";"S";1;1;0;-0,3;4,12419897548015
"1422";"Holbaek.05-12-2018.pdf";0;0;354;"Holbæk Kommune";"05-12-2018";354;0;0;2018;"12";2018-12-05;0;0;70983;58667;1181;6,6;6,8;"Søren Kjærsgaard";"Christina Hansen";1;"V";"S";1;1;0;-0,2;3,85949206817912
"1423";"Holbaek.09-01-2019.pdf";2;2;1654;"Holbæk Kommune";"09-01-2019";1658;0,00120627261761158;0,00120627261761158;2019;"01";2019-01-09;0,322071554531432;0,386232873746483;71297;59793;1147;6,4;6,6;"Søren Kjærsgaard";"Christina Hansen";1;"V";"S";1;1;0;-0,199999999999999;3,74838052684289
"1424";"Holbaek.09-04-2018.pdf";4;4;1136;"Holbæk Kommune";"09-04-2018";1144;0,0034965034965035;0,0034965034965035;2018;"04";2018-04-09;0,933557058414536;1,11953514802739;70983;58667;1181;6,6;6,8;"Søren Kjærsgaard";"Christina Hansen";1;"V";"S";1;1;0;-0,2;3,85949206817912
"1425";"Holbaek.10-01-2017.pdf";5;16;3697;"Holbæk Kommune";"10-01-2017";3718;0,00134480903711673;0,00430338891877353;2017;"01";2017-01-10;0,359060407082514;1,37788941295679;70950;57782;1262;6,4;6,7;"Søren Kjærsgaard";"Christina Hansen";1;"V";"S";1;1;0;-0,3;4,12419897548015
"1426";"Holbaek.17-12-2018.pdf";25;2;989;"Holbæk Kommune";"17-12-2018";1016;0,0246062992125984;0,00196850393700787;2018;"12";2018-12-17;6,56981591305505;0,630289473102036;70983;58667;1181;6,6;6,8;"Søren Kjærsgaard";"Christina Hansen";1;"V";"S";1;1;0;-0,2;3,85949206817912
"1427";"Holbaek.20-06-2017.pdf";22;14;2724;"Holbæk Kommune";"20-06-2017";2760;0,00797101449275362;0,00507246376811594;2017;"06";2017-06-20;2,12823949693633;1,62413722199336;70950;57782;1262;6,4;6,7;"Søren Kjærsgaard";"Christina Hansen";1;"V";"S";1;1;0;-0,3;4,12419897548015
"1428";"Holbaek.20-06-2018.pdf";6;1;2706;"Holbæk Kommune";"20-06-2018";2713;0,00221157390342794;0,000368595650571323;2018;"06";2018-06-20;0,590484302336654;0,118019554860241;70983;58667;1181;6,6;6,8;"Søren Kjærsgaard";"Christina Hansen";1;"V";"S";1;1;0;-0,2;3,85949206817912
"1429";"Holbaek.21-02-2017.pdf";11;10;3264;"Holbæk Kommune";"21-02-2017";3285;0,00334855403348554;0,0030441400304414;2017;"02";2017-02-21;0,894054948484666;0,974694223244548;70950;57782;1262;6,4;6,7;"Søren Kjærsgaard";"Christina Hansen";1;"V";"S";1;1;0;-0,3;4,12419897548015
"1430";"Holbaek.21-03-2017.pdf";8;4;3109;"Holbæk Kommune";"21-03-2017";3121;0,00256328099967959;0,00128164049983979;2017;"03";2017-03-21;0,684389154005914;0,410364693797929;70950;57782;1262;6,4;6,7;"Søren Kjærsgaard";"Christina Hansen";1;"V";"S";1;1;0;-0,3;4,12419897548015
"1431";"Holbaek.21-03-2018.pdf";16;3;4262;"Holbæk Kommune";"21-03-2018";4281;0,00373744452230787;0,000700770847932726;2018;"03";2018-03-21;0,997887666270711;0,224377752162463;70983;58667;1181;6,6;6,8;"Søren Kjærsgaard";"Christina Hansen";1;"V";"S";1;1;0;-0,2;3,85949206817912
"1432";"Holbaek.21-06-2016.pdf";6;1;2657;"Holbæk Kommune";"21-06-2016";2664;0,00225225225225225;0,000375375375375375;2016;"06";2016-06-21;0,601345312402156;0,120190334960899;69972;60071;930;6,6;6,8;"Søren Kjærsgaard";"Christina Hansen";1;"V";"S";1;1;0;-0,2;3,03922745419694
"1433";"Holbaek.21-12-2016.pdf";0;0;213;"Holbæk Kommune";"21-12-2016";213;0;0;2016;"12";2016-12-21;0;0;69972;60071;930;6,6;6,8;"Søren Kjærsgaard";"Christina Hansen";1;"V";"S";1;1;0;-0,2;3,03922745419694
"1434";"Holbaek.23-02-2016.pdf";24;24;4322;"Holbæk Kommune";"23-02-2016";4370;0,00549199084668192;0,00549199084668192;2016;"02";2016-02-23;1,46634683042503;1,75846436065447;69972;60071;930;6,6;6,8;"Søren Kjærsgaard";"Christina Hansen";1;"V";"S";1;1;0;-0,2;3,03922745419694
"1435";"Holbaek.23-08-2016.pdf";10;6;1927;"Holbæk Kommune";"23-08-2016";1943;0,00514668039114771;0,00308800823468863;2016;"08";2016-08-23;1,37414986467605;0,988740254253734;69972;60071;930;6,6;6,8;"Søren Kjærsgaard";"Christina Hansen";1;"V";"S";1;1;0;-0,2;3,03922745419694
"1436";"Holbaek.24-01-2017.pdf";6;3;2186;"Holbæk Kommune";"24-01-2017";2195;0,00273348519362187;0,00136674259681093;2017;"01";2017-01-24;0,729833217421113;0,437613283374716;70950;57782;1262;6,4;6,7;"Søren Kjærsgaard";"Christina Hansen";1;"V";"S";1;1;0;-0,3;4,12419897548015
"1437";"Holbaek.24-05-2018.pdf";15;8;4204;"Holbæk Kommune";"24-05-2018";4227;0,0035486160397445;0,00189259522119707;2018;"05";2018-05-24;0,947470967730863;0,605984485139975;70983;58667;1181;6,6;6,8;"Søren Kjærsgaard";"Christina Hansen";1;"V";"S";1;1;0;-0,2;3,85949206817912
"1438";"Holbaek.24-10-2017.pdf";11;10;1233;"Holbæk Kommune";"24-10-2017";1254;0,0087719298245614;0,00797448165869218;2017;"10";2017-10-24;2,34208174303998;2,55332577620282;70950;57782;1262;6,4;6,7;"Søren Kjærsgaard";"Christina Hansen";1;"V";"S";1;1;0;-0,3;4,12419897548015
"1439";"Holbaek.25-04-2017.pdf";4;10;3617;"Holbæk Kommune";"25-04-2017";3631;0,00110162489672267;0,00275406224180666;2017;"04";2017-04-25;0,29413089364534;0,881815071153495;70950;57782;1262;6,4;6,7;"Søren Kjærsgaard";"Christina Hansen";1;"V";"S";1;1;0;-0,3;4,12419897548015
"1440";"Holbaek.25-04-2018.pdf";15;8;4204;"Holbæk Kommune";"25-04-2018";4227;0,0035486160397445;0,00189259522119707;2018;"04";2018-04-25;0,947470967730863;0,605984485139975;70983;58667;1181;6,6;6,8;"Søren Kjærsgaard";"Christina Hansen";1;"V";"S";1;1;0;-0,2;3,85949206817912
"1441";"Holbaek.25-10-2016.pdf";7;5;2343;"Holbæk Kommune";"25-10-2016";2355;0,0029723991507431;0,00212314225053079;2016;"10";2016-10-25;0,793622603374055;0,679802658887121;69972;60071;930;6,6;6,8;"Søren Kjærsgaard";"Christina Hansen";1;"V";"S";1;1;0;-0,2;3,03922745419694
"1442";"Holbaek.26-01-2016.pdf";11;5;2820;"Holbæk Kommune";"26-01-2016";2836;0,0038787023977433;0,00176304654442877;2016;"01";2016-01-26;1,03560314025816;0,564504676191527;69972;60071;930;6,6;6,8;"Søren Kjærsgaard";"Christina Hansen";1;"V";"S";1;1;0;-0,2;3,03922745419694
"1443";"Holbaek.26-04-2016.pdf";6;8;3039;"Holbæk Kommune";"26-04-2016";3053;0,00196528005240747;0,00262037340320996;2016;"04";2016-04-26;0,524724504500276;0,839009635993014;69972;60071;930;6,6;6,8;"Søren Kjærsgaard";"Christina Hansen";1;"V";"S";1;1;0;-0,2;3,03922745419694
"1444";"Holbaek.26-09-2017.pdf";30;13;3265;"Holbæk Kommune";"26-09-2017";3308;0,0090689238210399;0,00392986698911729;2017;"09";2017-09-26;2,42137834377168;1,25829252731737;70950;57782;1262;6,4;6,7;"Søren Kjærsgaard";"Christina Hansen";1;"V";"S";1;1;0;-0,3;4,12419897548015
"1445";"Holbaek.26-09-2018.pdf";3;7;3744;"Holbæk Kommune";"26-09-2018";3754;0,00079914757591902;0,00186467767714438;2018;"09";2018-09-26;0,213370260021223;0,597045649001289;70983;58667;1181;6,6;6,8;"Søren Kjærsgaard";"Christina Hansen";1;"V";"S";1;1;0;-0,2;3,85949206817912
"1446";"Holbaek.26-10-2016.pdf";2;2;868;"Holbæk Kommune";"26-10-2016";872;0,00229357798165138;0,00229357798165138;2016;"10";2016-10-26;0,612379171345315;0,734373973247326;69972;60071;930;6,6;6,8;"Søren Kjærsgaard";"Christina Hansen";1;"V";"S";1;1;0;-0,2;3,03922745419694
"1447";"Holbaek.27-02-2019.pdf";7;10;2559;"Holbæk Kommune";"27-02-2019";2576;0,00271739130434783;0,00388198757763975;2019;"02";2019-02-27;0,725536192137384;1,2429621596888;71297;59793;1147;6,4;6,6;"Søren Kjærsgaard";"Christina Hansen";1;"V";"S";1;1;0;-0,199999999999999;3,74838052684289
"1448";"Holbaek.27-03-2019.pdf";23;18;4290;"Holbæk Kommune";"27-03-2019";4331;0,00531055183560379;0,00415608404525514;2019;"03";2019-03-27;1,4179031009584;1,33072429971023;71297;59793;1147;6,4;6,6;"Søren Kjærsgaard";"Christina Hansen";1;"V";"S";1;1;0;-0,199999999999999;3,74838052684289
"1449";"Holbaek.27-06-2017.pdf";3;8;1193;"Holbæk Kommune";"27-06-2017";1204;0,00249169435215947;0,00664451827242525;2017;"06";2017-06-27;0,66527571106285;2,12748871983943;70950;57782;1262;6,4;6,7;"Søren Kjærsgaard";"Christina Hansen";1;"V";"S";1;1;0;-0,3;4,12419897548015
"1450";"Holbaek.27-09-2016.pdf";28;2;3890;"Holbæk Kommune";"27-09-2016";3920;0,00714285714285714;0,000510204081632653;2016;"09";2016-09-27;1,90712370504684;0,163360740987671;69972;60071;930;6,6;6,8;"Søren Kjærsgaard";"Christina Hansen";1;"V";"S";1;1;0;-0,2;3,03922745419694
"1451";"Holbaek.28-02-2018.pdf";26;8;2386;"Holbæk Kommune";"28-02-2018";2420;0,0107438016528926;0,00330578512396694;2018;"02";2018-02-28;2,86856623403739;1,05846959449863;70983;58667;1181;6,6;6,8;"Søren Kjærsgaard";"Christina Hansen";1;"V";"S";1;1;0;-0,2;3,85949206817912
"1452";"Holbaek.28-11-2017.pdf";19;7;3622;"Holbæk Kommune";"28-11-2017";3648;0,00520833333333333;0,00191885964912281;2017;"11";2017-11-28;1,39061103492999;0,614394014898805;70950;57782;1262;6,4;6,7;"Søren Kjærsgaard";"Christina Hansen";1;"V";"S";1;1;0;-0,3;4,12419897548015
"1453";"Holbaek.28-11-2018.pdf";42;7;4490;"Holbæk Kommune";"28-11-2018";4539;0,0092531394580304;0,00154218990967173;2018;"11";2018-11-28;2,47056342491196;0,493789241319859;70983;58667;1181;6,6;6,8;"Søren Kjærsgaard";"Christina Hansen";1;"V";"S";1;1;0;-0,2;3,85949206817912
"1454";"Holbaek.29-08-2017.pdf";4;3;2825;"Holbæk Kommune";"29-08-2017";2832;0,00141242937853107;0,00105932203389831;2017;"08";2017-08-29;0,377114856930165;0,339181199508299;70950;57782;1262;6,4;6,7;"Søren Kjærsgaard";"Christina Hansen";1;"V";"S";1;1;0;-0,3;4,12419897548015
"1455";"Holbaek.29-08-2018.pdf";17;16;3988;"Holbæk Kommune";"29-08-2018";4021;0,00422780402884855;0,0039791096742104;2018;"08";2018-08-29;1,12881233971934;1,27405939750643;70983;58667;1181;6,6;6,8;"Søren Kjærsgaard";"Christina Hansen";1;"V";"S";1;1;0;-0,2;3,85949206817912
"1456";"Holbaek.29-11-2016.pdf";31;13;5442;"Holbæk Kommune";"29-11-2016";5486;0,00565074735690849;0,0023696682464455;2016;"11";2016-11-29;1,50873439298273;0,758737090843209;69972;60071;930;6,6;6,8;"Søren Kjærsgaard";"Christina Hansen";1;"V";"S";1;1;0;-0,2;3,03922745419694
"1457";"Holbaek.30-01-2018.pdf";3;10;2014;"Holbæk Kommune";"30-01-2018";2027;0,00148001973359645;0,00493339911198816;2018;"01";2018-01-30;0,395161300503045;1,57961051966371;70983;58667;1181;6,6;6,8;"Søren Kjærsgaard";"Christina Hansen";1;"V";"S";1;1;0;-0,2;3,85949206817912
"1458";"Holbaek.30-01-2019.pdf";39;23;5479;"Holbæk Kommune";"30-01-2019";5541;0,00703844071467244;0,00415087529326836;2019;"01";2019-01-30;1,87924479869261;1,32905652476524;71297;59793;1147;6,4;6,6;"Søren Kjærsgaard";"Christina Hansen";1;"V";"S";1;1;0;-0,199999999999999;3,74838052684289
"1459";"Holbaek.30-03-2016.pdf";14;25;5767;"Holbæk Kommune";"30-03-2016";5806;0,00241129865656218;0,00430589045814675;2016;"03";2016-03-30;0,643810275902825;1,378690373475;69972;60071;930;6,6;6,8;"Søren Kjærsgaard";"Christina Hansen";1;"V";"S";1;1;0;-0,2;3,03922745419694
"1460";"Holbaek.30-05-2017.pdf";0;0;1074;"Holbæk Kommune";"30-05-2017";1074;0;0;2017;"05";2017-05-30;0;0;70950;57782;1262;6,4;6,7;"Søren Kjærsgaard";"Christina Hansen";1;"V";"S";1;1;0;-0,3;4,12419897548015
"1461";"Holbaek.30-05-2018.pdf";6;15;3006;"Holbæk Kommune";"30-05-2018";3027;0,00198216055500496;0,00495540138751239;2018;"05";2018-05-30;0,529231553432224;1,58665536340849;70983;58667;1181;6,6;6,8;"Søren Kjærsgaard";"Christina Hansen";1;"V";"S";1;1;0;-0,2;3,85949206817912
"1462";"Holbaek.31-05-2016.pdf";14;13;3291;"Holbæk Kommune";"31-05-2016";3318;0,00421940928270042;0,00391802290536468;2016;"05";2016-05-31;1,12657096500657;1,254500205053;69972;60071;930;6,6;6,8;"Søren Kjærsgaard";"Christina Hansen";1;"V";"S";1;1;0;-0,2;3,03922745419694
"1463";"Holbaek.31-05-2017.pdf";0;0;217;"Holbæk Kommune";"31-05-2017";217;0;0;2017;"05";2017-05-31;0;0;70950;57782;1262;6,4;6,7;"Søren Kjærsgaard";"Christina Hansen";1;"V";"S";1;1;0;-0,3;4,12419897548015
"1464";"Holbaek.31-10-2018.pdf";25;8;4029;"Holbæk Kommune";"31-10-2018";4062;0,00615460364352536;0,00196947316592811;2018;"10";2018-10-31;1,64326267052288;0,630599807653046;70983;58667;1181;6,6;6,8;"Søren Kjærsgaard";"Christina Hansen";1;"V";"S";1;1;0;-0,2;3,85949206817912
"1465";"Holstebro.01-06-2017.pdf";4;0;815;"Holstebro Kommune";"01-06-2017";819;0,00488400488400488;0;2017;"06";2017-06-01;1,30401620857903;0;58125;57844;406;7,5;7,2;"HC Østerby";"HC Østerby";0;"S";"S";0;0;0;0,3;1,32680252301501
"1466";"Holstebro.01-09-2016.pdf";0;1;788;"Holstebro Kommune";"01-09-2016";789;0;0,00126742712294043;2016;"09";2016-09-01;0;0,405813754544783;57661;54120;366;7,3;7;"HC Østerby";"HC Østerby";0;"S";"S";0;0;0;0,3;1,19608306261944
"1467";"Holstebro.02-11-2017.pdf";0;0;362;"Holstebro Kommune";"02-11-2017";362;0;0;2017;"11";2017-11-02;0;0;58125;57844;406;7,5;7,2;"HC Østerby";"HC Østerby";0;"S";"S";0;0;0;0,3;1,32680252301501
"1468";"Holstebro.03-05-2018.pdf";5;7;3065;"Holstebro Kommune";"03-05-2018";3077;0,0016249593760156;0,00227494312642184;2018;"05";2018-05-03;0,433859796403245;0,728407333880676;58418;58656;371;7,1;7;"HC Østerby";"HC Østerby";0;"S";"S";0;0;0;0,0999999999999996;1,21242299516889
"1469";"Holstebro.03-11-2016.pdf";3;1;1189;"Holstebro Kommune";"03-11-2016";1193;0,00251466890192791;0,000838222967309304;2016;"11";2016-11-03;0,671409854249515;0,268388141102962;57661;54120;366;7,3;7;"HC Østerby";"HC Østerby";0;"S";"S";0;0;0;0,3;1,19608306261944
"1470";"Holstebro.04-02-2016.pdf";1;2;1182;"Holstebro Kommune";"04-02-2016";1185;0,000843881856540084;0,00168776371308017;2016;"02";2016-02-04;0,225314193001314;0,540400088330522;57661;54120;366;7,3;7;"HC Østerby";"HC Østerby";0;"S";"S";0;0;0;0,3;1,19608306261944
"1471";"Holstebro.04-04-2019.pdf";0;0;980;"Holstebro Kommune";"04-04-2019";980;0;0;2019;"04";2019-04-04;0;0;58504;59828;346;7,4;7,2;"HC Østerby";"HC Østerby";0;"S";"S";0;0;0;0,2;1,13072333242166
"1472";"Holstebro.04-05-2017.pdf";2;2;639;"Holstebro Kommune";"04-05-2017";643;0,0031104199066874;0,0031104199066874;2017;"05";2017-05-04;0,830473775137036;0,99591618144894;58125;57844;406;7,5;7,2;"HC Østerby";"HC Østerby";0;"S";"S";0;0;0;0,3;1,32680252301501
"1473";"Holstebro.04-10-2018.pdf";2;5;791;"Holstebro Kommune";"04-10-2018";798;0,0025062656641604;0,006265664160401;2018;"10";2018-10-04;0,669166212297136;2,00618453844508;58418;58656;371;7,1;7;"HC Østerby";"HC Østerby";0;"S";"S";0;0;0;0,0999999999999996;1,21242299516889
"1474";"Holstebro.05-01-2017.pdf";0;2;207;"Holstebro Kommune";"05-01-2017";209;0;0,00956937799043062;2017;"01";2017-01-05;0;3,06399093144339;58125;57844;406;7,5;7,2;"HC Østerby";"HC Østerby";0;"S";"S";0;0;0;0,3;1,32680252301501
"1475";"Holstebro.05-04-2018.pdf";4;0;1563;"Holstebro Kommune";"05-04-2018";1567;0,00255264837268666;0;2018;"04";2018-04-05;0,681550271107995;0;58418;58656;371;7,1;7;"HC Østerby";"HC Østerby";0;"S";"S";0;0;0;0,0999999999999996;1,21242299516889
"1476";"Holstebro.06-09-2016.pdf";0;0;100;"Holstebro Kommune";"06-09-2016";100;0;0;2016;"09";2016-09-06;0;0;57661;54120;366;7,3;7;"HC Østerby";"HC Østerby";0;"S";"S";0;0;0;0,3;1,19608306261944
"1477";"Holstebro.06-09-2018.pdf";2;2;1495;"Holstebro Kommune";"06-09-2018";1499;0,00133422281521014;0,00133422281521014;2018;"09";2018-09-06;0,356233914218222;0,427200870361353;58418;58656;371;7,1;7;"HC Østerby";"HC Østerby";0;"S";"S";0;0;0;0,0999999999999996;1,21242299516889
"1478";"Holstebro.06-10-2016.pdf";0;2;481;"Holstebro Kommune";"06-10-2016";483;0;0,0041407867494824;2016;"10";2016-10-06;0;1,32582630366805;57661;54120;366;7,3;7;"HC Østerby";"HC Østerby";0;"S";"S";0;0;0;0,3;1,19608306261944
"1479";"Holstebro.06-12-2018.pdf";3;26;4001;"Holstebro Kommune";"06-12-2018";4030;0,000744416873449132;0,00645161290322581;2018;"12";2018-12-06;0,198757309210837;2,0657229182957;58418;58656;371;7,1;7;"HC Østerby";"HC Østerby";0;"S";"S";0;0;0;0,0999999999999996;1,21242299516889
"1480";"Holstebro.07-04-2016.pdf";0;7;1487;"Holstebro Kommune";"07-04-2016";1494;0;0,00468540829986613;2016;"04";2016-04-07;0;1,50020707252399;57661;54120;366;7,3;7;"HC Østerby";"HC Østerby";0;"S";"S";0;0;0;0,3;1,19608306261944
"1481";"Holstebro.07-06-2018.pdf";1;2;346;"Holstebro Kommune";"07-06-2018";349;0,00286532951289398;0,00573065902578797;2018;"06";2018-06-07;0,765035297153459;1,83488282140879;58418;58656;371;7,1;7;"HC Østerby";"HC Østerby";0;"S";"S";0;0;0;0,0999999999999996;1,21242299516889
"1482";"Holstebro.08-12-2016.pdf";1;1;1075;"Holstebro Kommune";"08-12-2016";1077;0,000928505106778087;0,000928505106778087;2016;"12";2016-12-08;0,247908373915095;0,297295313218045;57661;54120;366;7,3;7;"HC Østerby";"HC Østerby";0;"S";"S";0;0;0;0,3;1,19608306261944
"1483";"Holstebro.09-03-2017.pdf";1;1;652;"Holstebro Kommune";"09-03-2017";654;0,00152905198776758;0,00152905198776758;2017;"03";2017-03-09;0,408252780896876;0,489582648831551;58125;57844;406;7,5;7,2;"HC Østerby";"HC Østerby";0;"S";"S";0;0;0;0,3;1,32680252301501
"1484";"Holstebro.09-06-2016.pdf";2;6;1275;"Holstebro Kommune";"09-06-2016";1283;0,00155884645362432;0,00467653936087295;2016;"06";2016-06-09;0,416207823392918;1,49736735309042;57661;54120;366;7,3;7;"HC Østerby";"HC Østerby";0;"S";"S";0;0;0;0,3;1,19608306261944
"1485";"Holstebro.10-08-2017.pdf";0;11;1158;"Holstebro Kommune";"10-08-2017";1169;0;0,00940975192472198;2017;"08";2017-08-10;0;3,01288073198817;58125;57844;406;7,5;7,2;"HC Østerby";"HC Østerby";0;"S";"S";0;0;0;0,3;1,32680252301501
"1486";"Holstebro.11-08-2016.pdf";4;0;558;"Holstebro Kommune";"11-08-2016";562;0,00711743772241993;0;2016;"08";2016-08-11;1,90033678794703;0;57661;54120;366;7,3;7;"HC Østerby";"HC Østerby";0;"S";"S";0;0;0;0,3;1,19608306261944
"1487";"Holstebro.12-04-2016.pdf";0;4;601;"Holstebro Kommune";"12-04-2016";605;0;0,00661157024793388;2016;"04";2016-04-12;0;2,11693918899725;57661;54120;366;7,3;7;"HC Østerby";"HC Østerby";0;"S";"S";0;0;0;0,3;1,19608306261944
"1488";"Holstebro.12-05-2016.pdf";0;3;428;"Holstebro Kommune";"12-05-2016";431;0;0,00696055684454756;2016;"05";2016-05-12;0;2,2286801786717;57661;54120;366;7,3;7;"HC Østerby";"HC Østerby";0;"S";"S";0;0;0;0,3;1,19608306261944
"1489";"Holstebro.14-03-2019.pdf";5;0;268;"Holstebro Kommune";"14-03-2019";273;0,0183150183150183;0;2019;"03";2019-03-14;4,89006078217138;0;58504;59828;346;7,4;7,2;"HC Østerby";"HC Østerby";0;"S";"S";0;0;0;0,2;1,13072333242166
"1490";"Holstebro.14-09-2017.pdf";3;6;742;"Holstebro Kommune";"14-09-2017";751;0,00399467376830892;0,00798934753661784;2017;"09";2017-09-14;1,0665671852459;2,55808563783622;58125;57844;406;7,5;7,2;"HC Østerby";"HC Østerby";0;"S";"S";0;0;0;0,3;1,32680252301501
"1491";"Holstebro.14-12-2017.pdf";0;0;233;"Holstebro Kommune";"14-12-2017";233;0;0;2017;"12";2017-12-14;0;0;58125;57844;406;7,5;7,2;"HC Østerby";"HC Østerby";0;"S";"S";0;0;0;0,3;1,32680252301501
"1492";"Holstebro.15-03-2018.pdf";10;1;1246;"Holstebro Kommune";"15-03-2018";1257;0,00795544948289578;0,000795544948289578;2018;"03";2018-03-15;2,12408368103864;0,254723191993504;58418;58656;371;7,1;7;"HC Østerby";"HC Østerby";0;"S";"S";0;0;0;0,0999999999999996;1,21242299516889
"1493";"Holstebro.15-06-2017.pdf";2;0;1710;"Holstebro Kommune";"15-06-2017";1712;0,00116822429906542;0;2017;"06";2017-06-15;0,311912755498314;0;58125;57844;406;7,5;7,2;"HC Østerby";"HC Østerby";0;"S";"S";0;0;0;0,3;1,32680252301501
"1494";"Holstebro.16-08-2018.pdf";1;10;1453;"Holstebro Kommune";"16-08-2018";1464;0,000683060109289617;0,00683060109289617;2018;"08";2018-08-16;0,182375217695736;2,18707002961635;58418;58656;371;7,1;7;"HC Østerby";"HC Østerby";0;"S";"S";0;0;0;0,0999999999999996;1,21242299516889
"1495";"Holstebro.17-01-2019.pdf";2;1;295;"Holstebro Kommune";"17-01-2019";298;0,00671140939597315;0,00335570469798658;2019;"01";2019-01-17;1,79192831346683;1,07445319575783;58504;59828;346;7,4;7,2;"HC Østerby";"HC Østerby";0;"S";"S";0;0;0;0,2;1,13072333242166
"1496";"Holstebro.17-03-2016.pdf";5;6;1324;"Holstebro Kommune";"17-03-2016";1335;0,00374531835205993;0,00449438202247191;2016;"03";2016-03-17;0,999989957702461;1,43904293184645;57661;54120;366;7,3;7;"HC Østerby";"HC Østerby";0;"S";"S";0;0;0;0,3;1,19608306261944
"1497";"Holstebro.17-05-2018.pdf";0;0;426;"Holstebro Kommune";"17-05-2018";426;0;0;2018;"05";2018-05-17;0;0;58418;58656;371;7,1;7;"HC Østerby";"HC Østerby";0;"S";"S";0;0;0;0,0999999999999996;1,21242299516889
"1498";"Holstebro.18-01-2018.pdf";0;4;610;"Holstebro Kommune";"18-01-2018";614;0;0,00651465798045603;2018;"01";2018-01-18;0;2,08590913573833;58418;58656;371;7,1;7;"HC Østerby";"HC Østerby";0;"S";"S";0;0;0;0,0999999999999996;1,21242299516889
"1499";"Holstebro.19-01-2017.pdf";1;2;778;"Holstebro Kommune";"19-01-2017";781;0,00128040973111396;0,00256081946222791;2017;"01";2017-01-19;0,34186596505321;0,819941235174991;58125;57844;406;7,5;7,2;"HC Østerby";"HC Østerby";0;"S";"S";0;0;0;0,3;1,32680252301501
"1500";"Holstebro.20-04-2017.pdf";4;2;1575;"Holstebro Kommune";"20-04-2017";1581;0,00253004427577483;0,00126502213788741;2017;"04";2017-04-20;0,675515037840752;0,405043709469746;58125;57844;406;7,5;7,2;"HC Østerby";"HC Østerby";0;"S";"S";0;0;0;0,3;1,32680252301501
"1501";"Holstebro.20-09-2018.pdf";0;0;523;"Holstebro Kommune";"20-09-2018";523;0;0;2018;"09";2018-09-20;0;0;58418;58656;371;7,1;7;"HC Østerby";"HC Østerby";0;"S";"S";0;0;0;0,0999999999999996;1,21242299516889
"1502";"Holstebro.20-12-2016.pdf";0;0;5;"Holstebro Kommune";"20-12-2016";5;0;0;2016;"12";2016-12-20;0;0;57661;54120;366;7,3;7;"HC Østerby";"HC Østerby";0;"S";"S";0;0;0;0,3;1,19608306261944
"1503";"Holstebro.20-12-2018.pdf";2;0;2006;"Holstebro Kommune";"20-12-2018";2008;0,00099601593625498;0;2018;"12";2018-12-20;0,265933584369081;0;58418;58656;371;7,1;7;"HC Østerby";"HC Østerby";0;"S";"S";0;0;0;0,0999999999999996;1,21242299516889
"1504";"Holstebro.21-02-2019.pdf";12;0;1857;"Holstebro Kommune";"21-02-2019";1869;0,00642054574638844;0;2019;"02";2019-02-21;1,71426849891851;0;58504;59828;346;7,4;7,2;"HC Østerby";"HC Østerby";0;"S";"S";0;0;0;0,2;1,13072333242166
"1505";"Holstebro.21-04-2016.pdf";2;3;1096;"Holstebro Kommune";"21-04-2016";1101;0,00181653042688465;0,00272479564032698;2016;"04";2016-04-21;0,485008753327079;0,872444284293826;57661;54120;366;7,3;7;"HC Østerby";"HC Østerby";0;"S";"S";0;0;0;0,3;1,19608306261944
"1506";"Holstebro.21-09-2017.pdf";1;0;309;"Holstebro Kommune";"21-09-2017";310;0,0032258064516129;0;2017;"09";2017-09-21;0,861281673246959;0;58125;57844;406;7,5;7,2;"HC Østerby";"HC Østerby";0;"S";"S";0;0;0;0,3;1,32680252301501
"1507";"Holstebro.21-12-2017.pdf";0;4;1516;"Holstebro Kommune";"21-12-2017";1520;0;0,00263157894736842;2017;"12";2017-12-21;0;0,842597506146932;58125;57844;406;7,5;7,2;"HC Østerby";"HC Østerby";0;"S";"S";0;0;0;0,3;1,32680252301501
"1508";"Holstebro.22-03-2018.pdf";7;1;795;"Holstebro Kommune";"22-03-2018";803;0,0087173100871731;0,0012453300124533;2018;"03";2018-03-22;2,32749841960884;0,39873854587277;58418;58656;371;7,1;7;"HC Østerby";"HC Østerby";0;"S";"S";0;0;0;0,0999999999999996;1,21242299516889
"1509";"Holstebro.22-09-2016.pdf";1;1;1721;"Holstebro Kommune";"22-09-2016";1723;0,000580383052814858;0,000580383052814858;2016;"09";2016-09-22;0,154960718924293;0,185831138906462;57661;54120;366;7,3;7;"HC Østerby";"HC Østerby";0;"S";"S";0;0;0;0,3;1,19608306261944
"1510";"Holstebro.22-11-2018.pdf";1;12;2350;"Holstebro Kommune";"22-11-2018";2363;0,000423190859077444;0,00507829030892933;2018;"11";2018-11-22;0,112990824674802;1,62600280492171;58418;58656;371;7,1;7;"HC Østerby";"HC Østerby";0;"S";"S";0;0;0;0,0999999999999996;1,21242299516889
"1511";"Holstebro.23-01-2017.pdf";0;0;230;"Holstebro Kommune";"23-01-2017";230;0;0;2017;"01";2017-01-23;0;0;58125;57844;406;7,5;7,2;"HC Østerby";"HC Østerby";0;"S";"S";0;0;0;0,3;1,32680252301501
"1512";"Holstebro.23-02-2017.pdf";0;1;760;"Holstebro Kommune";"23-02-2017";761;0;0,00131406044678055;2017;"02";2017-02-23;0;0,420745141045774;58125;57844;406;7,5;7,2;"HC Østerby";"HC Østerby";0;"S";"S";0;0;0;0,3;1,32680252301501
"1513";"Holstebro.23-06-2016.pdf";0;3;5155;"Holstebro Kommune";"23-06-2016";5158;0;0,000581620783249321;2016;"06";2016-06-23;0;0,186227444165859;57661;54120;366;7,3;7;"HC Østerby";"HC Østerby";0;"S";"S";0;0;0;0,3;1,19608306261944
"1514";"Holstebro.23-11-2017.pdf";0;0;683;"Holstebro Kommune";"23-11-2017";683;0;0;2017;"11";2017-11-23;0;0;58125;57844;406;7,5;7,2;"HC Østerby";"HC Østerby";0;"S";"S";0;0;0;0,3;1,32680252301501
"1515";"Holstebro.24-05-2018.pdf";0;0;59;"Holstebro Kommune";"24-05-2018";59;0;0;2018;"05";2018-05-24;0;0;58418;58656;371;7,1;7;"HC Østerby";"HC Østerby";0;"S";"S";0;0;0;0,0999999999999996;1,21242299516889
"1516";"Holstebro.24-11-2016.pdf";0;1;1578;"Holstebro Kommune";"24-11-2016";1579;0;0,000633312222925902;2016;"11";2016-11-24;0;0,202778373866899;57661;54120;366;7,3;7;"HC Østerby";"HC Østerby";0;"S";"S";0;0;0;0,3;1,19608306261944
"1517";"Holstebro.25-02-2016.pdf";0;3;1870;"Holstebro Kommune";"25-02-2016";1873;0;0,00160170848905499;2016;"02";2016-02-25;0;0,512846319811801;57661;54120;366;7,3;7;"HC Østerby";"HC Østerby";0;"S";"S";0;0;0;0,3;1,19608306261944
"1518";"Holstebro.25-10-2018.pdf";1;25;1052;"Holstebro Kommune";"25-10-2018";1078;0,000927643784786642;0,023191094619666;2018;"10";2018-10-25;0,247678403252836;7,42548822671229;58418;58656;371;7,1;7;"HC Østerby";"HC Østerby";0;"S";"S";0;0;0;0,0999999999999996;1,21242299516889
"1519";"Holstebro.26-05-2016.pdf";4;6;1293;"Holstebro Kommune";"26-05-2016";1303;0,00306983883346124;0,00460475825019187;2016;"05";2016-05-26;0,819638737395417;1,47438397084805;57661;54120;366;7,3;7;"HC Østerby";"HC Østerby";0;"S";"S";0;0;0;0,3;1,19608306261944
"1520";"Holstebro.26-10-2017.pdf";0;1;295;"Holstebro Kommune";"26-10-2017";296;0;0,00337837837837838;2017;"10";2017-10-26;0;1,08171301464809;58125;57844;406;7,5;7,2;"HC Østerby";"HC Østerby";0;"S";"S";0;0;0;0,3;1,32680252301501
"1521";"Holstebro.27-06-2016.pdf";0;0;353;"Holstebro Kommune";"27-06-2016";353;0;0;2016;"06";2016-06-27;0;0;57661;54120;366;7,3;7;"HC Østerby";"HC Østerby";0;"S";"S";0;0;0;0,3;1,19608306261944
"1522";"Holstebro.27-10-2016.pdf";0;0;512;"Holstebro Kommune";"27-10-2016";512;0;0;2016;"10";2016-10-27;0;0;57661;54120;366;7,3;7;"HC Østerby";"HC Østerby";0;"S";"S";0;0;0;0,3;1,19608306261944
"1523";"Holstebro.28-06-2018.pdf";5;4;1287;"Holstebro Kommune";"28-06-2018";1296;0,00385802469135802;0,00308641975308642;2018;"06";2018-06-28;1,03008224809629;0,988231643011834;58418;58656;371;7,1;7;"HC Østerby";"HC Østerby";0;"S";"S";0;0;0;0,0999999999999996;1,21242299516889
"1524";"Holstebro.30-03-2017.pdf";1;5;1712;"Holstebro Kommune";"30-03-2017";1718;0,000582072176949942;0,00291036088474971;2017;"03";2017-03-30;0,155411710539323;0,93185987292152;58125;57844;406;7,5;7,2;"HC Østerby";"HC Østerby";0;"S";"S";0;0;0;0,3;1,32680252301501
"1525";"Holstebro.31-08-2017.pdf";0;1;525;"Holstebro Kommune";"31-08-2017";526;0;0,00190114068441065;2017;"08";2017-08-31;0;0,608720631817175;58125;57844;406;7,5;7,2;"HC Østerby";"HC Østerby";0;"S";"S";0;0;0;0,3;1,32680252301501
"1526";"Horsens.01-02-2016.pdf";7;18;2981;"Horsens Kommune";"01-02-2016";3006;0,00232867598137059;0,00598802395209581;2016;"02";2016-02-01;0,621750243162309;1,91728773853793;87736;60762;517;6,8;6,8;"Peter Sørensen";"Peter Sørensen";0;"S";"S";0;0;0;0;1,68954902561271
"1527";"Horsens.02-05-2016.pdf";3;10;2392;"Horsens Kommune";"02-05-2016";2405;0,00124740124740125;0,00415800415800416;2016;"05";2016-05-02;0,333052788407348;1,33133909495149;87736;60762;517;6,8;6,8;"Peter Sørensen";"Peter Sørensen";0;"S";"S";0;0;0;0;1,68954902561271
"1528";"Horsens.02-10-2017.pdf";4;25;2179;"Horsens Kommune";"02-10-2017";2208;0,00181159420289855;0,0113224637681159;2017;"10";2017-10-02;0,483690794758256;3,62530629909233;89030;60441;553;6,9;6,8;"Peter Sørensen";"Peter Sørensen";0;"S";"S";0;0;0;0,100000000000001;1,80719653996872
"1529";"Horsens.03-04-2017.pdf";17;19;3444;"Horsens Kommune";"03-04-2017";3480;0,00488505747126437;0,00545977011494253;2017;"04";2017-04-03;1,30429724655502;1,74814769953473;89030;60441;553;6,9;6,8;"Peter Sørensen";"Peter Sørensen";0;"S";"S";0;0;0;0,100000000000001;1,80719653996872
"1530";"Horsens.03-05-2018.pdf";5;13;4321;"Horsens Kommune";"03-05-2018";4339;0,00115233924867481;0,00299608204655451;2018;"05";2018-05-03;0,307671489636503;0,959306679042601;89598;61606;581;7;6,8;"Peter Sørensen";"Peter Sørensen";0;"S";"S";0;0;0;0,2;1,89870016224561
"1531";"Horsens.03-10-2016.pdf";6;28;3664;"Horsens Kommune";"03-10-2016";3698;0,00162249864791779;0,0075716603569497;2016;"10";2016-10-03;0,433202788599065;2,42434761097982;87736;60762;517;6,8;6,8;"Peter Sørensen";"Peter Sørensen";0;"S";"S";0;0;0;0;1,68954902561271
"1532";"Horsens.04-04-2019.pdf";9;12;4066;"Horsens Kommune";"04-04-2019";4087;0,00220210423293369;0,00293613897724492;2019;"04";2019-04-04;0,587955925705656;0,940113684372403;90370;61871;607;7;6,8;"Peter Sørensen";"Peter Sørensen";0;"S";"S";0;0;0;0,2;1,98366781150273
"1533";"Horsens.04-09-2017.pdf";48;11;3060;"Horsens Kommune";"04-09-2017";3119;0,0153895479320295;0,00352677140109009;2017;"09";2017-09-04;4,10896803395792;1,12922653917736;89030;60441;553;6,9;6,8;"Peter Sørensen";"Peter Sørensen";0;"S";"S";0;0;0;0,100000000000001;1,80719653996872
"1534";"Horsens.05-09-2016.pdf";22;29;4293;"Horsens Kommune";"05-09-2016";4344;0,00506445672191529;0,00667587476979742;2016;"09";2016-09-05;1,35219636545678;2,1375286643046;87736;60762;517;6,8;6,8;"Peter Sørensen";"Peter Sørensen";0;"S";"S";0;0;0;0;1,68954902561271
"1535";"Horsens.05-12-2016.pdf";15;28;4598;"Horsens Kommune";"05-12-2016";4641;0,00323206205559147;0,00603318250377074;2016;"12";2016-12-05;0,862951902736125;1,93174692208648;87736;60762;517;6,8;6,8;"Peter Sørensen";"Peter Sørensen";0;"S";"S";0;0;0;0;1,68954902561271
"1536";"Horsens.06-02-2017.pdf";33;18;4318;"Horsens Kommune";"06-02-2017";4369;0,00755321583886473;0,00411993591210803;2017;"02";2017-02-06;2,01668837658878;1,31915013551042;89030;60441;553;6,9;6,8;"Peter Sørensen";"Peter Sørensen";0;"S";"S";0;0;0;0,100000000000001;1,80719653996872
"1537";"Horsens.06-03-2017.pdf";9;12;5413;"Horsens Kommune";"06-03-2017";5434;0,00165623849834376;0,00220831799779168;2017;"03";2017-03-06;0,442211238196359;0,70707483033309;89030;60441;553;6,9;6,8;"Peter Sørensen";"Peter Sørensen";0;"S";"S";0;0;0;0,100000000000001;1,80719653996872
"1538";"Horsens.06-06-2016.pdf";20;25;3319;"Horsens Kommune";"06-06-2016";3364;0,00594530321046373;0,00743162901307967;2016;"06";2016-06-06;1,5873800160913;2,37951138775144;87736;60762;517;6,8;6,8;"Peter Sørensen";"Peter Sørensen";0;"S";"S";0;0;0;0;1,68954902561271
"1539";"Horsens.06-11-2017.pdf";3;1;2681;"Horsens Kommune";"06-11-2017";2685;0,00111731843575419;0,00037243947858473;2017;"11";2017-11-06;0,298321026487773;0,11925029882154;89030;60441;553;6,9;6,8;"Peter Sørensen";"Peter Sørensen";0;"S";"S";0;0;0;0,100000000000001;1,80719653996872
"1540";"Horsens.06-12-2019.pdf";19;18;4727;"Horsens Kommune";"06-12-2019";4764;0,00398824517212426;0,00377833753148615;2019;"12";2019-12-06;1,06485076730155;1,2097747569364;90370;61871;607;7;6,8;"Peter Sørensen";"Peter Sørensen";0;"S";"S";0;0;0;0,2;1,98366781150273
"1541";"Horsens.07-02-2019.pdf";41;12;4107;"Horsens Kommune";"07-02-2019";4160;0,00985576923076923;0,00288461538461538;2019;"02";2019-02-07;2,63146395840597;0,923616497122599;90370;61871;607;7;6,8;"Peter Sørensen";"Peter Sørensen";0;"S";"S";0;0;0;0,2;1,98366781150273
"1542";"Horsens.07-03-2016.pdf";6;3;1818;"Horsens Kommune";"07-03-2016";1827;0,00328407224958949;0,00164203612479475;2016;"03";2016-03-07;0,876838485079005;0,525758706626985;87736;60762;517;6,8;6,8;"Peter Sørensen";"Peter Sørensen";0;"S";"S";0;0;0;0;1,68954902561271
"1543";"Horsens.07-03-2018.pdf";5;10;5108;"Horsens Kommune";"07-03-2018";5123;0,000975990630489947;0,00195198126097989;2018;"03";2018-03-07;0,260586881423538;0,624999126167937;89598;61606;581;7;6,8;"Peter Sørensen";"Peter Sørensen";0;"S";"S";0;0;0;0,2;1,89870016224561
"1544";"Horsens.07-03-2019.pdf";7;14;3984;"Horsens Kommune";"07-03-2019";4005;0,0017478152309613;0,0034956304619226;2019;"03";2019-03-07;0,466661980261149;1,11925561365835;90370;61871;607;7;6,8;"Peter Sørensen";"Peter Sørensen";0;"S";"S";0;0;0;0,2;1,98366781150273
"1545";"Horsens.07-11-2016.pdf";18;0;1762;"Horsens Kommune";"07-11-2016";1780;0,0101123595505618;0;2016;"11";2016-11-07;2,69997288579665;0;87736;60762;517;6,8;6,8;"Peter Sørensen";"Peter Sørensen";0;"S";"S";0;0;0;0;1,68954902561271
"1546";"Horsens.08-02-2018.pdf";63;1;5041;"Horsens Kommune";"08-02-2018";5105;0,0123408423114594;0,00019588638589618;2018;"02";2018-02-08;3,29497180774008;0,0627202844928177;89598;61606;581;7;6,8;"Peter Sørensen";"Peter Sørensen";0;"S";"S";0;0;0;0,2;1,89870016224561
"1547";"Horsens.08-05-2017.pdf";11;9;1123;"Horsens Kommune";"08-05-2017";1143;0,00962379702537183;0,0078740157480315;2017;"05";2017-05-08;2,56952800155042;2,52115789240814;89030;60441;553;6,9;6,8;"Peter Sørensen";"Peter Sørensen";0;"S";"S";0;0;0;0,100000000000001;1,80719653996872
"1548";"Horsens.11-04-2016.pdf";41;16;4402;"Horsens Kommune";"11-04-2016";4459;0,00919488674590715;0,00358824848620767;2016;"04";2016-04-11;2,45501010696767;1,14891070584735;87736;60762;517;6,8;6,8;"Peter Sørensen";"Peter Sørensen";0;"S";"S";0;0;0;0;1,68954902561271
"1549";"Horsens.11-10-2018.pdf";2;5;3978;"Horsens Kommune";"11-10-2018";3985;0,000501882057716437;0,00125470514429109;2018;"10";2018-10-11;0,134001163717218;0,401740341701172;89598;61606;581;7;6,8;"Peter Sørensen";"Peter Sørensen";0;"S";"S";0;0;0;0,2;1,89870016224561
"1550";"Horsens.12-04-2018.pdf";41;7;3780;"Horsens Kommune";"12-04-2018";3828;0,0107105538140021;0,00182863113897597;2018;"04";2018-04-12;2,85968915020085;0,585504014198234;89598;61606;581;7;6,8;"Peter Sørensen";"Peter Sørensen";0;"S";"S";0;0;0;0,2;1,89870016224561
"1551";"Horsens.12-06-2017.pdf";0;4;3374;"Horsens Kommune";"12-06-2017";3378;0;0,00118413262285376;2017;"06";2017-06-12;0;0,379143934086245;89030;60441;553;6,9;6,8;"Peter Sørensen";"Peter Sørensen";0;"S";"S";0;0;0;0,100000000000001;1,80719653996872
"1552";"Horsens.12-06-2018.pdf";0;28;3519;"Horsens Kommune";"12-06-2018";3547;0;0,00789399492528898;2018;"06";2018-06-12;0;2,52755496628231;89598;61606;581;7;6,8;"Peter Sørensen";"Peter Sørensen";0;"S";"S";0;0;0;0,2;1,89870016224561
"1553";"Horsens.13-09-2018.pdf";7;58;2890;"Horsens Kommune";"13-09-2018";2955;0,00236886632825719;0,0196277495769882;2018;"09";2018-09-13;0,632480958018917;6,28455128104175;89598;61606;581;7;6,8;"Peter Sørensen";"Peter Sørensen";0;"S";"S";0;0;0;0,2;1,89870016224561
"1554";"Horsens.13-11-2018.pdf";91;59;6417;"Horsens Kommune";"13-11-2018";6567;0,0138571646109335;0,00898431551697883;2018;"11";2018-11-13;3,69982579599463;2,87666150263655;89598;61606;581;7;6,8;"Peter Sørensen";"Peter Sørensen";0;"S";"S";0;0;0;0,2;1,89870016224561
"1555";"Horsens.16-08-2018.pdf";4;90;3516;"Horsens Kommune";"16-08-2018";3610;0,00110803324099723;0,0249307479224377;2018;"08";2018-08-16;0,295841904383997;7,98250268981304;89598;61606;581;7;6,8;"Peter Sørensen";"Peter Sørensen";0;"S";"S";0;0;0;0,2;1,89870016224561
"1556";"Horsens.17-01-2019.pdf";3;6;3165;"Horsens Kommune";"17-01-2019";3174;0,000945179584120983;0,00189035916824197;2019;"01";2019-01-17;0,252360414656481;0,605268529935414;90370;61871;607;7;6,8;"Peter Sørensen";"Peter Sørensen";0;"S";"S";0;0;0;0,2;1,98366781150273
"1557";"Horsens.18-01-2018.pdf";1;0;1344;"Horsens Kommune";"18-01-2018";1345;0,000743494423791822;0;2018;"01";2018-01-18;0,198511017625693;0;89598;61606;581;7;6,8;"Peter Sørensen";"Peter Sørensen";0;"S";"S";0;0;0;0,2;1,89870016224561
"1558";"Horsens.22-05-2017.pdf";5;12;4031;"Horsens Kommune";"22-05-2017";4048;0,00123517786561265;0,00296442687747036;2017;"05";2017-05-22;0,329789178244265;0,949171103762354;89030;60441;553;6,9;6,8;"Peter Sørensen";"Peter Sørensen";0;"S";"S";0;0;0;0,100000000000001;1,80719653996872
"1559";"Horsens.24-05-2018.pdf";3;17;2381;"Horsens Kommune";"24-05-2018";2401;0,00124947938359017;0,00708038317367763;2018;"05";2018-05-24;0,333607645197697;2,26704701778808;89598;61606;581;7;6,8;"Peter Sørensen";"Peter Sørensen";0;"S";"S";0;0;0;0,2;1,89870016224561
"1560";"Hvidovre.01-11-2018.pdf";15;12;3576;"Hvidovre Kommune";"01-11-2018";3603;0,00416319733555371;0,00333055786844296;2018;"11";2018-11-01;1,11156252583912;1,06640150653067;53282;73965;627;6,8;6,8;"Helle Adelborg";"Helle Adelborg";0;"S";"S";0;0;0;0;2,04902754170052
"1561";"Hvidovre.01-12-2016.pdf";1;14;4449;"Hvidovre Kommune";"01-12-2016";4464;0,000224014336917563;0,00313620071684588;2016;"12";2016-12-01;0,0598112273088166;1,00417086306041;52831;74035;629;6,6;6,8;"Helle Adelborg";"Helle Adelborg";0;"S";"S";0;0;0;-0,2;2,05556351472029
"1562";"Hvidovre.02-03-2016.pdf";0;2;1213;"Hvidovre Kommune";"02-03-2016";1215;0;0,00164609053497942;2016;"03";2016-03-02;0;0,527056876272978;52831;74035;629;6,6;6,8;"Helle Adelborg";"Helle Adelborg";0;"S";"S";0;0;0;-0,2;2,05556351472029
"1563";"Hvidovre.02-06-2016.pdf";41;14;5896;"Hvidovre Kommune";"02-06-2016";5951;0,00688959838682574;0,00235254579062342;2016;"06";2016-06-02;1,8395042962475;0,753254702184789;52831;74035;629;6,6;6,8;"Helle Adelborg";"Helle Adelborg";0;"S";"S";0;0;0;-0,2;2,05556351472029
"1564";"Hvidovre.02-10-2018.pdf";43;11;3582;"Hvidovre Kommune";"02-10-2018";3636;0,0118261826182618;0,00302530253025303;2018;"10";2018-10-02;3,15755904961;0,968662699585857;53282;73965;627;6,8;6,8;"Helle Adelborg";"Helle Adelborg";0;"S";"S";0;0;0;0;2,04902754170052
"1565";"Hvidovre.02-11-2017.pdf";0;4;1251;"Hvidovre Kommune";"02-11-2017";1255;0;0,00318725099601594;2017;"11";2017-11-02;0;1,02051650146879;52964;74218;629;6,8;6,8;"Helle Adelborg";"Helle Adelborg";0;"S";"S";0;0;0;0;2,05556351472029
"1566";"Hvidovre.03-05-2018.pdf";13;19;3507;"Hvidovre Kommune";"03-05-2018";3539;0,00367335405481775;0,0053687482339644;2018;"05";2018-05-03;0,980775683296198;1,71900367176628;53282;73965;627;6,8;6,8;"Helle Adelborg";"Helle Adelborg";0;"S";"S";0;0;0;0;2,04902754170052
"1567";"Hvidovre.03-11-2016.pdf";11;21;4127;"Hvidovre Kommune";"03-11-2016";4159;0,00264486655446021;0,00504929069487858;2016;"11";2016-11-03;0,706172278377526;1,61671750397993;52831;74035;629;6,6;6,8;"Helle Adelborg";"Helle Adelborg";0;"S";"S";0;0;0;-0,2;2,05556351472029
"1568";"Hvidovre.04-05-2017.pdf";5;11;4225;"Hvidovre Kommune";"04-05-2017";4241;0,00117896722471115;0,00259372789436454;2017;"05";2017-05-04;0,314781087840789;0,830478089057811;52964;74218;629;6,8;6,8;"Helle Adelborg";"Helle Adelborg";0;"S";"S";0;0;0;0;2,05556351472029
"1569";"Hvidovre.04-09-2018.pdf";18;8;4583;"Hvidovre Kommune";"04-09-2018";4609;0,00390540247342157;0,00173573443263181;2018;"09";2018-09-04;1,04273198887351;0,55575969162219;53282;73965;627;6,8;6,8;"Helle Adelborg";"Helle Adelborg";0;"S";"S";0;0;0;0;2,04902754170052
"1570";"Hvidovre.05-01-2017.pdf";15;17;3954;"Hvidovre Kommune";"05-01-2017";3986;0,00376317109884596;0,00426492724535876;2017;"01";2017-01-05;1,00475659322588;1,36557448311821;52964;74218;629;6,8;6,8;"Helle Adelborg";"Helle Adelborg";0;"S";"S";0;0;0;0;2,05556351472029
"1571";"Hvidovre.05-04-2018.pdf";9;13;6004;"Hvidovre Kommune";"05-04-2018";6026;0,00149352804513774;0,00215731828742118;2018;"04";2018-04-05;0,398767983464822;0,690745383399576;53282;73965;627;6,8;6,8;"Helle Adelborg";"Helle Adelborg";0;"S";"S";0;0;0;0;2,04902754170052
"1572";"Hvidovre.06-02-2019.pdf";34;15;4128;"Hvidovre Kommune";"06-02-2019";4177;0,00813981326310749;0,00359109408666507;2019;"02";2019-02-06;2,17330831602177;1,14982183026993;53416;76004;629;6,7;6,8;"Helle Adelborg";"Helle Adelborg";0;"S";"S";0;0;0;-0,0999999999999996;2,05556351472029
"1573";"Hvidovre.06-03-2018.pdf";14;25;6360;"Hvidovre Kommune";"06-03-2018";6399;0,00218784185028911;0,00390686044694484;2018;"03";2018-03-06;0,584147907781185;1,25092613039473;53282;73965;627;6,8;6,8;"Helle Adelborg";"Helle Adelborg";0;"S";"S";0;0;0;0;2,04902754170052
"1574";"Hvidovre.06-04-2017.pdf";11;32;5777;"Hvidovre Kommune";"06-04-2017";5820;0,00189003436426117;0,00549828178694158;2017;"04";2017-04-06;0,504634107520984;1,76047863827263;52964;74218;629;6,8;6,8;"Helle Adelborg";"Helle Adelborg";0;"S";"S";0;0;0;0;2,05556351472029
"1575";"Hvidovre.07-01-2016.pdf";31;12;3746;"Hvidovre Kommune";"07-01-2016";3789;0,00818157825283716;0,00316706254948535;2016;"01";2016-01-07;2,1844594562954;1,01405242228293;52831;74035;629;6,6;6,8;"Helle Adelborg";"Helle Adelborg";0;"S";"S";0;0;0;-0,2;2,05556351472029
"1576";"Hvidovre.07-04-2016.pdf";9;1;2165;"Hvidovre Kommune";"07-04-2016";2175;0,00413793103448276;0,000459770114942529;2016;"04";2016-04-07;1,10481649119955;0,147212437855556;52831;74035;629;6,6;6,8;"Helle Adelborg";"Helle Adelborg";0;"S";"S";0;0;0;-0,2;2,05556351472029
"1577";"Hvidovre.08-02-2018.pdf";67;24;4711;"Hvidovre Kommune";"08-02-2018";4802;0,0139525197834236;0,00499791753436068;2018;"02";2018-02-08;3,72528537137429;1,60026848314453;53282;73965;627;6,8;6,8;"Helle Adelborg";"Helle Adelborg";0;"S";"S";0;0;0;0;2,04902754170052
"1578";"Hvidovre.08-06-2017.pdf";94;18;8881;"Hvidovre Kommune";"08-06-2017";8993;0,0104525742243968;0,00200155676637385;2017;"06";2017-06-08;2,7908092914952;0,640872561108086;52964;74218;629;6,8;6,8;"Helle Adelborg";"Helle Adelborg";0;"S";"S";0;0;0;0;2,05556351472029
"1579";"Hvidovre.09-01-2018.pdf";0;9;1249;"Hvidovre Kommune";"09-01-2018";1258;0;0,00715421303656598;2018;"01";2018-01-09;0;2,29068638396066;53282;73965;627;6,8;6,8;"Helle Adelborg";"Helle Adelborg";0;"S";"S";0;0;0;0;2,04902754170052
"1580";"Hvidovre.09-02-2017.pdf";12;14;2640;"Hvidovre Kommune";"09-02-2017";2666;0,00450112528132033;0,00525131282820705;2017;"02";2017-02-09;1,20178838127483;1,68140237535697;52964;74218;629;6,8;6,8;"Helle Adelborg";"Helle Adelborg";0;"S";"S";0;0;0;0;2,05556351472029
"1581";"Hvidovre.09-03-2017.pdf";21;20;6732;"Hvidovre Kommune";"09-03-2017";6773;0,00310054628672671;0,00295290122545401;2017;"03";2017-03-09;0,827837545081603;0,945480739216991;52964;74218;629;6,8;6,8;"Helle Adelborg";"Helle Adelborg";0;"S";"S";0;0;0;0;2,05556351472029
"1582";"Hvidovre.11-03-2019.pdf";18;13;6420;"Hvidovre Kommune";"11-03-2019";6451;0,00279026507518214;0,0020151914431871;2019;"03";2019-03-11;0,744993293554182;0,645238208086474;53416;76004;629;6,7;6,8;"Helle Adelborg";"Helle Adelborg";0;"S";"S";0;0;0;-0,0999999999999996;2,05556351472029
"1583";"Hvidovre.14-01-2019.pdf";1;1;830;"Hvidovre Kommune";"14-01-2019";832;0,00120192307692308;0,00120192307692308;2019;"01";2019-01-14;0,320910238829997;0,384840207134416;53416;76004;629;6,7;6,8;"Helle Adelborg";"Helle Adelborg";0;"S";"S";0;0;0;-0,0999999999999996;2,05556351472029
"1584";"Hvidovre.15-08-2017.pdf";1;3;1034;"Hvidovre Kommune";"15-08-2017";1038;0,000963391136801541;0,00289017341040462;2017;"08";2017-08-15;0,257222850391674;0,925396105016862;52964;74218;629;6,8;6,8;"Helle Adelborg";"Helle Adelborg";0;"S";"S";0;0;0;0;2,05556351472029
"1585";"Hvidovre.16-08-2016.pdf";2;3;1556;"Hvidovre Kommune";"16-08-2016";1561;0,00128122998078155;0,00192184497117233;2016;"08";2016-08-16;0,342084969515128;0,615349876366113;52831;74035;629;6,6;6,8;"Helle Adelborg";"Helle Adelborg";0;"S";"S";0;0;0;-0,2;2,05556351472029
"1586";"Hvidovre.17-05-2016.pdf";22;12;5536;"Hvidovre Kommune";"17-05-2016";5570;0,00394973070017953;0,00215439856373429;2016;"05";2016-05-17;1,05456750656091;0,689810525678637;52831;74035;629;6,6;6,8;"Helle Adelborg";"Helle Adelborg";0;"S";"S";0;0;0;-0,2;2,05556351472029
"1587";"Hvidovre.20-06-2017.pdf";4;0;1275;"Hvidovre Kommune";"20-06-2017";1279;0,00312744331508991;0;2017;"06";2017-06-20;0,835018979535753;0;52964;74218;629;6,8;6,8;"Helle Adelborg";"Helle Adelborg";0;"S";"S";0;0;0;0;2,05556351472029
"1588";"Hvidovre.21-06-2016.pdf";0;0;1128;"Hvidovre Kommune";"21-06-2016";1128;0;0;2016;"06";2016-06-21;0;0;52831;74035;629;6,6;6,8;"Helle Adelborg";"Helle Adelborg";0;"S";"S";0;0;0;-0,2;2,05556351472029
"1589";"Hvidovre.21-08-2018.pdf";2;14;3309;"Hvidovre Kommune";"21-08-2018";3325;0,000601503759398496;0,00421052631578947;2018;"08";2018-08-21;0,160599890951313;1,34815600983509;53282;73965;627;6,8;6,8;"Helle Adelborg";"Helle Adelborg";0;"S";"S";0;0;0;0;2,04902754170052
"1590";"Hvidovre.22-09-2016.pdf";2;7;4165;"Hvidovre Kommune";"22-09-2016";4174;0,000479156684235745;0,00167704839482511;2016;"09";2016-09-22;0,127933549931268;0,536969182163593;52831;74035;629;6,6;6,8;"Helle Adelborg";"Helle Adelborg";0;"S";"S";0;0;0;-0,2;2,05556351472029
"1591";"Hvidovre.25-02-2016.pdf";37;16;4808;"Hvidovre Kommune";"25-02-2016";4861;0,00761160255091545;0,00329150380580128;2016;"02";2016-02-25;2,03227747215442;1,05389690133169;52831;74035;629;6,6;6,8;"Helle Adelborg";"Helle Adelborg";0;"S";"S";0;0;0;-0,2;2,05556351472029
"1592";"Hvidovre.25-08-2016.pdf";39;13;4653;"Hvidovre Kommune";"25-08-2016";4705;0,00828905419766206;0,00276301806588735;2016;"08";2016-08-25;2,2131552453891;0,884682610067129;52831;74035;629;6,6;6,8;"Helle Adelborg";"Helle Adelborg";0;"S";"S";0;0;0;-0,2;2,05556351472029
"1593";"Hvidovre.28-01-2016.pdf";37;11;4110;"Hvidovre Kommune";"28-01-2016";4158;0,0088985088985089;0,00264550264550265;2016;"01";2016-01-28;2,37587801638832;0,847055694010143;52831;74035;629;6,6;6,8;"Helle Adelborg";"Helle Adelborg";0;"S";"S";0;0;0;-0,2;2,05556351472029
"1594";"Hvidovre.28-09-2017.pdf";4;17;3128;"Hvidovre Kommune";"28-09-2017";3149;0,0012702445220705;0,00539853921879962;2017;"09";2017-09-28;0,339151881494515;1,72854235938685;52964;74218;629;6,8;6,8;"Helle Adelborg";"Helle Adelborg";0;"S";"S";0;0;0;0;2,05556351472029
"1595";"Hvidovre.29-11-2018.pdf";3;62;5494;"Hvidovre Kommune";"29-11-2018";5559;0,000539665407447383;0,0111530850872459;2018;"11";2018-11-29;0,144089216787133;3,57107343853602;53282;73965;627;6,8;6,8;"Helle Adelborg";"Helle Adelborg";0;"S";"S";0;0;0;0;2,04902754170052
"1596";"Hvidovre.30-05-2018.pdf";45;32;6548;"Hvidovre Kommune";"30-05-2018";6625;0,00679245283018868;0,00483018867924528;2018;"05";2018-05-30;1,81356669310114;1,54656387543346;53282;73965;627;6,8;6,8;"Helle Adelborg";"Helle Adelborg";0;"S";"S";0;0;0;0;2,04902754170052
"1597";"Hvidovre.30-11-2017.pdf";12;8;3991;"Hvidovre Kommune";"30-11-2017";4011;0,00299177262528048;0,00199451508352032;2017;"11";2017-11-30;0,798795269129565;0,638617905431731;52964;74218;629;6,8;6,8;"Helle Adelborg";"Helle Adelborg";0;"S";"S";0;0;0;0;2,05556351472029
"1598";"Hvidovre.31-08-2017.pdf";4;20;3821;"Hvidovre Kommune";"31-08-2017";3845;0,00104031209362809;0,00520156046814044;2017;"08";2017-08-31;0,277760539616704;1,66547231384049;52964;74218;629;6,8;6,8;"Helle Adelborg";"Helle Adelborg";0;"S";"S";0;0;0;0;2,05556351472029
"1599";"Ikast.01-03-2017.pdf";15;14;3822;"Ikast-Brande Kommune";"01-03-2017";3851;0,00389509218384835;0,00363541937159179;2017;"03";2017-03-01;1,03997916920238;1,16401421259457;40981;66564;368;6,7;6,6;"Carsten kissmeyer";"Ib Lauritzen";1;"V";"V";0;0;0;0,100000000000001;1,20261903563922
"1600";"Ikast.01-11-2017.pdf";10;16;5762;"Ikast-Brande Kommune";"01-11-2017";5788;0,00172771250863856;0,0027643400138217;2017;"11";2017-11-01;0,461294607302276;0,885105880679569;40981;66564;368;6,7;6,6;"Carsten kissmeyer";"Ib Lauritzen";1;"V";"V";0;0;0;0,100000000000001;1,20261903563922
"1601";"Ikast.02-05-2018.pdf";27;7;3780;"Ikast-Brande Kommune";"02-05-2018";3814;0,00707918196119559;0,00183534347142108;2018;"05";2018-05-02;1,89012260227505;0,587653216138133;41191;66020;378;6,8;6,6;"Carsten kissmeyer";"Ib Lauritzen";1;"V";"V";0;0;0;0,2;1,23529890073811
"1602";"Ikast.02-11-2016.pdf";4;9;5542;"Ikast-Brande Kommune";"02-11-2016";5555;0,00072007200720072;0,00162016201620162;2016;"11";2016-11-02;0,192257295198241;0,518754900274079;40798;64977;357;6,7;6,5;"Carsten kissmeyer";"Ib Lauritzen";1;"V";"V";0;0;0;0,2;1,16667118403044
"1603";"Ikast.05-04-2017.pdf";31;15;4319;"Ikast-Brande Kommune";"05-04-2017";4365;0,00710194730813288;0,00343642611683849;2017;"04";2017-04-05;1,89620088886673;1,10029914892039;40981;66564;368;6,7;6,6;"Carsten kissmeyer";"Ib Lauritzen";1;"V";"V";0;0;0;0,100000000000001;1,20261903563922
"1604";"Ikast.05-12-2018.pdf";6;7;1957;"Ikast-Brande Kommune";"05-12-2018";1970;0,00304568527918782;0,00355329949238579;2018;"12";2018-12-05;0,813189803167179;1,13772049053342;41191;66020;378;6,8;6,6;"Carsten kissmeyer";"Ib Lauritzen";1;"V";"V";0;0;0;0,2;1,23529890073811
"1605";"Ikast.06-04-2016.pdf";18;6;3979;"Ikast-Brande Kommune";"06-04-2016";4003;0,00449662752935299;0,00149887584311766;2016;"04";2016-04-06;1,20058749355934;0,479920638025232;40798;64977;357;6,7;6,5;"Carsten kissmeyer";"Ib Lauritzen";1;"V";"V";0;0;0;0,2;1,16667118403044
"1606";"Ikast.06-12-2017.pdf";5;9;3179;"Ikast-Brande Kommune";"06-12-2017";3193;0,00156592546194801;0,00281866583150642;2017;"12";2017-12-06;0,418097899634446;0,902500304109774;40981;66564;368;6,7;6,6;"Carsten kissmeyer";"Ib Lauritzen";1;"V";"V";0;0;0;0,100000000000001;1,20261903563922
"1607";"Ikast.07-03-2016.pdf";0;0;228;"Ikast-Brande Kommune";"07-03-2016";228;0;0;2016;"03";2016-03-07;0;0;40798;64977;357;6,7;6,5;"Carsten kissmeyer";"Ib Lauritzen";1;"V";"V";0;0;0;0,2;1,16667118403044
"1608";"Ikast.07-12-2016.pdf";16;2;3160;"Ikast-Brande Kommune";"07-12-2016";3178;0,00503461296412838;0,000629326620516048;2016;"12";2016-12-07;1,34422816214755;0,201502235579505;40798;64977;357;6,7;6,5;"Carsten kissmeyer";"Ib Lauritzen";1;"V";"V";0;0;0;0,2;1,16667118403044
"1609";"Ikast.08-06-2016.pdf";14;19;6971;"Ikast-Brande Kommune";"08-06-2016";7004;0,0019988577955454;0,00271273557966876;2016;"06";2016-06-08;0,533689671886322;0,868582809020681;40798;64977;357;6,7;6,5;"Carsten kissmeyer";"Ib Lauritzen";1;"V";"V";0;0;0;0,2;1,16667118403044
"1610";"Ikast.11-04-2018.pdf";22;19;3879;"Ikast-Brande Kommune";"11-04-2018";3920;0,00561224489795918;0,0048469387755102;2018;"04";2018-04-11;1,49845433967966;1,55192703938287;41191;66020;378;6,8;6,6;"Carsten kissmeyer";"Ib Lauritzen";1;"V";"V";0;0;0;0,2;1,23529890073811
"1611";"Ikast.13-06-2018.pdf";18;21;5792;"Ikast-Brande Kommune";"13-06-2018";5831;0,00308694906534042;0,00360144057623049;2018;"06";2018-06-13;0,824207123429605;1,15313464226591;41191;66020;378;6,8;6,6;"Carsten kissmeyer";"Ib Lauritzen";1;"V";"V";0;0;0;0,2;1,23529890073811
"1612";"Ikast.14-03-2016.pdf";0;0;404;"Ikast-Brande Kommune";"14-03-2016";404;0;0;2016;"03";2016-03-14;0;0;40798;64977;357;6,7;6,5;"Carsten kissmeyer";"Ib Lauritzen";1;"V";"V";0;0;0;0,2;1,16667118403044
"1613";"Ikast.14-06-2017.pdf";13;1;987;"Ikast-Brande Kommune";"14-06-2017";1001;0,012987012987013;0,000999000999000999;2017;"06";2017-06-14;3,4674976455397;0,319867185150683;40981;66564;368;6,7;6,6;"Carsten kissmeyer";"Ib Lauritzen";1;"V";"V";0;0;0;0,100000000000001;1,20261903563922
"1614";"Ikast.14-11-2017.pdf";0;0;109;"Ikast-Brande Kommune";"14-11-2017";109;0;0;2017;"11";2017-11-14;0;0;40981;66564;368;6,7;6,6;"Carsten kissmeyer";"Ib Lauritzen";1;"V";"V";0;0;0;0,100000000000001;1,20261903563922
"1615";"Ikast.17-05-2017.pdf";43;7;2305;"Ikast-Brande Kommune";"17-05-2017";2355;0,0182590233545648;0,0029723991507431;2017;"05";2017-05-17;4,8751102778692;0,95172372244197;40981;66564;368;6,7;6,6;"Carsten kissmeyer";"Ib Lauritzen";1;"V";"V";0;0;0;0,100000000000001;1,20261903563922
"1616";"Ikast.18-05-2016.pdf";37;7;5597;"Ikast-Brande Kommune";"18-05-2016";5641;0,00655912072327601;0,0012409147314306;2016;"05";2016-05-18;1,75126764618731;0,397324830056876;40798;64977;357;6,7;6,5;"Carsten kissmeyer";"Ib Lauritzen";1;"V";"V";0;0;0;0,2;1,16667118403044
"1617";"Ikast.20-06-2016.pdf";2;6;1756;"Ikast-Brande Kommune";"20-06-2016";1764;0,00113378684807256;0,00340136054421769;2016;"06";2016-06-20;0,302718048420133;1,08907160658447;40798;64977;357;6,7;6,5;"Carsten kissmeyer";"Ib Lauritzen";1;"V";"V";0;0;0;0,2;1,16667118403044
"1618";"Ikast.20-09-2017.pdf";21;6;2732;"Ikast-Brande Kommune";"20-09-2017";2759;0,00761145342515404;0,00217470097861544;2017;"09";2017-09-20;2,03223765597597;0,696311096054732;40981;66564;368;6,7;6,6;"Carsten kissmeyer";"Ib Lauritzen";1;"V";"V";0;0;0;0,100000000000001;1,20261903563922
"1619";"Ikast.23-01-2019.pdf";30;21;5384;"Ikast-Brande Kommune";"23-01-2019";5435;0,00551977920883165;0,00386384544618215;2019;"01";2019-01-23;1,47376624861025;1,2371532840943;41282;62285;373;6,4;6,4;"Carsten kissmeyer";"Ib Lauritzen";1;"V";"V";0;0;0;0;1,21895896818866
"1620";"Ikast.23-08-2017.pdf";15;3;2171;"Ikast-Brande Kommune";"23-08-2017";2189;0,00685244403837369;0,00137048880767474;2017;"08";2017-08-23;1,82958418483251;0,438812771588626;40981;66564;368;6,7;6,6;"Carsten kissmeyer";"Ib Lauritzen";1;"V";"V";0;0;0;0,100000000000001;1,20261903563922
"1621";"Ikast.24-01-2018.pdf";5;2;2659;"Ikast-Brande Kommune";"24-01-2018";2666;0,0018754688672168;0,000750187546886722;2018;"01";2018-01-24;0,500745158864511;0,24020033933671;41191;66020;378;6,8;6,6;"Carsten kissmeyer";"Ib Lauritzen";1;"V";"V";0;0;0;0,2;1,23529890073811
"1622";"Ikast.24-02-2016.pdf";39;17;3545;"Ikast-Brande Kommune";"24-02-2016";3601;0,0108303249097473;0,00472091085809497;2016;"02";2016-02-24;2,89166771162336;1,51157453199366;40798;64977;357;6,7;6,5;"Carsten kissmeyer";"Ib Lauritzen";1;"V";"V";0;0;0;0,2;1,16667118403044
"1623";"Ikast.24-08-2016.pdf";22;24;5957;"Ikast-Brande Kommune";"24-08-2016";6003;0,0036648342495419;0,00399800099950025;2016;"08";2016-08-24;0,978500918131644;1,2801081552657;40798;64977;357;6,7;6,5;"Carsten kissmeyer";"Ib Lauritzen";1;"V";"V";0;0;0;0,2;1,16667118403044
"1624";"Ikast.25-01-2017.pdf";11;16;4614;"Ikast-Brande Kommune";"25-01-2017";4641;0,00237017884076708;0,00344753285929757;2017;"01";2017-01-25;0,632831395339825;1,10385538404942;40981;66564;368;6,7;6,6;"Carsten kissmeyer";"Ib Lauritzen";1;"V";"V";0;0;0;0,100000000000001;1,20261903563922
"1625";"Ikast.26-09-2018.pdf";7;4;1451;"Ikast-Brande Kommune";"26-09-2018";1462;0,00478796169630643;0,0027359781121751;2018;"09";2018-09-26;1,27837293498352;0,876024766992706;41191;66020;378;6,8;6,6;"Carsten kissmeyer";"Ib Lauritzen";1;"V";"V";0;0;0;0,2;1,23529890073811
"1626";"Ikast.27-01-2016.pdf";9;10;4420;"Ikast-Brande Kommune";"27-01-2016";4439;0,00202748366749268;0,00225275963054742;2016;"01";2016-01-27;0,541332702941882;0,721304465726141;40798;64977;357;6,7;6,5;"Carsten kissmeyer";"Ib Lauritzen";1;"V";"V";0;0;0;0,2;1,16667118403044
"1627";"Ikast.27-02-2019.pdf";7;4;3200;"Ikast-Brande Kommune";"27-02-2019";3211;0,00218000622858922;0,00124571784490813;2019;"02";2019-02-27;0,582055817796917;0,398862724803281;41282;62285;373;6,4;6,4;"Carsten kissmeyer";"Ib Lauritzen";1;"V";"V";0;0;0;0;1,21895896818866
"1628";"Ikast.27-03-2019.pdf";27;4;2393;"Ikast-Brande Kommune";"27-03-2019";2424;0,0111386138613861;0,00165016501650165;2019;"03";2019-03-27;2,97398003509779;0,528361472501377;41282;62285;373;6,4;6,4;"Carsten kissmeyer";"Ib Lauritzen";1;"V";"V";0;0;0;0;1,21895896818866
"1629";"Ikast.28-02-2018.pdf";56;7;3113;"Ikast-Brande Kommune";"28-02-2018";3176;0,017632241813602;0,00220403022670025;2018;"02";2018-02-28;4,70776128701738;0,705701941546234;41191;66020;378;6,8;6,6;"Carsten kissmeyer";"Ib Lauritzen";1;"V";"V";0;0;0;0,2;1,23529890073811
"1630";"Ikast.28-09-2016.pdf";2;2;1593;"Ikast-Brande Kommune";"28-09-2016";1597;0,00125234815278647;0,00125234815278647;2016;"09";2016-09-28;0,334373598881099;0,400985663538928;40798;64977;357;6,7;6,5;"Carsten kissmeyer";"Ib Lauritzen";1;"V";"V";0;0;0;0,2;1,16667118403044
"1631";"Ikast.29-08-2018.pdf";27;8;4833;"Ikast-Brande Kommune";"29-08-2018";4868;0,00554642563681183;0,00164338537387017;2018;"08";2018-08-29;1,48088077343407;0,526190718711313;41191;66020;378;6,8;6,6;"Carsten kissmeyer";"Ib Lauritzen";1;"V";"V";0;0;0;0,2;1,23529890073811
"1632";"Ikast.31-10-2018.pdf";12;9;4389;"Ikast-Brande Kommune";"31-10-2018";4410;0,00272108843537415;0,00204081632653061;2018;"10";2018-10-31;0,726523316208319;0,653442963950682;41191;66020;378;6,8;6,6;"Carsten kissmeyer";"Ib Lauritzen";1;"V";"V";0;0;0;0,2;1,23529890073811
"1633";"Ishoej.09-05-2016.pdf";6;2;1123;"Ishøj Kommune";"09-05-2016";1131;0,00530503978779841;0,0017683465959328;2016;"05";2016-05-09;1,41643139897378;0,566201684059831;22358;80386;412;5,5;5,8;"Ole Bjørstorp";"Ole Bjørstorp";0;"S";"S";0;0;0;-0,3;1,34641044207434
"1634";"Ishoej.09-10-2018.pdf";2;10;2534;"Ishøj Kommune";"09-10-2018";2546;0,000785545954438335;0,00392772977219167;2018;"10";2018-10-09;0,209738663555819;1,25760821812975;22988;83861;407;5,9;6,1;"Ole Bjørstorp";"Ole Bjørstorp";0;"S";"S";0;0;0;-0,199999999999999;1,3300705095249
"1635";"Ishoej.10-10-2017.pdf";2;9;2505;"Ishøj Kommune";"10-10-2017";2516;0,000794912559618442;0,00357710651828299;2017;"10";2017-10-10;0,21223952202429;1,14534319198033;22719;82063;419;6;6,2;"Ole Bjørstorp";"Ole Bjørstorp";0;"S";"S";0;0;0;-0,2;1,36928634764357
"1636";"Ishoej.11-02-2019.pdf";0;0;750;"Ishøj Kommune";"11-02-2019";750;0;0;2019;"02";2019-02-11;0;0;22946;85951;416;5,7;5,9;"Ole Bjørstorp";"Ole Bjørstorp";0;"S";"S";0;0;0;-0,2;1,3594823881139
"1637";"Ishoej.11-12-2018.pdf";2;10;1805;"Ishøj Kommune";"11-12-2018";1817;0,00110071546505228;0,00550357732526142;2018;"12";2018-12-11;0,293888077827801;1,76217420107779;22988;83861;407;5,9;6,1;"Ole Bjørstorp";"Ole Bjørstorp";0;"S";"S";0;0;0;-0,199999999999999;1,3300705095249
"1638";"Ishoej.12-02-2019.pdf";3;3;1350;"Ishøj Kommune";"12-02-2019";1356;0,00221238938053097;0,00221238938053097;2019;"02";2019-02-12;0,590702032536631;0,708378434371315;22946;85951;416;5,7;5,9;"Ole Bjørstorp";"Ole Bjørstorp";0;"S";"S";0;0;0;-0,2;1,3594823881139
"1639";"Ishoej.12-12-2016.pdf";6;3;1644;"Ishøj Kommune";"12-12-2016";1653;0,00362976406533575;0,00181488203266788;2016;"12";2016-12-12;0,969137272982059;0,581101728377194;22358;80386;412;5,5;5,8;"Ole Bjørstorp";"Ole Bjørstorp";0;"S";"S";0;0;0;-0,3;1,34641044207434
"1640";"Ishoej.12-12-2017.pdf";3;9;1573;"Ishøj Kommune";"12-12-2017";1585;0,00189274447949527;0,0056782334384858;2017;"12";2017-12-12;0,505357701021875;1,81809682714354;22719;82063;419;6;6,2;"Ole Bjørstorp";"Ole Bjørstorp";0;"S";"S";0;0;0;-0,2;1,36928634764357
"1641";"Ishoej.13-02-2018.pdf";19;3;2404;"Ishøj Kommune";"13-02-2018";2426;0,0078318219291014;0,00123660346248969;2018;"02";2018-02-13;2,09107545565729;0,395944417562862;22988;83861;407;5,9;6,1;"Ole Bjørstorp";"Ole Bjørstorp";0;"S";"S";0;0;0;-0,199999999999999;1,3300705095249
"1642";"Ishoej.13-06-2016.pdf";14;11;3984;"Ishøj Kommune";"13-06-2016";4009;0,00349214267897231;0,0027438263906211;2016;"06";2016-06-13;0,932392731826341;0,878537684134242;22358;80386;412;5,5;5,8;"Ole Bjørstorp";"Ole Bjørstorp";0;"S";"S";0;0;0;-0,3;1,34641044207434
"1643";"Ishoej.14-02-2017.pdf";18;1;1271;"Ishøj Kommune";"14-02-2017";1290;0,013953488372093;0,000775193798449612;2017;"02";2017-02-14;3,72554398195196;0,2482070173146;22719;82063;419;6;6,2;"Ole Bjørstorp";"Ole Bjørstorp";0;"S";"S";0;0;0;-0,2;1,36928634764357
"1644";"Ishoej.14-03-2016.pdf";8;6;1395;"Ishøj Kommune";"14-03-2016";1409;0,0056777856635912;0,0042583392476934;2016;"03";2016-03-14;1,51595354836938;1,36346509156494;22358;80386;412;5,5;5,8;"Ole Bjørstorp";"Ole Bjørstorp";0;"S";"S";0;0;0;-0,3;1,34641044207434
"1645";"Ishoej.15-01-2018.pdf";10;8;2524;"Ishøj Kommune";"15-01-2018";2542;0,003933910306845;0,003147128245476;2018;"01";2018-01-15;1,05034350395971;1,00766971624181;22988;83861;407;5,9;6,1;"Ole Bjørstorp";"Ole Bjørstorp";0;"S";"S";0;0;0;-0,199999999999999;1,3300705095249
"1646";"Ishoej.15-02-2016.pdf";18;0;2076;"Ishøj Kommune";"15-02-2016";2094;0,00859598853868195;0;2016;"02";2016-02-15;2,29510589146038;0;22358;80386;412;5,5;5,8;"Ole Bjørstorp";"Ole Bjørstorp";0;"S";"S";0;0;0;-0,3;1,34641044207434
"1647";"Ishoej.15-05-2017.pdf";6;10;3110;"Ishøj Kommune";"15-05-2017";3126;0,00191938579654511;0,00319897632757518;2017;"05";2017-05-15;0,512470861240993;1,02427080081841;22719;82063;419;6;6,2;"Ole Bjørstorp";"Ole Bjørstorp";0;"S";"S";0;0;0;-0,2;1,36928634764357
"1648";"Ishoej.15-05-2018.pdf";2;11;2956;"Ishøj Kommune";"15-05-2018";2969;0,000673627484001347;0,00370495116200741;2018;"05";2018-05-15;0,179856732035404;1,18627739161138;22988;83861;407;5,9;6,1;"Ole Bjørstorp";"Ole Bjørstorp";0;"S";"S";0;0;0;-0,199999999999999;1,3300705095249
"1649";"Ishoej.15-08-2016.pdf";3;5;2411;"Ishøj Kommune";"15-08-2016";2419;0,00124018189334436;0,0020669698222406;2016;"08";2016-08-15;0,331125240231365;0,661816974650339;22358;80386;412;5,5;5,8;"Ole Bjørstorp";"Ole Bjørstorp";0;"S";"S";0;0;0;-0,3;1,34641044207434
"1650";"Ishoej.16-01-2017.pdf";5;0;1690;"Ishøj Kommune";"16-01-2017";1695;0,00294985250737463;0;2017;"01";2017-01-16;0,787602710048841;0;22719;82063;419;6;6,2;"Ole Bjørstorp";"Ole Bjørstorp";0;"S";"S";0;0;0;-0,2;1,36928634764357
"1651";"Ishoej.16-04-2018.pdf";2;0;1731;"Ishøj Kommune";"16-04-2018";1733;0,00115406809001731;0;2018;"04";2018-04-16;0,30813308563942;0;22988;83861;407;5,9;6,1;"Ole Bjørstorp";"Ole Bjørstorp";0;"S";"S";0;0;0;-0,199999999999999;1,3300705095249
"1652";"Ishoej.17-09-2018.pdf";6;9;1919;"Ishøj Kommune";"17-09-2018";1934;0,0031023784901758;0,0046535677352637;2018;"09";2018-09-17;0,828326738489836;1,49001213599923;22988;83861;407;5,9;6,1;"Ole Bjørstorp";"Ole Bjørstorp";0;"S";"S";0;0;0;-0,199999999999999;1,3300705095249
"1653";"Ishoej.17-10-2016.pdf";0;11;1983;"Ishøj Kommune";"17-10-2016";1994;0;0,00551654964894684;2016;"10";2016-10-17;0;1,76632777116057;22358;80386;412;5,5;5,8;"Ole Bjørstorp";"Ole Bjørstorp";0;"S";"S";0;0;0;-0,3;1,34641044207434
"1654";"Ishoej.18-01-2016.pdf";8;0;1284;"Ishøj Kommune";"18-01-2016";1292;0,00619195046439629;0;2016;"01";2016-01-18;1,65323417155763;0;22358;80386;412;5,5;5,8;"Ole Bjørstorp";"Ole Bjørstorp";0;"S";"S";0;0;0;-0,3;1,34641044207434
"1655";"Ishoej.18-03-2019.pdf";1;8;2290;"Ishøj Kommune";"18-03-2019";2299;0,000434971726837756;0,00347977381470204;2019;"03";2019-03-18;0,116136284778842;1,11417852052487;22946;85951;416;5,7;5,9;"Ole Bjørstorp";"Ole Bjørstorp";0;"S";"S";0;0;0;-0,2;1,3594823881139
"1656";"Ishoej.18-04-2016.pdf";1;3;1531;"Ishøj Kommune";"18-04-2016";1535;0,000651465798045603;0,00195439739413681;2016;"04";2016-04-18;0,173939621307203;0,6257727407215;22358;80386;412;5,5;5,8;"Ole Bjørstorp";"Ole Bjørstorp";0;"S";"S";0;0;0;-0,3;1,34641044207434
"1657";"Ishoej.18-04-2017.pdf";9;0;1609;"Ishøj Kommune";"18-04-2017";1618;0,00556242274412855;0;2017;"04";2017-04-18;1,48515195819469;0;22719;82063;419;6;6,2;"Ole Bjørstorp";"Ole Bjørstorp";0;"S";"S";0;0;0;-0,2;1,36928634764357
"1658";"Ishoej.18-06-2018.pdf";11;27;2774;"Ishøj Kommune";"18-06-2018";2812;0,00391180654338549;0,00960170697012802;2018;"06";2018-06-18;1,04444185838269;3,07434225215773;22988;83861;407;5,9;6,1;"Ole Bjørstorp";"Ole Bjørstorp";0;"S";"S";0;0;0;-0,199999999999999;1,3300705095249
"1659";"Ishoej.18-09-2017.pdf";3;1;2629;"Ishøj Kommune";"18-09-2017";2633;0,00113938473224459;0,000379794910748196;2017;"09";2017-09-18;0,304212668484494;0,121605412964616;22719;82063;419;6;6,2;"Ole Bjørstorp";"Ole Bjørstorp";0;"S";"S";0;0;0;-0,2;1,36928634764357
"1660";"Ishoej.19-03-2018.pdf";8;16;2879;"Ishøj Kommune";"19-03-2018";2903;0,00275576989321392;0,00551153978642783;2018;"03";2018-03-19;0,735783172460371;1,764723678048;22988;83861;407;5,9;6,1;"Ole Bjørstorp";"Ole Bjørstorp";0;"S";"S";0;0;0;-0,199999999999999;1,3300705095249
"1661";"Ishoej.19-06-2017.pdf";11;10;3461;"Ishøj Kommune";"19-06-2017";3482;0,00315910396323952;0,00287191269385411;2017;"06";2017-06-19;0,843472287700209;0,919549260011011;22719;82063;419;6;6,2;"Ole Bjørstorp";"Ole Bjørstorp";0;"S";"S";0;0;0;-0,2;1,36928634764357
"1662";"Ishoej.19-09-2016.pdf";5;3;2795;"Ishøj Kommune";"19-09-2016";2803;0,00178380306814128;0,00107028184088477;2016;"09";2016-09-19;0,476270636294251;0,342690387801464;22358;80386;412;5,5;5,8;"Ole Bjørstorp";"Ole Bjørstorp";0;"S";"S";0;0;0;-0,3;1,34641044207434
"1663";"Ishoej.19-11-2018.pdf";3;0;1264;"Ishøj Kommune";"19-11-2018";1267;0,00236779794790845;0;2018;"11";2018-11-19;0,632195703330443;0;22988;83861;407;5,9;6,1;"Ole Bjørstorp";"Ole Bjørstorp";0;"S";"S";0;0;0;-0,199999999999999;1,3300705095249
"1664";"Ishoej.20-03-2017.pdf";0;3;2014;"Ishøj Kommune";"20-03-2017";2017;0;0,0014873574615766;2017;"03";2017-03-20;0;0,47623260139192;22719;82063;419;6;6,2;"Ole Bjørstorp";"Ole Bjørstorp";0;"S";"S";0;0;0;-0,2;1,36928634764357
"1665";"Ishoej.20-08-2018.pdf";4;9;3725;"Ishøj Kommune";"20-08-2018";3738;0,00107009095773141;0,00240770465489567;2018;"08";2018-08-20;0,285711416486418;0,77091585634631;22988;83861;407;5,9;6,1;"Ole Bjørstorp";"Ole Bjørstorp";0;"S";"S";0;0;0;-0,199999999999999;1,3300705095249
"1666";"Ishoej.20-11-2017.pdf";6;0;2284;"Ishøj Kommune";"20-11-2017";2290;0,00262008733624454;0;2017;"11";2017-11-20;0,699556293554298;0;22719;82063;419;6;6,2;"Ole Bjørstorp";"Ole Bjørstorp";0;"S";"S";0;0;0;-0,2;1,36928634764357
"1667";"Ishoej.21-01-2019.pdf";7;6;2398;"Ishøj Kommune";"21-01-2019";2411;0,00290335960182497;0,0024885939444214;2019;"01";2019-01-21;0,775189228928204;0,796815559525095;22946;85951;416;5,7;5,9;"Ole Bjørstorp";"Ole Bjørstorp";0;"S";"S";0;0;0;-0,2;1,3594823881139
"1668";"Ishoej.21-08-2017.pdf";4;9;2373;"Ishøj Kommune";"21-08-2017";2386;0,00167644593461861;0,00377200335289187;2017;"08";2017-08-21;0,447606569499677;1,20774663496333;22719;82063;419;6;6,2;"Ole Bjørstorp";"Ole Bjørstorp";0;"S";"S";0;0;0;-0,2;1,36928634764357
"1669";"Ishoej.21-11-2016.pdf";4;2;1393;"Ishøj Kommune";"21-11-2016";1399;0,00285918513223731;0,00142959256611866;2016;"11";2016-11-21;0,763394763993016;0,457737029786754;22358;80386;412;5,5;5,8;"Ole Bjørstorp";"Ole Bjørstorp";0;"S";"S";0;0;0;-0,3;1,34641044207434
"1670";"Ishoej.29-06-2016.pdf";0;1;179;"Ishøj Kommune";"29-06-2016";180;0;0,00555555555555556;2016;"06";2016-06-29;0;1,7788169574213;22358;80386;412;5,5;5,8;"Ole Bjørstorp";"Ole Bjørstorp";0;"S";"S";0;0;0;-0,3;1,34641044207434
"1671";"Ishoej.30-11-2016.pdf";0;0;149;"Ishøj Kommune";"30-11-2016";149;0;0;2016;"11";2016-11-30;0;0;22358;80386;412;5,5;5,8;"Ole Bjørstorp";"Ole Bjørstorp";0;"S";"S";0;0;0;-0,3;1,34641044207434
"1672";"Ishoej.31-01-2017.pdf";1;2;529;"Ishøj Kommune";"31-01-2017";532;0,0018796992481203;0,0037593984962406;2017;"01";2017-01-31;0,501874659222852;1,20371072306705;22719;82063;419;6;6,2;"Ole Bjørstorp";"Ole Bjørstorp";0;"S";"S";0;0;0;-0,2;1,36928634764357
"1673";"Jammerbugt.01-02-2016.pdf";0;13;1954;"Jammerbugt Kommune";"01-02-2016";1967;0;0,00660904931367565;2016;"02";2016-02-01;0;2,11613201848797;38466;60692;361;7;6,8;"Mogens Gade";"Mogens Gade";0;"V";"V";0;0;0;0,2;1,17974313006999
"1674";"Jammerbugt.01-04-2019.pdf";2;1;1980;"Jammerbugt Kommune";"01-04-2019";1983;0,00100857286938981;0,000504286434694907;2019;"04";2019-04-01;0,269286251847259;0,161465987057909;38460;68966;340;7;6,7;"Mogens Gade";"Mogens Gade";0;"V";"V";0;0;0;0,3;1,11111541336232
"1675";"Jammerbugt.02-05-2016.pdf";2;4;1443;"Jammerbugt Kommune";"02-05-2016";1449;0,00138026224982747;0,00276052449965493;2016;"05";2016-05-02;0,368526319815814;0,883884202445367;38466;60692;361;7;6,8;"Mogens Gade";"Mogens Gade";0;"V";"V";0;0;0;0,2;1,17974313006999
"1676";"Jammerbugt.03-04-2017.pdf";3;8;2923;"Jammerbugt Kommune";"03-04-2017";2934;0,00102249488752556;0,0027266530334015;2017;"04";2017-04-03;0,273003393360488;0,873038997507387;38581;61849;355;6,7;6,7;"Mogens Gade";"Mogens Gade";0;"V";"V";0;0;0;0;1,16013521101066
"1677";"Jammerbugt.03-05-2017.pdf";3;4;1303;"Jammerbugt Kommune";"03-05-2017";1310;0,00229007633587786;0,00305343511450382;2017;"05";2017-05-03;0,611444241312726;0,977670388811707;38581;61849;355;6,7;6,7;"Mogens Gade";"Mogens Gade";0;"V";"V";0;0;0;0;1,16013521101066
"1678";"Jammerbugt.03-09-2018.pdf";5;0;387;"Jammerbugt Kommune";"03-09-2018";392;0,0127551020408163;0;2018;"09";2018-09-03;3,40557804472649;0;38638;63260;347;6,7;6,7;"Mogens Gade";"Mogens Gade";0;"V";"V";0;0;0;0;1,13399131893155
"1679";"Jammerbugt.03-12-2018.pdf";10;49;5917;"Jammerbugt Kommune";"03-12-2018";5976;0,00167336010709505;0,00819946452476573;2018;"12";2018-12-03;0,446782661824895;2,62536237691698;38638;63260;347;6,7;6,7;"Mogens Gade";"Mogens Gade";0;"V";"V";0;0;0;0;1,13399131893155
"1680";"Jammerbugt.04-02-2019.pdf";2;3;1395;"Jammerbugt Kommune";"04-02-2019";1400;0,00142857142857143;0,00214285714285714;2019;"02";2019-02-04;0,381424741009367;0,686115112148216;38460;68966;340;7;6,7;"Mogens Gade";"Mogens Gade";0;"V";"V";0;0;0;0,3;1,11111541336232
"1681";"Jammerbugt.04-04-2016.pdf";2;6;3775;"Jammerbugt Kommune";"04-04-2016";3783;0,000528680941052075;0,00158604282315623;2016;"04";2016-04-04;0,141156393712163;0,507830376424796;38466;60692;361;7;6,8;"Mogens Gade";"Mogens Gade";0;"V";"V";0;0;0;0,2;1,17974313006999
"1682";"Jammerbugt.04-06-2018.pdf";4;7;2026;"Jammerbugt Kommune";"04-06-2018";2037;0,00196367206676485;0,00343642611683849;2018;"06";2018-06-04;0,524295176645179;1,10029914892039;38638;63260;347;6,7;6,7;"Mogens Gade";"Mogens Gade";0;"V";"V";0;0;0;0;1,13399131893155
"1683";"Jammerbugt.04-09-2017.pdf";2;17;1456;"Jammerbugt Kommune";"04-09-2017";1475;0,00135593220338983;0,0115254237288136;2017;"09";2017-09-04;0,362030262652959;3,69029145065029;38581;61849;355;6,7;6,7;"Mogens Gade";"Mogens Gade";0;"V";"V";0;0;0;0;1,16013521101066
"1684";"Jammerbugt.05-03-2018.pdf";39;33;4066;"Jammerbugt Kommune";"05-03-2018";4138;0,00942484291928468;0,00797486708554857;2018;"03";2018-03-05;2,51640778867949;2,55344918489186;38638;63260;347;6,7;6,7;"Mogens Gade";"Mogens Gade";0;"V";"V";0;0;0;0;1,13399131893155
"1685";"Jammerbugt.05-09-2016.pdf";0;0;238;"Jammerbugt Kommune";"05-09-2016";238;0;0;2016;"09";2016-09-05;0;0;38466;60692;361;7;6,8;"Mogens Gade";"Mogens Gade";0;"V";"V";0;0;0;0,2;1,17974313006999
"1686";"Jammerbugt.05-11-2018.pdf";0;6;1484;"Jammerbugt Kommune";"05-11-2018";1490;0;0,00402684563758389;2018;"11";2018-11-05;0;1,2893438349094;38638;63260;347;6,7;6,7;"Mogens Gade";"Mogens Gade";0;"V";"V";0;0;0;0;1,13399131893155
"1687";"Jammerbugt.06-06-2017.pdf";13;9;6056;"Jammerbugt Kommune";"06-06-2017";6078;0,00213886146758802;0,00148075024679171;2017;"06";2017-06-06;0,571070276930774;0,474117056765796;38581;61849;355;6,7;6,7;"Mogens Gade";"Mogens Gade";0;"V";"V";0;0;0;0;1,16013521101066
"1688";"Jammerbugt.06-11-2017.pdf";6;2;2364;"Jammerbugt Kommune";"06-11-2017";2372;0,00252951096121417;0,000843170320404722;2017;"11";2017-11-06;0,675372644283028;0,269972219507449;38581;61849;355;6,7;6,7;"Mogens Gade";"Mogens Gade";0;"V";"V";0;0;0;0;1,16013521101066
"1689";"Jammerbugt.07-09-2018.pdf";0;2;567;"Jammerbugt Kommune";"07-09-2018";569;0;0,00351493848857645;2018;"09";2018-09-07;0;1,12543779379907;38638;63260;347;6,7;6,7;"Mogens Gade";"Mogens Gade";0;"V";"V";0;0;0;0;1,13399131893155
"1690";"Jammerbugt.08-01-2018.pdf";0;2;2454;"Jammerbugt Kommune";"08-01-2018";2456;0;0,000814332247557003;2018;"01";2018-01-08;0;0,260738641967292;38638;63260;347;6,7;6,7;"Mogens Gade";"Mogens Gade";0;"V";"V";0;0;0;0;1,13399131893155
"1691";"Jammerbugt.08-08-2016.pdf";2;3;959;"Jammerbugt Kommune";"08-08-2016";964;0,0020746887966805;0,00311203319502075;2016;"08";2016-08-08;0,553936345864226;0,996432735484961;38466;60692;361;7;6,8;"Mogens Gade";"Mogens Gade";0;"V";"V";0;0;0;0,2;1,17974313006999
"1692";"Jammerbugt.09-01-2017.pdf";0;7;2491;"Jammerbugt Kommune";"09-01-2017";2498;0;0,00280224179343475;2017;"01";2017-01-09;0;0,897241539772153;38581;61849;355;6,7;6,7;"Mogens Gade";"Mogens Gade";0;"V";"V";0;0;0;0;1,16013521101066
"1693";"Jammerbugt.09-04-2018.pdf";16;4;3358;"Jammerbugt Kommune";"09-04-2018";3378;0,00473653049141504;0,00118413262285376;2018;"04";2018-04-09;1,26464094117967;0,379143934086245;38638;63260;347;6,7;6,7;"Mogens Gade";"Mogens Gade";0;"V";"V";0;0;0;0;1,13399131893155
"1694";"Jammerbugt.11-01-2016.pdf";1;1;2087;"Jammerbugt Kommune";"11-01-2016";2089;0,000478697941598851;0,000478697941598851;2016;"01";2016-01-11;0,127811066877241;0,153272882879767;38466;60692;361;7;6,8;"Mogens Gade";"Mogens Gade";0;"V";"V";0;0;0;0,2;1,17974313006999
"1695";"Jammerbugt.11-03-2019.pdf";16;31;5653;"Jammerbugt Kommune";"11-03-2019";5700;0,00280701754385965;0,00543859649122807;2019;"03";2019-03-11;0,749466157772792;1,74136817937033;38460;68966;340;7;6,7;"Mogens Gade";"Mogens Gade";0;"V";"V";0;0;0;0,3;1,11111541336232
"1696";"Jammerbugt.12-12-2017.pdf";7;8;1450;"Jammerbugt Kommune";"12-12-2017";1465;0,00477815699658703;0,00546075085324232;2017;"12";2017-12-12;1,27575510644771;1,74846171924005;38581;61849;355;6,7;6,7;"Mogens Gade";"Mogens Gade";0;"V";"V";0;0;0;0;1,16013521101066
"1697";"Jammerbugt.13-03-2017.pdf";9;11;3734;"Jammerbugt Kommune";"13-03-2017";3754;0,00239744272775706;0,00293020777836974;2017;"03";2017-03-13;0,640110780063669;0,93821459128774;38581;61849;355;6,7;6,7;"Mogens Gade";"Mogens Gade";0;"V";"V";0;0;0;0;1,16013521101066
"1698";"Jammerbugt.13-08-2018.pdf";5;2;1434;"Jammerbugt Kommune";"13-08-2018";1441;0,00346981263011797;0,00138792505204719;2018;"08";2018-08-13;0,926430668655646;0,444395631278049;38638;63260;347;6,7;6,7;"Mogens Gade";"Mogens Gade";0;"V";"V";0;0;0;0;1,13399131893155
"1699";"Jammerbugt.14-01-2019.pdf";5;17;3394;"Jammerbugt Kommune";"14-01-2019";3416;0,00146370023419204;0,00497658079625293;2019;"01";2019-01-14;0,390804037919434;1,59343673586334;38460;68966;340;7;6,7;"Mogens Gade";"Mogens Gade";0;"V";"V";0;0;0;0,3;1,11111541336232
"1700";"Jammerbugt.14-05-2018.pdf";15;24;4670;"Jammerbugt Kommune";"14-05-2018";4709;0,00318538967933744;0,0050966234869399;2018;"05";2018-05-14;0,850490503418636;1,63187285114887;38638;63260;347;6,7;6,7;"Mogens Gade";"Mogens Gade";0;"V";"V";0;0;0;0;1,13399131893155
"1701";"Jammerbugt.14-08-2017.pdf";43;45;6254;"Jammerbugt Kommune";"14-08-2017";6342;0,00678019552191738;0,00709555345316935;2017;"08";2017-08-14;1,81029402465815;2,27190434486164;38581;61849;355;6,7;6,7;"Mogens Gade";"Mogens Gade";0;"V";"V";0;0;0;0;1,16013521101066
"1702";"Jammerbugt.20-06-2016.pdf";3;6;791;"Jammerbugt Kommune";"20-06-2016";800;0,00375;0,0075;2016;"06";2016-06-20;1,00123994514959;2,40140289251876;38466;60692;361;7;6,8;"Mogens Gade";"Mogens Gade";0;"V";"V";0;0;0;0,2;1,17974313006999
"1703";"Jammerbugt.24-09-2018.pdf";2;8;2477;"Jammerbugt Kommune";"24-09-2018";2487;0,000804181745074387;0,00321672698029755;2018;"09";2018-09-24;0,214714369687621;1,02995432999062;38638;63260;347;6,7;6,7;"Mogens Gade";"Mogens Gade";0;"V";"V";0;0;0;0;1,13399131893155
"1704";"Jammerbugt.25-08-2016.pdf";0;0;271;"Jammerbugt Kommune";"25-08-2016";271;0;0;2016;"08";2016-08-25;0;0;38466;60692;361;7;6,8;"Mogens Gade";"Mogens Gade";0;"V";"V";0;0;0;0,2;1,17974313006999
"1705";"Jammerbugt.25-09-2017.pdf";11;2;1295;"Jammerbugt Kommune";"25-09-2017";1308;0,00840978593272171;0,00152905198776758;2017;"09";2017-09-25;2,24539029493282;0,489582648831551;38581;61849;355;6,7;6,7;"Mogens Gade";"Mogens Gade";0;"V";"V";0;0;0;0;1,16013521101066
"1706";"Jammerbugt.26-06-2017.pdf";1;2;762;"Jammerbugt Kommune";"26-06-2017";765;0,00130718954248366;0,00261437908496732;2017;"06";2017-06-26;0,349016102884388;0,837090332904141;38581;61849;355;6,7;6,7;"Mogens Gade";"Mogens Gade";0;"V";"V";0;0;0;0;1,16013521101066
"1707";"Jammerbugt.26-09-2016.pdf";3;2;1732;"Jammerbugt Kommune";"26-09-2016";1737;0,00172711571675302;0,00115141047783535;2016;"09";2016-09-26;0,461135265469011;0,368666726926694;38466;60692;361;7;6,8;"Mogens Gade";"Mogens Gade";0;"V";"V";0;0;0;0,2;1,17974313006999
"1708";"Jammerbugt.27-11-2017.pdf";10;17;2926;"Jammerbugt Kommune";"27-11-2017";2953;0,00338638672536404;0,00575685743311886;2017;"11";2017-11-27;0,904156175775676;1,84327121222797;38581;61849;355;6,7;6,7;"Mogens Gade";"Mogens Gade";0;"V";"V";0;0;0;0;1,16013521101066
"1709";"Jammerbugt.28-11-2016.pdf";4;7;2734;"Jammerbugt Kommune";"28-11-2016";2745;0,00145719489981785;0,00255009107468124;2016;"11";2016-11-28;0,389067131084236;0,816506144390105;38466;60692;361;7;6,8;"Mogens Gade";"Mogens Gade";0;"V";"V";0;0;0;0,2;1,17974313006999
"1710";"Jammerbugt.29-01-2018.pdf";5;11;2470;"Jammerbugt Kommune";"29-01-2018";2486;0,00201126307320998;0,00442477876106195;2018;"01";2018-01-29;0,537001847760574;1,41675686874263;38638;63260;347;6,7;6,7;"Mogens Gade";"Mogens Gade";0;"V";"V";0;0;0;0;1,13399131893155
"1711";"Jammerbugt.29-02-2016.pdf";2;6;3688;"Jammerbugt Kommune";"29-02-2016";3696;0,000541125541125541;0,00162337662337662;2016;"02";2016-02-29;0,144479068564154;0,519784175869861;38466;60692;361;7;6,8;"Mogens Gade";"Mogens Gade";0;"V";"V";0;0;0;0,2;1,17974313006999
"1712";"Jammerbugt.30-01-2017.pdf";3;8;2671;"Jammerbugt Kommune";"30-01-2017";2682;0,00111856823266219;0,00298284862043251;2017;"01";2017-01-30;0,298654718911138;0,955069507340296;38581;61849;355;6,7;6,7;"Mogens Gade";"Mogens Gade";0;"V";"V";0;0;0;0;1,16013521101066
"1713";"Jammerbugt.30-05-2016.pdf";8;15;2095;"Jammerbugt Kommune";"30-05-2016";2118;0,00377714825306893;0,00708215297450425;2016;"05";2016-05-30;1,00848845592656;2,26761368509798;38466;60692;361;7;6,8;"Mogens Gade";"Mogens Gade";0;"V";"V";0;0;0;0,2;1,17974313006999
"1714";"Jammerbugt.31-10-2016.pdf";0;33;2133;"Jammerbugt Kommune";"31-10-2016";2166;0;0,0152354570637119;2016;"10";2016-10-31;0;4,87819608821908;38466;60692;361;7;6,8;"Mogens Gade";"Mogens Gade";0;"V";"V";0;0;0;0,2;1,17974313006999
"1715";"Kalundborg.01-03-2017.pdf";16;2;6229;"Kalundborg Kommune";"01-03-2017";6247;0,00256122939010725;0,000320153673763406;2017;"03";2017-03-01;0,683841379751067;0,102509061096793;48736;68008;243;6,3;6,4;"Martin Damm";"Martin Damm";0;"V";"V";0;0;0;-0,100000000000001;0,794120721903071
"1716";"Kalundborg.01-12-2017.pdf";0;0;213;"Kalundborg Kommune";"01-12-2017";213;0;0;2017;"12";2017-12-01;0;0;48736;68008;243;6,3;6,4;"Martin Damm";"Martin Damm";0;"V";"V";0;0;0;-0,100000000000001;0,794120721903071
"1717";"Kalundborg.02-03-2016.pdf";25;27;4075;"Kalundborg Kommune";"02-03-2016";4127;0,00605766900896535;0,00654228252968258;2016;"03";2016-03-02;1,61738138300556;2,09475415872729;48660;65594;252;6,3;6,5;"Martin Damm";"Martin Damm";0;"V";"V";0;0;0;-0,2;0,823532600492073
"1718";"Kalundborg.02-05-2018.pdf";3;19;2860;"Kalundborg Kommune";"02-05-2018";2882;0,00104094378903539;0,00659264399722415;2018;"05";2018-05-02;0,277929200596694;2,11087924857073;48982;69771;253;6;6,5;"Martin Damm";"Martin Damm";0;"V";"V";0;0;0;-0,5;0,826800587001963
"1719";"Kalundborg.03-02-2016.pdf";10;14;3263;"Kalundborg Kommune";"03-02-2016";3287;0,00304228780042592;0,00425920292059629;2016;"02";2016-02-03;0,81228268544739;1,3637416284459;48660;65594;252;6,3;6,5;"Martin Damm";"Martin Damm";0;"V";"V";0;0;0;-0,2;0,823532600492073
"1720";"Kalundborg.03-04-2019.pdf";6;17;5655;"Kalundborg Kommune";"03-04-2019";5678;0,00105671010919338;0,0029940119760479;2019;"04";2019-04-03;0,282138765804745;0,958643869268965;48681;73322;267;6;6,3;"Martin Damm";"Martin Damm";0;"V";"V";0;0;0;-0,3;0,872552398140411
"1721";"Kalundborg.03-05-2017.pdf";1;1;4423;"Kalundborg Kommune";"03-05-2017";4425;0,000225988700564972;0,000225988700564972;2017;"05";2017-05-03;0,0603383771088265;0,0723586558951038;48736;68008;243;6,3;6,4;"Martin Damm";"Martin Damm";0;"V";"V";0;0;0;-0,100000000000001;0,794120721903071
"1722";"Kalundborg.03-10-2018.pdf";32;20;5149;"Kalundborg Kommune";"03-10-2018";5201;0,0061526629494328;0,0038454143433955;2018;"10";2018-10-03;1,64274451040374;1,23125188362174;48982;69771;253;6;6,5;"Martin Damm";"Martin Damm";0;"V";"V";0;0;0;-0,5;0,826800587001963
"1723";"Kalundborg.04-04-2016.pdf";0;0;176;"Kalundborg Kommune";"04-04-2016";176;0;0;2016;"04";2016-04-04;0;0;48660;65594;252;6,3;6,5;"Martin Damm";"Martin Damm";0;"V";"V";0;0;0;-0,2;0,823532600492073
"1724";"Kalundborg.04-04-2018.pdf";9;11;5407;"Kalundborg Kommune";"04-04-2018";5427;0,00165837479270315;0,00202690252441496;2018;"04";2018-04-04;0,442781623062284;0,648987944664488;48982;69771;253;6;6,5;"Martin Damm";"Martin Damm";0;"V";"V";0;0;0;-0,5;0,826800587001963
"1725";"Kalundborg.04-10-2017.pdf";2;8;4179;"Kalundborg Kommune";"04-10-2017";4189;0,00047744091668656;0,00190976366674624;2017;"10";2017-10-04;0,127475444596112;0,611481599113553;48736;68008;243;6,3;6,4;"Martin Damm";"Martin Damm";0;"V";"V";0;0;0;-0,100000000000001;0,794120721903071
"1726";"Kalundborg.05-04-2017.pdf";42;5;4772;"Kalundborg Kommune";"05-04-2017";4819;0,00871550114131563;0,00103755965968043;2017;"04";2017-04-05;2,32701543591521;0,332213169055649;48736;68008;243;6,3;6,4;"Martin Damm";"Martin Damm";0;"V";"V";0;0;0;-0,100000000000001;0,794120721903071
"1727";"Kalundborg.05-09-2018.pdf";12;25;3226;"Kalundborg Kommune";"05-09-2018";3263;0,00367759730309531;0,00766166104811523;2018;"09";2018-09-05;0,981908619208914;2,45316466699229;48982;69771;253;6;6,5;"Martin Damm";"Martin Damm";0;"V";"V";0;0;0;-0,5;0,826800587001963
"1728";"Kalundborg.05-10-2016.pdf";2;1;3363;"Kalundborg Kommune";"05-10-2016";3366;0,0005941770647653;0,00029708853238265;2016;"10";2016-10-05;0,158643683129267;0,0951239014663797;48660;65594;252;6,3;6,5;"Martin Damm";"Martin Damm";0;"V";"V";0;0;0;-0,2;0,823532600492073
"1729";"Kalundborg.05-12-2018.pdf";10;24;3233;"Kalundborg Kommune";"05-12-2018";3267;0,00306091215182124;0,00734618916437098;2018;"12";2018-12-05;0,81725533733259;2,35215465444139;48982;69771;253;6;6,5;"Martin Damm";"Martin Damm";0;"V";"V";0;0;0;-0,5;0,826800587001963
"1730";"Kalundborg.06-02-2019.pdf";1;2;3298;"Kalundborg Kommune";"06-02-2019";3301;0,000302938503483793;0,000605877006967586;2019;"02";2019-02-06;0,0808837681631497;0,193993972939009;48681;73322;267;6;6,3;"Martin Damm";"Martin Damm";0;"V";"V";0;0;0;-0,3;0,872552398140411
"1731";"Kalundborg.06-03-2019.pdf";25;13;3915;"Kalundborg Kommune";"06-03-2019";3953;0,00632431065013913;0,00328864153807235;2019;"03";2019-03-06;1,68857398625447;1,05298044026457;48681;73322;267;6;6,3;"Martin Damm";"Martin Damm";0;"V";"V";0;0;0;-0,3;0,872552398140411
"1732";"Kalundborg.06-04-2016.pdf";4;1;2028;"Kalundborg Kommune";"06-04-2016";2033;0,00196753566158387;0,000491883915395967;2016;"04";2016-04-06;0,525326746102424;0,157494860962043;48660;65594;252;6,3;6,5;"Martin Damm";"Martin Damm";0;"V";"V";0;0;0;-0,2;0,823532600492073
"1733";"Kalundborg.06-06-2018.pdf";22;43;5570;"Kalundborg Kommune";"06-06-2018";5635;0,00390417036379769;0,00763087843833185;2018;"06";2018-06-06;1,04240301890759;2,44330847390255;48982;69771;253;6;6,5;"Martin Damm";"Martin Damm";0;"V";"V";0;0;0;-0,5;0,826800587001963
"1734";"Kalundborg.06-09-2017.pdf";0;14;1567;"Kalundborg Kommune";"06-09-2017";1581;0;0,00885515496521189;2017;"09";2017-09-06;0;2,83530596628822;48736;68008;243;6,3;6,4;"Martin Damm";"Martin Damm";0;"V";"V";0;0;0;-0,100000000000001;0,794120721903071
"1735";"Kalundborg.06-12-2017.pdf";38;4;4514;"Kalundborg Kommune";"06-12-2017";4556;0,00834064969271291;0,000877963125548727;2017;"12";2017-12-06;2,22693110422502;0,281112425229003;48736;68008;243;6,3;6,4;"Martin Damm";"Martin Damm";0;"V";"V";0;0;0;-0,100000000000001;0,794120721903071
"1736";"Kalundborg.07-02-2018.pdf";12;9;4721;"Kalundborg Kommune";"07-02-2018";4742;0,00253057781526782;0,00189793336145086;2018;"02";2018-02-07;0,675657491454805;0,607693688532794;48982;69771;253;6;6,5;"Martin Damm";"Martin Damm";0;"V";"V";0;0;0;-0,5;0,826800587001963
"1737";"Kalundborg.07-03-2018.pdf";5;0;2314;"Kalundborg Kommune";"07-03-2018";2319;0,00215610176800345;0;2018;"03";2018-03-07;0,575673390915388;0;48982;69771;253;6;6,5;"Martin Damm";"Martin Damm";0;"V";"V";0;0;0;-0,5;0,826800587001963
"1738";"Kalundborg.07-09-2016.pdf";8;4;3038;"Kalundborg Kommune";"07-09-2016";3050;0,00262295081967213;0,00131147540983607;2016;"09";2016-09-07;0,700320835951625;0,41991744568634;48660;65594;252;6,3;6,5;"Martin Damm";"Martin Damm";0;"V";"V";0;0;0;-0,2;0,823532600492073
"1739";"Kalundborg.07-11-2018.pdf";17;15;3452;"Kalundborg Kommune";"07-11-2018";3484;0,00487944890929966;0,00430539609644087;2018;"11";2018-11-07;1,30279977554864;1,37853208525761;48982;69771;253;6;6,5;"Martin Damm";"Martin Damm";0;"V";"V";0;0;0;-0,5;0,826800587001963
"1740";"Kalundborg.08-01-2019.pdf";19;7;2250;"Kalundborg Kommune";"08-01-2019";2276;0,00834797891036907;0,00307557117750439;2019;"01";2019-01-08;2,22888798568743;0,984758069574182;48681;73322;267;6;6,3;"Martin Damm";"Martin Damm";0;"V";"V";0;0;0;-0,3;0,872552398140411
"1741";"Kalundborg.08-06-2016.pdf";14;9;4536;"Kalundborg Kommune";"08-06-2016";4559;0,00307084887036631;0,00197411713094977;2016;"06";2016-06-08;0,819908414540864;0,632086745124481;48660;65594;252;6,3;6,5;"Martin Damm";"Martin Damm";0;"V";"V";0;0;0;-0,2;0,823532600492073
"1742";"Kalundborg.08-08-2018.pdf";16;18;4185;"Kalundborg Kommune";"08-08-2018";4219;0,00379236785968239;0,00426641384214269;2018;"08";2018-08-08;1,01255205008412;1,36605047216047;48982;69771;253;6;6,5;"Martin Damm";"Martin Damm";0;"V";"V";0;0;0;-0,5;0,826800587001963
"1743";"Kalundborg.08-11-2017.pdf";6;1;3637;"Kalundborg Kommune";"08-11-2017";3644;0,00164654226125137;0,000274423710208562;2017;"11";2017-11-08;0,439622368891148;0,0878669188627426;48736;68008;243;6,3;6,4;"Martin Damm";"Martin Damm";0;"V";"V";0;0;0;-0,100000000000001;0,794120721903071
"1744";"Kalundborg.08-12-2016.pdf";18;0;2136;"Kalundborg Kommune";"08-12-2016";2154;0,00835654596100279;0;2016;"12";2016-12-08;2,23117536523585;0;48660;65594;252;6,3;6,5;"Martin Damm";"Martin Damm";0;"V";"V";0;0;0;-0,2;0,823532600492073
"1745";"Kalundborg.09-01-2018.pdf";0;1;1309;"Kalundborg Kommune";"09-01-2018";1310;0;0,000763358778625954;2018;"01";2018-01-09;0;0,244417597202927;48982;69771;253;6;6,5;"Martin Damm";"Martin Damm";0;"V";"V";0;0;0;-0,5;0,826800587001963
"1746";"Kalundborg.09-08-2017.pdf";20;5;3558;"Kalundborg Kommune";"09-08-2017";3583;0,00558191459670667;0,00139547864917667;2017;"08";2017-08-09;1,49035623056967;0,446814195277469;48736;68008;243;6,3;6,4;"Martin Damm";"Martin Damm";0;"V";"V";0;0;0;-0,100000000000001;0,794120721903071
"1747";"Kalundborg.09-11-2016.pdf";22;7;8310;"Kalundborg Kommune";"09-11-2016";8339;0,00263820601990646;0,000839429188152057;2016;"11";2016-11-09;0,704393933510524;0,268774357399069;48660;65594;252;6,3;6,5;"Martin Damm";"Martin Damm";0;"V";"V";0;0;0;-0,2;0,823532600492073
"1748";"Kalundborg.10-01-2017.pdf";4;1;2767;"Kalundborg Kommune";"10-01-2017";2772;0,00144300144300144;0,000360750360750361;2017;"01";2017-01-10;0,385277516171078;0,115507594637747;48736;68008;243;6,3;6,4;"Martin Damm";"Martin Damm";0;"V";"V";0;0;0;-0,100000000000001;0,794120721903071
"1749";"Kalundborg.10-08-2016.pdf";23;13;8749;"Kalundborg Kommune";"10-08-2016";8785;0,00261809903244166;0,00147979510529311;2016;"08";2016-08-10;0,699025421770155;0,473811232824797;48660;65594;252;6,3;6,5;"Martin Damm";"Martin Damm";0;"V";"V";0;0;0;-0,2;0,823532600492073
"1750";"Kalundborg.11-01-2016.pdf";28;17;4946;"Kalundborg Kommune";"11-01-2016";4991;0,00561009817671809;0,00340613103586456;2016;"01";2016-01-11;1,49788117086428;1,09059905624307;48660;65594;252;6,3;6,5;"Martin Damm";"Martin Damm";0;"V";"V";0;0;0;-0,2;0,823532600492073
"1751";"Kalundborg.11-05-2016.pdf";6;9;4367;"Kalundborg Kommune";"11-05-2016";4382;0,00136923779096303;0,00205385668644455;2016;"05";2016-05-11;0,365582818858819;0,657618318352923;48660;65594;252;6,3;6,5;"Martin Damm";"Martin Damm";0;"V";"V";0;0;0;-0,2;0,823532600492073
"1752";"Kalundborg.14-06-2017.pdf";3;7;4448;"Kalundborg Kommune";"14-06-2017";4458;0,000672947510094213;0,0015702108568865;2017;"06";2017-06-14;0,179675180825409;0,502761185812212;48736;68008;243;6,3;6,4;"Martin Damm";"Martin Damm";0;"V";"V";0;0;0;-0,100000000000001;0,794120721903071
"1753";"Kalundborg.23-01-2019.pdf";0;1;421;"Kalundborg Kommune";"23-01-2019";422;0;0,0023696682464455;2019;"01";2019-01-23;0;0,758737090843209;48681;73322;267;6;6,3;"Martin Damm";"Martin Damm";0;"V";"V";0;0;0;-0,3;0,872552398140411
"1754";"Kalundborg.31-01-2017.pdf";33;4;8264;"Kalundborg Kommune";"31-01-2017";8301;0,00397542464763282;0,000481869654258523;2017;"01";2017-01-31;1,06142772163792;0,154288424207124;48736;68008;243;6,3;6,4;"Martin Damm";"Martin Damm";0;"V";"V";0;0;0;-0,100000000000001;0,794120721903071
"1755";"Kerteminde.01-04-2019.pdf";0;6;1196;"Kerteminde Kommune";"01-04-2019";1202;0;0,00499168053244592;2019;"04";2019-04-01;0;1,59827147588603;23773;69186;334;7,2;6,9;"Hans Luunbjerg";"Kasper Olesen";1;"V";"S";1;1;0;0,3;1,09150749430299
"1756";"Kerteminde.01-10-2018.pdf";1;2;1439;"Kerteminde Kommune";"01-10-2018";1442;0,000693481276005548;0,0013869625520111;2018;"10";2018-10-01;0,185157641266683;0,444087451228619;23756;68491;340;7,2;7;"Hans Luunbjerg";"Kasper Olesen";1;"V";"S";1;1;0;0,2;1,11111541336232
"1757";"Kerteminde.03-09-2018.pdf";2;0;944;"Kerteminde Kommune";"03-09-2018";946;0,00211416490486258;0;2018;"09";2018-09-03;0,564476360901812;0;23756;68491;340;7,2;7;"Hans Luunbjerg";"Kasper Olesen";1;"V";"S";1;1;0;0,2;1,11111541336232
"1758";"Kerteminde.03-12-2018.pdf";3;11;1652;"Kerteminde Kommune";"03-12-2018";1666;0,00180072028811525;0,00660264105642257;2018;"12";2018-12-03;0,48078748866727;2,1140801774875;23756;68491;340;7,2;7;"Hans Luunbjerg";"Kasper Olesen";1;"V";"S";1;1;0;0,2;1,11111541336232
"1759";"Kerteminde.04-02-2019.pdf";0;0;756;"Kerteminde Kommune";"04-02-2019";756;0;0;2019;"02";2019-02-04;0;0;23773;69186;334;7,2;6,9;"Hans Luunbjerg";"Kasper Olesen";1;"V";"S";1;1;0;0,3;1,09150749430299
"1760";"Kerteminde.05-03-2018.pdf";0;0;816;"Kerteminde Kommune";"05-03-2018";816;0;0;2018;"03";2018-03-05;0;0;23756;68491;340;7,2;7;"Hans Luunbjerg";"Kasper Olesen";1;"V";"S";1;1;0;0,2;1,11111541336232
"1761";"Kerteminde.09-04-2018.pdf";2;8;2418;"Kerteminde Kommune";"09-04-2018";2428;0,000823723228995058;0,00329489291598023;2018;"04";2018-04-09;0,219931893497988;1,05498205052993;23756;68491;340;7,2;7;"Hans Luunbjerg";"Kasper Olesen";1;"V";"S";1;1;0;0,2;1,11111541336232
"1762";"Kerteminde.10-01-2018.pdf";0;2;233;"Kerteminde Kommune";"10-01-2018";235;0;0,00851063829787234;2018;"01";2018-01-10;0;2,72499619009221;23756;68491;340;7,2;7;"Hans Luunbjerg";"Kasper Olesen";1;"V";"S";1;1;0;0,2;1,11111541336232
"1763";"Kerteminde.11-03-2019.pdf";1;0;955;"Kerteminde Kommune";"11-03-2019";956;0,00104602510460251;0;2019;"03";2019-03-11;0,279285898228616;0;23773;69186;334;7,2;6,9;"Hans Luunbjerg";"Kasper Olesen";1;"V";"S";1;1;0;0,3;1,09150749430299
"1764";"Kerteminde.11-06-2018.pdf";21;5;1572;"Kerteminde Kommune";"11-06-2018";1598;0,0131414267834793;0,00312891113892365;2018;"06";2018-06-11;3,50872571516752;1,00183683459272;23756;68491;340;7,2;7;"Hans Luunbjerg";"Kasper Olesen";1;"V";"S";1;1;0;0,2;1,11111541336232
"1765";"Kerteminde.12-11-2018.pdf";2;2;1656;"Kerteminde Kommune";"12-11-2018";1660;0,00120481927710843;0,00120481927710843;2018;"11";2018-11-12;0,321683516513924;0,38576753293474;23756;68491;340;7,2;7;"Hans Luunbjerg";"Kasper Olesen";1;"V";"S";1;1;0;0,2;1,11111541336232
"1766";"Kerteminde.13-08-2018.pdf";2;15;2034;"Kerteminde Kommune";"13-08-2018";2051;0,000975134080936129;0,00731350560702097;2018;"08";2018-08-13;0,260358184989329;2,34168980255364;23756;68491;340;7,2;7;"Hans Luunbjerg";"Kasper Olesen";1;"V";"S";1;1;0;0,2;1,11111541336232
"1767";"Kerteminde.14-01-2019.pdf";2;2;1062;"Kerteminde Kommune";"14-01-2019";1066;0,00187617260787992;0,00187617260787992;2019;"01";2019-01-14;0,500933055734629;0,600726176990308;23773;69186;334;7,2;6,9;"Hans Luunbjerg";"Kasper Olesen";1;"V";"S";1;1;0;0,3;1,09150749430299
"1768";"Kerteminde.14-05-2018.pdf";3;6;1085;"Kerteminde Kommune";"14-05-2018";1094;0,00274223034734918;0,00548446069469835;2018;"05";2018-05-14;0,732168150017981;1,75605330348721;23756;68491;340;7,2;7;"Hans Luunbjerg";"Kasper Olesen";1;"V";"S";1;1;0;0,2;1,11111541336232
"1769";"Kerteminde.29-01-2018.pdf";4;4;1782;"Kerteminde Kommune";"29-01-2018";1790;0,00223463687150838;0,00223463687150838;2018;"01";2018-01-29;0,596642052975547;0,715501792929238;23756;68491;340;7,2;7;"Hans Luunbjerg";"Kasper Olesen";1;"V";"S";1;1;0;0,2;1,11111541336232
"1770";"Koebenhavn.01-02-2017.pdf";4;3;2233;"Københavns Kommune";"01-02-2017";2240;0,00178571428571429;0,00133928571428571;2017;"02";2017-02-01;0,476780926261709;0,428821945092635;602481;67009;624;6,9;7;"Frank Jensen";"Frank Jensen";0;"S";"S";0;0;0;-0,0999999999999996;2,03922358217085
"1771";"Koebenhavn.02-05-2018.pdf";5;40;3032;"Københavns Kommune";"02-05-2018";3077;0,0016249593760156;0,0129996750081248;2018;"05";2018-05-02;0,433859796403245;4,16232762217529;613288;69256;647;6,9;7;"Frank Jensen";"Frank Jensen";0;"S";"S";0;0;0;-0,0999999999999996;2,1143872718983
"1772";"Koebenhavn.03-04-2019.pdf";2;15;1360;"Københavns Kommune";"03-04-2019";1377;0,00145243282498184;0,0108932461873638;2019;"04";2019-04-03;0,387795669871543;3,48787638710059;623404;66679;649;6,9;7,1;"Frank Jensen";"Frank Jensen";0;"S";"S";0;0;0;-0,199999999999999;2,12092324491808
"1773";"Koebenhavn.04-04-2018.pdf";3;10;2229;"Københavns Kommune";"04-04-2018";2242;0,00133809099018733;0,00446030330062444;2018;"04";2018-04-04;0,35726670656542;1,42813136635073;613288;69256;647;6,9;7;"Frank Jensen";"Frank Jensen";0;"S";"S";0;0;0;-0,0999999999999996;2,1143872718983
"1774";"Koebenhavn.05-12-2018.pdf";19;28;2995;"Københavns Kommune";"05-12-2018";3042;0,00624589086127548;0,00920447074293228;2018;"12";2018-12-05;1,66763611289434;2,94715235549091;613288;69256;647;6,9;7;"Frank Jensen";"Frank Jensen";0;"S";"S";0;0;0;-0,0999999999999996;2,1143872718983
"1775";"Koebenhavn.06-04-2016.pdf";15;3;3049;"Københavns Kommune";"06-04-2016";3067;0,00489077274209325;0,00097815454841865;2016;"04";2016-04-06;1,30582320854201;0,313192421587057;591481;67822;609;6,7;6,9;"Frank Jensen";"Frank Jensen";0;"S";"S";0;0;0;-0,2;1,99020378452251
"1776";"Koebenhavn.06-06-2018.pdf";15;5;3613;"Københavns Kommune";"06-06-2018";3633;0,00412881915772089;0,00137627305257363;2018;"06";2018-06-06;1,10238364453574;0,440664811912791;613288;69256;647;6,9;7;"Frank Jensen";"Frank Jensen";0;"S";"S";0;0;0;-0,0999999999999996;2,1143872718983
"1777";"Koebenhavn.06-12-2017.pdf";14;28;4978;"Københavns Kommune";"06-12-2017";5020;0,00278884462151394;0,00557768924302789;2017;"12";2017-12-06;0,744614036233426;1,78590387757039;602481;67009;624;6,9;7;"Frank Jensen";"Frank Jensen";0;"S";"S";0;0;0;-0,0999999999999996;2,03922358217085
"1778";"Koebenhavn.07-06-2017.pdf";22;16;4731;"Københavns Kommune";"07-06-2017";4769;0,00461312644160201;0,00335500104843783;2017;"06";2017-06-07;1,23169239076206;1,07422789628294;602481;67009;624;6,9;7;"Frank Jensen";"Frank Jensen";0;"S";"S";0;0;0;-0,0999999999999996;2,03922358217085
"1779";"Koebenhavn.07-12-2016.pdf";24;3;2362;"Københavns Kommune";"07-12-2016";2389;0,0100460443700293;0,00125575554625366;2016;"12";2016-12-07;2,68226691040493;0,402076666809336;591481;67822;609;6,7;6,9;"Frank Jensen";"Frank Jensen";0;"S";"S";0;0;0;-0,2;1,99020378452251
"1780";"Koebenhavn.08-06-2016.pdf";17;20;7868;"Københavns Kommune";"08-06-2016";7905;0,0021505376344086;0,00253004427577483;2016;"06";2016-06-08;0,574187782164639;0,810087418939492;591481;67822;609;6,7;6,9;"Frank Jensen";"Frank Jensen";0;"S";"S";0;0;0;-0,2;1,99020378452251
"1781";"Koebenhavn.08-11-2017.pdf";11;25;4692;"Københavns Kommune";"08-11-2017";4728;0,00232656514382403;0,00528764805414552;2017;"11";2017-11-08;0,621186655197151;1,69303644424616;602481;67009;624;6,9;7;"Frank Jensen";"Frank Jensen";0;"S";"S";0;0;0;-0,0999999999999996;2,03922358217085
"1782";"Koebenhavn.09-03-2016.pdf";18;33;6940;"Københavns Kommune";"09-03-2016";6991;0,00257473895007867;0,0047203547418109;2016;"03";2016-03-09;0,687448396040342;1,51139647075991;591481;67822;609;6,7;6,9;"Frank Jensen";"Frank Jensen";0;"S";"S";0;0;0;-0,2;1,99020378452251
"1783";"Koebenhavn.09-11-2016.pdf";11;20;4075;"Københavns Kommune";"09-11-2016";4106;0,00267900633219679;0,00487092060399415;2016;"11";2016-11-09;0,71528750749443;1,55960571035477;591481;67822;609;6,7;6,9;"Frank Jensen";"Frank Jensen";0;"S";"S";0;0;0;-0,2;1,99020378452251
"1784";"Koebenhavn.10-05-2017.pdf";27;25;5125;"Københavns Kommune";"10-05-2017";5177;0,00521537570021248;0,00482905157427081;2017;"05";2017-05-10;1,39249132800406;1,54619978914349;602481;67009;624;6,9;7;"Frank Jensen";"Frank Jensen";0;"S";"S";0;0;0;-0,0999999999999996;2,03922358217085
"1785";"Koebenhavn.11-01-2017.pdf";11;10;2767;"Københavns Kommune";"11-01-2017";2788;0,0039454806312769;0,00358680057388809;2017;"01";2017-01-11;1,05343274955959;1,14844710306971;602481;67009;624;6,9;7;"Frank Jensen";"Frank Jensen";0;"S";"S";0;0;0;-0,0999999999999996;2,03922358217085
"1786";"Koebenhavn.11-05-2016.pdf";14;45;6474;"Københavns Kommune";"11-05-2016";6533;0,00214296647788152;0,00688810653604776;2016;"05";2016-05-11;0,572166303672402;2,20548252795232;591481;67822;609;6,7;6,9;"Frank Jensen";"Frank Jensen";0;"S";"S";0;0;0;-0,2;1,99020378452251
"1787";"Koebenhavn.11-10-2017.pdf";9;26;3314;"Københavns Kommune";"11-10-2017";3349;0,00268736936398925;0,00776351149596895;2017;"10";2017-10-11;0,717520414559276;2,48577586166966;602481;67009;624;6,9;7;"Frank Jensen";"Frank Jensen";0;"S";"S";0;0;0;-0,0999999999999996;2,03922358217085
"1788";"Koebenhavn.12-09-2018.pdf";0;21;673;"Københavns Kommune";"12-09-2018";694;0;0,0302593659942363;2018;"09";2018-09-12;0;9,6886572032457;613288;69256;647;6,9;7;"Frank Jensen";"Frank Jensen";0;"S";"S";0;0;0;-0,0999999999999996;2,1143872718983
"1789";"Koebenhavn.12-10-2016.pdf";21;3;2803;"Københavns Kommune";"12-10-2016";2827;0,00742836929607358;0,0010611956137248;2016;"10";2016-10-12;1,98335468441376;0,339781095510259;591481;67822;609;6,7;6,9;"Frank Jensen";"Frank Jensen";0;"S";"S";0;0;0;-0,2;1,99020378452251
"1790";"Koebenhavn.13-01-2016.pdf";3;9;2861;"Københavns Kommune";"13-01-2016";2873;0,00104420466411417;0,0031326139923425;2016;"01";2016-01-13;0,278799845499364;1,00302244031413;591481;67822;609;6,7;6,9;"Frank Jensen";"Frank Jensen";0;"S";"S";0;0;0;-0,2;1,99020378452251
"1791";"Koebenhavn.13-03-2019.pdf";28;10;6516;"Københavns Kommune";"13-03-2019";6554;0,00427220018309429;0,00152578577967653;2019;"03";2019-03-13;1,14066599386384;0,488536851290562;623404;66679;649;6,9;7,1;"Frank Jensen";"Frank Jensen";0;"S";"S";0;0;0;-0,199999999999999;2,12092324491808
"1792";"Koebenhavn.14-03-2018.pdf";9;13;3552;"Københavns Kommune";"14-03-2018";3574;0,00251818690542809;0,00363738108561835;2018;"03";2018-03-14;0,672349151751263;1,16464232802626;613288;69256;647;6,9;7;"Frank Jensen";"Frank Jensen";0;"S";"S";0;0;0;-0,0999999999999996;2,1143872718983
"1793";"Koebenhavn.14-11-2018.pdf";37;52;5202;"Københavns Kommune";"14-11-2018";5291;0,00699300699300699;0,00982800982800983;2018;"11";2018-11-14;1,86711411682907;3,14680149715808;613288;69256;647;6,9;7;"Frank Jensen";"Frank Jensen";0;"S";"S";0;0;0;-0,0999999999999996;2,1143872718983
"1794";"Koebenhavn.15-03-2017.pdf";6;15;4133;"Københavns Kommune";"15-03-2017";4154;0,00144439094848339;0,00361097737120847;2017;"03";2017-03-15;0,385648510409086;1,15618820053864;602481;67009;624;6,9;7;"Frank Jensen";"Frank Jensen";0;"S";"S";0;0;0;-0,0999999999999996;2,03922358217085
"1795";"Koebenhavn.15-08-2018.pdf";17;49;6324;"Københavns Kommune";"15-08-2018";6390;0,002660406885759;0,00766823161189358;2018;"08";2018-08-15;0,710321505166114;2,45526847644067;613288;69256;647;6,9;7;"Frank Jensen";"Frank Jensen";0;"S";"S";0;0;0;-0,0999999999999996;2,1143872718983
"1796";"Koebenhavn.16-01-2019.pdf";3;33;3984;"Københavns Kommune";"16-01-2019";4020;0,000746268656716418;0,0082089552238806;2019;"01";2019-01-16;0,199251730378028;2,62840117589118;623404;66679;649;6,9;7,1;"Frank Jensen";"Frank Jensen";0;"S";"S";0;0;0;-0,199999999999999;2,12092324491808
"1797";"Koebenhavn.16-08-2017.pdf";5;31;5508;"Københavns Kommune";"16-08-2017";5544;0,000901875901875902;0,00559163059163059;2017;"08";2017-08-16;0,240798447606924;1,79036771688508;602481;67009;624;6,9;7;"Frank Jensen";"Frank Jensen";0;"S";"S";0;0;0;-0,0999999999999996;2,03922358217085
"1798";"Koebenhavn.17-01-2018.pdf";4;15;3878;"Københavns Kommune";"17-01-2018";3897;0,00102643058763151;0,00384911470361817;2018;"01";2018-01-17;0,274054214736009;1,23243669105402;613288;69256;647;6,9;7;"Frank Jensen";"Frank Jensen";0;"S";"S";0;0;0;-0,0999999999999996;2,1143872718983
"1799";"Koebenhavn.17-08-2016.pdf";8;51;4900;"Københavns Kommune";"17-08-2016";4959;0,00161322847348256;0,0102843315184513;2016;"08";2016-08-17;0,430727676880915;3,29290979413744;591481;67822;609;6,7;6,9;"Frank Jensen";"Frank Jensen";0;"S";"S";0;0;0;-0,2;1,99020378452251
"1800";"Koebenhavn.18-04-2018.pdf";1;3;1101;"Københavns Kommune";"18-04-2018";1105;0,000904977375565611;0,00271493212669683;2018;"04";2018-04-18;0,241626532766115;0,869286114938916;613288;69256;647;6,9;7;"Frank Jensen";"Frank Jensen";0;"S";"S";0;0;0;-0,0999999999999996;2,1143872718983
"1801";"Koebenhavn.20-02-2019.pdf";12;39;3675;"Københavns Kommune";"20-02-2019";3726;0,00322061191626409;0,0104669887278583;2019;"02";2019-02-20;0,859894746236899;3,35139426760535;623404;66679;649;6,9;7,1;"Frank Jensen";"Frank Jensen";0;"S";"S";0;0;0;-0,199999999999999;2,12092324491808
"1802";"Koebenhavn.20-06-2018.pdf";0;0;132;"Københavns Kommune";"20-06-2018";132;0;0;2018;"06";2018-06-20;0;0;613288;69256;647;6,9;7;"Frank Jensen";"Frank Jensen";0;"S";"S";0;0;0;-0,0999999999999996;2,1143872718983
"1803";"Koebenhavn.21-02-2018.pdf";37;11;4908;"Københavns Kommune";"21-02-2018";4956;0,00746569814366425;0,00221953188054883;2018;"02";2018-02-21;1,99332138663087;0,710665370398341;613288;69256;647;6,9;7;"Frank Jensen";"Frank Jensen";0;"S";"S";0;0;0;-0,0999999999999996;2,1143872718983
"1804";"Koebenhavn.21-09-2016.pdf";5;14;4380;"Københavns Kommune";"21-09-2016";4399;0,00113662195953626;0,00318254148670152;2016;"09";2016-09-21;0,303475015579174;1,01900857756346;591481;67822;609;6,7;6,9;"Frank Jensen";"Frank Jensen";0;"S";"S";0;0;0;-0,2;1,99020378452251
"1805";"Koebenhavn.22-02-2017.pdf";3;9;1262;"Københavns Kommune";"22-02-2017";1274;0,00235478806907378;0,00706436420722135;2017;"02";2017-02-22;0,628722100564891;2,26191795213698;602481;67009;624;6,9;7;"Frank Jensen";"Frank Jensen";0;"S";"S";0;0;0;-0,0999999999999996;2,03922358217085
"1806";"Koebenhavn.23-05-2018.pdf";3;23;4943;"Københavns Kommune";"23-05-2018";4969;0,000603743207888911;0,00462869792714832;2018;"05";2018-05-23;0,161197817693635;1,48204914544661;613288;69256;647;6,9;7;"Frank Jensen";"Frank Jensen";0;"S";"S";0;0;0;-0,0999999999999996;2,1143872718983
"1807";"Koebenhavn.23-11-2016.pdf";5;13;2750;"Københavns Kommune";"23-11-2016";2768;0,00180635838150289;0,00469653179190751;2016;"11";2016-11-23;0,482292844484388;1,5037686706524;591481;67822;609;6,7;6,9;"Frank Jensen";"Frank Jensen";0;"S";"S";0;0;0;-0,2;1,99020378452251
"1808";"Koebenhavn.24-02-2016.pdf";45;21;6097;"Københavns Kommune";"24-02-2016";6163;0,00730163881226675;0,00340743144572448;2016;"02";2016-02-24;1,94951798503895;1,09101543064295;591481;67822;609;6,7;6,9;"Frank Jensen";"Frank Jensen";0;"S";"S";0;0;0;-0,2;1,99020378452251
"1809";"Koebenhavn.24-10-2018.pdf";4;2;2519;"Københavns Kommune";"24-10-2018";2525;0,00158415841584158;0,000792079207920792;2018;"10";2018-10-24;0,42296604943613;0,253613506800661;613288;69256;647;6,9;7;"Frank Jensen";"Frank Jensen";0;"S";"S";0;0;0;-0,0999999999999996;2,1143872718983
"1810";"Koebenhavn.26-04-2017.pdf";17;24;3865;"Københavns Kommune";"26-04-2017";3906;0,00435227854582693;0,00614439324116743;2017;"04";2017-04-26;1,16204670199986;1,96735516028162;602481;67009;624;6,9;7;"Frank Jensen";"Frank Jensen";0;"S";"S";0;0;0;-0,0999999999999996;2,03922358217085
"1811";"Koebenhavn.26-09-2018.pdf";15;9;3176;"Københavns Kommune";"26-09-2018";3200;0,0046875;0,0028125;2018;"09";2018-09-26;1,25154993143699;0,900526084694534;613288;69256;647;6,9;7;"Frank Jensen";"Frank Jensen";0;"S";"S";0;0;0;-0,0999999999999996;2,1143872718983
"1812";"Koebenhavn.27-04-2016.pdf";12;9;4656;"Københavns Kommune";"27-04-2016";4677;0,00256574727389352;0,00192431045542014;2016;"04";2016-04-27;0,685047642608229;0,616139292500002;591481;67822;609;6,7;6,9;"Frank Jensen";"Frank Jensen";0;"S";"S";0;0;0;-0,2;1,99020378452251
"1813";"Koebenhavn.29-03-2017.pdf";4;1;1190;"Københavns Kommune";"29-03-2017";1195;0,00334728033472803;0,000836820083682008;2017;"03";2017-03-29;0,893714874331572;0,267938955929568;602481;67009;624;6,9;7;"Frank Jensen";"Frank Jensen";0;"S";"S";0;0;0;-0,0999999999999996;2,03922358217085
"1814";"Koebenhavn.29-08-2018.pdf";6;29;4147;"Københavns Kommune";"29-08-2018";4182;0,00143472022955524;0,00693448110951698;2018;"08";2018-08-29;0,383066454385304;2,22033106593477;613288;69256;647;6,9;7;"Frank Jensen";"Frank Jensen";0;"S";"S";0;0;0;-0,0999999999999996;2,1143872718983
"1815";"Koebenhavn.30-08-2017.pdf";6;34;3199;"Københavns Kommune";"30-08-2017";3239;0,00185242358752701;0,0104970669959864;2017;"08";2017-08-30;0,494592130978494;3,36102493961666;602481;67009;624;6,9;7;"Frank Jensen";"Frank Jensen";0;"S";"S";0;0;0;-0,0999999999999996;2,03922358217085
"1816";"Koebenhavn.31-08-2016.pdf";8;34;4362;"Københavns Kommune";"31-08-2016";4404;0,00181653042688465;0,00772025431425976;2016;"08";2016-08-31;0,485008753327079;2,47192547216584;591481;67822;609;6,7;6,9;"Frank Jensen";"Frank Jensen";0;"S";"S";0;0;0;-0,2;1,99020378452251
"1817";"Koege.01-03-2017.pdf";6;3;2518;"Køge Kommune";"01-03-2017";2527;0,00237435694499406;0,00118717847249703;2017;"03";2017-03-01;0,633946937965708;0,380119175705383;60109;64670;465;6,8;6,8;"Flemming Christensen";"Maria Stærke";1;"C";"S";1;1;0;0;1,51961372709847
"1818";"Koege.01-11-2017.pdf";2;0;678;"Køge Kommune";"01-11-2017";680;0,00294117647058824;0;2017;"11";2017-11-01;0,785286231489874;0;60109;64670;465;6,8;6,8;"Flemming Christensen";"Maria Stærke";1;"C";"S";1;1;0;0;1,51961372709847
"1819";"Koege.02-03-2016.pdf";0;0;1150;"Køge Kommune";"02-03-2016";1150;0;0;2016;"03";2016-03-02;0;0;59868;63952;474;6,9;6,9;"Flemming Christensen";"Maria Stærke";1;"C";"S";1;1;0;0;1,54902560568747
"1820";"Koege.02-05-2018.pdf";5;8;1972;"Køge Kommune";"02-05-2018";1985;0,00251889168765743;0,00403022670025189;2018;"05";2018-05-02;0,672537326716769;1,29042640739883;60356;66811;452;7;7,1;"Flemming Christensen";"Maria Stærke";1;"C";"S";1;1;0;-0,0999999999999996;1,47712990246991
"1821";"Koege.02-11-2016.pdf";0;12;1346;"Køge Kommune";"02-11-2016";1358;0;0,00883652430044183;2016;"11";2016-11-02;0;2,82934066865244;59868;63952;474;6,9;6,9;"Flemming Christensen";"Maria Stærke";1;"C";"S";1;1;0;0;1,54902560568747
"1822";"Koege.03-02-2016.pdf";5;2;1753;"Køge Kommune";"03-02-2016";1760;0,00284090909090909;0,00113636363636364;2016;"02";2016-02-03;0,75851510996181;0,363848923108902;59868;63952;474;6,9;6,9;"Flemming Christensen";"Maria Stærke";1;"C";"S";1;1;0;0;1,54902560568747
"1823";"Koege.03-04-2019.pdf";0;2;596;"Køge Kommune";"03-04-2019";598;0;0,00334448160535117;2019;"04";2019-04-03;0;1,07085970680881;60675;72296;442;7,1;7;"Flemming Christensen";"Maria Stærke";1;"C";"S";1;1;0;0,0999999999999996;1,44445003737102
"1824";"Koege.03-05-2017.pdf";3;1;1897;"Køge Kommune";"03-05-2017";1901;0,00157811678064177;0,000526038926880589;2017;"05";2017-05-03;0,421352949037176;0,168430853411801;60109;64670;465;6,8;6,8;"Flemming Christensen";"Maria Stærke";1;"C";"S";1;1;0;0;1,51961372709847
"1825";"Koege.03-10-2018.pdf";8;2;1621;"Køge Kommune";"03-10-2018";1631;0,00490496627835684;0,00122624156958921;2018;"10";2018-10-03;1,30961284466736;0,392626673618436;60356;66811;452;7;7,1;"Flemming Christensen";"Maria Stærke";1;"C";"S";1;1;0;-0,0999999999999996;1,47712990246991
"1826";"Koege.04-01-2017.pdf";0;0;885;"Køge Kommune";"04-01-2017";885;0;0;2017;"01";2017-01-04;0;0;60109;64670;465;6,8;6,8;"Flemming Christensen";"Maria Stærke";1;"C";"S";1;1;0;0;1,51961372709847
"1827";"Koege.04-04-2018.pdf";3;2;2334;"Køge Kommune";"04-04-2018";2339;0,00128259940145361;0,000855066267635742;2018;"04";2018-04-04;0,34245060116275;0,273781147786092;60356;66811;452;7;7,1;"Flemming Christensen";"Maria Stærke";1;"C";"S";1;1;0;-0,0999999999999996;1,47712990246991
"1828";"Koege.04-04-2019.pdf";0;0;263;"Køge Kommune";"04-04-2019";263;0;0;2019;"04";2019-04-04;0;0;60675;72296;442;7,1;7;"Flemming Christensen";"Maria Stærke";1;"C";"S";1;1;0;0,0999999999999996;1,44445003737102
"1829";"Koege.04-05-2016.pdf";0;0;1475;"Køge Kommune";"04-05-2016";1475;0;0;2016;"05";2016-05-04;0;0;59868;63952;474;6,9;6,9;"Flemming Christensen";"Maria Stærke";1;"C";"S";1;1;0;0;1,54902560568747
"1830";"Koege.04-10-2017.pdf";0;5;481;"Køge Kommune";"04-10-2017";486;0;0,0102880658436214;2017;"10";2017-10-04;0;3,29410547670611;60109;64670;465;6,8;6,8;"Flemming Christensen";"Maria Stærke";1;"C";"S";1;1;0;0;1,51961372709847
"1831";"Koege.05-04-2017.pdf";3;0;1285;"Køge Kommune";"05-04-2017";1288;0,00232919254658385;0;2017;"04";2017-04-05;0,621888164689186;0;60109;64670;465;6,8;6,8;"Flemming Christensen";"Maria Stærke";1;"C";"S";1;1;0;0;1,51961372709847
"1832";"Koege.05-09-2018.pdf";5;0;1397;"Køge Kommune";"05-09-2018";1402;0,00356633380884451;0;2018;"09";2018-09-05;0,952201564574027;0;60356;66811;452;7;7,1;"Flemming Christensen";"Maria Stærke";1;"C";"S";1;1;0;-0,0999999999999996;1,47712990246991
"1833";"Koege.05-10-2016.pdf";4;1;734;"Køge Kommune";"05-10-2016";739;0,0054127198917456;0,0013531799729364;2016;"10";2016-10-05;1,44518169800572;0,43327070681439;59868;63952;474;6,9;6,9;"Flemming Christensen";"Maria Stærke";1;"C";"S";1;1;0;0;1,54902560568747
"1834";"Koege.05-12-2018.pdf";2;0;1101;"Køge Kommune";"05-12-2018";1103;0,00181323662737987;0;2018;"12";2018-12-05;0,484129317690947;0;60356;66811;452;7;7,1;"Flemming Christensen";"Maria Stærke";1;"C";"S";1;1;0;-0,0999999999999996;1,47712990246991
"1835";"Koege.06-01-2016.pdf";0;17;2309;"Køge Kommune";"06-01-2016";2326;0;0,00730868443680138;2016;"01";2016-01-06;0;2,34014612627222;59868;63952;474;6,9;6,9;"Flemming Christensen";"Maria Stærke";1;"C";"S";1;1;0;0;1,54902560568747
"1836";"Koege.06-02-2019.pdf";6;1;947;"Køge Kommune";"06-02-2019";954;0,00628930817610063;0,0010482180293501;2019;"02";2019-02-06;1,6792284195381;0,335625841022887;60675;72296;442;7,1;7;"Flemming Christensen";"Maria Stærke";1;"C";"S";1;1;0;0,0999999999999996;1,44445003737102
"1837";"Koege.06-03-2019.pdf";3;0;1223;"Køge Kommune";"06-03-2019";1226;0,00244698205546493;0;2019;"03";2019-03-06;0,653337647732195;0;60675;72296;442;7,1;7;"Flemming Christensen";"Maria Stærke";1;"C";"S";1;1;0;0,0999999999999996;1,44445003737102
"1838";"Koege.06-04-2016.pdf";4;0;763;"Køge Kommune";"06-04-2016";767;0,00521512385919166;0;2016;"04";2016-04-06;1,39242408712676;0;59868;63952;474;6,9;6,9;"Flemming Christensen";"Maria Stærke";1;"C";"S";1;1;0;0;1,54902560568747
"1839";"Koege.06-09-2017.pdf";6;11;2106;"Køge Kommune";"06-09-2017";2123;0,00282618935468676;0,00518134715025907;2017;"09";2017-09-06;0,754584979858381;1,65900027117013;60109;64670;465;6,8;6,8;"Flemming Christensen";"Maria Stærke";1;"C";"S";1;1;0;0;1,51961372709847
"1840";"Koege.06-12-2017.pdf";4;7;1753;"Køge Kommune";"06-12-2017";1764;0,00226757369614512;0,00396825396825397;2017;"12";2017-12-06;0,605436096840266;1,27058354101521;60109;64670;465;6,8;6,8;"Flemming Christensen";"Maria Stærke";1;"C";"S";1;1;0;0;1,51961372709847
"1841";"Koege.07-02-2018.pdf";2;1;1941;"Køge Kommune";"07-02-2018";1944;0,00102880658436214;0,00051440329218107;2018;"02";2018-02-07;0,274688599492343;0,164705273835306;60356;66811;452;7;7,1;"Flemming Christensen";"Maria Stærke";1;"C";"S";1;1;0;-0,0999999999999996;1,47712990246991
"1842";"Koege.07-06-2017.pdf";5;16;3721;"Køge Kommune";"07-06-2017";3742;0,00133618385889898;0,00427578834847675;2017;"06";2017-06-07;0,35675750762501;1,36905206771068;60109;64670;465;6,8;6,8;"Flemming Christensen";"Maria Stærke";1;"C";"S";1;1;0;0;1,51961372709847
"1843";"Koege.07-06-2018.pdf";9;20;4264;"Køge Kommune";"07-06-2018";4293;0,00209643605870021;0,00465874679711158;2018;"06";2018-06-07;0,559742806512698;1,49167040454616;60356;66811;452;7;7,1;"Flemming Christensen";"Maria Stærke";1;"C";"S";1;1;0;-0,0999999999999996;1,47712990246991
"1844";"Koege.07-09-2016.pdf";6;6;2810;"Køge Kommune";"07-09-2016";2822;0,00212615166548547;0,00212615166548547;2016;"09";2016-09-07;0,567676793848102;0,680766234590718;59868;63952;474;6,9;6,9;"Flemming Christensen";"Maria Stærke";1;"C";"S";1;1;0;0;1,54902560568747
"1845";"Koege.07-11-2018.pdf";3;7;2077;"Køge Kommune";"07-11-2018";2087;0,00143747005270724;0,00335409678965022;2018;"11";2018-11-07;0,383800649793805;1,07393836432719;60356;66811;452;7;7,1;"Flemming Christensen";"Maria Stærke";1;"C";"S";1;1;0;-0,0999999999999996;1,47712990246991
"1846";"Koege.07-12-2016.pdf";3;3;1767;"Køge Kommune";"07-12-2016";1773;0,00169204737732657;0,00169204737732657;2016;"12";2016-12-07;0,451772112870655;0,541771662158772;59868;63952;474;6,9;6,9;"Flemming Christensen";"Maria Stærke";1;"C";"S";1;1;0;0;1,54902560568747
"1847";"Koege.08-05-2017.pdf";0;0;523;"Køge Kommune";"08-05-2017";523;0;0;2017;"05";2017-05-08;0;0;60109;64670;465;6,8;6,8;"Flemming Christensen";"Maria Stærke";1;"C";"S";1;1;0;0;1,51961372709847
"1848";"Koege.08-06-2016.pdf";6;0;1185;"Køge Kommune";"08-06-2016";1191;0,00503778337531486;0;2016;"06";2016-06-08;1,34507465343354;0;59868;63952;474;6,9;6,9;"Flemming Christensen";"Maria Stærke";1;"C";"S";1;1;0;0;1,54902560568747
"1849";"Koege.09-01-2019.pdf";3;0;1029;"Køge Kommune";"09-01-2019";1032;0,00290697674418605;0;2019;"01";2019-01-09;0,776154996239992;0;60675;72296;442;7,1;7;"Flemming Christensen";"Maria Stærke";1;"C";"S";1;1;0;0,0999999999999996;1,44445003737102
"1850";"Koege.10-08-2016.pdf";0;0;1187;"Køge Kommune";"10-08-2016";1187;0;0;2016;"08";2016-08-10;0;0;59868;63952;474;6,9;6,9;"Flemming Christensen";"Maria Stærke";1;"C";"S";1;1;0;0;1,54902560568747
"1851";"Koege.13-03-2018.pdf";5;1;2380;"Køge Kommune";"13-03-2018";2386;0,00209555741827326;0,000419111483654652;2018;"03";2018-03-13;0,559508211874596;0,134194070551481;60356;66811;452;7;7,1;"Flemming Christensen";"Maria Stærke";1;"C";"S";1;1;0;-0,0999999999999996;1,47712990246991
"1852";"Koege.14-08-2018.pdf";11;16;2241;"Køge Kommune";"14-08-2018";2268;0,00485008818342152;0,00705467372134039;2018;"08";2018-08-14;1,2949605404639;2,25881518402705;60356;66811;452;7;7,1;"Flemming Christensen";"Maria Stærke";1;"C";"S";1;1;0;-0,0999999999999996;1,47712990246991
"1853";"Koege.15-08-2017.pdf";4;6;1909;"Køge Kommune";"15-08-2017";1919;0,00208441896821261;0,00312662845231892;2017;"08";2017-08-15;0,556534275573855;1,00110594789734;60109;64670;465;6,8;6,8;"Flemming Christensen";"Maria Stærke";1;"C";"S";1;1;0;0;1,51961372709847
"1854";"Koege.16-05-2018.pdf";0;0;139;"Køge Kommune";"16-05-2018";139;0;0;2018;"05";2018-05-16;0;0;60356;66811;452;7;7,1;"Flemming Christensen";"Maria Stærke";1;"C";"S";1;1;0;-0,0999999999999996;1,47712990246991
"1855";"Koege.16-06-2016.pdf";3;0;924;"Køge Kommune";"16-06-2016";927;0,00323624595469256;0;2016;"06";2016-06-16;0,864068992577855;0;59868;63952;474;6,9;6,9;"Flemming Christensen";"Maria Stærke";1;"C";"S";1;1;0;0;1,54902560568747
"1856";"Koege.25-04-2017.pdf";0;0;154;"Køge Kommune";"25-04-2017";154;0;0;2017;"04";2017-04-25;0;0;60109;64670;465;6,8;6,8;"Flemming Christensen";"Maria Stærke";1;"C";"S";1;1;0;0;1,51961372709847
"1857";"Koege.30-10-2018.pdf";0;0;218;"Køge Kommune";"30-10-2018";218;0;0;2018;"10";2018-10-30;0;0;60356;66811;452;7;7,1;"Flemming Christensen";"Maria Stærke";1;"C";"S";1;1;0;-0,0999999999999996;1,47712990246991
"1858";"Koege.31-01-2017.pdf";0;1;570;"Køge Kommune";"31-01-2017";571;0;0,00175131348511384;2017;"01";2017-01-31;0;0,560747902514596;60109;64670;465;6,8;6,8;"Flemming Christensen";"Maria Stærke";1;"C";"S";1;1;0;0;1,51961372709847
"1859";"Kolding.01-06-2016.pdf";2;17;2711;"Kolding Kommune";"01-06-2016";2730;0,000732600732600733;0,00622710622710623;2016;"06";2016-06-01;0,195602431286855;1,99383878743926;91695;58104;432;7,4;7;"Jørn Pedersen";"Jørn Pedersen";0;"V";"V";0;0;0;0,4;1,41177017227213
"1860";"Kolding.02-10-2017.pdf";5;2;3298;"Kolding Kommune";"02-10-2017";3305;0,00151285930408472;0,000605143721633888;2017;"10";2017-10-02;0,403929377770888;0,193759184469491;92282;59627;430;7,4;7,1;"Jørn Pedersen";"Jørn Pedersen";0;"V";"V";0;0;0;0,300000000000001;1,40523419925235
"1861";"Kolding.04-04-2017.pdf";7;4;4055;"Kolding Kommune";"04-04-2017";4066;0,00172159370388588;0,000983767830791933;2017;"04";2017-04-04;0,459660902839621;0,314989721924087;92282;59627;430;7,4;7,1;"Jørn Pedersen";"Jørn Pedersen";0;"V";"V";0;0;0;0,300000000000001;1,40523419925235
"1862";"Kolding.05-12-2016.pdf";4;3;2891;"Kolding Kommune";"05-12-2016";2898;0,00138026224982747;0,0010351966873706;2016;"12";2016-12-05;0,368526319815814;0,331456575917013;91695;58104;432;7,4;7;"Jørn Pedersen";"Jørn Pedersen";0;"V";"V";0;0;0;0,4;1,41177017227213
"1863";"Kolding.06-02-2019.pdf";1;6;4377;"Kolding Kommune";"06-02-2019";4384;0,000228102189781022;0,00136861313868613;2019;"02";2019-02-06;0,0609026730626271;0,438212206664007;92893;61621;423;7,4;7,1;"Jørn Pedersen";"Jørn Pedersen";0;"V";"V";0;0;0;0,300000000000001;1,38235829368312
"1864";"Kolding.07-03-2016.pdf";54;16;7753;"Kolding Kommune";"07-03-2016";7823;0,00690272274063658;0,00204525118241084;2016;"03";2016-03-07;1,84300846352475;0,654862947382506;91695;58104;432;7,4;7;"Jørn Pedersen";"Jørn Pedersen";0;"V";"V";0;0;0;0,4;1,41177017227213
"1865";"Kolding.08-02-2016.pdf";12;4;5460;"Kolding Kommune";"08-02-2016";5476;0,00219138056975895;0,000730460189919649;2016;"02";2016-02-08;0,585092736391287;0,233883895059046;91695;58104;432;7,4;7;"Jørn Pedersen";"Jørn Pedersen";0;"V";"V";0;0;0;0,4;1,41177017227213
"1866";"Kolding.08-02-2017.pdf";9;8;3860;"Kolding Kommune";"08-02-2017";3877;0,00232138251225174;0,00206345112200155;2017;"02";2017-02-08;0,619802906463506;0,660690332392745;92282;59627;430;7,4;7,1;"Jørn Pedersen";"Jørn Pedersen";0;"V";"V";0;0;0;0,300000000000001;1,40523419925235
"1867";"Kolding.08-05-2017.pdf";19;5;4750;"Kolding Kommune";"08-05-2017";4774;0,00397989107666527;0,00104733975701718;2017;"05";2017-05-08;1,06262024621378;0,335344629593458;92282;59627;430;7,4;7,1;"Jørn Pedersen";"Jørn Pedersen";0;"V";"V";0;0;0;0,300000000000001;1,40523419925235
"1868";"Kolding.08-08-2016.pdf";7;25;4690;"Kolding Kommune";"08-08-2016";4722;0,00148242270224481;0,00529436679373147;2016;"08";2016-08-08;0,395802886689094;1,6951876976696;91695;58104;432;7,4;7;"Jørn Pedersen";"Jørn Pedersen";0;"V";"V";0;0;0;0,4;1,41177017227213
"1869";"Kolding.09-05-2016.pdf";2;9;4496;"Kolding Kommune";"09-05-2016";4507;0,000443754160195252;0,00199689372087863;2016;"05";2016-05-09;0,118481170937012;0,639379514316066;91695;58104;432;7,4;7;"Jørn Pedersen";"Jørn Pedersen";0;"V";"V";0;0;0;0,4;1,41177017227213
"1870";"Kolding.09-05-2018.pdf";8;6;5134;"Kolding Kommune";"09-05-2018";5148;0,00155400155400155;0,00116550116550117;2018;"05";2018-05-09;0,414914248184238;0,373178382675797;92515;59452;427;7,5;7,1;"Jørn Pedersen";"Jørn Pedersen";0;"V";"V";0;0;0;0,4;1,39543023972268
"1871";"Kolding.10-10-2016.pdf";2;6;6454;"Kolding Kommune";"10-10-2016";6462;0,000309501702259362;0,000928505106778087;2016;"10";2016-10-10;0,0826361246383649;0,297295313218045;91695;58104;432;7,4;7;"Jørn Pedersen";"Jørn Pedersen";0;"V";"V";0;0;0;0,4;1,41177017227213
"1872";"Kolding.10-10-2018.pdf";17;35;8275;"Kolding Kommune";"10-10-2018";8327;0,00204155157920019;0,0042031944277651;2018;"10";2018-10-10;0,545088797647589;1,34580843422051;92515;59452;427;7,5;7,1;"Jørn Pedersen";"Jørn Pedersen";0;"V";"V";0;0;0;0,4;1,39543023972268
"1873";"Kolding.11-01-2016.pdf";1;1;2656;"Kolding Kommune";"11-01-2016";2658;0,000376222723852521;0,000376222723852521;2016;"01";2016-01-11;0,100450458505101;0,120461644972097;91695;58104;432;7,4;7;"Jørn Pedersen";"Jørn Pedersen";0;"V";"V";0;0;0;0,4;1,41177017227213
"1874";"Kolding.11-04-2016.pdf";38;4;7658;"Kolding Kommune";"11-04-2016";7700;0,00493506493506494;0,000519480519480519;2016;"04";2016-04-11;1,31764910530509;0,166330936278355;91695;58104;432;7,4;7;"Jørn Pedersen";"Jørn Pedersen";0;"V";"V";0;0;0;0,4;1,41177017227213
"1875";"Kolding.11-09-2017.pdf";1;5;1865;"Kolding Kommune";"11-09-2017";1871;0,000534473543559594;0,00267236771779797;2017;"09";2017-09-11;0,142703003050004;0,855657542319172;92282;59627;430;7,4;7,1;"Jørn Pedersen";"Jørn Pedersen";0;"V";"V";0;0;0;0,300000000000001;1,40523419925235
"1876";"Kolding.12-06-2017.pdf";11;7;5602;"Kolding Kommune";"12-06-2017";5620;0,00195729537366548;0,00124555160142349;2017;"06";2017-06-12;0,522592616685432;0,398809495791964;92282;59627;430;7,4;7,1;"Jørn Pedersen";"Jørn Pedersen";0;"V";"V";0;0;0;0,300000000000001;1,40523419925235
"1877";"Kolding.12-09-2016.pdf";1;13;2870;"Kolding Kommune";"12-09-2016";2884;0,000346740638002774;0,00450762829403606;2016;"09";2016-09-12;0,0925788206333416;1,44328421649301;91695;58104;432;7,4;7;"Jørn Pedersen";"Jørn Pedersen";0;"V";"V";0;0;0;0,4;1,41177017227213
"1878";"Kolding.12-09-2019.pdf";0;0;3394;"Kolding Kommune";"12-09-2019";3394;0;0;2019;"09";2019-09-12;0;0;92893;61621;423;7,4;7,1;"Jørn Pedersen";"Jørn Pedersen";0;"V";"V";0;0;0;0,300000000000001;1,38235829368312
"1879";"Kolding.12-12-2018.pdf";38;24;7308;"Kolding Kommune";"12-12-2018";7370;0,00515603799185889;0,00325644504748982;2018;"12";2018-12-12;1,37664831897546;1,04267154084939;92515;59452;427;7,5;7,1;"Jørn Pedersen";"Jørn Pedersen";0;"V";"V";0;0;0;0,4;1,39543023972268
"1880";"Kolding.13-03-2017.pdf";5;2;2872;"Kolding Kommune";"13-03-2017";2879;0,00173671413685307;0,00069468565474123;2017;"03";2017-03-13;0,463698017899544;0,222429352091583;92282;59627;430;7,4;7,1;"Jørn Pedersen";"Jørn Pedersen";0;"V";"V";0;0;0;0,300000000000001;1,40523419925235
"1881";"Kolding.13-03-2019.pdf";37;15;9646;"Kolding Kommune";"13-03-2019";9698;0,003815219632914;0,00154671066199216;2019;"03";2019-03-13;1,01865341226465;0,495236727679677;92893;61621;423;7,4;7,1;"Jørn Pedersen";"Jørn Pedersen";0;"V";"V";0;0;0;0,300000000000001;1,38235829368312
"1882";"Kolding.13-06-2016.pdf";24;16;8355;"Kolding Kommune";"13-06-2016";8395;0,00285884455032758;0,00190589636688505;2016;"06";2016-06-13;0,763303829536316;0,6102433397705;91695;58104;432;7,4;7;"Jørn Pedersen";"Jørn Pedersen";0;"V";"V";0;0;0;0,4;1,41177017227213
"1883";"Kolding.13-06-2018.pdf";53;14;7374;"Kolding Kommune";"13-06-2018";7441;0,00712269856202123;0,00188146754468485;2018;"06";2018-06-13;1,90174141801472;0,602421547198183;92515;59452;427;7,5;7,1;"Jørn Pedersen";"Jørn Pedersen";0;"V";"V";0;0;0;0,4;1,39543023972268
"1884";"Kolding.13-11-2017.pdf";1;7;3241;"Kolding Kommune";"13-11-2017";3249;0,000307787011388119;0,00215450907971684;2017;"11";2017-11-13;0,0821783067733325;0,689845911465324;92282;59627;430;7,4;7,1;"Jørn Pedersen";"Jørn Pedersen";0;"V";"V";0;0;0;0,300000000000001;1,40523419925235
